id,title,isbn,isbn13,asin,kindle_asin,country_code,image_url,small_image_url,large_image_url,publication_year,publication_month,publication_day,publisher,language_code,is_ebook,description,average_rating,num_pages,format,edition_information,text_reviews_count,url,link
14283,Something I've Been Meaning to Tell You: 13 Stories,0375707484,9780375707483, , ,ID,https://i.gr-assets.com/images/S/compressed.photo.goodreads.com/books/1388209929l/14283._SX98_.jpg,https://i.gr-assets.com/images/S/compressed.photo.goodreads.com/books/1388209929l/14283._SY75_.jpg,https://i.gr-assets.com/images/S/compressed.photo.goodreads.com/books/1388209929l/14283.jpg,2004,10,12,Vintage,eng,false,"In the thirteen stories in her remarkable second collection, Alice Munro demonstrates the precise observation, straightforward prose style, and masterful technique that led no less a critic than John Updike to compare her to Chekhov. The sisters, mothers and daughters, aunts, grandmothers, and friends in these stories shimmer with hope and love, anger and reconciliation, as they contend with their histories and their present, and what they can see of the future.<br /><br />WINNER OF THE NOBEL PRIZE® IN LITERATURE 2013",4.10,246,Paperback, ,188,https://www.goodreads.com/book/show/14283.Something_I_ve_Been_Meaning_to_Tell_You,https://www.goodreads.com/book/show/14283.Something_I_ve_Been_Meaning_to_Tell_You
14285,Lives of Girls and Women,0375707492,9780375707490, , ,ID,https://i.gr-assets.com/images/S/compressed.photo.goodreads.com/books/1320391660l/14285._SX98_.jpg,https://i.gr-assets.com/images/S/compressed.photo.goodreads.com/books/1320391660l/14285._SY75_.jpg,https://i.gr-assets.com/images/S/compressed.photo.goodreads.com/books/1320391660l/14285.jpg,2001,2,13,Vintage,eng,false,"The only novel from Alice Munro -- award-winning author of <i>The Love of a Good Woman</i> -- is an insightful, honest book, ""autobiographical in form but not in fact,"" that chronicles a young girl's growing up in rural Ontario in the 1940s.<br /><br />Del Jordan lives out at the end of the Flats Road on her father's fox farm, where her most frequent companions are an eccentric bachelor family friend and her rough younger brother. When she begins spending more time in town, she is surrounded by women -- her mother, an agnostic, opinionated woman who sells encyclopedias to local farmers; her mother's boarder, the lusty Fern Dogherty; and her best friend, Naomi, with whom she shares the frustrations and unbridled glee of adolescence.<br /><br />Through these unwitting mentors and in her own encounters with sex, birth, and death, Del explores the dark and bright sides of womanhood. All along she remains a wise, witty observer and recorder of truths in small-town life. The result is a powerful, moving, and humorous demonstration of Alice Munro's unparalleled awareness of the lives of girls and women.",3.98,277,Paperback, ,602,https://www.goodreads.com/book/show/14285.Lives_of_Girls_and_Women,https://www.goodreads.com/book/show/14285.Lives_of_Girls_and_Women
14287,Almost Transparent Blue, ,9784770029041, , ,ID,https://i.gr-assets.com/images/S/compressed.photo.goodreads.com/books/1348961366l/14287._SX98_.jpg,https://i.gr-assets.com/images/S/compressed.photo.goodreads.com/books/1348961366l/14287._SX50_.jpg,https://i.gr-assets.com/images/S/compressed.photo.goodreads.com/books/1348961366l/14287.jpg,2003,4,11,Kodansha,eng,false,"Almost Transparent Blue is a brutal tale of lost youth in a Japanese port town close to an American military base. Murakami's image-intensive narrative paints a portrait of a group of friends locked in a destructive cycle of sex, drugs and rock'n'roll. The novel is all but plotless, but the raw and often violent prose takes us on a rollercoaster ride through reality and hallucination, highs and lows, in which the characters and their experiences come vividly to life. Trapped in passivity, they gain neither passion nor pleasure from their adventures. Yet out of the alienation, boredom and underlying rage and grief emerges a strangely quiet and almost equally shocking beauty. Ryu Murakami's first novel, Almost Transparent Blue won the coveted Akutagawa literary prize and became an instant bestseller. Representing a sharp and conscious turning away from the introspective trend of postwar Japanese literature, it polarized critics and public alike and soon attracted international attention as an alternative view of modern Japan.",3.26,126,Paperback, ,347,https://www.goodreads.com/book/show/14287.Almost_Transparent_Blue,https://www.goodreads.com/book/show/14287.Almost_Transparent_Blue
14292,Parasites,2877305872,9782877305877, , ,ID,https://i.gr-assets.com/images/S/compressed.photo.goodreads.com/books/1166586117l/14292._SX98_.jpg,https://i.gr-assets.com/images/S/compressed.photo.goodreads.com/books/1166586117l/14292._SY75_.jpg,https://i.gr-assets.com/images/S/compressed.photo.goodreads.com/books/1166586117l/14292.jpg,2002,2,26,Philippe Picquier,fre,false,"Avec pour seule compagnie un ordinateur, Uehara se fait manipuler par une organisation appelée Inter-Bio et découvre ce que le monde de l'Internet peut engendrer de pire : la folie meurtrière.",3.48,357,Paperback, ,2,https://www.goodreads.com/book/show/14292.Parasites,https://www.goodreads.com/book/show/14292.Parasites
14295,Pastoralia,0747553866,9780747553861, , ,ID,https://i.gr-assets.com/images/S/compressed.photo.goodreads.com/books/1348067120l/14295._SX98_.jpg,https://i.gr-assets.com/images/S/compressed.photo.goodreads.com/books/1348067120l/14295._SY75_.jpg,https://i.gr-assets.com/images/S/compressed.photo.goodreads.com/books/1348067120l/14295._SY475_.jpg,2001,9,8,Bloomsbury Publishing,eng,false,"With this new collection, George Saunders takes us even further into the shocking, uproarious and oddly familiar landscape of his imagination.<br /><br />The stories in <em>Pastoralia</em> are set in a slightly skewed version of America, where elements of contemporary life have been merged, twisted, and amplified, casting their absurdity-and our humanity-in a startling new light. Whether he writes a gothic morality tale in which a male exotic dancer is haunted by his maiden aunt from beyond the grave, or about a self-help guru who tells his followers his mission is to discover who's been ""crapping in your oatmeal,"" Saunders's stories are both indelibly strange and vividly real.",4.10,188,Paperback, ,970,https://www.goodreads.com/book/show/14295.Pastoralia,https://www.goodreads.com/book/show/14295.Pastoralia
14300,Good Faith,0385721056,9780385721059, , ,ID,https://i.gr-assets.com/images/S/compressed.photo.goodreads.com/books/1388304457l/14300._SX98_.jpg,https://i.gr-assets.com/images/S/compressed.photo.goodreads.com/books/1388304457l/14300._SY75_.jpg,https://i.gr-assets.com/images/S/compressed.photo.goodreads.com/books/1388304457l/14300.jpg,2004,5,11,Anchor Books,eng,false,"Greed. Envy. Sex. Property. In her subversively funny and genuinely moving new novel, Jane Smiley nails down several American obsessions with the expertise of a master carpenter.<br /><br />Forthright, likable Joe Stratford is the kind of local businessman everybody trusts, for good reason. But it's 1982, and even in Joe's small town, values are in upheaval: not just property values, either. Enter Marcus Burns, a would-be master of the universe whose years with the IRS have taught him which rules are meant to be broken. Before long he and Joe are new best friends--and partners in an investment venture so complex that no one may ever understand it. Add to this Joe's roller coaster affair with his mentor's married daughter. The result is as suspenseful and entertaining as any of Jane Smiley's fiction.<br /><i>
  <br />
</i>",3.26,432,Paperback, ,249,https://www.goodreads.com/book/show/14300.Good_Faith,https://www.goodreads.com/book/show/14300.Good_Faith
14305,The Greenlanders,1400095468,9781400095469, , ,ID,https://i.gr-assets.com/images/S/compressed.photo.goodreads.com/books/1322464537l/14305._SX98_.jpg,https://i.gr-assets.com/images/S/compressed.photo.goodreads.com/books/1322464537l/14305._SY75_.jpg,https://i.gr-assets.com/images/S/compressed.photo.goodreads.com/books/1322464537l/14305.jpg,2005,9,13,Anchor,eng,false,"Pulitzer Prize winner and bestselling author Jane Smiley’s <b>The Greenlanders</b><i> </i>is an enthralling novel in the epic tradition of the old Norse sagas. Set in the fourteenth century in Europe’s most far-flung outpost, a land of glittering fjords, blasting winds, sun-warmed meadows, and high, dark mountains, <b>The Greenlanders</b><i> </i>is the story of one family–proud landowner Asgeir Gunnarsson; his daughter Margret, whose willful independence leads her into passionate adultery and exile; and his son Gunnar, whose quest for knowledge is at the compelling center of this unforgettable book. Jane Smiley takes us into this world of farmers, priests, and lawspeakers, of hunts and feasts and long-standing feuds, and by an act of literary magic, makes a remote time, place, and people not only real but dear to us.",3.90,608,Paperback, ,323,https://www.goodreads.com/book/show/14305.The_Greenlanders,https://www.goodreads.com/book/show/14305.The_Greenlanders
14313,Anna Karenina,0809596814,9780809596812, , ,ID,https://i.gr-assets.com/images/S/compressed.photo.goodreads.com/books/1348589985l/14313._SX98_.jpg,https://i.gr-assets.com/images/S/compressed.photo.goodreads.com/books/1348589985l/14313._SX50_.jpg,https://i.gr-assets.com/images/S/compressed.photo.goodreads.com/books/1348589985l/14313.jpg,2004,1,1,Wildside Press,eng,false,"Anna, miserable in a loveless marriage, succumbs to the desire for the dashing Vronsky. That sort of thing didn't stand one in good stead in 19th-century Russia; bad goes to worse and the end Anna comes to is the stuff of legend. Tolstoy seamlessly captures a weaves a tapestry of Russian society -- as Matthew Arnold wrote in his celebrated essay on Tolstoy, ""We are not to take Anna Karenina as a work of art; we are to take it as a piece of life.""<br /><br />The novel remains popular, as demonstrated by a 2007 poll of 125 contemporary authors in Time, which declared that Anna Karenina is the ""greatest book ever written."" Anna Karenina may be the greatest single novel ever written; it may also be just plainly and sublimely good. Regardless, there is no doubt that Anna Karenina (generally considered Tolstoy's finest novel) is a sublime achievement.",4.06,740,Hardcover, ,7,https://www.goodreads.com/book/show/14313.Anna_Karenina,https://www.goodreads.com/book/show/14313.Anna_Karenina
14316,Black Swan Green,0812974018,9780812974010, , ,ID,https://i.gr-assets.com/images/S/compressed.photo.goodreads.com/books/1320562118l/14316._SX98_.jpg,https://i.gr-assets.com/images/S/compressed.photo.goodreads.com/books/1320562118l/14316._SY75_.jpg,https://i.gr-assets.com/images/S/compressed.photo.goodreads.com/books/1320562118l/14316.jpg,2007,2,27,Random House,eng,false,"From award-winning writer David Mitchell comes a sinewy, meditative novel of boyhood on the cusp of adulthood and the old on the cusp of the new.<br /><br />Black Swan Green tracks a single year in what is, for thirteen-year-old Jason Taylor, the sleepiest village in muddiest Worcestershire in a dying Cold War England, 1982. But the thirteen chapters, each a short story in its own right, create an exquisitely observed world that is anything but sleepy. A world of Kissingeresque realpolitik enacted in boys’ games on a frozen lake; of “nightcreeping” through the summer backyards of strangers; of the tabloid-fueled thrills of the Falklands War and its human toll; of the cruel, luscious Dawn Madden and her power-hungry boyfriend, Ross Wilcox; of a certain Madame Eva van Outryve de Crommelynck, an elderly bohemian emigré who is both more and less than she appears; of Jason’s search to replace his dead grandfather’s irreplaceable smashed watch before the crime is discovered; of first cigarettes, first kisses, first Duran Duran LPs, and first deaths; of Margaret Thatcher’s recession; of Gypsies camping in the woods and the hysteria they inspire; and, even closer to home, of a slow-motion divorce in four seasons.<br /><br />Pointed, funny, profound, left-field, elegiac, and painted with the stuff of life, Black Swan Green is David Mitchell’s most subtlest and effective achievement to date.",3.97,296,Paperback, ,2714,https://www.goodreads.com/book/show/14316.Black_Swan_Green,https://www.goodreads.com/book/show/14316.Black_Swan_Green
14318,Chronicles: Volume One,0743244583,9780743244589, , ,ID,https://i.gr-assets.com/images/S/compressed.photo.goodreads.com/books/1348218030l/14318._SX98_.jpg,https://i.gr-assets.com/images/S/compressed.photo.goodreads.com/books/1348218030l/14318._SY75_.jpg,https://i.gr-assets.com/images/S/compressed.photo.goodreads.com/books/1348218030l/14318.jpg,2005,9,13,Simon  Schuster,eng,false,"<i>""I'd come from a long ways off and had started a long ways down. But now destiny was about to manifest itself. I felt like it was looking right at me and nobody else.""</i> So writes Bob Dylan in <i>Chronicles: Volume One,</i> his remarkable book exploring critical junctures in his life and career. <br /><br />Through Dylan's eyes and open mind, we see Greenwich Village, circa 1961, when he first arrives in Manhattan. Dylan's New York is a magical city of possibilities -- smoky, nightlong parties; literary awakenings; transient loves and unbreakable friendships. Elegiac observations are punctuated by jabs of memories, penetrating and tough. With the book's side trips to New Orleans, Woodstock, Minnesota and points west, <i>Chronicles: Volume One</i> is an intimate and intensely personal recollection of extraordinary times.<br /><br />By turns revealing, poetical, passionate and witty, <i>Chronicles: Volume One</i> is a mesmerizing window on Bob Dylan's thoughts and influences. Dylan's voice is distinctively American: generous of spirit, engaged, fanciful and rhythmic. Utilizing his unparalleled gifts of storytelling and the exquisite expressiveness that are the hallmarks of his music, Bob Dylan turns <i>Chronicles: Volume One</i> into a poignant reflection on life, and the people and places that helped shape the man and the art.",3.97,320,Paperback, ,1421,https://www.goodreads.com/book/show/14318.Chronicles,https://www.goodreads.com/book/show/14318.Chronicles
14326,Going Native,140007942X,9781400079421, , ,ID,https://i.gr-assets.com/images/S/compressed.photo.goodreads.com/books/1391126090l/14326._SX98_.jpg,https://i.gr-assets.com/images/S/compressed.photo.goodreads.com/books/1391126090l/14326._SY75_.jpg,https://i.gr-assets.com/images/S/compressed.photo.goodreads.com/books/1391126090l/14326.jpg,2005,4,12,Vintage,eng,false,"<b>Going Native</b> is Stephen Wright’s darkly comic take on the road novel, in which one man’s headlong escape from the American Dream becomes everybody’s worst nightmare. Wylie Jones is set: lovely wife, beautiful kids, barbecues in the backyard of his tastefully decorated suburban Chicago house with good friends. Set, but not satisfied. So one night he just walks out, gets behind the wheel of a neighbor’s emerald-green Galaxy 500, and drives off into some other life, his name changed, his personality malleable. In Wright’s inimitable narrative, we’re taken on a joy ride to hell, a rollercoaster of sex and violence and the peculiar mix of the two that is our society today.",3.57,320,Paperback, ,66,https://www.goodreads.com/book/show/14326.Going_Native,https://www.goodreads.com/book/show/14326.Going_Native
14336,Stranger In A Strange Land,0340837950,9780340837955, , ,ID,https://i.gr-assets.com/images/S/compressed.photo.goodreads.com/books/1166590266l/14336._SX98_.jpg,https://i.gr-assets.com/images/S/compressed.photo.goodreads.com/books/1166590266l/14336._SY75_.jpg,https://i.gr-assets.com/images/S/compressed.photo.goodreads.com/books/1166590266l/14336._SY475_.jpg,2005,3,14,Hodder & Stoughton,eng,false,"<b>NAME: Valentine Michael Smith<br />ANCESTRY: Human<br />ORIGIN: Mars</b><br /><br />Valentine Michael Smith is a human being raised on Mars, newly returned to Earth. Among his people for the first time, he struggles to understand the social mores and prejudices of human nature that are so alien to him, while teaching them his own fundamental beliefs in grokking, watersharing, and love.",3.92,672,Paperback, ,49,https://www.goodreads.com/book/show/14336.Stranger_In_A_Strange_Land,https://www.goodreads.com/book/show/14336.Stranger_In_A_Strange_Land
14344,Thirteen Senses,0060935677,9780060935672, , ,ID,https://i.gr-assets.com/images/S/compressed.photo.goodreads.com/books/1348383507l/14344._SX98_.jpg,https://i.gr-assets.com/images/S/compressed.photo.goodreads.com/books/1348383507l/14344._SY75_.jpg,https://i.gr-assets.com/images/S/compressed.photo.goodreads.com/books/1348383507l/14344.jpg,2004,10,5,Harper Perennial,eng,false,"A daring memoir of love, magic, adventure, and miracles, Victor Villaseñor's <em>Thirteen Senses</em> continues the exhilarating family saga that began in the widely acclaimed bestseller <em>Rain of Gold,</em> delivering a stunning story of passion, family, and the forgotten mystical senses that stir within us all.<br /><br /><em>Thirteen Senses</em> begins with the fiftieth wedding anniversary of the aging former bootlegger Salvador and his elegant wife, Lupe. When asked by a young priest to repeat the sacred ceremonial phrase ""to honor and obey,"" Lupe surprises herself and says. ""No, I will not say 'obey'. How dare you! You don't talk to me like this after fifty years of marriage and I now knowing what I know!"" After the hilarious shock of Lupe's rejection of the ceremony, the Villaseñor family is forced to examine the love that Lupe and Salvador have shared for so many years -- a universal, gut-honest love that will eventually energize and inspire the couple into old age.",4.28,544,Paperback, ,64,https://www.goodreads.com/book/show/14344.Thirteen_Senses,https://www.goodreads.com/book/show/14344.Thirteen_Senses
14345,Rain of Gold,038531177X,9780385311779, , ,ID,https://i.gr-assets.com/images/S/compressed.photo.goodreads.com/books/1320554857l/14345._SX98_.jpg,https://i.gr-assets.com/images/S/compressed.photo.goodreads.com/books/1320554857l/14345._SY75_.jpg,https://i.gr-assets.com/images/S/compressed.photo.goodreads.com/books/1320554857l/14345.jpg,1992,9,1,Delta,eng,false,"In <i>Rain of Gold</i>, Victor Villasenor weaves the parallel stories of two families and two countries…bringing us the timeless romance between the volatile bootlegger who would become his father and the beautiful Lupe, his mother–men and women in whose lives the real and the fantastical exist side by side…and in whose hearts the spirit to survive is fueled by a family’s unconditional love.",4.48,576,Paperback, ,637,https://www.goodreads.com/book/show/14345.Rain_of_Gold,https://www.goodreads.com/book/show/14345.Rain_of_Gold
14349,The Pearl/The Red Pony,0140042326,9780140042320, , ,ID,https://i.gr-assets.com/images/S/compressed.photo.goodreads.com/books/1474914480l/14349._SX98_.jpg,https://i.gr-assets.com/images/S/compressed.photo.goodreads.com/books/1474914480l/14349._SY75_.jpg,https://i.gr-assets.com/images/S/compressed.photo.goodreads.com/books/1474914480l/14349._SY475_.jpg,1976,9,30,Penguin Books,eng,false,"The Pearl:<br />When Kino, an Indian pearl-diver, finds 'the Pearl of the world' he believes that his life will be magically transformed. He will marry Juana in church and their little boy, Coyotito, will be able to attend school. Obsessed by his dreams, Kino is blind to the greed, fear and even violence the pearl arouses in him and his neighbours. <br /><br />The Red Pony: <br />Set on a ranch in the Calidornia mountains this is the story of the joy and sorrow a young boy finds in his responsibility for his horse.",3.67,181,Paperback,Penguin,41,https://www.goodreads.com/book/show/14349.The_Pearl_The_Red_Pony,https://www.goodreads.com/book/show/14349.The_Pearl_The_Red_Pony
14350,A Midsummer Night's Dream,0140714553,9780140714555, , ,ID,https://i.gr-assets.com/images/S/compressed.photo.goodreads.com/books/1552319593l/14350._SX98_.jpg,https://i.gr-assets.com/images/S/compressed.photo.goodreads.com/books/1552319593l/14350._SY75_.jpg,https://i.gr-assets.com/images/S/compressed.photo.goodreads.com/books/1552319593l/14350.jpg,2000,8,1,Penguin Classics,eng,false,"A Midsummer Night's Dream is a comedy by William Shakespeare. It is believed to have been written around 1590 to 1596. It portrays the events surrounding the marriage of the Duke of Athens, Theseus, and the Queen of the Amazons, Hippolyta. These include the adventures of four young Athenian lovers and a group of amateur actors, who are manipulated by the fairies who inhabit the forest in which most of the play is set. The play is one of Shakespeare's most popular works for the stage and is widely performed across the world.",3.95,88,Paperback, ,61,https://www.goodreads.com/book/show/14350.A_Midsummer_Night_s_Dream,https://www.goodreads.com/book/show/14350.A_Midsummer_Night_s_Dream
14354,The Power Of One,0140272917,9780140272918, , ,ID,https://i.gr-assets.com/images/S/compressed.photo.goodreads.com/books/1387700139l/14354._SY160_.jpg,https://i.gr-assets.com/images/S/compressed.photo.goodreads.com/books/1387700139l/14354._SY75_.jpg,https://i.gr-assets.com/images/S/compressed.photo.goodreads.com/books/1387700139l/14354.jpg,1998,8,6,Penguin,en-GB,false,"In 1939, as Hitler casts his enormous, cruel shadow across the world, the seeds of apartheid take root in South Africa. There, a boy called Peekay is born. His childhood is marked by humiliation and abandonment, yet he vows to survive and conceives heroic dreams, which are nothing compared to what life actually has in store for him. He embarks on an epic journey through a land of tribal superstition and modern prejudice where he will learn the power of words, the power to transform lives and the power of one.",4.32, ,Paperback, ,71,https://www.goodreads.com/book/show/14354.The_Power_Of_One,https://www.goodreads.com/book/show/14354.The_Power_Of_One
14358,"A Ring of Endless Light (Austin Family Chronicles, #4)",0440910811,9780440910817, , ,ID,https://i.gr-assets.com/images/S/compressed.photo.goodreads.com/books/1559762881l/14358._SY160_.jpg,https://i.gr-assets.com/images/S/compressed.photo.goodreads.com/books/1559762881l/14358._SY75_.jpg,https://i.gr-assets.com/images/S/compressed.photo.goodreads.com/books/1559762881l/14358._SY475_.jpg,1995,9,1,Bantam Doubleday Dell Publishing Group,eng,false,"<p>After a tumultuous year in New York City, the Austins are spending the summer on the small island where their grandfather lives. He’s very sick, and watching his condition deteriorate as the summer passes is almost more than Vicky can bear. To complicate matters, she finds herself as the center of attention for three very different boys.</p><p> Zachary Grey, the troubled and reckless boy Vicky met last summer, wants her all to himself as he grieves the loss of his mother. Leo Rodney has been just a friend for years, but the tragic loss of his father causes him to turn to Vicky for comfort—and romance. And then there’s Adam Eddington. Adam is only asking Vicky to help with his research on dolphins. But Adam—and the dolphins—may just be what Vicky needs to get through this heartbreaking summer.</p>",4.16,332,Paperback, ,640,https://www.goodreads.com/book/show/14358.A_Ring_of_Endless_Light,https://www.goodreads.com/book/show/14358.A_Ring_of_Endless_Light
14362,"Bless Me, Ultima",0446675369,9780446675369, , ,ID,https://i.gr-assets.com/images/S/compressed.photo.goodreads.com/books/1474056548l/14362._SX98_.jpg,https://i.gr-assets.com/images/S/compressed.photo.goodreads.com/books/1474056548l/14362._SY75_.jpg,https://i.gr-assets.com/images/S/compressed.photo.goodreads.com/books/1474056548l/14362._SY475_.jpg,1999,4,1,Grand Central Publishing,eng,false,"Antonio Marez is six years old when Ultima enters his life. She is a curandera, one who heals with herbs and magic. 'We cannot let her live her last days in loneliness,' says Antonio's mother. 'It is not the way of our people,' agrees his father. And so Ultima comes to live with Antonio's family in New Mexico. Soon Tony will journey to the threshold of manhood. Always, Ultima watches over him. She graces him with the courage to face childhood bigotry, diabolical possession, the moral collapse of his brother, and too many violent deaths. Under her wise guidance, Tony will probe the family ties that bind him, and he will find in himself the magical secrets of the pagan past—a mythic legacy equally as palpable as the Catholicism of Latin America in which he has been schooled. At each turn in his life there is Ultima who will nurture the birth of his soul.",3.81,290,Paperback, ,2010,https://www.goodreads.com/book/show/14362.Bless_Me_Ultima,https://www.goodreads.com/book/show/14362.Bless_Me_Ultima
