id,title,isbn,isbn13,asin,kindle_asin,country_code,image_url,small_image_url,large_image_url,publication_year,publication_month,publication_day,publisher,language_code,is_ebook,description,average_rating,num_pages,format,edition_information,text_reviews_count,url,link
32829,"Journey to the Center of the Earth (Extraordinary Voyages, #3)",0553213970,9780553213973, , ,ID,https://i.gr-assets.com/images/S/compressed.photo.goodreads.com/books/1389754903l/32829._SY160_.jpg,https://i.gr-assets.com/images/S/compressed.photo.goodreads.com/books/1389754903l/32829._SY75_.jpg,https://i.gr-assets.com/images/S/compressed.photo.goodreads.com/books/1389754903l/32829.jpg,2006,4,25,Bantam,eng,false,"""The reason Verne is still read by millions today is simply that he was one of the best storytellers who ever lived."" — Arthur C. Clarke<br />An adventurous geology professor chances upon a manuscript in which a 16th-century explorer claims to have found a route to the earth's core. Professor Lidenbrock can't resist the opportunity to investigate, and with his nephew Axel, he sets off across Iceland in the company of Hans Bjelke, a native guide. The expedition descends into an extinct volcano toward a sunless sea, where they encounter a subterranean world of luminous rocks, antediluvian forests, and fantastic marine life — a living past that holds the secrets to the origins of human existence.<br />Originally published in 1864, Jules Verne's classic remains critically acclaimed for its style and imaginative visions. Verne wrote many fantasy stories that later proved remarkably prescient, and his distinctive combination of realism and romanticism exercised a lasting influence on writers as diverse as Mark Twain, Arthur Conan Doyle, and Jean-Paul Sartre. In addition to the excitement of an action novel, <i>Journey to the Center of the Earth</i> has the added appeal of a psychological quest, in which the sojourn itself is as significant as the ultimate destination.",3.86,240,Paperback, ,2782,https://www.goodreads.com/book/show/32829.Journey_to_the_Center_of_the_Earth,https://www.goodreads.com/book/show/32829.Journey_to_the_Center_of_the_Earth
32831,"The Mysterious Island (Extraordinary Voyages, #12)",0812972120,9780812972122, , ,ID,https://i.gr-assets.com/images/S/compressed.photo.goodreads.com/books/1388278046l/32831._SY160_.jpg,https://i.gr-assets.com/images/S/compressed.photo.goodreads.com/books/1388278046l/32831._SY75_.jpg,https://i.gr-assets.com/images/S/compressed.photo.goodreads.com/books/1388278046l/32831.jpg,2004,4,27,Modern Library,eng,false,"After hijacking a balloon from a Confederate camp, a band of five northern prisoners escapes the American Civil War. Seven thousand miles later, they drop from the clouds onto an uncharted volcanic island in the Pacific. Through teamwork, scientific knowledge, engineering, and perseverance, they endeavour to build a colony from scratch. But this island of abundant resources has its secrets. The castaways discover they are not alone. A shadowy, yet familiar, agent of their unfathomable fate is watching.<br /><br />What unfolds in Jules Verne’s imaginative marvel is both an enthralling mystery and the ultimate in survivalist adventures.",4.11,723,Mass Market Paperback, ,1013,https://www.goodreads.com/book/show/32831.The_Mysterious_Island,https://www.goodreads.com/book/show/32831.The_Mysterious_Island
32832,The Lighthouse at the End of the World,1589630947,9781589630949, , ,ID,https://i.gr-assets.com/images/S/compressed.photo.goodreads.com/books/1387611459l/32832._SX98_.jpg,https://i.gr-assets.com/images/S/compressed.photo.goodreads.com/books/1387611459l/32832._SY75_.jpg,https://i.gr-assets.com/images/S/compressed.photo.goodreads.com/books/1387611459l/32832.jpg,2001,3,20,Fredonia Books (NL),eng,false,"In <i>The Lighthouse at the End of the World</i>, Jules Verne is seen at his simplest and best. No antecedent improbability here has to be made good. The remoteness of the scene where the drama is laid supplies an element of dread of which advantage is skillfully taken, and the shortness of the period over which the story is extended adds excitement to the race against time which the villains of the piece are compelled to make in their attempt to escape justice. The rest is pure action, courage and resourcefulness pitted against ferocity and power of numbers, with no merely invented complications to retard the issue. As a simple adventure story <i>The Lighthouse at the End of the World</i> must be declared a little masterpiece.",3.64,260,Paperback, ,42,https://www.goodreads.com/book/show/32832.The_Lighthouse_at_the_End_of_the_World,https://www.goodreads.com/book/show/32832.The_Lighthouse_at_the_End_of_the_World
32843,Around the World in Eighty Days,0812968565,9780812968569, , ,ID,https://i.gr-assets.com/images/S/compressed.photo.goodreads.com/books/1348887225l/32843._SX98_.jpg,https://i.gr-assets.com/images/S/compressed.photo.goodreads.com/books/1348887225l/32843._SY75_.jpg,https://i.gr-assets.com/images/S/compressed.photo.goodreads.com/books/1348887225l/32843.jpg,2003,12,30,Modern Library,eng,false,"Jules Verne's career as a novelist began in 1863, when he struck a new vein in fiction-stories that combined popular science and exploration. In <i>Around the World in Eighty Days</i>, Phileas Fogg rashly bets his companions £20,000 that he can travel around the entire globe in just eighty days, and he is determined not to lose. Breaking the well-established routine of his daily life, the reserved Englishman immediately sets off for Dover, accompanied by his hot-blooded French manservant, Passepartout. Traveling by train, steamship, sailboat, sledge, and even elephant, they must overcome storms, kidnappings, natural disasters, Sioux attacks, and the dogged Inspector Fix of Scotland Yard to win the extraordinary wager. Combining exploration, adventure, and a thrilling race against time, <i>Around the World in Eighty Days</i> gripped audiences upon its publication and remains hugely popular to this day.",3.94,211,Paperback, ,37,https://www.goodreads.com/book/show/32843.Around_the_World_in_Eighty_Days,https://www.goodreads.com/book/show/32843.Around_the_World_in_Eighty_Days
32856,Pearl,1400078075,9781400078073, , ,ID,https://i.gr-assets.com/images/S/compressed.photo.goodreads.com/books/1320471116l/32856._SX98_.jpg,https://i.gr-assets.com/images/S/compressed.photo.goodreads.com/books/1320471116l/32856._SY75_.jpg,https://i.gr-assets.com/images/S/compressed.photo.goodreads.com/books/1320471116l/32856.jpg,2006,4,11,Anchor,eng,false,"On Christmas night of 1998, Maria Meyers learns that her twenty-year-old daughter, Pearl, has chained herself outside the American embassy in Dublin, where she intends to starve herself to death. Although Maria was once a student radical and still proudly lives by her beliefs, gentle, book-loving Pearl has never been interested in politics–nor in the Catholicism her mother rejected years before. What, then, is driving her to martyr herself? <br /><br />Shaken by this mystery, Maria and her childhood friend (and Pearl’s surrogate father), Joseph Kasperman, both rush to Pearl’s side. As Mary Gordon tells the story of the bonds among them, she<i> </i>takes us deep into the labyrinths of maternal love, religious faith, and Ireland’s tragic history. <i>Pearl</i> is a grand and emotionally daring novel of ideas, told with the tension of a thriller.",3.18,368,Paperback, ,89,https://www.goodreads.com/book/show/32856.Pearl,https://www.goodreads.com/book/show/32856.Pearl
32875,Sliver,0553295071,9780553295078, , ,ID,https://i.gr-assets.com/images/S/compressed.photo.goodreads.com/books/1396551483l/32875._SY160_.jpg,https://i.gr-assets.com/images/S/compressed.photo.goodreads.com/books/1396551483l/32875._SY75_.jpg,https://i.gr-assets.com/images/S/compressed.photo.goodreads.com/books/1396551483l/32875.jpg,1991,12,1,Bantam,eng,false,"<b>AN UPTOWN HIGH-RISE</b><br />A glittering Manhattan ""sliver"" building.<br />A successful single career woman.<br />A shocking secret hidden in brick and concrete.<br /><br /><b>A HIGH-TECH NIGHTMARE</b><br />Someone is watching her.<br />He watches her unpack, watches her make the bed; his eyes are everywhere.<br />He owns the building: now he owns <i>her</i>.<br /><br /><b>SLIVER</b><br />There's no place more frightening than home.",3.20,261,Mass Market Paperback, ,163,https://www.goodreads.com/book/show/32875.Sliver,https://www.goodreads.com/book/show/32875.Sliver
32880,The Mothman Prophecies,0340824468,9780340824467, , ,ID,https://i.gr-assets.com/images/S/compressed.photo.goodreads.com/books/1168397344l/32880._SX98_.jpg,https://i.gr-assets.com/images/S/compressed.photo.goodreads.com/books/1168397344l/32880._SY75_.jpg,https://i.gr-assets.com/images/S/compressed.photo.goodreads.com/books/1168397344l/32880.jpg,2002,3,7,Hodder & Stoughton,eng,false,"The Mothman Prophecies is a '75 book by John A. Keel &amp; an '02 movie of the same name. Its subject matter mostly concerns events in Point Pleasant, WV, during '66/7, focusing on sightings of a creature dubbed Mothman. It includes theories about UFOs, aliens, Men in Black, angels, demons, mutants, ghosts &amp; other paranormal phenomena, as well as the 12/15/67 collapse of the Silver Bridge across the Ohio River from Pt Pleasant to Gallipolis, OH. It also deals with strange occurences around the time that Mothman was sighted, such as odd phone calls, disasters &amp; mutilated pets. Keel claims that Mothman caused these events.<br /> The book involves Keel as a journalist, direct observer of some events &amp; also presents some fragments of memoir. It's been seen as an innovative work of creative nonfiction. The writing style combines reportage &amp; understated humor with fragments of the vivid cinematic approach used by Capote in In Cold Blood.<br /> The Mothman Prophecies raises issues with creative nonfiction, as Keel's main thesis suggests paranormal phenomena are engaging in elusive communication &amp; it may be easier to appreciate the essence of this communication than make literal sense of it: ""Once you have established a belief, the phenomenon adjusts its manifestations to support that belief &amp; thereby escalate it."" (p. 11) ""I have come to realize that we have been observing complex forces which have always been an essential part of our environment."" (p.55).",3.53,352,Paperback,New English Library,18,https://www.goodreads.com/book/show/32880.The_Mothman_Prophecies,https://www.goodreads.com/book/show/32880.The_Mothman_Prophecies
32883,Communion: A True Story,0517057565,9780517057568, , ,ID,https://i.gr-assets.com/images/S/compressed.photo.goodreads.com/books/1392357825l/32883._SX98_.jpg,https://i.gr-assets.com/images/S/compressed.photo.goodreads.com/books/1392357825l/32883._SY75_.jpg,https://i.gr-assets.com/images/S/compressed.photo.goodreads.com/books/1392357825l/32883.jpg,1990,10,1,Random House Value Publishing,en-US,false,"<p> Thus begins the most astonishing true-life odyssey ever recordedâ��one man's riveting account of his extraordinary experiences with visitors from �elsewhere� . . . how they found him, where they took him, what they did to him, and why. </p> <p> Believe it. Or don't believe it. But read itâ��for this gripping story will move you like no other. It will fascinate you, terrify you, and alter the way you experience your world. </p>",3.50,299,Hardcover, ,0,https://www.goodreads.com/book/show/32883.Communion,https://www.goodreads.com/book/show/32883.Communion
32901,Tess of the d'Urbervilles,067101546X,9780671015466, , ,ID,https://i.gr-assets.com/images/S/compressed.photo.goodreads.com/books/1388749446l/32901._SX98_.jpg,https://i.gr-assets.com/images/S/compressed.photo.goodreads.com/books/1388749446l/32901._SY75_.jpg,https://i.gr-assets.com/images/S/compressed.photo.goodreads.com/books/1388749446l/32901.jpg,2001,6,26,Simon & Schuster,en-US,false,"This critical edition of Thomas Hardy's 1891 British Victorian novel reprints the authoritative second impression of the 1920 Wessex edition together with five critical essays - newly commissioned or revised - that read Tess of the d'Urbervilles from five contemporary critical perspectives. Each critical essay is accompanied by a succinct introduction to the history, principles, and practice of the critical perspective and by a bibliography that promotes further exploration of that approach. In addition, the text and essays are complemented by an introduction providing biographical and historical contexts for Hardy and Tess of the d'Urbervilles, a survey of critical responses to the work since its initial publication, and a glossary of critical and theoretical terms.",3.80,446,Paperback, ,32,https://www.goodreads.com/book/show/32901.Tess_of_the_d_Urbervilles,https://www.goodreads.com/book/show/32901.Tess_of_the_d_Urbervilles
32923,Charlotte's Web,0060006986,9780060006983, , ,ID,https://i.gr-assets.com/images/S/compressed.photo.goodreads.com/books/1519405132l/32923._SX98_.jpg,https://i.gr-assets.com/images/S/compressed.photo.goodreads.com/books/1519405132l/32923._SX50_.jpg,https://i.gr-assets.com/images/S/compressed.photo.goodreads.com/books/1519405132l/32923._SX318_.jpg,2002,5,1,HarperCollins,eng,false,"Since its publication in 1952, ""Charlotte's Web has become one of America's best-loved children' s books.This special cloth-bound anniversary edition features Garth Williams' s original drawings lovingly colorized by renowned illustrator Rosemary Wells. Also included is a retrospective essay written in honor of this anniversary by scholar Peter Neumeyer, about the development and publication of this landmark book. The ""Charlotte's Web 50th Anniversary Edition is a keepsake book that readers of all ages will cherish.",4.18,224,Hardcover,50th Anniversary Retrospective Edition,15,https://www.goodreads.com/book/show/32923.Charlotte_s_Web,https://www.goodreads.com/book/show/32923.Charlotte_s_Web
32929,Goodnight Moon,0060775858,9780060775858, , ,ID,https://i.gr-assets.com/images/S/compressed.photo.goodreads.com/books/1439223893l/32929._SX98_.jpg,https://i.gr-assets.com/images/S/compressed.photo.goodreads.com/books/1439223893l/32929._SX50_.jpg,https://i.gr-assets.com/images/S/compressed.photo.goodreads.com/books/1439223893l/32929._SX318_.jpg,2007,1,23,HarperCollins,eng,false,"In a great green room, tucked away in bed, is a little bunny. ""Goodnight room, goodnight moon."" And to all the familiar things in the softly lit room -- to the picture of the three little bears sitting on chairs, to the clocks and his socks, to the mittens and the kittens, to everything one by one -- the little bunny says goodnight.<br /><br />In this classic of children's literature, beloved by generations of readers and listeners, the quiet poetry of the words and the gentle, lulling illustrations combine to make a perfect book for the end of the day.",4.28,32,Hardcover,60th Anniversary Edition,5268,https://www.goodreads.com/book/show/32929.Goodnight_Moon,https://www.goodreads.com/book/show/32929.Goodnight_Moon
32944,When You Ride Alone You Ride with Bin Laden: What the Government Should Be Telling Us to Help Fight the War on Terrorism,1893224902,9781893224902, , ,ID,https://i.gr-assets.com/images/S/compressed.photo.goodreads.com/books/1386923383l/32944._SX98_.jpg,https://i.gr-assets.com/images/S/compressed.photo.goodreads.com/books/1386923383l/32944._SX50_.jpg,https://i.gr-assets.com/images/S/compressed.photo.goodreads.com/books/1386923383l/32944.jpg,2003,9,1,Phoenix Audio,en-US,false,"Political provocateur Bill Maher tells it like it is in a useful and hilarious guide for the many Americans who want to do more here at home to help the war effort, but are at a loss as to what. Thirty-three dynamic new posters and several classics from our government's archive accompanied by text from one of our leading pundits and cutting-edge comedians make this the perfect book for this time in our nation's history, the zeitgeist of post-9/11 America. This is the book that will help Americans make connections between what we do and how it can help (or hurt) our troops and us.",3.52,144,Paperback, ,1,https://www.goodreads.com/book/show/32944.When_You_Ride_Alone_You_Ride_with_Bin_Laden,https://www.goodreads.com/book/show/32944.When_You_Ride_Alone_You_Ride_with_Bin_Laden
32946,The Outsiders,0141314575,9780141314570, , ,ID,https://i.gr-assets.com/images/S/compressed.photo.goodreads.com/books/1419894150l/32946._SX98_.jpg,https://i.gr-assets.com/images/S/compressed.photo.goodreads.com/books/1419894150l/32946._SY75_.jpg,https://i.gr-assets.com/images/S/compressed.photo.goodreads.com/books/1419894150l/32946.jpg,2003,3,6,Puffin Group,eng,false,"<i>""...the hand at the back of my neck was strong.</i> I'm drowning<i>, I thought...</i>""<br /><br />The Socs' idea of having a good time of beating up Greasers like Ponyboy. Ponyboy knows what to expect and knows he can count on his brothers and friends - until the night someone takes things too far. <br /><br /><b>A ground-breaking, timeless story from a brilliant writer.</b>",4.10,218,Paperback,40th Anniverary Edition,268,https://www.goodreads.com/book/show/32946.The_Outsiders,https://www.goodreads.com/book/show/32946.The_Outsiders
32951,Sister Outsider: Essays and Speeches,0895941414,9780895941411, , ,ID,https://i.gr-assets.com/images/S/compressed.photo.goodreads.com/books/1168407974l/32951._SY160_.jpg,https://i.gr-assets.com/images/S/compressed.photo.goodreads.com/books/1168407974l/32951._SY75_.jpg,https://i.gr-assets.com/images/S/compressed.photo.goodreads.com/books/1168407974l/32951.jpg,1984,6,1,Crossing Press,en-GB,false,"A collection of fifteen essays written between 1976 and 1984 gives clear voice to Audre Lorde's literary and philosophical personae. These essays explore and illuminate the roots of Lorde's intellectual development and her deep-seated and longstanding concerns about ways of increasing empowerment among minority women writers and the absolute necessity to explicate the concept of difference—difference according to sex, race, and economic status. The title Sister Outsider finds its source in her poetry collection The Black Unicorn (1978). These poems and the essays in Sister Outsider stress Lorde's oft-stated theme of continuity, particularly of the geographical and intellectual link between Dahomey, Africa, and her emerging self.",4.53,190,Paperback, ,941,https://www.goodreads.com/book/show/32951.Sister_Outsider,https://www.goodreads.com/book/show/32951.Sister_Outsider
32957,Caramelo,0679742581,9780679742586, , ,ID,https://i.gr-assets.com/images/S/compressed.photo.goodreads.com/books/1408223495l/32957._SX98_.jpg,https://i.gr-assets.com/images/S/compressed.photo.goodreads.com/books/1408223495l/32957._SY75_.jpg,https://i.gr-assets.com/images/S/compressed.photo.goodreads.com/books/1408223495l/32957.jpg,2003,9,9,Vintage,eng,false,"Every year, Ceyala ""Lala"" Reyes' family--aunts, uncles, mothers, fathers, and Lala's six older brothers--packs up three cars and, in a wild ride, drive from Chicago to the Little Grandfather and Awful Grandmother's house in Mexico City for the summer. Struggling to find a voice above the boom of her brothers and to understand her place on this side of the border and that, Lala is a shrewd observer of family life. But when she starts telling the Awful Grandmother's life story, seeking clues to how she got to be so awful, grandmother accuses Lala of exaggerating. Soon, a multigenerational family narrative turns into a whirlwind exploration of storytelling, lies, and life. Like the cherished <i>rebozo</i>, or shawl, that has been passed down through generations of Reyes women,<b> Caramelo</b> is alive with the vibrations of history, family, and love.",3.91,441,Paperback, ,743,https://www.goodreads.com/book/show/32957.Caramelo,https://www.goodreads.com/book/show/32957.Caramelo
32961,The House on Mango Street,0739322796,9780739322796, , ,ID,https://i.gr-assets.com/images/S/compressed.photo.goodreads.com/books/1388689098l/32961._SX98_.jpg,https://i.gr-assets.com/images/S/compressed.photo.goodreads.com/books/1388689098l/32961._SX50_.jpg,https://i.gr-assets.com/images/S/compressed.photo.goodreads.com/books/1388689098l/32961.jpg,2005,8,30,Random House Audio,en-US,false,"<i>The House on Mango Street</i> tells the story of Esperanza Cordero, whose neighborhood is one of harsh realities and hard beauty. Esperanza doesn't want to belong—not to her rundown neighborhood, and not to the low expectations the world has for her. Esperanza's story is that of a young girl coming into her power, and inventing for herself what she will become.<br /><br /><i>An unabridged recording on 2 CDs (2 hours), read by the author.</i>",3.66,2,Audio CD, ,22,https://www.goodreads.com/book/show/32961.The_House_on_Mango_Street,https://www.goodreads.com/book/show/32961.The_House_on_Mango_Street
32964,Selections from Homer’s Iliad,0806133635,9780806133638, , ,ID,https://i.gr-assets.com/images/S/compressed.photo.goodreads.com/books/1390867763l/32964._SX98_.jpg,https://i.gr-assets.com/images/S/compressed.photo.goodreads.com/books/1390867763l/32964._SX50_.jpg,https://i.gr-assets.com/images/S/compressed.photo.goodreads.com/books/1390867763l/32964.jpg,2001,12,15,University of Oklahoma Press,eng,false,"First published in 1903, <em>Selections from Homer’s Iliad</em> has become a classic Greek textbook. Allen Rogers Benner presents selections from twelve books of the <em>Iliad</em> both in Greek and English. Short summaries between books bridge the narrative and aid the student in gaining a comprehensive view of the <em>Iliad</em> as a work of literature and art. Invaluable resources include an extensive section of notes on the text, a short Homeric grammar, and a vocabulary and Greek index.<br /><br /><br />In a new foreword, Mark W. Edwards argues for the utility of Benner’s text while offering a useful summary of current scholarship on the historical sources of the epic, Greek oral tradition, and Homeric style and diction. Benner’s <em>Iliad</em> will join Barbour’s <em>Herodotus</em> and Garrison’s <em>Catullus</em> as indispensable volumes in classical culture and literature available from the University of Oklahoma Press.<br /><br /><br /> ",4.42,522,Paperback, ,8,https://www.goodreads.com/book/show/32964.Selections_from_Homer_s_Iliad,https://www.goodreads.com/book/show/32964.Selections_from_Homer_s_Iliad
32971,Fahrenheit 451,0965020592,9780965020596, , ,ID,https://i.gr-assets.com/images/S/compressed.photo.goodreads.com/books/1331513023l/32971._SY160_.jpg,https://i.gr-assets.com/images/S/compressed.photo.goodreads.com/books/1331513023l/32971._SY75_.jpg,https://i.gr-assets.com/images/S/compressed.photo.goodreads.com/books/1331513023l/32971.jpg,2001,,,Bookspan,eng,false,"This edition was especially created in 2001 for Book of the Month Club by arrangement with Simon and Schuster, Inc. This edition copyright 2001 by Bookspan. All rights reserved. Printed in the United States of America<br /><br />Foreward copyright 1993 by Ray Bradbury.",3.99,190,Hardcover,Book-of-the-Month Club,28,https://www.goodreads.com/book/show/32971.Fahrenheit_451,https://www.goodreads.com/book/show/32971.Fahrenheit_451
32978,"The Clue in the Diary (Nancy Drew Mystery Stories, #7)",1557091617,9781557091611, , ,ID,https://i.gr-assets.com/images/S/compressed.photo.goodreads.com/books/1352472581l/32978._SX98_.jpg,https://i.gr-assets.com/images/S/compressed.photo.goodreads.com/books/1352472581l/32978._SY75_.jpg,https://i.gr-assets.com/images/S/compressed.photo.goodreads.com/books/1352472581l/32978.jpg,1995,,,Applewood Books,eng,false,"Nancy and her friends witness an explosion and the burning of a beautiful country mansion. Fearing its occupants may be trapped in the blazing building, they rush to the rescue--and unexpectedly find themselves confronted with a mystery that seems insoluble. The first clue is an anonymous diary--its entries in a handwriting difficult to decipher. Who dropped the diary? Was it the stranger Nancy saw running away from the fire? What was he doing there? Finding out how Nancy discovers the answers to these questions makes for another exciting Nancy Drew mystery. Praise for the Nancy Drew series on audio...",3.96,202,Hardcover, ,250,https://www.goodreads.com/book/show/32978.The_Clue_in_the_Diary,https://www.goodreads.com/book/show/32978.The_Clue_in_the_Diary
32979,"The Secret of the Old Clock (Nancy Drew Mystery Stories, #1)",1557091552,9781557091550, , ,ID,https://i.gr-assets.com/images/S/compressed.photo.goodreads.com/books/1351534678l/32979._SX98_.jpg,https://i.gr-assets.com/images/S/compressed.photo.goodreads.com/books/1351534678l/32979._SX50_.jpg,https://i.gr-assets.com/images/S/compressed.photo.goodreads.com/books/1351534678l/32979.jpg,1991,9,1,Applewood Books,eng,false,"Nancy, unaided, seeks to find a missing will. To the surprise of many, the Topham family will inherit wealthy Josiah Crowley's fortune, instead of deserving relatives and friends who were promised inheritances. Nancy determines that a clue to a second will might be found in an old clock Mr. Crowley had owned and she seeks to find the timepiece. Her search not only tests her keen mind, but also leads her into a thrilling adventure.",3.98,210,Hardcover, ,2378,https://www.goodreads.com/book/show/32979.The_Secret_of_the_Old_Clock,https://www.goodreads.com/book/show/32979.The_Secret_of_the_Old_Clock
