id,title,isbn,isbn13,asin,kindle_asin,country_code,image_url,small_image_url,large_image_url,publication_year,publication_month,publication_day,publisher,language_code,is_ebook,description,average_rating,num_pages,format,edition_information,text_reviews_count,url,link
31693,Persuasion,0141439688,9780141439686, , ,ID,https://i.gr-assets.com/images/S/compressed.photo.goodreads.com/books/1362222581l/31693._SX98_.jpg,https://i.gr-assets.com/images/S/compressed.photo.goodreads.com/books/1362222581l/31693._SY75_.jpg,https://i.gr-assets.com/images/S/compressed.photo.goodreads.com/books/1362222581l/31693.jpg,2003,4,29,Penguin Classics,eng,false,"<i>'She had been forced into prudence in her youth, she learned romance as she grew older'</i> <br /><br />At twenty-seven, Anne Elliot is no longer young and has few romantic prospects. Eight years earlier, she had been persuaded by her friend Lady Russell to break off her engagement to Frederick Wentworth, a handsome naval captain with neither fortune nor rank. What happens when they encounter each other again is movingly told in Jane Austen’s last completed novel. Set in the fashionable societies of Lyme Regis and Bath, <i>Persuasion</i> is a brilliant satire of vanity and pretension, but, above all, it is a love story tinged with the heartache of missed opportunities.<br /><br />In her introduction, Gillian Beer discusses Austen’s portrayal of the double-edged nature of persuasion and the clash between old and new worlds. This edition also includes a new chronology and full textual notes.",4.14,325,Paperback, ,587,https://www.goodreads.com/book/show/31693.Persuasion,https://www.goodreads.com/book/show/31693.Persuasion
31721,Leaf Storm and Other Stories,006075155X,9780060751555, , ,ID,https://i.gr-assets.com/images/S/compressed.photo.goodreads.com/books/1410141595l/31721._SX98_.jpg,https://i.gr-assets.com/images/S/compressed.photo.goodreads.com/books/1410141595l/31721._SY75_.jpg,https://i.gr-assets.com/images/S/compressed.photo.goodreads.com/books/1410141595l/31721.jpg,2005,2,1,Harper Perennial,eng,false,"Contains the Novella <i>Leaf Storm</i>: 'SUDDENLY, AS IF A WHIRLWIND HAD SET DOWN ROOTS IN THE CENTRE OF THE TOWN, THE BANANA COMPANY ARRIVED, PURSUED BY THE LEAF STORM' <br /><br />As a blizzard of warehouses and amusement parlours and slums descends on the small town of Macondo, the inhabitants reel at the accompanying stench of rubbish that makes their home unrecognisable. When the banana company leaves town as fast as it arrived, all they are left with is a void of decay. <br /><br />Living in this devastated and soulless wasteland is one last honourable man, the Colonel, who is determined to fulfil a long standing promise, no matter how unpalatable it may be. With the death of the detested Doctor, he must provide an honourable burial - and incur the wrath of the rest of Macondo, who would rather see the Doctor rot, forgotten and unattended.<br /><br />Also contains the stories: The Handsomest Drowned Man in the World, A Very Old Man With Enormous Wings, Blacaman the Good, Vendor of Miracles, The Last Voyage of the Ghost Ship, Monologue of Isabel Watching It Rain in Macondo, Nabo",3.68,146,Paperback, ,150,https://www.goodreads.com/book/show/31721.Leaf_Storm_and_Other_Stories,https://www.goodreads.com/book/show/31721.Leaf_Storm_and_Other_Stories
31733,"La Aventura de Miguel Littín, Clandestino en Chile",030735041X,9780307350411, , ,ID,https://i.gr-assets.com/images/S/compressed.photo.goodreads.com/books/1347336475l/31733._SX98_.jpg,https://i.gr-assets.com/images/S/compressed.photo.goodreads.com/books/1347336475l/31733._SY75_.jpg,https://i.gr-assets.com/images/S/compressed.photo.goodreads.com/books/1347336475l/31733.jpg,2006,2,7,Plaza y Janes,spa,false,"A principios de 1985, el director de cine chileno Miguel Littín, sobre quien pesaba prohibición absoluta de volver a su tierra, entró clandestinamente en Chile. Durante seis semanas filmó más de siete mil metros de película sobre la realidad de su país después de doce años de dictadura militar. Para ello afrontó situaciones de extremo riesgo y tuvo que servirse de disfraces y tretas para mantenerse de incógnito. El resultado de su peripecia fue una película de cuatro horas para la televisión y de dos horas para el cine. Con el testimonio directo del protagonista, el premio Nobel colombiano escribió este libro en el más puro estilo del reportaje periodístico. <br /><br /><br /><i>La aventura de Miguel Littín clandestino en Chile</i> se trata de la historia de la dificultad de contar la verdad en el Chile durante la dictadura Augusto Pinochet.",3.84,192,Paperback, ,13,https://www.goodreads.com/book/show/31733.La_Aventura_de_Miguel_Litt_n_Clandestino_en_Chile,https://www.goodreads.com/book/show/31733.La_Aventura_de_Miguel_Litt_n_Clandestino_en_Chile
31741,Innocent Erendira and Other Stories,0060751584,9780060751586, , ,ID,https://i.gr-assets.com/images/S/compressed.photo.goodreads.com/books/1410129032l/31741._SX98_.jpg,https://i.gr-assets.com/images/S/compressed.photo.goodreads.com/books/1410129032l/31741._SY75_.jpg,https://i.gr-assets.com/images/S/compressed.photo.goodreads.com/books/1410129032l/31741.jpg,2005,2,1,Perennial Classics,eng,false,"""The stories are rich and startling in their matter and confident in their manner....They are--the word cannot be avoided--magical.""--John Updike, <i>The New Yorker</i><br /><p>This collection of fiction, representing some of García Márquez's earlier work, includes eleven short stories and a novella, Innocent Eréndira, in which a young girl who dreams of freedom cannot escape the reach of her vicious and avaricious grandmother.<br /></p><p>""Garcí­a Márquez's fictional universe has the same staggeringly gratifying density and texture as Proust's Faubourg Saint-Germain and Joyce's Dublin....Arguably the best of the Latin Americans.""--Martin Kaplan, <i>The New Republic</i><br /></p><p>""It is the genius of the mature Garcí­a Márquez that fatalism and possibility somehow coexist, that dreams redeem, that there is laughter even in death.'--John Leonard, <i>New York Times</i></p>",3.91,192,Paperback,First Perennial Classics Edition,222,https://www.goodreads.com/book/show/31741.Innocent_Erendira_and_Other_Stories,https://www.goodreads.com/book/show/31741.Innocent_Erendira_and_Other_Stories
31761,El Dia Que Nietzsche Lloró,9875801445,9789875801448, , ,ID,https://i.gr-assets.com/images/S/compressed.photo.goodreads.com/books/1168286666l/31761._SX98_.jpg,https://i.gr-assets.com/images/S/compressed.photo.goodreads.com/books/1168286666l/31761._SY75_.jpg,https://i.gr-assets.com/images/S/compressed.photo.goodreads.com/books/1168286666l/31761._SY475_.jpg,2006,10,24,Planeta,spa,false,This richly evocative novel portrays an astutely imagined relationship between Europe's greatest philosopher and one of the founding fathers of psychoanalysis.,4.34,445,Paperback, ,4,https://www.goodreads.com/book/show/31761.El_Dia_Que_Nietzsche_Llor_,https://www.goodreads.com/book/show/31761.El_Dia_Que_Nietzsche_Llor_
31785,The Will to Power,0394704371,9780394704371, , ,ID,https://i.gr-assets.com/images/S/compressed.photo.goodreads.com/books/1403177768l/31785._SX98_.jpg,https://i.gr-assets.com/images/S/compressed.photo.goodreads.com/books/1403177768l/31785._SY75_.jpg,https://i.gr-assets.com/images/S/compressed.photo.goodreads.com/books/1403177768l/31785.jpg,2011,8,17,Vintage Books,eng,false,"Nietzsche's notebooks, kept by him during his most productive years, offer a fascinating glimpse into the workshop and mind of a great thinker, and compare favorably with the notebooks of <a href=""https://www.goodreads.com/author/show/7617.Gide"" title=""Gide"" rel=""nofollow noopener"">Gide</a> and <a href=""https://www.goodreads.com/author/show/5223.Kafka"" title=""Kafka"" rel=""nofollow noopener"">Kafka</a>, <a href=""https://www.goodreads.com/author/show/957894.Camus"" title=""Camus"" rel=""nofollow noopener"">Camus</a> and <a href=""https://www.goodreads.com/author/show/7672.Wittgenstein"" title=""Wittgenstein"" rel=""nofollow noopener"">Wittgenstein</a>. <i>The Will to Power</i>, compiled from the notebooks, is one of the most famous books of the past hundred years, but few have studied it. Here, at last, is the first critical edition in any language.<br /><br />Down through the Nazi period <i>The Will to Power</i> was often mistakenly considered to be Nietzsche's crowning systematic labor; since World War II it has frequently been denigrated, just as fallaciously, as being not worth reading. In fact, it represents a stunning selection from Nietzsche's notebooks, in a topical arrangement that enables the reader to find what Nietzsche wrote on nihilism, art, morality, religion, the theory of knowledge, and whatever else interested him. But no previous edition—even in the original German—shows which notes Nietzsche utilized subsequently in his works, and which sections are not paralleled in the finished books. Nor has any previous edition furnished a commentary or index.<br /><br />Walter Kauffman, in collaboration with R.J. Hollingdale, brings to this volume his unsurpassed skills as a Nietzsche translator and scholar. Professor Kauffman has included the approximate date of each note. His running footnote commentary offers the information needed to follow Nietzsche's train of thought, and indicates, among other things, which notes were eventually superseded by later formulations, and where all German editions, including the very latest, depart from the manuscripts. The comprehensive index serves to guide the reader to the extraordinary riches of this book.",4.05,575,Paperback, ,144,https://www.goodreads.com/book/show/31785.The_Will_to_Power,https://www.goodreads.com/book/show/31785.The_Will_to_Power
31795,The Story of Philosophy: The Lives and Opinions of the World's Greatest Philosophers,0671739166,9780671739164, , ,ID,https://i.gr-assets.com/images/S/compressed.photo.goodreads.com/books/1438471992l/31795._SY160_.jpg,https://i.gr-assets.com/images/S/compressed.photo.goodreads.com/books/1438471992l/31795._SY75_.jpg,https://i.gr-assets.com/images/S/compressed.photo.goodreads.com/books/1438471992l/31795._SY475_.jpg,1991,1,1,Pocket Books,eng,false,"A brilliant and concise account of the lives and ideas of the great philosophers—Plato, Aristotle, Bacon, Spinoza, Voltaire, Kant, Schopenhauer, Spencer, Nietzsche, Bergson, Croce, Russell, Santayana, James, and Dewey—<i>The Story of Philosophy </i>is one of the great books of our time. Few write for the non-specialist as well as Will Durant, and this book is a splendid example of his eminently readable scholarship. Durant’s insight and wit never cease to dazzle; <i>The Story of Philosophy</i> is a key book for any reader who wishes to survey the history and development of philosophical ideas in the Western world.",4.13,704,Paperback, ,605,https://www.goodreads.com/book/show/31795.The_Story_of_Philosophy,https://www.goodreads.com/book/show/31795.The_Story_of_Philosophy
31799,The Problems of Philosophy,1421903679,9781421903675, , ,ID,https://i.gr-assets.com/images/S/compressed.photo.goodreads.com/books/1405495766l/31799._SX98_.jpg,https://i.gr-assets.com/images/S/compressed.photo.goodreads.com/books/1405495766l/31799._SX50_.jpg,https://i.gr-assets.com/images/S/compressed.photo.goodreads.com/books/1405495766l/31799.jpg,2005,4,15,IndyPublish.com,eng,false,"A lively and still one of the best introductions to philosophy, this book pays off both a closer reading for students and specialists, and a casual reading for the general public.",3.91,116,Paperback, ,384,https://www.goodreads.com/book/show/31799.The_Problems_of_Philosophy,https://www.goodreads.com/book/show/31799.The_Problems_of_Philosophy
31813,The Simpsons and Philosophy: The D'oh! of Homer,0812694333,9780812694338, , ,ID,https://i.gr-assets.com/images/S/compressed.photo.goodreads.com/books/1328811688l/31813._SX98_.jpg,https://i.gr-assets.com/images/S/compressed.photo.goodreads.com/books/1328811688l/31813._SX50_.jpg,https://i.gr-assets.com/images/S/compressed.photo.goodreads.com/books/1328811688l/31813.jpg,2001,2,28,Open Court,eng,false,"This unconventional and lighthearted introduction to the ideas of the major Western philosophers examines The Simpsons — TV’s favorite animated family. The authors look beyond the jokes, the crudeness, the attacks on society — and see a clever display of irony, social criticism, and philosophical thought. The writers begin with an examination of the characters. Does Homer actually display Aristotle’s virtues of character? In what way does Bart exemplify American pragmatism? The book also examines the ethics and themes of the show, and concludes with discussions of how the series reflects the work of Aristotle, Marx, Camus, Sartre, and other thinkers.",3.47,256,Paperback, ,139,https://www.goodreads.com/book/show/31813.The_Simpsons_and_Philosophy,https://www.goodreads.com/book/show/31813.The_Simpsons_and_Philosophy
31818,The Philosophy of Andy Warhol (From A to B and Back Again),0156717204,9780156717205, , ,ID,https://i.gr-assets.com/images/S/compressed.photo.goodreads.com/books/1423704668l/31818._SX98_.jpg,https://i.gr-assets.com/images/S/compressed.photo.goodreads.com/books/1423704668l/31818._SY75_.jpg,https://i.gr-assets.com/images/S/compressed.photo.goodreads.com/books/1423704668l/31818.jpg,1977,4,6,Mariner Books,eng,false,"<b>A loosely formed autobiography by Andy Warhol, told with his trademark blend of irony and detachment</b><br /><br />In <i>The Philosophy of Andy Warhol</i>—which, with the subtitle ""(From A to B and Back Again),"" is less a memoir than a collection of riffs and reflections—he talks about love, sex, food, beauty, fame, work, money, and success; about New York, America, and his childhood in McKeesport, Pennsylvania; about his good times and bad in New York, the explosion of his career in the sixties, and his life among celebrities.",3.77,272,Paperback, ,429,https://www.goodreads.com/book/show/31818.The_Philosophy_of_Andy_Warhol,https://www.goodreads.com/book/show/31818.The_Philosophy_of_Andy_Warhol
31841,Philosophy & Education: An Introduction in Christian Perspective,1883925541,9781883925543, , ,ID,https://i.gr-assets.com/images/S/compressed.photo.goodreads.com/books/1386924564l/31841._SX98_.jpg,https://i.gr-assets.com/images/S/compressed.photo.goodreads.com/books/1386924564l/31841._SX50_.jpg,https://i.gr-assets.com/images/S/compressed.photo.goodreads.com/books/1386924564l/31841.jpg,2006,1,1,Andrews University Press,en-US,false,"George Knight's Philosophy and Education: An Introduction in Christian Perspective had been a classic in its field for more than a quarter of a century. New features of this revised and updated fourth edition make it of even greater usefulness in the educational philosophy classrooms of a new century. These include: <br /> 1. An all-new chapter on the Christian teacher in the public school setting<br /> 2. ""Points to Ponder"" study questions at the end of each chapter<br /> 3. New material addressing the latest relevant issues, including the rise of the home school movement, and the relation of the Intelligent Design debate to Christian educational philosophy<br /> 4. A fresh, new text design, including call-out highlights of major themes<br /> 5. An updated bibliography and references",3.91,301,Paperback, ,24,https://www.goodreads.com/book/show/31841.Philosophy_Education,https://www.goodreads.com/book/show/31841.Philosophy_Education
31852,A Short History of Philosophy,0195101960,9780195101966, , ,ID,https://i.gr-assets.com/images/S/compressed.photo.goodreads.com/books/1347648604l/31852._SX98_.jpg,https://i.gr-assets.com/images/S/compressed.photo.goodreads.com/books/1347648604l/31852._SY75_.jpg,https://i.gr-assets.com/images/S/compressed.photo.goodreads.com/books/1347648604l/31852.jpg,1996,2,1,"Oxford University Press, USA",eng,false,"In this accessible and comprehensive work, Robert Solomon and Kathleen Higgins cover the entire history of philosophy--ancient, medieval, and modern, from cultures both East and West--in its broader historical and cultural contexts. Major philosophers and movements are discussed along with less well-known but interesting figures. The authors examine the early Greek, Indic, and Chinese philosophers and the mythological traditions that preceded them, as well as the great religious philosophies, including Christianity, Hinduism, Judaism, and Taoism. Easily understandable to students without specialized knowledge of philosophy, <em>A Short History of Philosophy</em> demonstrates the relevance of philosophy to our times, illuminating the impact of the revolutions wrought by science, industry, colonialism, and sectarian warfare; the two world wars and the Holocaust; and the responses of philosophy in the schools of existentialism, postmodernism, feminism, and multiculturalism. In addition, the authors provide their own twists and interpretations of events, resulting in a broad view of the nature of philosophy as an intellectual discipline and its sometimes odd and dramatic consequences.<br />",3.78,352,Paperback, ,17,https://www.goodreads.com/book/show/31852.A_Short_History_of_Philosophy,https://www.goodreads.com/book/show/31852.A_Short_History_of_Philosophy
31872,Philosophy of Religion: Thinking about Faith,0877843430,9780877843436, , ,ID,https://i.gr-assets.com/images/S/compressed.photo.goodreads.com/books/1388249174l/31872._SX98_.jpg,https://i.gr-assets.com/images/S/compressed.photo.goodreads.com/books/1388249174l/31872._SY75_.jpg,https://i.gr-assets.com/images/S/compressed.photo.goodreads.com/books/1388249174l/31872.jpg,1985,1,28,IVP Academic,en-US,false,"Is there a God? How can we know? What can we know about God? These questions are the focal points of the philosophy of religion. C. Stephen Evans wrestles with these issues, looking at the classical arguments for God's existence and examining the contemporary challenges to theism from sociology, psychology and philosophy. He investigates the meaning and significance of personal religious experience, revelation and miracles, and looks at how religious pluralism relates to individual commitment.",3.69,192,Paperback, ,13,https://www.goodreads.com/book/show/31872.Philosophy_of_Religion,https://www.goodreads.com/book/show/31872.Philosophy_of_Religion
31874,Baseball and Philosophy: Thinking Outside the Batter's Box,0812695569,9780812695564, , ,ID,https://i.gr-assets.com/images/S/compressed.photo.goodreads.com/books/1390762399l/31874._SX98_.jpg,https://i.gr-assets.com/images/S/compressed.photo.goodreads.com/books/1390762399l/31874._SY75_.jpg,https://i.gr-assets.com/images/S/compressed.photo.goodreads.com/books/1390762399l/31874.jpg,2004,1,9,Open Court,en-US,false,"Baseball and Philosophy brings together two high-powered pastimes: the sport of baseball and the academic discipline of philosophy. Eric Bronson asked eighteen young professors to provide their profound analysis of some aspect of baseball. The result offers surprisingly deep insights into this most American of games.<br />The contributors include many of the leading voices in the burgeoning new field of philosophy of sport, plus a few other talented philosophers with a personal interest in baseball. A few of the contributors are also drawn from academic areas outside philosophy: statistics, law, and history.<br />This volume gives the thoughtful baseball fan substancial material to think more deeply about. What moral issues are raised by the Intentional Walk? Do teams sometimes benefit from the self-interested behavior of their individual members? How can Zen be applied to hitting? Is it ethical to employ deception in sports? Can a game be defined by its written rules or are there also other constraints? What can the U.S. Supreme Court learn from umpiring? Why should baseball be the only industry exempt from antitrust laws? What part does luck play in any game of skill?",3.60,334,Paperback, ,17,https://www.goodreads.com/book/show/31874.Baseball_and_Philosophy,https://www.goodreads.com/book/show/31874.Baseball_and_Philosophy
31882,The Matrix and Philosophy: Welcome to the Desert of the Real,081269502X,9780812695021, , ,ID,https://i.gr-assets.com/images/S/compressed.photo.goodreads.com/books/1386921242l/31882._SX98_.jpg,https://i.gr-assets.com/images/S/compressed.photo.goodreads.com/books/1386921242l/31882._SY75_.jpg,https://i.gr-assets.com/images/S/compressed.photo.goodreads.com/books/1386921242l/31882.jpg,2002,8,28,Open Court,eng,false,"The Matrix conveys the horror of a false world made of nothing but perceptions. Based on the premise that reality is a dream controlled by malevolent forces, it is one of the most overtly philosophical movies ever to come out of Hollywood. These thought-provoking essays by the same team of young philosophers who created <i>The Simpsons and Philosophy</i> discuss different facets of the primary philosophical puzzle of The Matrix: Can we be sure the world is really there, and if not, what should we do about it? Other chapters address issues of religion, lifestyle, pop culture, the Zeitgeist, the nature of mind and matter, and the reality of fiction.",3.91,280,Paperback, ,76,https://www.goodreads.com/book/show/31882.The_Matrix_and_Philosophy,https://www.goodreads.com/book/show/31882.The_Matrix_and_Philosophy
31921,Philosophy of Science: A Very Short Introduction,0192802836,9780192802835, , ,ID,https://i.gr-assets.com/images/S/compressed.photo.goodreads.com/books/1435405005l/31921._SX98_.jpg,https://i.gr-assets.com/images/S/compressed.photo.goodreads.com/books/1435405005l/31921._SY75_.jpg,https://i.gr-assets.com/images/S/compressed.photo.goodreads.com/books/1435405005l/31921.jpg,2002,8,29,"Oxford University Press, USA",,false,"What is science? Is there a real difference between science and myth? Is science objective? Can science explain everything? This Very Short Introduction provides a concise overview of the main themes of contemporary philosophy of science. Beginning with a short history of science to set the scene, Samir Okasha goes on to investigate the nature of scientific reasoning, scientific explanation, revolutions in science, and theories such as realism and anti-realism. He also looks at philosophical issues in particular sciences, including the problem of classification in biology, and the nature of space and time in physics. The final chapter touches on the conflicts between science and religion, and explores whether science is ultimately a good thing.",3.93,144,Paperback, ,169,https://www.goodreads.com/book/show/31921.Philosophy_of_Science,https://www.goodreads.com/book/show/31921.Philosophy_of_Science
31968,Walking the Bible: A Journey by Land Through the Five Books of Moses,0060838639,9780060838638, , ,ID,https://i.gr-assets.com/images/S/compressed.photo.goodreads.com/books/1413747256l/31968._SX98_.jpg,https://i.gr-assets.com/images/S/compressed.photo.goodreads.com/books/1413747256l/31968._SY75_.jpg,https://i.gr-assets.com/images/S/compressed.photo.goodreads.com/books/1413747256l/31968.jpg,2005,8,2,William Morrow Paperbacks,eng,false,"Both a heart-racing adventure and an uplifting quest, <em>Walking the Bible</em> describes one man's epic odyssey—by foot, jeep, rowboat, and camel—through the greatest stories every told. From crossing the Red Sea to climbing Mount Sinai to touching the burning bush, Bruce Feiler's inspiring journey will forever change your view of some of history's most storied events.",3.88,451,Paperback, ,343,https://www.goodreads.com/book/show/31968.Walking_the_Bible,https://www.goodreads.com/book/show/31968.Walking_the_Bible
32006,The Encyclopedia of Recreational Diving,187866302X,9781878663023, , ,ID,https://i.gr-assets.com/images/S/compressed.photo.goodreads.com/books/1394318420l/32006._SX98_.jpg,https://i.gr-assets.com/images/S/compressed.photo.goodreads.com/books/1394318420l/32006._SX50_.jpg,https://i.gr-assets.com/images/S/compressed.photo.goodreads.com/books/1394318420l/32006.jpg,1988,12,1,I A D Publications,en-GB,false,,4.27,371,Paperback, ,3,https://www.goodreads.com/book/show/32006.The_Encyclopedia_of_Recreational_Diving,https://www.goodreads.com/book/show/32006.The_Encyclopedia_of_Recreational_Diving
32049,Lady Chatterley's Lover,039460430X,9780394604305, , ,ID,https://i.gr-assets.com/images/S/compressed.photo.goodreads.com/books/1215571713l/32049._SY160_.jpg,https://i.gr-assets.com/images/S/compressed.photo.goodreads.com/books/1215571713l/32049._SY75_.jpg,https://i.gr-assets.com/images/S/compressed.photo.goodreads.com/books/1215571713l/32049.jpg,1983,6,12,Modern Library,eng,false,"Lawrence's frank portrayal of an extramarital affair and the explicit sexual explorations of it's central characters caused this controversial book, now considered a masterpiece, to be banned as pornography until 1960.",3.51,376,Hardcover, ,958,https://www.goodreads.com/book/show/32049.Lady_Chatterley_s_Lover,https://www.goodreads.com/book/show/32049.Lady_Chatterley_s_Lover
