id,title,isbn,isbn13,asin,kindle_asin,country_code,image_url,small_image_url,large_image_url,publication_year,publication_month,publication_day,publisher,language_code,is_ebook,description,average_rating,num_pages,format,edition_information,text_reviews_count,url,link
298730,"Among the Barons (Shadow Children, #4)",0689839103,9780689839108, , ,ID,https://i.gr-assets.com/images/S/compressed.photo.goodreads.com/books/1388178243l/298730._SX98_.jpg,https://i.gr-assets.com/images/S/compressed.photo.goodreads.com/books/1388178243l/298730._SX50_.jpg,https://i.gr-assets.com/images/S/compressed.photo.goodreads.com/books/1388178243l/298730.jpg,2004,9,1,Aladdin,en-US,false,"Luke Garner, an illegal third child, spent his first twelve years in hiding. For the past four months Luke has lived among others, using the identity of Lee Grant, at the Hendricks School for Boys. But just as things are finally starting to go right, Lee's little brother Smits arrives at the school and Luke finds himself caught in a tangle of lies that gets more complex with every passing day. <p>Can Luke trust Smits to keep his secret? And can he trust Smits's menacing, fat bodyguard, Oscar who carrys a sledge hammer?</p>",4.09,208,Paperback, ,685,https://www.goodreads.com/book/show/298730.Among_the_Barons,https://www.goodreads.com/book/show/298730.Among_the_Barons
299215,The Road to Serfdom,0226320618,9780226320618, , ,ID,https://i.gr-assets.com/images/S/compressed.photo.goodreads.com/books/1327787673l/299215._SX98_.jpg,https://i.gr-assets.com/images/S/compressed.photo.goodreads.com/books/1327787673l/299215._SY75_.jpg,https://i.gr-assets.com/images/S/compressed.photo.goodreads.com/books/1327787673l/299215.jpg,1994,10,15,University Of Chicago Press,eng,false,"A classic work in political philosophy, intellectual and cultural history, and economics, <i>The Road to Serfdom</i> has inspired and infuriated politicians, scholars, and general readers for half a century. Originally published in England in the spring of 1944—when Eleanor Roosevelt supported the efforts of Stalin, and Albert Einstein subscribed lock, stock, and barrel to the socialist program—<i>The Road to Serfdom</i> was seen as heretical for its passionate warning against the dangers of state control over the means of production. For F. A. Hayek, the collectivist idea of empowering government with increasing economic control would inevitably lead not to a utopia but to the horrors of nazi Germany and fascist Italy.<br /><br />First published by the University of Chicago Press on September 18, 1944, <i>The Road to Serfdom</i> garnered immediate attention from the public, politicians, and scholars alike. The first printing of 2,000 copies was exhausted instantly, and within six months more than 30,000 were sold. In April of 1945, <i>Reader's Digest</i> published a condensed version of the book, and soon thereafter the Book-of-the-Month Club distributed this condensation to more than 600,000 readers. A perennial best-seller, the book has sold over a quarter of a million copies in the United States, not including the British edition or the nearly twenty translations into such languages as German, French, Dutch, Swedish, and Japanese, and not to mention the many underground editions produced in Eastern Europe before the fall of the iron curtain.<br /><br />After thirty-two printings in the United States, <i>The Road to Serfdom</i> has established itself alongside the works of Alexis de Tocqueville, John Stuart Mill, and George Orwell for its timeless meditation on the relation between individual liberty and government authority. This fiftieth anniversary edition, with a new introduction by Milton Friedman, commemorates the enduring influence of <i>The Road to Serfdom</i> on the ever-changing political and social climates of the twentieth century, from the rise of socialism after World War II to the Reagan and Thatcher ""revolutions"" in the 1980s and the transitions in Eastern Europe from communism to capitalism in the 1990s.<br /><br />F. A. Hayek (1899-1992), recipient of the Medal of Freedom in 1991 and co-winner of the Nobel Memorial Prize in Economics in 1974, was a pioneer in monetary theory and the principal proponent of libertarianism in the twentieth century.<br /><br />On the first American edition of <i>The Road to Serfdom</i>:<br />""One of the most important books of our generation. . . . It restates for our time the issue between liberty and authority with the power and rigor of reasoning with which John Stuart Mill stated the issue for his own generation in his great essay <i>On Liberty.</i> . . . It is an arresting call to all well-intentioned planners and socialists, to all those who are sincere democrats and liberals at heart to stop, look and listen.""—Henry Hazlitt, <i>New York Times Book Review,</i> September 1944<br /><br />""In the negative part of Professor Hayek's thesis there is a great deal of truth. It cannot be said too often—at any rate, it is not being said nearly often enough—that collectivism is not inherently democratic, but, on the contrary, gives to a tyrannical minority such powers as the Spanish Inquisitors never dreamt of.""—George Orwell, <i>Collected Essays</i>",4.17,274,Paperback,Fiftieth Anniversary Edition,844,https://www.goodreads.com/book/show/299215.The_Road_to_Serfdom,https://www.goodreads.com/book/show/299215.The_Road_to_Serfdom
299448,Secret Ingredients: The New Yorker Book of Food and Drink,140006547X,9781400065479, , ,ID,https://i.gr-assets.com/images/S/compressed.photo.goodreads.com/books/1442125042l/299448._SX98_.jpg,https://i.gr-assets.com/images/S/compressed.photo.goodreads.com/books/1442125042l/299448._SY75_.jpg,https://i.gr-assets.com/images/S/compressed.photo.goodreads.com/books/1442125042l/299448._SY475_.jpg,2007,10,30,Random House (NY),eng,false,"Since its earliest days, ""The New Yorker ""has been a tastemaker literally. As the home of A. J. Liebling, Joseph Wechsberg, and M.F.K. Fisher, who practically invented American food writing, the magazine established a tradition that is carried forward today by irrepressible literary gastronomes, including Calvin Trillin, Bill Buford, Adam Gopnik, Jane Kramer, and Anthony Bourdain. Now, in this indispensable collection, ""The New Yorker ""dishes up a feast of delicious writing on food and drink, seasoned with a generous dash of cartoons. <br />Whether you re in the mood for snacking on humor pieces and cartoons or for savoring classic profiles of great chefs and great eaters, these offerings, from every age of The New Yorker s fabled eighty-year history, are sure to satisfy every taste. There are memoirs, short stories, tell-alls, and poems ranging in tone from sweet to sour and in subject from soup to nuts. <br /><br />M.F.K. Fisher pays homage to cookery witches, those mysterious cooks who possess an uncanny power over food, while John McPhee valiantly trails an inveterate forager and is rewarded with stewed persimmons and white-pine-needle tea. There is Roald Dahl s famous story Taste, in which a wine snob s palate comes in for some unwelcome scrutiny, and Julian Barnes s ingenious tale of a lifelong gourmand who goes on a very peculiar diet for still more peculiar reasons. Adam Gopnik asks if French cuisine is done for, and Calvin Trillin investigates whether people can actually taste the difference between red wine and white. We journey with Susan Orlean as she distills the essence of Cuba in the story of a single restaurant, and with Judith Thurman as she investigates the arcane practices of Japan s tofu masters. Closer to home, Joseph Mitchell celebrates the old New York tradition of the beefsteak dinner, and Mark Singer shadows the city s foremost fisherman-chef. <br /><br />Dining out: All you can hold for five bucks / Joseph Mitchell --<br />The finest butter and lots of time / Joseph Wechsberg --<br />A good appetite / A.J. Liebling --<br />The afterglow / A.J. Liebling --<br />Is there a crisis in French cooking? / Adam Gopnik --<br />Don't eat before reading this / Anthony Bourdain --<br />A really big lunch / Jim Harrison --<br />Eating in: The secret ingredient / M.F.K. Fisher --<br />The trouble with tripe / M.F.K. Fisher --<br />Nor censure nor disdain / M.F.K. Fisher --<br />Good cooking: / Calvin Tomkins --<br />Look back in hunger / Anthony Lane --<br />The reporter's kitchen / Jane Kramer --<br />Fishing and foraging: A mess of clams / Joseph Mitchell --<br />A forager / John McPhee --<br />The fruit detective / John Seabrook --<br />Gone fishing / Mark Singer --<br />On the bay / Bill Buford --<br />Local delicacies: An attempt to compile a short history of The buffalo chicken wing / Calvin Trillin --<br />The homesick restaurant / Susan Orlean --<br />The magic bagel / Calvin Trillin --<br />A rat in my soup / Peter Hessler --<br />Raw faith / Burkhard Bilger --<br />Night kitchens / Judith Thurman --<br />The pour: Dry martini / Roger Angell --<br />The red and the white / Calvin Trillin --<br />The russian god / Victor Erofeyev --<br />The ketchup conundrum / Malcolm Gladwell --<br />Tastes funny: But the one on the right / Dorothy Parker --<br />Curl up and diet / Ogden Nash --<br />Quick, hammacher, my stomacher! / Ogden Nash --<br />Nesselrode to jeopardy / S.J. Perelman --<br />Eat, drink, and be merry / Peter De Vries --<br />Notes from the overfed / Woody Allen --<br />Two menus / Steve Martin --<br />The zagat history of my last relationship 409(3) / Noah Baumbach --<br />Your table is ready / John Kenney --<br />Small plates: Bock / William Shawn --<br />Diat / Geoffrey T. Hellman --<br />4 a.m. / James Stevenson --<br />Slave / Alex Prud'Homme --<br />Under the hood / Mark Singer --<br />Protein source / Mark Singer --<br />A sandwich / Nora Ephron --<br />Sea urchin / Chang-Rae Lee --<br />As the french do / Janet MalColm --<br />Blocking and chowing / Ben McGrath --<br />When edibles attack / Rebecca Mead --<br />Killing dinner / Gabrielle Hamilton --<br />Fiction: Taste / Roald Dahl --<br />Two roast beefs / V.S. Pritchett --<br />The sorrows of gin / John Cheever --<br />The jaguar sun / Italo Calvino --<br />There should be a name for it / Matthew Klam --<br />Sputnik / Don DeLillo --<br />Enough / Alice McDermott --<br />The butcher's wife / Louise Erdrich --<br />Bark / Julian Barnes",4.05,582,Hardcover, ,121,https://www.goodreads.com/book/show/299448.Secret_Ingredients,https://www.goodreads.com/book/show/299448.Secret_Ingredients
299528,"Lights Out: Sleep, Sugar, and Survival",0671038680,9780671038687, , ,ID,https://i.gr-assets.com/images/S/compressed.photo.goodreads.com/books/1408319696l/299528._SX98_.jpg,https://i.gr-assets.com/images/S/compressed.photo.goodreads.com/books/1408319696l/299528._SY75_.jpg,https://i.gr-assets.com/images/S/compressed.photo.goodreads.com/books/1408319696l/299528.jpg,2001,3,1,Atria Books,en-GB,false,"When it comes to obesity, diabetes, heart disease, cancer, and depression, everything you believe is a lie.<br /><br />With research gleaned from the National Institutes of Health, T.S. Wiley and Bent Formby deliver staggering findings: Americans really are sick from being tired. Diabetes, heart disease, cancer, and depression are rising in our population. We’re literally dying for a good night’s sleep.<br /><br /> Our lifestyle wasn’t always this way. It began with the invention of the lightbulb.<br /><br /> When we don’t get enough sleep in sync with seasonal light exposure, we fundamentally alter a balance of nature that has been programmed into our physiology since day one. This delicate biological rhythm rules the hormones and neurotransmitters that determine appetite, fertility, and mental and physical health. When we rely on artificial light to extend our day until 11 p.m., midnight, and beyond, we fool our bodies into living in a perpetual state of summer. Anticipating the scarce food supply and forced inactivity of winter, our bodies begin storing fat and slowing metabolism to sustain us through the months of hibernation and hunger that never arrive. Our own survival instinct, honed over millennia, is now killing us.<br /><br /> Wiley and Formby also reveal:<br /> -That studies from our own government research prove the role of sleeplessness in diabetes, heart disease, cancer, infertility, mental illness, and premature aging<br /> -Why the carbohydrate-rich diets recommended by many health professionals are not only ridiculously ineffective but deadly<br /> -Why the lifesaving information that can turn things around is one of the best-kept secrets of our day.<br /><br /><i>Lights Out</i> is one wake-up call none of us can afford to miss.",3.73,368,Paperback, ,76,https://www.goodreads.com/book/show/299528.Lights_Out,https://www.goodreads.com/book/show/299528.Lights_Out
299758,"The Citadel of the Autarch (The Book of the New Sun, #4)",0671496662,9780671496661, , ,ID,https://i.gr-assets.com/images/S/compressed.photo.goodreads.com/books/1332036031l/299758._SY160_.jpg,https://i.gr-assets.com/images/S/compressed.photo.goodreads.com/books/1332036031l/299758._SY75_.jpg,https://i.gr-assets.com/images/S/compressed.photo.goodreads.com/books/1332036031l/299758.jpg,1983,11,1,Timescape Books,eng,false,"Volume Four of the Book of the New Sun. <br /><br />Severian the Torturer continues his epic journey across the lands of Urth, a journey as fraught with peril as it is with wonder. Exiled from his guild he is an outcast, but his travels are woven with strange portents. The Claw of the Conciliator, relic of a prophet and promise of a new age, flames to life in his hands. He carries the great sword Terminus Est, the Line of Division. The dwellers in the deep waters offer him a kingdom under the seas. And he is hunted and driven by terrors from beyond Urth. <br /><br />Now all his travels move him inexorably toward a grander fate, a destiny that he dare not refuse. For a devouring blackness gnaws at the heart of the Old Sun, and the fate of Urth rests in the return of the Conciliator, the New Sun long foretold.",4.21,330,Paperback, ,189,https://www.goodreads.com/book/show/299758.The_Citadel_of_the_Autarch,https://www.goodreads.com/book/show/299758.The_Citadel_of_the_Autarch
299775,Brothers,1400097282,9781400097289, , ,ID,https://i.gr-assets.com/images/S/compressed.photo.goodreads.com/books/1173515263l/299775._SX98_.jpg,https://i.gr-assets.com/images/S/compressed.photo.goodreads.com/books/1173515263l/299775._SX50_.jpg,https://i.gr-assets.com/images/S/compressed.photo.goodreads.com/books/1173515263l/299775._SX318_.jpg,2006,9,19,Shaye Areheart Books,eng,false,"At the height of China’s Cultural Revolution a powerful general fathered two sons. Tan was born to the general’s wife and into a life of comfort and luxury. His half brother, Shento, was born to the general’s mistress, who threw herself off a cliff in the mountains of Balan only moments after delivering her child. Growing up, each remained ignorant of the other’s existence. In Beijing, Tan enjoyed the best schools, the finest clothes, and the prettiest girls. Shento was raised on the mountainside by an old healer and his wife until their deaths landed him in an orphanage, where he was always hungry, alone, and frightened. Though on divergent roads, each brother is driven by a passionate desire—one to glorify his father, the other to seek revenge against him.<br /><br />Separated by distance and opportunity, Tan and Shento follow the paths that lie before them, while unknowingly falling in love with the same woman and moving toward the explosive moment when their fates finally merge. <br /><br /><i>Brothers</i>, by bestselling memoirist Da Chen, is a sprawling, dynamic family saga, complete with assassinations, love affairs, narrowly missed opportunities, and the ineluctable fulfillment of destiny.",3.75,432,Hardcover, ,117,https://www.goodreads.com/book/show/299775.Brothers,https://www.goodreads.com/book/show/299775.Brothers
299910,Oil on the Brain: Adventures from the Pump to the Pipeline,0385511450,9780385511452, , ,ID,https://i.gr-assets.com/images/S/compressed.photo.goodreads.com/books/1439739614l/299910._SX98_.jpg,https://i.gr-assets.com/images/S/compressed.photo.goodreads.com/books/1439739614l/299910._SY75_.jpg,https://i.gr-assets.com/images/S/compressed.photo.goodreads.com/books/1439739614l/299910._SY475_.jpg,2007,1,30,Nan A. Talese,eng,false,"All my books are kept in dust free glass front bookcases, in a pet, smoke, dust free home, with hepa cleaning and filtration.",3.72,336,Hardcover, ,46,https://www.goodreads.com/book/show/299910.Oil_on_the_Brain,https://www.goodreads.com/book/show/299910.Oil_on_the_Brain
299960,The Earth Moved: On the Remarkable Achievements of Earthworms,1565124685,9781565124684, , ,ID,https://i.gr-assets.com/images/S/compressed.photo.goodreads.com/books/1404581052l/299960._SX98_.jpg,https://i.gr-assets.com/images/S/compressed.photo.goodreads.com/books/1404581052l/299960._SY75_.jpg,https://i.gr-assets.com/images/S/compressed.photo.goodreads.com/books/1404581052l/299960.jpg,2005,3,11,Algonquin Books,en-GB,false,"<b>""You know a book is good when you actually welcome one of those howling days of wind and sleet that makes going out next to impossible."" —<i>The New York Times</i></b><br /><br /> In <i>The Earth Moved</i>, Amy Stewart takes us on a journey through the underground world and introduces us to one of its most amazing denizens. The earthworm may be small, spineless, and blind, but its impact on the ecosystem is profound. It ploughs the soil, fights plant diseases, cleans up pollution, and turns ordinary dirt into fertile land. Who knew?<br /><br /> In her witty, offbeat style, Stewart shows that much depends on the actions of the lowly worm. Charles Darwin devoted his last years to the meticulous study of these creatures, praising their remarkable abilities. With the august scientist as her inspiration, Stewart investigates the worm's subterranean realm, talks to oligochaetologists—the unsung heroes of earthworm science—who have devoted their lives to unearthing the complex life beneath our feet, and observes the thousands of worms in her own garden. From the legendary giant Australian worm that stretches to ten feet in length to the modest nightcrawler that wormed its way into the heart of Darwin's last book to the energetic red wigglers in Stewart's compost bin, <i>The Earth Moved</i> gives worms their due and exposes their hidden and extraordinary universe. This book is for all of us who appreciate Mother Nature's creatures, no matter how humble.",3.89,240,Paperback, ,320,https://www.goodreads.com/book/show/299960.The_Earth_Moved,https://www.goodreads.com/book/show/299960.The_Earth_Moved
299980,Silent Warfare: Understanding the World of Intelligence,1574883453,9781574883459, , ,ID,https://i.gr-assets.com/images/S/compressed.photo.goodreads.com/books/1348002692l/299980._SX98_.jpg,https://i.gr-assets.com/images/S/compressed.photo.goodreads.com/books/1348002692l/299980._SY75_.jpg,https://i.gr-assets.com/images/S/compressed.photo.goodreads.com/books/1348002692l/299980.jpg,2002,5,1,Potomac Books,en-GB,false,"A thoroughly updated revision of the first comprehensive overview of intelligence designed for both the student and the general reader, <i>Silent Warfare</i> is an insider’s guide to a shadowy, often misunderstood world. Leading intelligence scholars Abram N. Shulsky and Gary J. Schmitt clearly explain such topics as the principles of collection, analysis, counterintelligence, and covert action, and their interrelationship with policymakers and democratic values.<br /><br /> This new edition takes account of the expanding literature in the field of intelligence and deals with the consequences for intelligence of vast recent changes in telecommunication and computer technology the new “information age.” It also reflects the world’s strategic changes since the end of the Cold War. This landmark book provides a valuable framework for understanding today’s headlines, as well as the many developments likely to come in the real world of the spy.",3.64,262,Paperback,3rd Edition,8,https://www.goodreads.com/book/show/299980.Silent_Warfare,https://www.goodreads.com/book/show/299980.Silent_Warfare
300138,The Unveiling of Secrets: Diary of a Sufi Master,0964436213,9780964436213, , ,ID,https://i.gr-assets.com/images/S/compressed.photo.goodreads.com/books/1348475758l/300138._SX98_.jpg,https://i.gr-assets.com/images/S/compressed.photo.goodreads.com/books/1348475758l/300138._SX50_.jpg,https://i.gr-assets.com/images/S/compressed.photo.goodreads.com/books/1348475758l/300138.jpg,1997,11,1,Parvardigar Press,eng,false,"""This book opens before us a world of fragrant roses, visions of incredible boldness, described by one of the greatest visionaries in the realm of mystical love in Islam, Ruzbihan. The reader is Transported by this congenial translation into the sphere of Absolute Beauty, and overwhelming Divine Love"".",4.15,156,Paperback, ,2,https://www.goodreads.com/book/show/300138.The_Unveiling_of_Secrets,https://www.goodreads.com/book/show/300138.The_Unveiling_of_Secrets
300194,El amante bilingüe,8432212164,9788432212161, , ,ID,https://s.gr-assets.com/assets/nophoto/book/111x148-bcc042a9c91a29c1d680899eff700a03.png,https://s.gr-assets.com/assets/nophoto/book/50x75-a91bf249278a81aabab721ef782c4a74.png,https://s.gr-assets.com/assets/nophoto/book/111x148-bcc042a9c91a29c1d680899eff700a03.png,2006,1,1,Editorial Seix Barral,,false,"Juan Mares Fanetca, se ve enganado y abandonado por su guapa, rica y distinguida mujer. En su afan por reconquistarla, se rein venta a si mismo en la figura de un charnego tramposo y variopinto. Lo que empieza como una aventura algo grotesca e inverosimil no tarda en convertirse en una satira ironica y feroz sobre la dualidad social y linguistica catalana, agravada por las diferencias de clase.",3.56,0, , ,2,https://www.goodreads.com/book/show/300194.El_amante_biling_e,https://www.goodreads.com/book/show/300194.El_amante_biling_e
300226,The Naked Face,0446321214,9780446321211, , ,ID,https://i.gr-assets.com/images/S/compressed.photo.goodreads.com/books/1398003487l/300226.jpg,https://i.gr-assets.com/images/S/compressed.photo.goodreads.com/books/1398003487l/300226._SY75_.jpg,https://i.gr-assets.com/images/S/compressed.photo.goodreads.com/books/1398003487l/300226.jpg,1982,,,,eng,false,"<i>Judd Stevens is a psychoanalyst faced with the most critical case of his life. If he does not penetrate the mind of a murderer he will find himself arrested for murder or murdered himself...</i><br /><br />Two people closely involved with Dr. Stevens have already been killed. Is one of his patients responsible? Someone overwhelmed by his problems? A neurotic driven by compulsion? a madman? Before the murderer strikes again, Judd must strip away the mask of innocence the criminal wears, uncover his inner emotions, fears, and desires - expose the naked face beneath...",3.54,316,Mass Market Paperback, ,487,https://www.goodreads.com/book/show/300226.The_Naked_Face,https://www.goodreads.com/book/show/300226.The_Naked_Face
300674,To Hell and Back,0805070869,9780805070866, , ,ID,https://i.gr-assets.com/images/S/compressed.photo.goodreads.com/books/1344865109l/300674._SX98_.jpg,https://i.gr-assets.com/images/S/compressed.photo.goodreads.com/books/1344865109l/300674._SX50_.jpg,https://i.gr-assets.com/images/S/compressed.photo.goodreads.com/books/1344865109l/300674.jpg,2002,5,1,Holt Paperbacks,,false,"<b>The classic bestselling war memoir by the most decorated American soldier in World War II, back in print in a trade paperback</b><br /><br />Originally published in 1949, <i>To Hell and Back</i> was a smash bestseller for fourteen weeks and later became a major motion picture starring Audie Murphy as himself. More than fifty years later, this classic wartime memoir is just as gripping as it was then.<br /><br />Desperate to see action but rejected by both the marines and paratroopers because he was too short, Murphy eventually found a home with the infantry. He fought through campaigns in Sicily, Italy, France, and Germany. Although still under twenty-one years old on V-E Day, he was credited with having killed, captured, or wounded 240 Germans. He emerged from the war as America's most decorated soldier, having received twenty-one medals, including our highest military decoration, the Congressional Medal of Honor. <i>To Hell and Back</i> is a powerfully real portrayal of American GI's at war.",4.23,288,Paperback, ,210,https://www.goodreads.com/book/show/300674.To_Hell_and_Back,https://www.goodreads.com/book/show/300674.To_Hell_and_Back
