id,title,isbn,isbn13,asin,kindle_asin,country_code,image_url,small_image_url,large_image_url,publication_year,publication_month,publication_day,publisher,language_code,is_ebook,description,average_rating,num_pages,format,edition_information,text_reviews_count,url,link
25648432,Girl Gone Greek,1512251887,9781512251883, , ,ID,https://i.gr-assets.com/images/S/compressed.photo.goodreads.com/books/1433240196l/25648432._SX98_.jpg,https://i.gr-assets.com/images/S/compressed.photo.goodreads.com/books/1433240196l/25648432._SY75_.jpg,https://i.gr-assets.com/images/S/compressed.photo.goodreads.com/books/1433240196l/25648432._SY475_.jpg,2015,5,29,CreateSpace Independent Publishing Platform,eng,false,"Rachel, a free-spirited and single forty-something English teacher, has discovered there’s more to life than marriage, children and living up to family expectations. Girl Gone Greek is a novel about an Englishwoman’s experiences in rural Greece early in the millennium. Set against the breathtaking background of the Greek countryside and Athens, Rachel meets a colourful cast of eccentric characters, plants her feet deeply into the local soil and ultimately finds her true love – Greece.",3.74,186,Paperback, ,28,https://www.goodreads.com/book/show/25648432-girl-gone-greek,https://www.goodreads.com/book/show/25648432-girl-gone-greek
25649493,Junji Ito's Cat Diary: Yon & Mu,1632361973,9781632361974, , ,ID,https://i.gr-assets.com/images/S/compressed.photo.goodreads.com/books/1444685416l/25649493._SX98_.jpg,https://i.gr-assets.com/images/S/compressed.photo.goodreads.com/books/1444685416l/25649493._SX50_.jpg,https://i.gr-assets.com/images/S/compressed.photo.goodreads.com/books/1444685416l/25649493.jpg,2015,10,27,Kodansha Comics,eng,false,"Hell-o-kitty! Master of Japanese horror manga Junji Ito presents a series of hissterical tales chronicling his real-life trials and tribulations of becoming a cat owner. Junji Ito, as J-kun, has recently built a new house and has invited his financée, A-ko, to live with him. Little did he know … his blushing bride-to-be has some unexpected company in tow—Yon, a ghastly-looking family cat, and Mu, an adorable Norwegian forest cat. Despite being a dog person, J-kun finds himself purrsuaded by their odd cuteness and thus begins his comedic struggle to gain the affection of his new feline friends.",4.15,120,Paperback, ,318,https://www.goodreads.com/book/show/25649493-junji-ito-s-cat-diary,https://www.goodreads.com/book/show/25649493-junji-ito-s-cat-diary
25649743,Sex and Soul: A Memoir of Salvation, , ,B00OQFMEX6, ,ID,https://i.gr-assets.com/images/S/compressed.photo.goodreads.com/books/1433256706l/25649743._SX98_.jpg,https://i.gr-assets.com/images/S/compressed.photo.goodreads.com/books/1433256706l/25649743._SY75_.jpg,https://i.gr-assets.com/images/S/compressed.photo.goodreads.com/books/1433256706l/25649743._SY475_.jpg,2014,10,24,Letter Pen Press,en-US,true,"""I grew up in a world where it seemed all women were meant to marry, and it was expected that every girl wanted to be a bride. I wanted to be Roy Rogers."" <br /> <br />Sex and Soul: A Memoir of Salvation is about the quest to reconcile body and soul; it is an intimate look at a struggle between the dictates of a Catholic upbringing and the call to be true to one's sense of self. In a story of transition from compliance to nonconformity, Cristina L. White shares her sexual awakening, spiritual transformation, and her political affinities—a trinity that fueled her change from good Catholic girl to an out and open gay woman of color. <br /> <br />Sex and Soul is a frank and often funny account of how one woman's road to damnation became her sole path to salvation.",4.00,142,Kindle Edition, ,0,https://www.goodreads.com/book/show/25649743-sex-and-soul,https://www.goodreads.com/book/show/25649743-sex-and-soul
25652274,"Call to Arms (Black Fleet Trilogy, #2)", , ,B00YQBTMNK, ,ID,https://i.gr-assets.com/images/S/compressed.photo.goodreads.com/books/1437905409l/25652274._SX98_.jpg,https://i.gr-assets.com/images/S/compressed.photo.goodreads.com/books/1437905409l/25652274._SY75_.jpg,https://i.gr-assets.com/images/S/compressed.photo.goodreads.com/books/1437905409l/25652274._SY475_.jpg,2015,6,1,,eng,true,"From Joshua Dalzelle comes the follow up to the #1 Bestseller “Warship.” <br /> <br />Captain Jackson Wolfe survived the initial incursion of a vicious alien species into human space … barely. <br />He had assumed the juggernaut that had devastated three Terran systems was the herald for a full invasion, but for the last few years it has been eerily quiet along the Frontier. <br />Jackson now struggles to convince the Confederate leadership the threat is still imminent and needs to be taken seriously. While powerful factions make backroom deals he is desperate to find irrefutable proof that the invaders are coming and that if humanity expects to survive they must marshal their forces and make a stand. Now. <br />",4.10,332,Kindle Edition, ,198,https://www.goodreads.com/book/show/25652274-call-to-arms,https://www.goodreads.com/book/show/25652274-call-to-arms
25656499,Fates and Furies, , ,B00SI0B5VW, ,ID,https://i.gr-assets.com/images/S/compressed.photo.goodreads.com/books/1479662199l/25656499._SX98_.jpg,https://i.gr-assets.com/images/S/compressed.photo.goodreads.com/books/1479662199l/25656499._SY75_.jpg,https://i.gr-assets.com/images/S/compressed.photo.goodreads.com/books/1479662199l/25656499.jpg,2015,9,15,Riverhead Books,eng,true,"Every story has two sides. Every relationship has two perspectives. And sometimes, it turns out, the key to a great marriage is not its truths but its secrets. At the core of this rich, expansive, layered novel, Lauren Groff presents the story of one such marriage over the course of twenty-four years.<br /><br />At age twenty-two, Lotto and Mathilde are tall, glamorous, madly in love, and destined for greatness. A decade later, their marriage is still the envy of their friends, but with an electric thrill we understand that things are even more complicated and remarkable than they have seemed. With stunning revelations and multiple threads, and in prose that is vibrantly alive and original, Groff delivers a deeply satisfying novel about love, art, creativity, and power that is unlike anything that has come before it. Profound, surprising, propulsive, and emotionally riveting, it stirs both the mind and the heart.",3.57,391,Kindle Edition, ,746,https://www.goodreads.com/book/show/25656499-fates-and-furies,https://www.goodreads.com/book/show/25656499-fates-and-furies
25656573,I Know How She Does It: How Successful Women Make the Most of their Time,0241199514,9780241199510, , ,ID,https://i.gr-assets.com/images/S/compressed.photo.goodreads.com/books/1434259560l/25656573._SX98_.jpg,https://i.gr-assets.com/images/S/compressed.photo.goodreads.com/books/1434259560l/25656573._SY75_.jpg,https://i.gr-assets.com/images/S/compressed.photo.goodreads.com/books/1434259560l/25656573._SY475_.jpg,2015,6,25,Penguin,en-IN,false,"<p>
  <b>In <i>I Know How She Does It, </i>time management expert Laura Vanderkam offers powerful insights from the diaries of successful women to show you how to rethink the hours of your week - and build a life that works for you. </b>
</p><p>
  <b>
    <br />
  </b>
  <b> </b>
</p><p><b><br /></b>Do you struggle to balance the demands of a successful career with quality time with family and friends, your hobbies, and even a decent night's sleep? </p><p><br /> </p><p><br />In <i>I Know How She Does It</i>, time management expert and bestselling author of <i>What the Most Successful People Do Before Breakfast</i> Laura Vanderkam reveals the surprising strategies you can use to spend more time on the things you enjoy. By following her advice, you will be able to work less, sleep more, enjoy date nights, go to the gym and socialise.</p><p><br /> </p><p><br />Based on hour-by-hour time logs from 1,001 days in the lives of real women, Vanderkam proves that you don't have to give up on the things you really want. <i>I Know How She Does It</i> offers specific strategies proven to help you build a life that works, one hour at a time.</p>",3.71,304,Paperback, ,5,https://www.goodreads.com/book/show/25656573-i-know-how-she-does-it,https://www.goodreads.com/book/show/25656573-i-know-how-she-does-it
25657130,All American Boys,1481463330,9781481463331, , ,ID,https://i.gr-assets.com/images/S/compressed.photo.goodreads.com/books/1444506678l/25657130._SX98_.jpg,https://i.gr-assets.com/images/S/compressed.photo.goodreads.com/books/1444506678l/25657130._SX50_.jpg,https://i.gr-assets.com/images/S/compressed.photo.goodreads.com/books/1444506678l/25657130.jpg,2015,9,29,Atheneum/Caitlyn Dlouhy Books,eng,false,"<i>Rashad is absent again today.</i><br /><br />That’s the sidewalk graffiti that started it all…<br /><br />Well, no, actually, a lady tripping over Rashad at the store, making him drop a bag of chips, was what started it all. Because it didn’t matter what Rashad said next—that it was an accident, that he wasn’t stealing—the cop just kept pounding him. Over and over, pummeling him into the pavement. So then Rashad, an ROTC kid with mad art skills, was absent again…and again…stuck in a hospital room. Why? Because it <i>looked</i> like he was stealing. And he was a black kid in baggy clothes. So he must have been stealing.<br /><br />And that’s how it started.<br /><br />And that’s what Quinn, a white kid, saw. He saw his best friend’s older brother beating the daylights out of a classmate. At first Quinn doesn’t tell a soul…He’s not even sure he understands it. And does it matter? The whole thing was caught on camera, anyway. But when the school—and nation—start to divide on what happens, blame spreads like wildfire fed by ugly words like “racism” and “police brutality.” Quinn realizes he’s <i>got</i> to understand it, because, bystander or not, he’s a part of history. He just has to figure out what side of history that will be.<br /><br />Rashad and Quinn—one black, one white, both American—face the unspeakable truth that racism and prejudice didn’t die after the civil rights movement. There’s a future at stake, a future where no one else will have to be absent because of police brutality. They just have to risk everything to change the world.<br /><br />Cuz that’s how it can end.",4.33,316,Hardcover,First Edition,4885,https://www.goodreads.com/book/show/25657130-all-american-boys,https://www.goodreads.com/book/show/25657130-all-american-boys
25658482,"At the Existentialist Café: Freedom, Being, and Apricot Cocktails",0701186585,9780701186586, , ,ID,https://i.gr-assets.com/images/S/compressed.photo.goodreads.com/books/1550567060l/25658482._SX98_.jpg,https://i.gr-assets.com/images/S/compressed.photo.goodreads.com/books/1550567060l/25658482._SY75_.jpg,https://i.gr-assets.com/images/S/compressed.photo.goodreads.com/books/1550567060l/25658482._SY475_.jpg,2016,3,3,Chatto & Windus,eng,false,"Paris, near the turn of 1933. Three young friends meet over apricot cocktails at the Bec-de-Gaz bar on the rue Montparnasse. They are Jean-Paul Sartre, Simone de Beauvoir and their friend Raymond Aron, who opens their eyes to a radical new way of thinking. Pointing to his drink, he says, 'You can make philosophy out of <i>this cocktail</i>!'<br /><br />From this moment of inspiration, Sartre will create his own extraordinary philosophy of real, experienced life–of love and desire, of freedom and being, of cafés and waiters, of friendships and revolutionary fervour. It is a philosophy that will enthral Paris and sweep through the world, leaving its mark on post-war liberation movements, from the student uprisings of 1968 to civil rights pioneers.<br /><br /><i>At the Existentialist Café</i> tells the story of modern existentialism as one of passionate encounters between people, minds and ideas. From the ‘king and queen of existentialism'–Sartre and de Beauvoir–to their wider circle of friends and adversaries including Albert Camus, Martin Heidegger, Maurice Merleau-Ponty and Iris Murdoch, this book is an enjoyable and original journey through a captivating intellectual movement. Weaving biography and thought, Sarah Bakewell takes us to the heart of a philosophy about life that also <i>changed</i> lives, and that tackled the biggest questions of all: <i>what we are</i> and <i>how we are to live</i>.",4.23,440,Hardcover, ,898,https://www.goodreads.com/book/show/25658482-at-the-existentialist-caf,https://www.goodreads.com/book/show/25658482-at-the-existentialist-caf
25658832,Shelter,1250075645,9781250075642, , ,ID,https://i.gr-assets.com/images/S/compressed.photo.goodreads.com/books/1452090024l/25658832._SX98_.jpg,https://i.gr-assets.com/images/S/compressed.photo.goodreads.com/books/1452090024l/25658832._SX50_.jpg,https://i.gr-assets.com/images/S/compressed.photo.goodreads.com/books/1452090024l/25658832.jpg,2016,3,15,Picador,eng,true,"<b>Why should a man care for his parents when they failed to take care of him as a child?</b><br /><br />Kyung Cho is a young father burdened by a house he can’t afford. For years, he and his wife, Gillian, have lived beyond their means. Now their debts and bad decisions are catching up with them, and Kyung is anxious for his family’s future.<br /><br />A few miles away, his parents, Jin and Mae, live in the town’s most exclusive neighborhood, surrounded by the material comforts that Kyung desires for his wife and son. Growing up, they gave him every possible advantage—private tutors, expensive hobbies—but they never showed him kindness. Kyung can hardly bear to see them now, much less ask for their help. Yet when an act of violence leaves Jin and Mae unable to live on their own, the dynamic suddenly changes, and he’s compelled to take them in. For the first time in years, the Chos find themselves living under the same roof. Tensions quickly mount as Kyung’s proximity to his parents forces old feelings of guilt and anger to the surface, along with a terrible and persistent question: how can he ever be a good husband, father, and son when he never knew affection as a child?<br /><br />As <i>Shelter</i> veers swiftly toward its startling conclusion, Jung Yun leads us through dark and violent territory, where, unexpectedly, the Chos discover hope. <i>Shelter</i> is a masterfully crafted debut novel that asks what it means to provide for one's family and, in answer, delivers a story as riveting as it is profound.",3.73,336,ebook, ,855,https://www.goodreads.com/book/show/25658832-shelter,https://www.goodreads.com/book/show/25658832-shelter
25663539,Outline,1250081548,9781250081544, , ,ID,https://i.gr-assets.com/images/S/compressed.photo.goodreads.com/books/1453058723l/25663539._SX98_.jpg,https://i.gr-assets.com/images/S/compressed.photo.goodreads.com/books/1453058723l/25663539._SX50_.jpg,https://i.gr-assets.com/images/S/compressed.photo.goodreads.com/books/1453058723l/25663539.jpg,2016,2,9,Picador,eng,false,"A woman writer goes to Athens in the height of summer to teach a writing course. Though her own circumstances remain indistinct, she becomes the audience to a chain of narratives, as the people she meets tell her one after another the stories of their lives.<br /><br />Beginning with the neighbouring passenger on the flight out and his tales of fast boats and failed marriages, the storytellers talk of their loves and ambitions and pains, their anxieties, their perceptions and daily lives. In the stifling heat and noise of the city the sequence of voice begins to weave a complex human tapestry. The more they talk the more elliptical their listener becomes, as she shapes and directs their accounts until certain themes begin to emerge: the experience of loss, the nature of family life, the difficulty of intimacy and the mystery of creativity itself.<br /><br />Outline is a novel about writing and talking, about self-effacement and self-expression, about the desire to create and the human art of self-portraiture in which that desire finds its universal form.",3.65,256,Paperback, ,163,https://www.goodreads.com/book/show/25663539-outline,https://www.goodreads.com/book/show/25663539-outline
25663657,"The Cracked Spine (Scottish Bookshop Mystery, #1)",1250057485,9781250057488, , ,ID,https://i.gr-assets.com/images/S/compressed.photo.goodreads.com/books/1435952724l/25663657._SX98_.jpg,https://i.gr-assets.com/images/S/compressed.photo.goodreads.com/books/1435952724l/25663657._SY75_.jpg,https://i.gr-assets.com/images/S/compressed.photo.goodreads.com/books/1435952724l/25663657.jpg,2016,3,29,Minotaur Books,,false,"In need of a good adventure, Delaney Nichols takes the leap and moves to Edinburgh, Scotland to start a job at The Cracked Spine. She doesn't know much about what she's gotten herself into, other than that the work sounds exciting, and that her new boss, Edwin MacAlister, has given her the opportunity of a lifetime. Edwin has promised that she'll be working with ""a desk that has seen the likes of kings and queens, paupers and princes,"" and Delaney can't wait to get started.<br /><br />When she arrives, she meets her new Scottish family; also working at the Cracked Spine are Rosie, perpetually wrapped in scarves, and who always has tiny dog Hector in tow; Hamlet, a nineteen-year-old thespian with a colored past and bright future; and Edwin, who is just as enigmatic and mysterious as Delaney expected. An unexpected bonus is Tom the bartender from across the street, with his piercing eyes, and a rolling brogue -- and it doesn't hurt that he looks awfully good in a kilt.<br /><br />But before she can settle into her new life, a precious artifact -- a previously undiscovered First Folio of Shakespeare's plays -- goes missing, and Edwin's sister is murdered, seemingly in connection to the missing folio. Delaney decides to do some sleuthing of her own, to find out just what the real story is behind the priceless folio, and how it's connected to the tragic death, all without getting harmed herself.",3.51,304,Hardcover, ,652,https://www.goodreads.com/book/show/25663657-the-cracked-spine,https://www.goodreads.com/book/show/25663657-the-cracked-spine
25663779,The Doomsday Machine: Confessions of a Nuclear War Planner,1608196704,9781608196708, , ,ID,https://i.gr-assets.com/images/S/compressed.photo.goodreads.com/books/1503339552l/25663779._SX98_.jpg,https://i.gr-assets.com/images/S/compressed.photo.goodreads.com/books/1503339552l/25663779._SY75_.jpg,https://i.gr-assets.com/images/S/compressed.photo.goodreads.com/books/1503339552l/25663779.jpg,2017,12,5,Bloomsbury Press,,false,"<b>From the legendary whistle-blower who revealed the Pentagon Papers, an eyewitness exposé of the awful dangers of America’s hidden, fifty-year-long nuclear policy that continues to this day.</b><br /><br />When former presidential advisor Daniel Ellsberg famously took the top-secret Pentagon Papers, he also took with him a chilling cache of top secret documents related to America’s nuclear program in the 1960s. Here for the first time he reveals the contents of those documents, and makes clear their shocking relevance for today.<br /><br /><i>The Doomsday Machine</i> is Ellsberg’s hair-raising insider’s account of the most dangerous arms buildup in the history of civilization, whose legacy—and proposed renewal under the Trump administration—threatens the very survival of humanity. It is scarcely possible to estimate the true dangers of our present nuclear policies without penetrating the secret realities of the nuclear strategy of the late Eisenhower and early Kennedy years, when Ellsberg had high-level access to them. No other insider has written so candidly of that long-classified history, though the policies remain fundamentally, and frighteningly, unchanged <br /><br />Ellsberg, in the end, offers steps we can take under the current administration to avoid nuclear catastrophe. Framed as a memoir, this gripping exposé reads like a thriller with cloak-and-dagger intrigue, placing Ellsberg back in his natural role as whistle-blower. It is a real-life Dr. Strangelove story, but an ultimately hopeful—and powerfully important—book.",4.24,387,Hardcover, ,228,https://www.goodreads.com/book/show/25663779-the-doomsday-machine,https://www.goodreads.com/book/show/25663779-the-doomsday-machine
25663872,Left of Boom: How a Young CIA Case Officer Penetrated the Taliban and Al-Qaeda,125008136X,9781250081360, , ,ID,https://i.gr-assets.com/images/S/compressed.photo.goodreads.com/books/1459652566l/25663872._SX98_.jpg,https://i.gr-assets.com/images/S/compressed.photo.goodreads.com/books/1459652566l/25663872._SY75_.jpg,https://i.gr-assets.com/images/S/compressed.photo.goodreads.com/books/1459652566l/25663872.jpg,2016,4,5,St. Martin's Press,,false,"On September 11, 2001, Doug Laux was a freshman in college, on the path to becoming a doctor. But with the fall of the Twin Towers came a turning point in his life. After graduating he joined the Central Intelligence Agency, determined to get himself to Afghanistan and into the center of the action. Through persistence and hard work he was fast-tracked to a clandestine operations position overseas. Dropped into a remote region of Afghanistan, he received his baptism by fire. Frustrated by bureaucratic red tape, a widespread lack of knowledge of the local customs and culture and an attitude of complacency that hindered his ability to combat the local Taliban, Doug confounded his peers by dressing like a native and mastering the local dialect, making contact and building sources within several deadly terrorist networks. His new approach resulted in unprecedented successes, including the uncovering the largest IED network in the world, responsible for killing hundreds of US soldiers. Meanwhile, Doug had to keep up false pretenses with his family, girlfriend and friends--nobody could know what he did for a living--and deal with the emotional turbulence of constantly living a lie. His double life was building to an explosive resolution, with repercussions that would have far reaching consequences.",3.84,320,Hardcover, ,101,https://www.goodreads.com/book/show/25663872-left-of-boom,https://www.goodreads.com/book/show/25663872-left-of-boom
25663961,How Not to Die: Discover the Foods Scientifically Proven to Prevent and Reverse Disease,1250066115,9781250066114, , ,ID,https://i.gr-assets.com/images/S/compressed.photo.goodreads.com/books/1436292289l/25663961._SX98_.jpg,https://i.gr-assets.com/images/S/compressed.photo.goodreads.com/books/1436292289l/25663961._SY75_.jpg,https://i.gr-assets.com/images/S/compressed.photo.goodreads.com/books/1436292289l/25663961._SY475_.jpg,2015,12,8,Flatiron Books,eng,false,"From the physician behind the wildly popular website NutritionFacts.org, <i>How Not to Die </i>reveals the groundbreaking scientific evidence behind the only diet that can prevent and reverse many of the causes of disease-related death.<br /><br />The vast majority of premature deaths can be prevented through simple changes in diet and lifestyle. In <i>How Not to Die</i>, Dr. Michael Greger, the internationally-renowned nutrition expert, physician, and founder of NutritionFacts.org, examines the fifteen top causes of premature death in America -- heart disease, various cancers, diabetes, Parkinson's, high blood pressure, and more -- and explains how nutritional and lifestyle interventions can sometimes trump prescription pills and other pharmaceutical and surgical approaches, freeing us to live healthier lives.<br /><br />The simple truth is that most doctors are good at treating acute illnesses but bad at preventing chronic disease. The fifteen leading causes of death claim the lives of 1.6 million Americans annually. This doesn't have to be the case. By following Dr. Greger's advice, all of it backed up by strong scientific evidence, you will learn which foods to eat and which lifestyle changes to make to live longer.<br /><br />History of prostate cancer in your family? Put down that glass of milk and add flaxseed to your diet whenever you can. Have high blood pressure? Hibiscus tea can work better than a leading hypertensive drug-and without the side effects. Fighting off liver disease? Drinking coffee can reduce liver inflammation. Battling breast cancer? Consuming soy is associated with prolonged survival. Worried about heart disease (the number 1 killer in the United States)? Switch to a whole-food, plant-based diet, which has been repeatedly shown not just to prevent the disease but often stop it in its tracks.<br /><br />In addition to showing what to eat to help treat the top fifteen causes of death, <i>How Not to Die</i> includes Dr. Greger's Daily Dozen -- a checklist of the twelve foods we should consume every day. Full of practical, actionable advice and surprising, cutting edge nutritional science, these doctor's orders are just what we need to live longer, healthier lives.",4.50,576,Hardcover, ,2073,https://www.goodreads.com/book/show/25663961-how-not-to-die,https://www.goodreads.com/book/show/25663961-how-not-to-die
