id,title,isbn,isbn13,asin,kindle_asin,country_code,image_url,small_image_url,large_image_url,publication_year,publication_month,publication_day,publisher,language_code,is_ebook,description,average_rating,num_pages,format,edition_information,text_reviews_count,url,link
29939160,"The Collapsing Empire (The Interdependency, #1)",076538888X,9780765388889, , ,ID,https://i.gr-assets.com/images/S/compressed.photo.goodreads.com/books/1464097604l/29939160._SX98_.jpg,https://i.gr-assets.com/images/S/compressed.photo.goodreads.com/books/1464097604l/29939160._SY75_.jpg,https://i.gr-assets.com/images/S/compressed.photo.goodreads.com/books/1464097604l/29939160.jpg,2017,3,21,Tor Books,eng,false,"The first novel of a new space-opera sequence set in an all-new universe by the Hugo Award-winning, New York Times-bestselling author of Redshirts and Old Man's War.<br /><br />Our universe is ruled by physics and faster than light travel is not possible -- until the discovery of The Flow, an extra-dimensional field we can access at certain points in space-time that transport us to other worlds, around other stars. <br /><br />Humanity flows away from Earth, into space, and in time forgets our home world and creates a new empire, the Interdependency, whose ethos requires that no one human outpost can survive without the others. It’s a hedge against interstellar war -- and a system of control for the rulers of the empire.<br /><br />The Flow is eternal -- but it is not static. Just as a river changes course, The Flow changes as well, cutting off worlds from the rest of humanity. When it’s discovered that The Flow is moving, possibly cutting off all human worlds from faster than light travel forever, three individuals -- a scientist, a starship captain and the Empress of the Interdependency -- are in a race against time to discover what, if anything, can be salvaged from an interstellar empire on the brink of collapse.",4.10,333,Hardcover, ,337,https://www.goodreads.com/book/show/29939160-the-collapsing-empire,https://www.goodreads.com/book/show/29939160-the-collapsing-empire
29939161,Radical Candor: Be a Kickass Boss Without Losing Your Humanity,1250103509,9781250103505, , ,ID,https://i.gr-assets.com/images/S/compressed.photo.goodreads.com/books/1482838407l/29939161._SX98_.jpg,https://i.gr-assets.com/images/S/compressed.photo.goodreads.com/books/1482838407l/29939161._SY75_.jpg,https://i.gr-assets.com/images/S/compressed.photo.goodreads.com/books/1482838407l/29939161.jpg,2017,3,14,St. Martin's Press,,false,"From the time we learn to speak, we’re told that if you don’t have anything nice to say, don’t say anything at all. While this advice may work for everyday life, it is, as Kim Scott has seen, a disaster when adopted by managers.<br /><br />Scott earned her stripes as a highly successful manager at Google and then decamped to Apple, where she developed a class on optimal management. She has earned growing fame in recent years with her vital new approach to effective management, the “radical candor” method.<br /><br />Radical candor is the sweet spot between managers who are obnoxiously aggressive on one side and ruinously empathetic on the other. It’s about providing guidance, which involves a mix of praise as well as criticism—delivered to produce better results and help employees achieve.<br /><br />Great bosses have strong relationships with their employees, and Scott has identified three simple principles for building better relationships with your employees: make it personal, get (sh)it done, and understand why it matters.<br /><br /><i>Radical Candor </i>offers a guide to those bewildered or exhausted by management, written for bosses and those who manage bosses. Taken from years of the author’s experience, and distilled clearly giving actionable lessons to the reader; it shows managers how to be successful while retaining their humanity, finding meaning in their job, and creating an environment where people both love their work and their colleagues.",4.15,246,Hardcover, ,1449,https://www.goodreads.com/book/show/29939161-radical-candor,https://www.goodreads.com/book/show/29939161-radical-candor
29939230,"A Conjuring of Light (Shades of Magic, #3)",0765387468,9780765387462, , ,ID,https://i.gr-assets.com/images/S/compressed.photo.goodreads.com/books/1464017758l/29939230._SX98_.jpg,https://i.gr-assets.com/images/S/compressed.photo.goodreads.com/books/1464017758l/29939230._SY75_.jpg,https://i.gr-assets.com/images/S/compressed.photo.goodreads.com/books/1464017758l/29939230.jpg,2017,2,21,Tor Books,eng,false,"<b><i>Witness the fate of beloved heroes - and enemies.</i><br /><br />THE BALANCE OF POWER HAS FINALLY TIPPED...</b><br />The precarious equilibrium among four Londons has reached its breaking point. Once brimming with the red vivacity of magic, darkness casts a shadow over the Maresh Empire, leaving a space for another London to rise.<br /><br /><b>WHO WILL CRUMBLE?</b><br />Kell - once assumed to be the last surviving <i>Antari</i> - begins to waver under the pressure of competing loyalties. And in the wake of tragedy, can Arnes survive?<br /><br /><b>WHO WILL RISE?</b><br />Lila Bard, once a commonplace - but never common - thief, has survived and flourished through a series of magical trials. But now she must learn to control the magic, before it bleeds her dry. Meanwhile, the disgraced Captain Alucard Emery of the <i>Night Spire</i> collects his crew, attempting a race against time to acquire the impossible.<br /><br /><b>WHO WILL TAKE CONTROL?</b><br />And an ancient enemy returns to claim a crown while a fallen hero tries to save a world in decay.",4.33,624,Hardcover,First Edition,9550,https://www.goodreads.com/book/show/29939230-a-conjuring-of-light,https://www.goodreads.com/book/show/29939230-a-conjuring-of-light
29939353,Lillian Boxfish Takes a Walk,1250113326,9781250113320, , ,ID,https://i.gr-assets.com/images/S/compressed.photo.goodreads.com/books/1464820875l/29939353._SX98_.jpg,https://i.gr-assets.com/images/S/compressed.photo.goodreads.com/books/1464820875l/29939353._SX50_.jpg,https://i.gr-assets.com/images/S/compressed.photo.goodreads.com/books/1464820875l/29939353.jpg,2017,1,17,St. Martin's Press,eng,false,"It’s the last day of 1984, and 85-year-old Lillian Boxfish is about to take a walk.<br /><br />As she traverses a grittier Manhattan, a city anxious after an attack by a still-at-large subway vigilante, she encounters bartenders, bodega clerks, chauffeurs, security guards, bohemians, criminals, children, parents, and parents-to-be—in surprising moments of generosity and grace. While she strolls, Lillian recalls a long and eventful life that included a brief reign as the highest-paid advertising woman in America—a career cut short by marriage, motherhood, divorce, and a breakdown.<br /><br />A love letter to city life—however shiny or sleazy—<i>Lillian Boxfish Takes a Walk</i> by Kathleen Rooney paints a portrait of a remarkable woman across the canvas of a changing America: from the Jazz Age to the onset of the AIDS epidemic; the Great Depression to the birth of hip-hop.",3.85,287,Hardcover, ,3107,https://www.goodreads.com/book/show/29939353-lillian-boxfish-takes-a-walk,https://www.goodreads.com/book/show/29939353-lillian-boxfish-takes-a-walk
29939363,Transit,0374278628,9780374278625, , ,ID,https://i.gr-assets.com/images/S/compressed.photo.goodreads.com/books/1468505188l/29939363._SX98_.jpg,https://i.gr-assets.com/images/S/compressed.photo.goodreads.com/books/1468505188l/29939363._SY75_.jpg,https://i.gr-assets.com/images/S/compressed.photo.goodreads.com/books/1468505188l/29939363._SY475_.jpg,2017,1,17,"Farrar, Straus and Giroux",eng,false,"<b>The stunning second novel of a trilogy that began with <i>Outline</i>, one of <i>The New York Times Book Review</i>’s ten best books of 2015</b>.<br /><br />In the wake of family collapse, a writer and her two young sons move to London. The process of upheaval is the catalyst for a number of transitions—personal, moral, artistic, practical—as she endeavors to construct a new reality for herself and her children. In the city she is made to confront aspects of living she has, until now, avoided, and to consider questions of vulnerability and power, death and renewal, in what becomes her struggle to reattach herself to, and believe in, life.<br /><br />Filtered through the impersonal gaze of its keenly intelligent protagonist, <i>Transit</i> sees Rachel Cusk delve deeper into the themes first raised in her critically acclaimed <i>Outline</i>, and offers up a penetrating and moving reflection on childhood and fate, the value of suffering, the moral problems of personal responsibility, and the mystery of change. In this precise, short, and yet epic cycle of novels, Cusk manages to describe the most elemental experiences, the liminal qualities of life, through a narrative near-silence that draws language toward it. She captures with unsettling restraint and honesty the longing to both inhabit and flee one's life and the wrenching ambivalence animating our desire to feel real.",3.96,260,Hardcover, ,811,https://www.goodreads.com/book/show/29939363-transit,https://www.goodreads.com/book/show/29939363-transit
29939365,"Conviction (Rebekah Roberts, #3)",1250083699,9781250083692, , ,ID,https://i.gr-assets.com/images/S/compressed.photo.goodreads.com/books/1464822856l/29939365._SX98_.jpg,https://i.gr-assets.com/images/S/compressed.photo.goodreads.com/books/1464822856l/29939365._SY75_.jpg,https://i.gr-assets.com/images/S/compressed.photo.goodreads.com/books/1464822856l/29939365.jpg,2017,3,28,Minotaur Books,eng,false,"New York City 1992: a year after riots exploded between black and Jewish neighbors in Brooklyn, a black family is brutally murdered in their Crown Heights home. A teenager is quickly convicted, and the justice system moves on.<br /><br />Twenty-two years later, journalist Rebekah Roberts gets a letter: I didn't do it. Frustrated with her work at the city’s sleaziest tabloid, Rebekah starts to dig. But witnesses are missing, memories faded, and almost no one wants to talk about that grim, violent time in New York City—not even Saul Katz, a former NYPD cop and her source in Brooklyn’s insular Hasidic community.<br /><br />So she goes it alone. And as she gets closer to the truth of that night, Rebekah finds herself in the path of a killer with two decades of secrets to protect.<br /><br />From the author of the Edgar-nominated Invisible City comes another timely thriller that illuminates society’s darkest corners. Told in part through the eyes of a jittery eyewitness and the massacre’s sole survivor, Julia Dahl's <i>Conviction</i> examines the power—and cost—of community, loyalty, and denial.",3.84,312,Hardcover, ,122,https://www.goodreads.com/book/show/29939365-conviction,https://www.goodreads.com/book/show/29939365-conviction
29939402,Unf*ck Your Habitat: You're Better Than Your Mess,1250102952,9781250102959, , ,ID,https://i.gr-assets.com/images/S/compressed.photo.goodreads.com/books/1466048026l/29939402._SX98_.jpg,https://i.gr-assets.com/images/S/compressed.photo.goodreads.com/books/1466048026l/29939402._SY75_.jpg,https://i.gr-assets.com/images/S/compressed.photo.goodreads.com/books/1466048026l/29939402._SY475_.jpg,2017,1,3,St. Martin's Griffin,eng,false,"Finally, a housekeeping and organizational system developed for those of us who'd describe our current living situation as a “f*cking mess” that we're desperate to fix. <i>Unf*ck Your Habitat</i> is for anyone who has been left behind by traditional aspirational systems: The ones that ignore single people with full-time jobs; people without kids but living with roommates; and people with mental illnesses or physical limitations, and many others. Most organizational books are aimed at traditional homemakers, DIYers, and people who seem to have unimaginable amounts of free time. They assume we all iron our sheets, have linen napkins to match our table runners, and can keep plants alive for longer than a week. Basically, they ignore most of us living here in the real world.<br /><br />Interspersed with lists and challenges, this practical, no-nonsense advice relies on a 20/10 system (20 minutes of cleaning followed by a 10-minute break; no marathon cleaning allowed) to help you develop lifelong habits. It motivates you to embrace a new lifestyle in manageable sections so you can actually start applying the tactics as you progress. For everyone stuck between <i>The Life-Changing Magic of Tidying Up </i>and<i> Adulting</i>, this philosophy is decidedly more realistic than aspirational, but the goal is the same: not everyone will have a showcase of a home, but whatever your habitat, you deserve one that brings you happiness, not stress.",3.80,224,Hardcover, ,478,https://www.goodreads.com/book/show/29939402-unf-ck-your-habitat,https://www.goodreads.com/book/show/29939402-unf-ck-your-habitat
29940320,The Return Journey,1409103579,9781409103578, , ,ID,https://i.gr-assets.com/images/S/compressed.photo.goodreads.com/books/1460989981l/29940320._SX98_.jpg,https://i.gr-assets.com/images/S/compressed.photo.goodreads.com/books/1460989981l/29940320._SY75_.jpg,https://i.gr-assets.com/images/S/compressed.photo.goodreads.com/books/1460989981l/29940320._SY475_.jpg,2010,4,2,Orion Publishing Group,en-IN,false,"A secretary's silent passion for her boss meets the acid test on a business trip; a man and a woman's mutual disdain at first sight shows how deceptive appearances can be; an insecure wife clings to the illusion of order, only to discover chaos at the hands of a house-sitter who opens the wrong doors; a pair of star-crossed travellers pick up each other's bags, and then learn when you unlock a stranger's suitcase, you enter a stranger's life. These and many more poignant, ironic, often humorous stories - unforgettable slices of life - show why Maeve Binchy is one of the world's favourite storytellers.",3.79,368,Paperback, ,0,https://www.goodreads.com/book/show/29940320-the-return-journey,https://www.goodreads.com/book/show/29940320-the-return-journey
29940843,This Vast Southern Empire: Slaveholders at the Helm of American Foreign Policy,0674737253,9780674737259, , ,ID,https://i.gr-assets.com/images/S/compressed.photo.goodreads.com/books/1472072564l/29940843._SX98_.jpg,https://i.gr-assets.com/images/S/compressed.photo.goodreads.com/books/1472072564l/29940843._SY75_.jpg,https://i.gr-assets.com/images/S/compressed.photo.goodreads.com/books/1472072564l/29940843._SY475_.jpg,2016,9,12,Harvard University Press,,false,"When the United States emerged as a world power in the years before the Civil War, the men who presided over the nation s triumphant territorial and economic expansion were largely southern slaveholders. As presidents, cabinet officers, and diplomats, slaveholding leaders controlled the main levers of foreign policy inside an increasingly powerful American state. ""This Vast Southern Empire ""explores the international vision and strategic operations of these southerners at the commanding heights of American politics.<br /><br />For proslavery leaders like John C. Calhoun and Jefferson Davis, the nineteenth-century world was torn between two hostile forces: a rising movement against bondage, and an Atlantic plantation system that was larger and more productive than ever before. In this great struggle, southern statesmen saw the United States as slavery s most powerful champion. Overcoming traditional qualms about a strong central government, slaveholding leaders harnessed the power of the state to defend slavery abroad. During the antebellum years, they worked energetically to modernize the U.S. military, while steering American diplomacy to protect slavery in Brazil, Cuba, and the Republic of Texas.<br /><br />As Matthew Karp demonstrates, these leaders were nationalists, not separatists. Their vast southern empire was not an independent South but the entire United States, and only the election of Abraham Lincoln broke their grip on national power. Fortified by years at the helm of U.S. foreign affairs, slaveholding elites formed their own Confederacy not only as a desperate effort to preserve their property but as a confident bid to shape the future of the Atlantic world.""",4.26,368,Hardcover, ,48,https://www.goodreads.com/book/show/29940843-this-vast-southern-empire,https://www.goodreads.com/book/show/29940843-this-vast-southern-empire
29942666,"Sunstone, Vol. 5",1534302786,9781534302785, , ,ID,https://i.gr-assets.com/images/S/compressed.photo.goodreads.com/books/1488146345l/29942666._SX98_.jpg,https://i.gr-assets.com/images/S/compressed.photo.goodreads.com/books/1488146345l/29942666._SY75_.jpg,https://i.gr-assets.com/images/S/compressed.photo.goodreads.com/books/1488146345l/29942666._SY475_.jpg,2017,1,18,Image Comics/Top Cow,eng,true,"<i>""She loves me... she loves me not.""</i><br /><br />Ally and Lisa's storybook BDSM romance is at an end, the two women too stubborn to admit the depth of their feelings. But even as they go their separate ways, Lisa returns to the writing that brought her and Ally together in the first place. With a little help from their friends, and a lot of mutual self-reflection, these allegorical love stories represent one last chance to salvage Ally and Lisa's relationship.<br /><br />From New York Times bestselling writer/artist Stjepan Šejić (Switch, Death Vigil) comes this fifth installment in the saga of love, bad jokes, and, of course, bondage.",4.60,263,ebook, ,177,https://www.goodreads.com/book/show/29942666-sunstone-vol-5,https://www.goodreads.com/book/show/29942666-sunstone-vol-5
29947651,"Endurance: A Year in Space, A Lifetime of Discovery",1524731595,9781524731595, , ,ID,https://i.gr-assets.com/images/S/compressed.photo.goodreads.com/books/1488392710l/29947651._SX98_.jpg,https://i.gr-assets.com/images/S/compressed.photo.goodreads.com/books/1488392710l/29947651._SX50_.jpg,https://i.gr-assets.com/images/S/compressed.photo.goodreads.com/books/1488392710l/29947651.jpg,2017,10,17,Alfred A. Knopf,eng,false,"""A stunning memoir from the astronaut who spent a record-breaking year aboard the International Space Station – a candid account of his remarkable voyage, the journeys that preceded it, and his colorful formative years."" Inside book cover comments.",4.18,400,Hardcover,First Edition,1569,https://www.goodreads.com/book/show/29947651-endurance,https://www.goodreads.com/book/show/29947651-endurance
29959030,The Girl Who Lied, , ,B01CH72PLU, ,ID,https://i.gr-assets.com/images/S/compressed.photo.goodreads.com/books/1461086795l/29959030._SX98_.jpg,https://i.gr-assets.com/images/S/compressed.photo.goodreads.com/books/1461086795l/29959030._SY75_.jpg,https://i.gr-assets.com/images/S/compressed.photo.goodreads.com/books/1461086795l/29959030._SY475_.jpg,2016,5,19,HarperImpulse,eng,true,"The truth hurts…<br /><br />Erin and Roisin were once friends until a fatal accident ruined both their lives. Now, Roisin has discovered a secret—one Erin has kept for over a decade—and she’s determined to make Erin pay for her lies.<br /><br />Erin wants nothing to do with Roisin. She has a new life in London and no intention of going back home. Yet when her father is mysteriously and critically injured, Erin has no choice but to return and face Roisin—and her past. Erin knows if the secret of what she gave up got out, the consequences could be devastating.<br /><br />When Roisin suddenly disappears, suspicion soon lands on Erin. She would do anything to protect her family, but just how far is she willing to go when time is running out…?",3.66,244,Kindle Edition, ,624,https://www.goodreads.com/book/show/29959030-the-girl-who-lied,https://www.goodreads.com/book/show/29959030-the-girl-who-lied
29961849,Soul Machine: The Invention of the Modern Mind,1531819567,9781531819569, , ,ID,https://i.gr-assets.com/images/S/compressed.photo.goodreads.com/books/1463599365l/29961849._SX98_.jpg,https://i.gr-assets.com/images/S/compressed.photo.goodreads.com/books/1463599365l/29961849._SY75_.jpg,https://i.gr-assets.com/images/S/compressed.photo.goodreads.com/books/1463599365l/29961849.jpg,2016,8,30,Audible Studios on Brilliance Audio,,false,"A brilliant and comprehensive history of the creation of the modern Western mind.<br /><br /><i>Soul Machine</i> takes us back to the origins of modernity, a time when a crisis in religious authority and the scientific revolution led to searching questions about the nature of human inner life. This is the story of how a new concept - the mind - emerged as a potential solution, one that was part soul and part machine but fully neither.<br /><br />In this groundbreaking work, award-winning historian George Makari shows how writers, philosophers, physicians, and anatomists worked to construct notions of the mind as not an ethereal thing but a natural one. From the ascent of Oliver Cromwell to the fall of Napoleon, seminal thinkers like Hobbes, Locke, Diderot, and Kant worked alongside often-forgotten brain specialists, physiologists, and alienists in the hopes of mapping the inner world. Conducted in a cauldron of political turmoil, these frequently shocking, always embattled efforts would give rise to psychiatry, mind sciences such as phrenology, and radically new visions of the self. Further, they would be crucial to the establishment of secular ethics and political liberalism.<br /><br />Boldly original, wide ranging, and brilliantly synthetic, <i>Soul Machine</i> gives us a masterful, new account of the making of the modern Western mind.",3.68, ,Audio CD, ,0,https://www.goodreads.com/book/show/29961849-soul-machine,https://www.goodreads.com/book/show/29961849-soul-machine
29963227,"Antígona (Edipo, #3)", ,9788424903428, , ,ID,https://i.gr-assets.com/images/S/compressed.photo.goodreads.com/books/1461121832l/29963227._SX98_.jpg,https://i.gr-assets.com/images/S/compressed.photo.goodreads.com/books/1461121832l/29963227._SY75_.jpg,https://i.gr-assets.com/images/S/compressed.photo.goodreads.com/books/1461121832l/29963227._SY475_.jpg,2010,,,Gredos,spa,false,"Como figura heroica, Antígona ha propiciado innumerables interpretaciones a lo largo de los siglos (con una excelente acogida en el teatro contemporáneo) y ha dado pie a todo tipo de especulaciones filosóficas. El personaje, encarnación del conflicto entre individuo y sociedad, lo admite y aun lo propicia. Creonte, rey de Tebas, prohíbe dar sepultura a Polinices, hijo de Edipo, alzado contra el estado y muerto en lucha fratricida. Antígona, contraviniendo esas órdenes explícitas, arroja un puñado de tierra sobre el cadáver de su hermano, proporcionándole así un enterramiento simbólico. La valentía con la que afronta la situación contrasta con la actitud de su hermana Ismene, sumisa al poder establecido. Antígona pagará la desobediencia con su vida, pero arrastrará a Creonte a la desgracia.<br /><br />Sófocles (c. 496-406 a.C.) ocupa el lugar central en la tríada de grandes trágicos áticos, entre Esquilo y Eurípides. Nació en Colono, cerca de Atenas, hijo de un rico fabricante de armaduras. Su infancia y primera juventud coincidieron con la expansión del imperio ateniense. Fue elegido dos veces general, pero sobre todo se consagró a su actividad de dramaturgo. Se le atribuyen unas ciento veinte obras, y veinticuatro victorias con sus tetralogías en las competiciones dramáticas atenienses; conservamos siete de estas tragedias.",3.66,128,Paperback, ,3,https://www.goodreads.com/book/show/29963227-ant-gona,https://www.goodreads.com/book/show/29963227-ant-gona
