id,title,isbn,isbn13,asin,kindle_asin,country_code,image_url,small_image_url,large_image_url,publication_year,publication_month,publication_day,publisher,language_code,is_ebook,description,average_rating,num_pages,format,edition_information,text_reviews_count,url,link
15014,Crucial Conversations: Tools for Talking When Stakes Are High,0071401946,9780071401944, , ,ID,https://i.gr-assets.com/images/S/compressed.photo.goodreads.com/books/1497193248l/15014._SX98_.jpg,https://i.gr-assets.com/images/S/compressed.photo.goodreads.com/books/1497193248l/15014._SX50_.jpg,https://i.gr-assets.com/images/S/compressed.photo.goodreads.com/books/1497193248l/15014._SY475_.jpg,2002,7,9,McGraw-Hill Education,eng,false,"Learn how to keep your cool and get the results you want when emotions flare.<br /><br />When stakes are high, opinions vary, and emotions run strong, you have three choices: Avoid a crucial conversation and suffer the consequences; handle the conversation badly and suffer the consequences; or read Crucial Conversations and discover how to communicate best when it matters most. Crucial Conversations gives you the tools you need to step up to life's most difficult and important conversations, say what's on your mind, and achieve the positive resolutions you want. You'll learn how to:<br /><br /> Prepare for high-impact situations with a six-minute mastery technique<br /> Make it safe to talk about almost anything<br /> Be persuasive, not abrasive<br /> Keep listening when others blow up or clam up<br /> Turn crucial conversations into the action and results you want",4.04,240,Paperback, ,2540,https://www.goodreads.com/book/show/15014.Crucial_Conversations,https://www.goodreads.com/book/show/15014.Crucial_Conversations
15018,"Conversations With God: An Uncommon Dialogue, Book 3",1571741038,9781571741035, , ,ID,https://i.gr-assets.com/images/S/compressed.photo.goodreads.com/books/1440034217l/15018._SX98_.jpg,https://i.gr-assets.com/images/S/compressed.photo.goodreads.com/books/1440034217l/15018._SX50_.jpg,https://i.gr-assets.com/images/S/compressed.photo.goodreads.com/books/1440034217l/15018._SX318_.jpg,2005,12,3,Hampton Roads Publishing Company,eng,false,"The sequel to the bestselling Books One and Two of ""Conversations with God"", this powerful and inspirational dialogue expands as readers enter into an adventurous exploration of life, gain a better understanding of the universe, and fully develop a personal relationship with God.",4.19,392,Hardcover, ,195,https://www.goodreads.com/book/show/15018.Conversations_With_God,https://www.goodreads.com/book/show/15018.Conversations_With_God
15021,Naked Conversations: How Blogs Are Changing the Way Businesses Talk with Customers,047174719X,9780471747192, , ,ID,https://i.gr-assets.com/images/S/compressed.photo.goodreads.com/books/1348648177l/15021._SX98_.jpg,https://i.gr-assets.com/images/S/compressed.photo.goodreads.com/books/1348648177l/15021._SY75_.jpg,https://i.gr-assets.com/images/S/compressed.photo.goodreads.com/books/1348648177l/15021.jpg,2006,1,1,Wiley,eng,false,"<b>From the creator of the number one business blog comes a powerful exploration of how, and why, businesses had better be blogging: Naked Conversations.</b> According to experts Robert Scoble and Shel Israel, blogs offer businesses something that has long been lacking in their communication with customers -- meaningful dialogue. Devoid of corporate-speak and empty promises, business blogs can humanize communication, bringing companies and their constituencies together in a way that improves both image and bottom line.<br /><br />The authors use more than 50 case histories to explain why blogging is an efficient and credible method of business communication. You'll find yourself excited about the possibilities blogs present after reading just a few pages. Discover how:<br /><br /><br />Prominent business leaders, including Mark Cuban of the Dallas Mavericks, Bob Lutz from General Motors, and Jonathan Schwartz of Sun Microsystems, are beginning to use blogs to connect with their customers in new ways. Blogging has changed the rules of communication and competition. You can launch an effective blogging strategy and the reasons why you should. Featuring a foreword by Tom Peters, this is a resource you and your business can't do without.",3.72,251,Hardcover, ,33,https://www.goodreads.com/book/show/15021.Naked_Conversations,https://www.goodreads.com/book/show/15021.Naked_Conversations
15044,Art and Lies,0679762701,9780679762706, , ,ID,https://i.gr-assets.com/images/S/compressed.photo.goodreads.com/books/1388209344l/15044._SX98_.jpg,https://i.gr-assets.com/images/S/compressed.photo.goodreads.com/books/1388209344l/15044._SY75_.jpg,https://i.gr-assets.com/images/S/compressed.photo.goodreads.com/books/1388209344l/15044.jpg,1996,2,20,Vintage,eng,false,"Handel is a failed priest but abiding Catholic with elitist tendencies whose work as a doctor forces him to consider social questions that he would probably rather avoid. Picasso, as she calls herself, is a young artist who has been sexually abused by her brother but whose family thinks she is at fault for her dark moods. Sappho is, indeed, Sappho, the lesbian poet of ancient Greece, who here proclaims herself a sensualist and then proceeds to dissect ""the union of language and lust."" The three converge in a place that may be England in a not-too-distant future made ugly by pollution and even uglier by greed. This is not a novel but an extended rift on art, sex, religion, social repression, the dangers of patriarchy, and everything that is wrong with the contemporary drift to the right. As such, it will be hard going for most readers, but those with some patience will discover exceptionally evocative writing and a vivifying review of some much-discussed contemporary issues.",3.86,240,Paperback, ,145,https://www.goodreads.com/book/show/15044.Art_and_Lies,https://www.goodreads.com/book/show/15044.Art_and_Lies
15046,Weight: The Myth of Atlas and Heracles,1841957186,9781841957180, , ,ID,https://i.gr-assets.com/images/S/compressed.photo.goodreads.com/books/1405975290l/15046._SX98_.jpg,https://i.gr-assets.com/images/S/compressed.photo.goodreads.com/books/1405975290l/15046._SY75_.jpg,https://i.gr-assets.com/images/S/compressed.photo.goodreads.com/books/1405975290l/15046.jpg,2005,10,5,Canongate U.S.,eng,false,"“When I was asked to choose a myth to write about, I realized I had chosen already. The story of Atlas holding up the world was in my mind before the telephone call had ended. If the call had not come, perhaps I would never have written the story, but when the call did come, that story was waiting to be written. Rewritten. The recurring language motif of <i>Weight</i> is ‘I want to tell the story again.’ My work is full of cover versions. I like to take stories we think we know and record them differently. In the retelling comes a new emphasis or bias, and the new arrangement of the key elements demands that fresh material be injected into the existing text. <i>Weight</i> moves far away from the simple story of Atlas’s punishment and his temporary relief when Heracles takes the world off his shoulders. I wanted to explore loneliness, isolation, responsibility, burden, and freedom, too, because my version has a very particular end not found elsewhere.” -- from Jeanette Winterson’s Foreword to <i>Weight</i>",3.76,151,Hardcover,Canongate Myths,422,https://www.goodreads.com/book/show/15046.Weight,https://www.goodreads.com/book/show/15046.Weight
15047,The Passion,0802135226,9780802135223, , ,ID,https://i.gr-assets.com/images/S/compressed.photo.goodreads.com/books/1388187737l/15047._SX98_.jpg,https://i.gr-assets.com/images/S/compressed.photo.goodreads.com/books/1388187737l/15047._SY75_.jpg,https://i.gr-assets.com/images/S/compressed.photo.goodreads.com/books/1388187737l/15047.jpg,1997,8,7,Grove Press,eng,false,"Jeanette Winterson’s novels have established her as one of the most important young writers in world literature. <i>The Passion</i> is perhaps her most highly acclaimed work, a modern classic that confirms her special claim on the novel. Set during the tumultuous years of the Napoleonic Wars, <i>The Passion</i> intertwines the destinies of two remarkable people: Henri, a simple French soldier, who follows Napoleon from glory to Russian ruin; and Villanelle, the red-haired, web-footed daughter of a Venetian boatman, whose husband has gambled away her heart. In Venice’s compound of carnival, chance, and darkness, the pair meet their singular destiny.<br /><br />In her unique and mesmerizing voice, Winterson blends reality with fantasy, dream, and imagination to weave a hypnotic tale with stunning effects.<br />",4.11,176,Paperback, ,1067,https://www.goodreads.com/book/show/15047.The_Passion,https://www.goodreads.com/book/show/15047.The_Passion
15048,Art Objects: Essays on Ecstasy and Effrontery,0679768203,9780679768203, , ,ID,https://i.gr-assets.com/images/S/compressed.photo.goodreads.com/books/1403171165l/15048._SX98_.jpg,https://i.gr-assets.com/images/S/compressed.photo.goodreads.com/books/1403171165l/15048._SY75_.jpg,https://i.gr-assets.com/images/S/compressed.photo.goodreads.com/books/1403171165l/15048.jpg,1997,2,4,Vintage,eng,false,"In these ten intertwined essays, one of our most provocative young novelists proves that she is just as stylish and outrageous an art critic. For when Jeanette Winterson looks at works as diverse as the <i>Mona Lisa</i> and Virginia Woolf's <i>The Waves</i>, she frees them from layers of preconception and restores their power to exalt and unnerve, shock and transform us.<br /><br />""<b>Art Objects</b> is a book to be admired for its effort to speak exorbitantly, urgently and sometimes beautifully about art and about our individual and collective need for serious art.""--<i>Los Angeles Times</i>",4.06,192,Paperback, ,109,https://www.goodreads.com/book/show/15048.Art_Objects,https://www.goodreads.com/book/show/15048.Art_Objects
15049,The World and Other Places: Stories,0375702369,9780375702365, , ,ID,https://i.gr-assets.com/images/S/compressed.photo.goodreads.com/books/1403179771l/15049._SX98_.jpg,https://i.gr-assets.com/images/S/compressed.photo.goodreads.com/books/1403179771l/15049._SY75_.jpg,https://i.gr-assets.com/images/S/compressed.photo.goodreads.com/books/1403179771l/15049.jpg,2000,6,20,Vintage,eng,false,"Her first short story collection exhibits the multitude of talents that have made English novelist Jeanette Winterson not just admired but beloved by her many fans. There are the surprising, fresh little phrases minted expressly to convey the delicate realities of the made-up world. There's the humor, fierce and sly but always kind. There's the imagination that changes gender and historical epoch at whim, and does so convincingly; and the characters themselves, a sundry bunch of men and women not necessarily successful or commendable but always, somehow, likable. Best of all, by their very diversity, these stories reveal glimpses of the smart and enigmatic woman behind the work.<br /><br /> In ""Atlantic Crossing,"" Winterson becomes a middle-aged businessman of the mid-20th century, accidentally assigned to share his second-class cabin with a young black woman on a transatlantic crossing. In the realm of event, little happens, but in its depth of perception and what it tells of the nuances of regret, the story is as rich as a novel in another writer's hands. A few scant pages later, Winterson becomes a kind of lost female Homer, telling Orion's story from Artemis's point of view: ""When she returned she saw this huge rag of a man eating her goat, raw.... His reputation hung about him like bad breath."" In ""The Poetics of Sex,"" she creates a lesbian love story that evokes her characters' personalities as explicitly as their erotic pleasures. ""The 24-Hour Dog,"" the story of a woman writer returning a puppy she had thought to adopt, is remorseless as a psychological thriller in the squirmy depths it plumbs: ""I had made every preparation, every calculation, except for those two essentials that could not be calculated: his heart and mine."" Read The World and Other Places twice, once for instruction, once for joy. --Joyce Thompson",3.86,240,Paperback, ,113,https://www.goodreads.com/book/show/15049.The_World_and_Other_Places,https://www.goodreads.com/book/show/15049.The_World_and_Other_Places
15050,Sexing the Cherry,0802135781,9780802135780, , ,ID,https://i.gr-assets.com/images/S/compressed.photo.goodreads.com/books/1328824090l/15050._SX98_.jpg,https://i.gr-assets.com/images/S/compressed.photo.goodreads.com/books/1328824090l/15050._SX50_.jpg,https://i.gr-assets.com/images/S/compressed.photo.goodreads.com/books/1328824090l/15050.jpg,1998,8,10,Grove Press,eng,false,"In a fantastic world that is and is not seventeenth-century England, a baby is found floating in the Thames. The child, Jordan, is rescued by Dog Woman and grows up to travel the world like Gulliver, though he finds that the world’s most curious oddities come from his own mind. Winterson leads the reader from discussions on the nature of time to Jordan’s fascination with journeys concealed within other journeys, all with a dizzying speed that shoots the reader from epiphany to shimmering epiphany.",3.81,167,Paperback, ,666,https://www.goodreads.com/book/show/15050.Sexing_the_Cherry,https://www.goodreads.com/book/show/15050.Sexing_the_Cherry
15052,Lighthousekeeping,0156032899,9780156032896, , ,ID,https://i.gr-assets.com/images/S/compressed.photo.goodreads.com/books/1328875027l/15052._SX98_.jpg,https://i.gr-assets.com/images/S/compressed.photo.goodreads.com/books/1328875027l/15052._SY75_.jpg,https://i.gr-assets.com/images/S/compressed.photo.goodreads.com/books/1328875027l/15052.jpg,2006,4,3,Mariner Books,eng,false,"Lighthousekeeping tells the tale of Silver (""My mother called me Silver. I was born part precious metal, part pirate.""), an orphaned girl who is taken in by blind Mr. Pew, the mysterious and miraculously old keeper of a lighthouse on the Scottish coast. Pew tells Silver stories of Babel Dark, a nineteenth-century clergyman. Dark lived two lives: a public one mired in darkness and deceit and a private one bathed in the light of passionate love. For Silver, Dark's life becomes a map through her own darkness, into her own story, and, finally, into love.<br /><br />One of the most original and extraordinary writers of her generation, Jeanette Winterson has created a modern fable about the transformative power of storytelling. <br /><br />",3.85,232,Paperback, ,517,https://www.goodreads.com/book/show/15052.Lighthousekeeping,https://www.goodreads.com/book/show/15052.Lighthousekeeping
15054,Written on the Body,0679744479,9780679744474, , ,ID,https://i.gr-assets.com/images/S/compressed.photo.goodreads.com/books/1386924844l/15054._SX98_.jpg,https://i.gr-assets.com/images/S/compressed.photo.goodreads.com/books/1386924844l/15054._SY75_.jpg,https://i.gr-assets.com/images/S/compressed.photo.goodreads.com/books/1386924844l/15054.jpg,1994,2,1,Vintage,eng,false,"<i>Written on the Body </i>is a secret code only visible in certain lights: the accumulation of a lifetime gather there. In places the palimpsest is so heavily worked that the letters feel like braille. I like to keep my body rolled away from prying eyes, never unfold too much, tell the whole story. I didn't know that Louise would have reading hands. She has translated me into her own book.",4.07,192,Paperback, ,1439,https://www.goodreads.com/book/show/15054.Written_on_the_Body,https://www.goodreads.com/book/show/15054.Written_on_the_Body
15055,Oranges Are Not the Only Fruit, , , , ,ID,https://i.gr-assets.com/images/S/compressed.photo.goodreads.com/books/1267717580l/15055._SX98_.jpg,https://i.gr-assets.com/images/S/compressed.photo.goodreads.com/books/1267717580l/15055._SY75_.jpg,https://i.gr-assets.com/images/S/compressed.photo.goodreads.com/books/1267717580l/15055.jpg,1997,8,20,Grove Press,eng,false,"Alternate cover edition for 9780802135162<br /><br />This is the story of Jeanette, adopted and brought up by her mother as one of God's elect. Zealous and passionate, she seems seems destined for life as a missionary, but then she falls for one of her converts.<br /><br />At sixteen, Jeanette decides to leave the church, her home and her family, for the young woman she loves. Innovative, punchy and tender,<br /><br /><i>Oranges Are Not the Only Fruit</i> is a few days ride into the bizarre outposts of religious excess and human obsession.",3.73,176,Paperback, ,2147,https://www.goodreads.com/book/show/15055.Oranges_Are_Not_the_Only_Fruit,https://www.goodreads.com/book/show/15055.Oranges_Are_Not_the_Only_Fruit
15056,Gut Symmetries,0517286939,9780517286937, , ,ID,https://i.gr-assets.com/images/S/compressed.photo.goodreads.com/books/1446104345l/15056._SX98_.jpg,https://i.gr-assets.com/images/S/compressed.photo.goodreads.com/books/1446104345l/15056._SY75_.jpg,https://i.gr-assets.com/images/S/compressed.photo.goodreads.com/books/1446104345l/15056.jpg,1997,3,25,Random House Value Publishing,eng,false,"Physics seems to have become the new language of love in the 1990s, and Jeanette Winterson is not the first writer to make a major character a physicist. Jonathan Lethem mined similar territory earlier this year in his delightful book, <i>As She Climbed Across the Table,</i> and now Winterson enters the lists with not one, but two physicists populating the pages of her equally wonderful book, <i>Gut Symmetries</i>. If you think about it, physics <i>does</i> make a good metaphor for love, encompassing as it does the principles of attraction, the exchange of energy, and unification. At the center of this meditation on ""the intelligence of the universe"" and ""the stupidity of humankind"" are Jove, a married physicist; Alice, a single physicist who becomes his mistress; and Stella, Jove's wife and later, Alice's lover. They meet on the <i>QE2</i> and from there the three participants in the story take turns telling their versions of it. <p> <i>Gut Symmetries</i> is a collage of memories, snippets of scientific theory, meditations on abstract concepts like truth, and the events surrounding Jove, Alice, and Stella's affair. This is a book that demands your attention, jumping as it does from one seemingly tangential topic to another; but whereas physics still seeks a grand unification theory (GUT) to explain how everything in the universe fits together, Winterson actually finds one of her own in this satisfyingly complete fictional world.</p>",3.80,219,Hardcover, ,177,https://www.goodreads.com/book/show/15056.Gut_Symmetries,https://www.goodreads.com/book/show/15056.Gut_Symmetries
15067,The Ticking,1891830708,9781891830709, , ,ID,https://i.gr-assets.com/images/S/compressed.photo.goodreads.com/books/1388338008l/15067._SX98_.jpg,https://i.gr-assets.com/images/S/compressed.photo.goodreads.com/books/1388338008l/15067._SX50_.jpg,https://i.gr-assets.com/images/S/compressed.photo.goodreads.com/books/1388338008l/15067.jpg,2006,5,8,Top Shelf Productions,en-US,false,"The Ticking is the story of Edison Steelhead, a boy who at birth takes his mother's life and his father's deformed face. Secreted away by his father to be raised in a remote island lighthouse, Edison relates to his surroundings in the only way he knows how--by capturing them in his sketchbook. Able to find beauty in even the most grotesque of things, Edison embraces his own unsettling appearance and sets out to confront the rest of the world.<br />Waiting for him on its alien shores are the sights and experiences that will give shape to both his future and his past. Written and illustrated by acclaimed artist RenEe French, The Ticking is a compelling work of graphic literature, a reminder that before we can appreciate the beauty around us, we must first find it within ourselves. A gorgeous 216-page hardcover graphic novel, designed by Jordan Crane.<br />",3.73,216,Hardcover, ,123,https://www.goodreads.com/book/show/15067.The_Ticking,https://www.goodreads.com/book/show/15067.The_Ticking
15096,Five Quarters of the Orange,0060958022,9780060958022, , ,ID,https://i.gr-assets.com/images/S/compressed.photo.goodreads.com/books/1583190215l/15096._SX98_.jpg,https://i.gr-assets.com/images/S/compressed.photo.goodreads.com/books/1583190215l/15096._SY75_.jpg,https://i.gr-assets.com/images/S/compressed.photo.goodreads.com/books/1583190215l/15096.jpg,2002,6,4,Harper Perennial,eng,false,"The novels of Joanne Harris are a literary feast for the senses. <i>Five Quarters of the Orange</i> represents Harris's most complex and sophisticated work yet - a novel in which darkness and fierce joy come together to create an unforgettable story.<br /><br />When Framboise Simon returns to a small village on the banks of the Loire, the locals do not recognize her as the daughter of the infamous Mirabelle Dartigen - the woman they still hold responsible for a terrible tragedy that took place during the German occupation decades before. Although Framboise hopes for a new beginning she quickly discovers that past and present are inextricably intertwined. Nowhere is this truth more apparent than in the scrapbook of recipes she has inherited from her dead mother.<br /><br />With this book, Framboise re-creates her mother's dishes, which she serves in her small creperie. And yet as she studies the scrapbook - searching for clues to unlock the contradiction between her mother's sensuous love of food and often cruel demeanor - she begins to recognize a deeper meaning behind Mirabelle's cryptic scribbles. Within the journal's tattered pages lies the key to what actually transpired the summer Framboise was nine years old.<br /><br />Rich and dark. <i>Five Quarters of the Orange</i> is a novel of mothers and daughters of the past and the present, of resisting, and succumbing, and an extraordinary work by a masterful writer.",3.86,307,Paperback, ,2004,https://www.goodreads.com/book/show/15096.Five_Quarters_of_the_Orange,https://www.goodreads.com/book/show/15096.Five_Quarters_of_the_Orange
15101,Blackberry Wine,0380815923,9780380815920, , ,ID,https://i.gr-assets.com/images/S/compressed.photo.goodreads.com/books/1442203288l/15101._SX98_.jpg,https://i.gr-assets.com/images/S/compressed.photo.goodreads.com/books/1442203288l/15101._SY75_.jpg,https://i.gr-assets.com/images/S/compressed.photo.goodreads.com/books/1442203288l/15101._SY475_.jpg,2003,12,23,William Morrow Paperbacks,eng,false,"Jay Mackintosh is trapped by memory in the old familiar landscape of his childhood, more enticing than the present, and to which he longs to return. A bottle of home-brewed wine left to him by a long vanished friend seems to provide both the key to an old mystery and a doorway into another world. As the unusual properties of the strange brew takes effect, Jay escapes to a derelict farmhouse in the French village of Lansquenet , where a ghost from the past waits to confront him, and the reclusive Marise -haunted, lovely, and dangerous- hides a terrible secret behind her closed shuters. Between them, a mysterious chemistry. Or could it be magic?",3.80,368,Paperback, ,653,https://www.goodreads.com/book/show/15101.Blackberry_Wine,https://www.goodreads.com/book/show/15101.Blackberry_Wine
15102,Gentlemen and Players,0060559144,9780060559144, , ,ID,https://i.gr-assets.com/images/S/compressed.photo.goodreads.com/books/1428545269l/15102._SX98_.jpg,https://i.gr-assets.com/images/S/compressed.photo.goodreads.com/books/1428545269l/15102._SY75_.jpg,https://i.gr-assets.com/images/S/compressed.photo.goodreads.com/books/1428545269l/15102.jpg,2006,1,3,William Morrow,eng,false,"Audere, agere, auferre. To dare, to strive, to conquer. For generations, privileged young men have attended St. Oswald's Grammar School for Boys, groomed for success by the likes of Roy Straitley, the eccentric Classics teacher who has been a fixture there for more than thirty years. But this year the wind of unwelcome change is blowing. Suits, paperwork, and information technology are beginning to overshadow St. Oswald's tradition, and Straitley is finally, and reluctantly, contemplating retirement. He is joined this term by five new faculty members, including one who -- unbeknownst to Straitley and everyone else -- holds intimate and dangerous knowledge of St. Oswald's ways and secrets. Harboring dark ties to the school's past, this young teacher has arrived with one terrible goal: to destroy St. Oswald's.<br /><br />As the new term gets under way, a number of incidents befall students and faculty alike. Beginning as small annoyances -- a lost pen, a misplaced coffee mug -- they are initially overlooked. But as the incidents escalate in both number and consequence, it soon becomes apparent that a darker undercurrent is stirring within the school. With St. Oswald's unraveling, only Straitley stands in the way of its ruin. The veteran teacher faces a formidable opponent, however -- a master player with a bitter grudge and a strategy that has been meticulously planned to the final move, a secret game with very real, very deadly consequences.<br /><br />A harrowing tale of cat and mouse, this riveting, hypnotically atmospheric novel showcases <i>New York Times</i> bestselling author Joanne Harris's astonishing storytelling talent as never before.",3.92,422,Hardcover, ,1233,https://www.goodreads.com/book/show/15102.Gentlemen_and_Players,https://www.goodreads.com/book/show/15102.Gentlemen_and_Players
