id,title,isbn,isbn13,asin,kindle_asin,country_code,image_url,small_image_url,large_image_url,publication_year,publication_month,publication_day,publisher,language_code,is_ebook,description,average_rating,num_pages,format,edition_information,text_reviews_count,url,link
1928,Avalanche: Heretical Reflections on the Dark and the Light,0345367227,9780345367228, , ,ID,https://i.gr-assets.com/images/S/compressed.photo.goodreads.com/books/1320453459l/1928._SX98_.jpg,https://i.gr-assets.com/images/S/compressed.photo.goodreads.com/books/1320453459l/1928._SY75_.jpg,https://i.gr-assets.com/images/S/compressed.photo.goodreads.com/books/1320453459l/1928.jpg,1992,5,26,Wellspring/Ballantine,eng,false,"In his powerful bestselling book Joy's Way, Dr. W. Brugh Joy shared the story of the spiritual transformation that led him to abandon his medical practice and indeed his whole way of life. In the ten years since, Dr. Joy has experienced the dramatic second stage of his spiritual evolution and Avalanche is the result. In this iconoclastic book, Dr. Joy challenges the idealistic vision of spirituality as an experience of love, light, and harmony. He dares to appreciate the dark, shadow side of human nature that, if left unintegrated, can wreak havoc in our lives.<br /><br />In fact, Dr. Joy sees shadow work as essential for the evolution of consciousness. He explores the dynamic of the shadow in such issues as multiple personalities as the basis of self, the collapse of exclusively masculine spiritual values, the emergence of the divine feminine and the counter forces that are set in motion in backlash against it, the power of destruction as a purging and healing force, and the battle of the individual with the collective. To access our hidden dark side, Dr. Joy offers as tools dreamwork, archetypes, rituals, and rites of passage, which can set the stage for transformation. Sure to generate controversy, Avalanche demands -- and rewards -- readers who are willing to experience their own deep psyche.",3.97,368,Paperback, ,2,https://www.goodreads.com/book/show/1928.Avalanche,https://www.goodreads.com/book/show/1928.Avalanche
1934,Little Women,0451529308,9780451529305, , ,ID,https://i.gr-assets.com/images/S/compressed.photo.goodreads.com/books/1562690475l/1934._SX98_.jpg,https://i.gr-assets.com/images/S/compressed.photo.goodreads.com/books/1562690475l/1934._SY75_.jpg,https://i.gr-assets.com/images/S/compressed.photo.goodreads.com/books/1562690475l/1934._SY475_.jpg,2004,4,6,Signet Classics,eng,false,"Generations of readers young and old, male and female, have fallen in love with the March sisters of Louisa May Alcott’s most popular and enduring novel, <i>Little Women</i>. Here are talented tomboy and author-to-be Jo, tragically frail Beth, beautiful Meg, and romantic, spoiled Amy, united in their devotion to each other and their struggles to survive in New England during the Civil War.<br /><p>It is no secret that Alcott based <i>Little Women</i> on her own early life. While her father, the freethinking reformer and abolitionist Bronson Alcott, hobnobbed with such eminent male authors as Emerson, Thoreau, and Hawthorne, Louisa supported herself and her sisters with ""woman’s work,” including sewing, doing laundry, and acting as a domestic servant. But she soon discovered she could make more money writing. <i>Little Women</i> brought her lasting fame and fortune, and far from being the ""girl’s book” her publisher requested, it explores such timeless themes as love and death, war and peace, the conflict between personal ambition and family responsibilities, and the clash of cultures between Europe and America.</p>",4.09,449,Paperback, ,22121,https://www.goodreads.com/book/show/1934.Little_Women,https://www.goodreads.com/book/show/1934.Little_Women
1935,"Little Women (Little Women, #1)",1402714580,9781402714580, , ,ID,https://i.gr-assets.com/images/S/compressed.photo.goodreads.com/books/1578267944l/1935._SX98_.jpg,https://i.gr-assets.com/images/S/compressed.photo.goodreads.com/books/1578267944l/1935._SX50_.jpg,https://i.gr-assets.com/images/S/compressed.photo.goodreads.com/books/1578267944l/1935._SX318_.jpg,2004,10,1,Sterling,eng,false,"The illustrations for this series were created by Scott McKowen, who, with his wife Christina Poddubiuk, operates Punch &amp; Judy Inc., a company specializing in design and illustration for theater and performing arts. Their projects often involve research into the visual aspects of historical settings and characters. Christina is a theater set and costume designer and contributed advice on the period clothing for the illustrations.<br /><br />Scott created these drawings in scratchboard ­ an engraving medium which evokes the look of popular art from the period of these stories. Scratchboard is an illustration board with a specifically prepared surface of hard white chalk. A thin layer of black ink is rolled over the surface, and lines are drawn by hand with a sharp knife by scraping through the ink layer to expose the white surface underneath. The finished drawings are then scanned and the color is added digitally.<br /><br />The beautiful Meg, artistic tomboy Jo, doomed Beth, and selfish Amy: since the publication of Little Women in 1869, these four sisters have become America’s most beloved literary siblings. Louisa May Alcott’s rich and realistic portrait has inspired three movies and stirred the emotions of countless young girls. Set in New England during the Civil War, the novel follows the adventures of the March sisters as they struggle to pursue their dreams.<br />",4.09,536,Hardcover,"Illustrated, unabridged",138,https://www.goodreads.com/book/show/1935.Little_Women,https://www.goodreads.com/book/show/1935.Little_Women
1937,Little Women,0517221160,9780517221167, , ,ID,https://i.gr-assets.com/images/S/compressed.photo.goodreads.com/books/1394879978l/1937._SX98_.jpg,https://i.gr-assets.com/images/S/compressed.photo.goodreads.com/books/1394879978l/1937._SX50_.jpg,https://i.gr-assets.com/images/S/compressed.photo.goodreads.com/books/1394879978l/1937.jpg,2002,9,3,Gramercy Books,eng,false,Chronicles the joys and sorrows of the four March sisters as they grow into young ladies in nineteenth-century New England.,4.09,389,Hardcover,The Illustrated Children's Library,9,https://www.goodreads.com/book/show/1937.Little_Women,https://www.goodreads.com/book/show/1937.Little_Women
1953,A Tale of Two Cities,0141439602,9780141439600, , ,ID,https://i.gr-assets.com/images/S/compressed.photo.goodreads.com/books/1344922523l/1953._SX98_.jpg,https://i.gr-assets.com/images/S/compressed.photo.goodreads.com/books/1344922523l/1953._SY75_.jpg,https://i.gr-assets.com/images/S/compressed.photo.goodreads.com/books/1344922523l/1953.jpg,2003,,,Penguin Books,eng,false,"After eighteen years as a political prisoner in the Bastille, the ageing Doctor Manette is finally released and reunited with his daughter in England. There the lives of two very different men, Charles Darnay, an exiled French aristocrat, and Sydney Carton, a disreputable but brilliant English lawyer, become enmeshed through their love for Lucie Manette. From the tranquil roads of London, they are drawn against their will to the vengeful, bloodstained streets of Paris at the height of the Reign of Terror, and they soon fall under the lethal shadow of La Guillotine.",3.85,489,Paperback,Penguin Classics (UK/CAN/USA),13143,https://www.goodreads.com/book/show/1953.A_Tale_of_Two_Cities,https://www.goodreads.com/book/show/1953.A_Tale_of_Two_Cities
1956,A Tale of Two Cities,0786180390,9780786180394, , ,ID,https://i.gr-assets.com/images/S/compressed.photo.goodreads.com/books/1389460338l/1956._SX98_.jpg,https://i.gr-assets.com/images/S/compressed.photo.goodreads.com/books/1389460338l/1956._SX50_.jpg,https://i.gr-assets.com/images/S/compressed.photo.goodreads.com/books/1389460338l/1956.jpg,2005,3,1,Blackstone Audiobooks,en-US,false,"This captivating tale, set in London and Paris at the time of the French Revolution, reveals the central choice confronting every society and each individual: Should a person work to change society or should the revolution occur within his heart?",3.85,350,Audio CD, ,5,https://www.goodreads.com/book/show/1956.A_Tale_of_Two_Cities,https://www.goodreads.com/book/show/1956.A_Tale_of_Two_Cities
1962,A Tale of Two Cities,1572705280,9781572705289, , ,ID,https://i.gr-assets.com/images/S/compressed.photo.goodreads.com/books/1328856021l/1962._SX98_.jpg,https://i.gr-assets.com/images/S/compressed.photo.goodreads.com/books/1328856021l/1962._SX50_.jpg,https://i.gr-assets.com/images/S/compressed.photo.goodreads.com/books/1328856021l/1962.jpg,2006,4,6,AudioGO,eng,false,"With his sublime parting words, ""It is a far, far better thing that I do, than I have ever done..."" Sidney Carton joins that exhalted group of Dickensian characters who have earned a permanent place in the popular literary imagination. His dramatic story, set against the volcanic fury of the French Revolution and pervaded by the ominous rumble of the death carts trundling toward the guillotine, is the heart-stirring tale of a heroic soul in an age gone mad. A masterful pageant of idealism, love, and adventure — in a Paris bursting with revolutionary frenzy, and a London alive with anxious anticipation — <i>A Tale of Two Cities</i> is one of Dickens's most energetic and exciting works.",3.85,0,Audio CD, ,8,https://www.goodreads.com/book/show/1962.A_Tale_of_Two_Cities,https://www.goodreads.com/book/show/1962.A_Tale_of_Two_Cities
1984,Bleak House,0375760059,9780375760051, , ,ID,https://i.gr-assets.com/images/S/compressed.photo.goodreads.com/books/1386922975l/1984._SX98_.jpg,https://i.gr-assets.com/images/S/compressed.photo.goodreads.com/books/1386922975l/1984._SY75_.jpg,https://i.gr-assets.com/images/S/compressed.photo.goodreads.com/books/1386922975l/1984.jpg,2002,7,9,Modern Library,eng,false,"Widely regarded as Dickens’s masterpiece, <b>Bleak House</b> centers on the generations-long lawsuit Jarndyce and Jarndyce, through which “whole families have inherited legendary hatreds.” Focusing on Esther Summerson, a ward of John Jarndyce, the novel traces Esther’s romantic coming-of-age and, in classic Dickensian style, the gradual revelation of long-buried secrets, all set against the foggy backdrop of the Court of Chancery. Mixing romance, mystery, comedy, and satire, <b>Bleak House</b> limns the suffering caused by the intricate inefficiency of the law. <br /><br />The text of this Modern Library Paperback Classic was set from the first single-volume edition, published by Bradbury &amp; Evans in 1853, and reproduces thirty-nine of H. K. Browne’s original illustrations for the book.",4.00,887,Paperback, ,149,https://www.goodreads.com/book/show/1984.Bleak_House,https://www.goodreads.com/book/show/1984.Bleak_House
1990,Martin Chuzzlewit,0140436146,9780140436143, , ,ID,https://i.gr-assets.com/images/S/compressed.photo.goodreads.com/books/1334392783l/1990._SX98_.jpg,https://i.gr-assets.com/images/S/compressed.photo.goodreads.com/books/1334392783l/1990._SY75_.jpg,https://i.gr-assets.com/images/S/compressed.photo.goodreads.com/books/1334392783l/1990.jpg,1999,11,25,Penguin Classics,eng,false,"While writing <i>Martin Chuzzlewit</i> - his sixth novel - Dickens declared it 'immeasurably the best of my stories.' He was already famous as the author of <i>The Pickwick Papers</i> and <i>Oliver Twist</i>. <br /><br />Set partly in America, which Dickens had visited in 1842, the novel includes a searing satire on the United States. Martin Chuzzlewit is the story of two Chuzzlewits, Martin and Jonas, who have inherited the characteristic Chuzzlewit selfishness. It contrasts their diverse fates of moral redemption and worldly success for one, with increasingly desperate crime for the other. This powerful black comedy involves hypocrisy, greed and blackmail, as well as the most famous of Dickens's grotesques, Mrs Gamp.",3.84,830,Paperback, ,421,https://www.goodreads.com/book/show/1990.Martin_Chuzzlewit,https://www.goodreads.com/book/show/1990.Martin_Chuzzlewit
1991,Why Is Sex Fun? The Evolution of Human Sexuality (Science Masters),0465031269,9780465031269, , ,ID,https://i.gr-assets.com/images/S/compressed.photo.goodreads.com/books/1431354333l/1991._SX98_.jpg,https://i.gr-assets.com/images/S/compressed.photo.goodreads.com/books/1431354333l/1991._SY75_.jpg,https://i.gr-assets.com/images/S/compressed.photo.goodreads.com/books/1431354333l/1991.jpg,1998,9,25,Basic Books,eng,false,Why are humans one of the few species to have sex in private? Why are human females the only mammals to go through menopause? Why is the human penis so unnecessarily large? There is no more knowledgeable authority than the award-winning author of <i>The Third Chimpanzee</i> to answer these intriguing questions. Here is a delightfully entertaining and enlightening look at the unique sex lives of humans.,3.71,176,Paperback, ,304,https://www.goodreads.com/book/show/1991.Why_Is_Sex_Fun_The_Evolution_of_Human_Sexuality,https://www.goodreads.com/book/show/1991.Why_Is_Sex_Fun_The_Evolution_of_Human_Sexuality
1993,The Third Chimpanzee: The Evolution & Future of the Human Animal,0060183071,9780060183073, , ,ID,https://i.gr-assets.com/images/S/compressed.photo.goodreads.com/books/1510809872l/1993._SX98_.jpg,https://i.gr-assets.com/images/S/compressed.photo.goodreads.com/books/1510809872l/1993._SY75_.jpg,https://i.gr-assets.com/images/S/compressed.photo.goodreads.com/books/1510809872l/1993.jpg,1992,1,1,HarperCollins Publishers,eng,false,"A provocative look at mankind's evolution from the ape into the complex creature we call human. By standards of other animals, our powerful civilization appears unique. So do many of our behaviors, including our sexual habits and the ways we select mates. Yet in many respects we are merely another species of ape--our genes are more than 98% identical to those of chimpanzees. 25 line drawings and halftones.",4.07,407,Hardcover, ,2,https://www.goodreads.com/book/show/1993.The_Third_Chimpanzee,https://www.goodreads.com/book/show/1993.The_Third_Chimpanzee
2002,Harry Potter Schoolbooks Box Set: Two Classic Books from the Library of Hogwarts School of Witchcraft and Wizardry,043932162X,9780439321624, , ,ID,https://i.gr-assets.com/images/S/compressed.photo.goodreads.com/books/1479775271l/2002._SX98_.jpg,https://i.gr-assets.com/images/S/compressed.photo.goodreads.com/books/1479775271l/2002._SY75_.jpg,https://i.gr-assets.com/images/S/compressed.photo.goodreads.com/books/1479775271l/2002._SY475_.jpg,2001,11,1,Arthur A. Levine,eng,false,"<i>There is an alternate cover edition for this ISBN13 <a href=""https://www.goodreads.com/book/show/31819939.here"" title=""here"" rel=""nofollow noopener"">here</a>.</i><br /><br />Fans of Harry Potter will love the chance to really get inside the Hogwarts School of Witchcraft and Wizardry. Now, straight from the Hogwarts School Library, come two textbooks used by Harry and all his fellow wizards-in-training. Written by J. K. Rowling under two delightful pseudonyms, <i>Quidditch Through the Ages</i> and <i>Fantastic Beasts &amp; Where to Find Them</i> come packaged in a fabulous box set.<br /><p><br />Did you know that in 1938 the wizard Zacharias Mumps set down the first full description of the game of Quidditch? Written by a renowned Quidditch expert (and ""the author of many Quidditch-related works""), <i>Quidditch Through the Ages</i> reveals everything readers need to know about the most important sport in the wizarding world. From the evolution of the flying broomstick and the rules for playing Quidditch to the changes in the sport since the 14th century (up until today) and details about all the Quidditch teams of Britain and Ireland, this book is a must-have for Quidditch fans old and new. Well researched and filled with diagrams, definitions, and more, <i>Quidditch Through the Ages</i> is what every wizard-in-training needs to be a pro. <br /></p><p><br /><i>Fantastic Beasts &amp; Where to Find Them</i> offers a complete listing of all the fantastic beasts that exist in Harry Potter's world. From the Acromantula (""a monstrous eight-eyed spider capable of human speech"") to the Yeti (""also known as Bigfoot, the Abominable Snowman""), here's well-researched information on where they come from, what they look like, what they eat, and, most important, what to do if you ever meet one face-to-face. This indispensible textbook also includes insight into Muggle awareness of fantastic beasts, information on why Magizoology matters, and much more. Adding to the fun and authenticity, <i>Fantastic Beasts &amp; Where to Find Them</i> features scribbled comments in the margins from Harry Potter, the previous owner of this book, as well as his friends Ron and Hermione.</p>",4.39,240,Hardcover, ,140,https://www.goodreads.com/book/show/2002.Harry_Potter_Schoolbooks_Box_Set,https://www.goodreads.com/book/show/2002.Harry_Potter_Schoolbooks_Box_Set
2005,"Harry Potter and the Half-Blood Prince (Harry Potter, #6)",0747584664,9780747584667, , ,ID,https://i.gr-assets.com/images/S/compressed.photo.goodreads.com/books/1546262426l/2005._SX98_.jpg,https://i.gr-assets.com/images/S/compressed.photo.goodreads.com/books/1546262426l/2005._SY75_.jpg,https://i.gr-assets.com/images/S/compressed.photo.goodreads.com/books/1546262426l/2005._SY475_.jpg,2006,6,23,Bloomsbury Publishing,eng,false,"Alternate Cover Edition <a href=""https://www.goodreads.com/book/show/38330582-harry-potter-and-the-half-blood-prince"" rel=""nofollow noopener"">here</a>.<br /><br />It is Harry Potter's sixth year at Hogwarts School of Witchcraft and Wizardry. As Voldemort's sinister forces amass and a spirit of gloom and fear sweeps the land, it becomes more and more clear to Harry that he will soon have to confront his destiny. But is he up to the challenges ahead of him?<br /><br />In this dark and breathtaking adventure, J.K. Rowling skilfully begins to unravel the complex web she has woven, as we discover more of the truth about Harry, Dumbledore, Snape and, of course, He Who Must Not Be Named . . .<br /><br />--back cover",4.57,768,Mass Market Paperback, ,82,https://www.goodreads.com/book/show/2005.Harry_Potter_and_the_Half_Blood_Prince,https://www.goodreads.com/book/show/2005.Harry_Potter_and_the_Half_Blood_Prince
2010,The Santaroga Barrier,0765342510,9780765342515, , ,ID,https://i.gr-assets.com/images/S/compressed.photo.goodreads.com/books/1386924715l/2010._SX98_.jpg,https://i.gr-assets.com/images/S/compressed.photo.goodreads.com/books/1386924715l/2010._SY75_.jpg,https://i.gr-assets.com/images/S/compressed.photo.goodreads.com/books/1386924715l/2010.jpg,2002,9,16,Tor Books,eng,false,"Santaroga seemed to be nothing more than a prosperous farm community. But there was something ... different ... about Santaroga.<br /><br />Santaroga had no juvenile delinquency, or any crime at all. Outsiders found no house for sale or rent in this valley, and no one ever moved out. No one bought cigarettes in Santaroga. No cheese, wine, beer or produce from outside the valley could be sold there. The list went on and on and grew stranger and stranger.<br /><br />Maybe Santaroga was the last outpost of American individualism. Maybe they were just a bunch of religious kooks...<br /><br />Or maybe there was something extraordinary at work in Santaroga. Something far more disturbing than anyone could imagine.",3.66,256,Paperback, ,90,https://www.goodreads.com/book/show/2010.The_Santaroga_Barrier,https://www.goodreads.com/book/show/2010.The_Santaroga_Barrier
2011,"The Dosadi Experiment (ConSentiency Universe, #2)",0765342537,9780765342539, , ,ID,https://i.gr-assets.com/images/S/compressed.photo.goodreads.com/books/1439457921l/2011._SX98_.jpg,https://i.gr-assets.com/images/S/compressed.photo.goodreads.com/books/1439457921l/2011._SY75_.jpg,https://i.gr-assets.com/images/S/compressed.photo.goodreads.com/books/1439457921l/2011.jpg,2002,9,16,Tor Books,eng,false,"Beyond the God Wall<br /><br />Generations of a tormented human-alien people, caged on a toxic planet, conditioned by constant hunger and war-this is the Dosadi Experiment, and it has succeeded too well. For the Dosadi have bred for Vengeance as well as cunning, and they have learned how to pass through the shimmering God Wall to exact their dreadful revenge on the Universe that created them . . .",3.82,320,Paperback, ,156,https://www.goodreads.com/book/show/2011.The_Dosadi_Experiment,https://www.goodreads.com/book/show/2011.The_Dosadi_Experiment
2016,"King of the Vagabonds (The Baroque Cycle, Vol. 1, Book 2)",0060833173,9780060833176, , ,ID,https://i.gr-assets.com/images/S/compressed.photo.goodreads.com/books/1159411407l/2016._SX98_.jpg,https://i.gr-assets.com/images/S/compressed.photo.goodreads.com/books/1159411407l/2016._SY75_.jpg,https://i.gr-assets.com/images/S/compressed.photo.goodreads.com/books/1159411407l/2016.jpg,2006,3,,HarperTorch,eng,false,"A chronicle of the breathtaking exploits of ""Half-Cocked Jack"" Shaftoe -- London street urchin-turned-legendary swashbuckling adventurer -- risking life and limb for fortune and love while slowly maddening from the pox. . . and Eliza, rescued by Jack from a Turkish harem to become spy, confidante, and pawn of royals in order to reinvent a contentious continent through the newborn power of finance.<br />--back cover",4.17,400,Mass Market Paperback,US / CAN Edition,104,https://www.goodreads.com/book/show/2016.King_of_the_Vagabonds,https://www.goodreads.com/book/show/2016.King_of_the_Vagabonds
2046,"Stories and Early Novels: Pulp Stories / The Big Sleep / Farewell, My Lovely / The High Window",1883011078,9781883011079, , ,ID,https://i.gr-assets.com/images/S/compressed.photo.goodreads.com/books/1347471837l/2046._SX98_.jpg,https://i.gr-assets.com/images/S/compressed.photo.goodreads.com/books/1347471837l/2046._SY75_.jpg,https://i.gr-assets.com/images/S/compressed.photo.goodreads.com/books/1347471837l/2046.jpg,1995,10,1,Library of America,eng,false,"In Raymond Chandler’s hands, the pulp crime story became a haunting mystery of power and corruption, set against a modern cityscape both lyrical and violent. Now Chandler joins the authoritative <em>Library of America</em> series in a comprehensive two-volume set displaying all the facets of his brilliant talent.<br /><br />In his first novel, <em>The Big Sleep</em> (1939), the classic private eye finds his full-fledged form as Philip Marlowe: at once tough, independent, brash, disillusioned, and sensitive—and man of weary honor threading his way (in Chandler’s phrase) “down these mean streets” among blackmailers, pornographers, and murderers for hire.<br /><br />In <em>Farewell, My Lovely</em> (1940), Chandler’s personal favorite among his novels, Marlowe’s search for a missing woman leads him from shanties and honky-tonks to the highest reaches of power, encountering an array of richly drawn characters. <em>The High Window</em> (1942), about a rare coin that becomes a catalyst by which a hushed-up crime comes back to haunt a wealthy family, is partly a humorous burlesque of pulp fiction. All three novels show Chandler at a peak of verbal inventiveness and storytelling drive<br /><br /><em>Stories and Early Novels</em> also includes every classic noir story from the 1930s that Chandler did not later incorporate into a novel—thirteen in all, among them such classics as “Red Wind,” “Finger Man,” The King in Yellow,"" and “Trouble Is My Business.” Drawn from the pages of <em>Black Mask</em> and <em>Dime Detective</em>, these stories show how Chandler adapted the violent conventions of the pulp magazine—with their brisk exposition and rapid-fire dialogue—to his own emerging vision of 20th-century America.",4.50,1199,Hardcover, ,67,https://www.goodreads.com/book/show/2046.Stories_and_Early_Novels,https://www.goodreads.com/book/show/2046.Stories_and_Early_Novels
2047,Collected Stories,0375415009,9780375415005, , ,ID,https://i.gr-assets.com/images/S/compressed.photo.goodreads.com/books/1320427881l/2047._SX98_.jpg,https://i.gr-assets.com/images/S/compressed.photo.goodreads.com/books/1320427881l/2047._SY75_.jpg,https://i.gr-assets.com/images/S/compressed.photo.goodreads.com/books/1320427881l/2047.jpg,2002,10,15,Everyman's Library,,false,"(Book Jacket Status: Jacketed)<br /><br />The only complete edition of stories by the undisputed master of detective literature, collected here for the first time in one volume, including some stories that have been unavailable for decades.<br /><br />When Raymond Chandler turned to writing at the age of forty-five, he began by publishing stories in pulp magazines such as “Black Mask” before later writing his famous novels. These stories are where Chandler honed his art and developed his uniquely vivid underworld, peopled with good cops and bad cops, informers and extortionists, lethally predatory blondes and redheads, and crime, sex, gambling, and alcohol in abundance. In addition to his classic hard-boiled stories–in which his signature atmosphere of depravity and violence swirls around the cool, intuitive loners whose type culminated in the famous detective Philip Marlowe–Chandler also turned his hand to fantasy and even a gothic romance. <br /><br />This rich treasury of twenty-five stories shows Chandler developing the terse, laconic, understated style that would serve him so well in his later masterpieces, and immerses the reader in the richly realized fictional universe that has become an enduring part of our literary landscape",4.39,1299,Hardcover, ,17,https://www.goodreads.com/book/show/2047.Collected_Stories,https://www.goodreads.com/book/show/2047.Collected_Stories
