id,title,isbn,isbn13,asin,kindle_asin,country_code,image_url,small_image_url,large_image_url,publication_year,publication_month,publication_day,publisher,language_code,is_ebook,description,average_rating,num_pages,format,edition_information,text_reviews_count,url,link
36671154,"The Mystery of Three Quarters (New Hercule Poirot Mysteries, #3)",0062792342,9780062792341, , ,ID,https://i.gr-assets.com/images/S/compressed.photo.goodreads.com/books/1521423850l/36671154._SX98_.jpg,https://i.gr-assets.com/images/S/compressed.photo.goodreads.com/books/1521423850l/36671154._SX50_.jpg,https://i.gr-assets.com/images/S/compressed.photo.goodreads.com/books/1521423850l/36671154.jpg,2018,8,28,William Morrow,eng,false,"The world's most beloved detective, Hercule Poirot, the legendary star of Agatha Christie's <em>Murder on the Orient Express</em> and most recently <em>The Monogram Murders</em> and <em>Closed Casket</em>, returns in a stylish, diabolically clever mystery set in the London of 1930.<br /><br />Hercule Poirot returns home after an agreeable luncheon to find an angry woman waiting to berate him outside his front door. Her name is Sylvia Rule, and she demands to know why Poirot has accused her of the murder of Barnabas Pandy, a man she has neither heard of nor ever met. She is furious to be so accused, and deeply shocked. Poirot is equally shocked, because he too has never heard of any Barnabas Pandy, and he certainly did not send the letter in question. He cannot convince Sylvia Rule of his innocence, however, and she marches away in a rage.<br /><br />Shaken, Poirot goes inside, only to find that he has a visitor waiting for him -- a man called John McCrodden who also claims also to have received a letter from Poirot that morning, accusing him of the murder of Barnabas Pandy...<br /><br />Poirot wonders how many more letters of this sort have been sent in his name. Who sent them, and why? More importantly, who is Barnabas Pandy, is he dead, and, if so, was he murdered? And can Poirot find out the answers without putting more lives in danger?",3.70,345,Hardcover, ,713,https://www.goodreads.com/book/show/36671154-the-mystery-of-three-quarters,https://www.goodreads.com/book/show/36671154-the-mystery-of-three-quarters
36676975,ریچارد سوم, ,9789641855439, , ,ID,https://i.gr-assets.com/images/S/compressed.photo.goodreads.com/books/1511855659l/36676975._SX98_.jpg,https://i.gr-assets.com/images/S/compressed.photo.goodreads.com/books/1511855659l/36676975._SY75_.jpg,https://i.gr-assets.com/images/S/compressed.photo.goodreads.com/books/1511855659l/36676975._SY475_.jpg,2017,11,28,نی,per,false,تو جهانی به خون آلودی و انجامت نیز چنین خواهد بود<br />زندگی‌ات به رسوایی گذشت و مرگت نیز قرین رسوایی خواهد بود<br /><br />نمایشنامه‌ی ریچارد سوم که در سال ۳-۱۵۹۲ نوشته شده، از همان آغاز با استقبال فراوان خوانندگان و تماشاگران روبرو شد، چندان که آن را در کنار هملت و رومئو و ژولیت در شمار محبوب‌ترین آثار شکسپیر جای داده‌اند.<br />این نمایشنامه داستان برآمدن و فروافتادن شاهی منفور را بازمی‌گوید. اما شکسپیر سیمای این مرد زشت‌صورت و زشت‌سیرت را چنان تصویر کرده که حضورش بر صحنه، همه‌ی شخصیت‌های دیگر را به محاق می‌برد. این هیولای بی‌شفقت که در راه رسیدن به تاج و تخت انگلیستان از هیچ دروغ و خدعه و جنایتی رویگردان نیست، با هوشی اهریمنی و نگاهی ژرفکاو تا اعماق وجود قربانیانش نفوذ می‌کند و آز و شهوت این یک یا عقل سست‌پای دیگری را آماج خود می‌گیرد. از این روست که جملگی را به‌آسانی می‌فریبد و سرانجام به نابودی می‌کشاند. اما فزون‌خواهی و غرور بی‌حدش سرانجام او را نیز قرین رسوایی و تباهی می‌کند.,3.93,256,Hardcover, ,9,https://www.goodreads.com/book/show/36676975,https://www.goodreads.com/book/show/36676975
36679056,The Incendiaries,0735213895,9780735213890, , ,ID,https://i.gr-assets.com/images/S/compressed.photo.goodreads.com/books/1512834150l/36679056._SX98_.jpg,https://i.gr-assets.com/images/S/compressed.photo.goodreads.com/books/1512834150l/36679056._SY75_.jpg,https://i.gr-assets.com/images/S/compressed.photo.goodreads.com/books/1512834150l/36679056._SY475_.jpg,2018,7,31,Riverhead Books,eng,false,"<b>A powerful, darkly glittering novel of violence, love, faith, and loss, as a young woman at an elite American university is drawn into acts of domestic terrorism by a cult tied to North Korea.</b><br /><br /> Phoebe Lin and Will Kendall meet their first month at prestigious Edwards University. Phoebe is a glamorous girl who doesn't tell anyone she blames herself for her mother's recent death. Will is a misfit scholarship boy who transfers to Edwards from Bible college, waiting tables to get by. What he knows for sure is that he loves Phoebe. <br /><br /> Grieving and guilt-ridden, Phoebe is increasingly drawn into a religious group—a secretive extremist cult—founded by a charismatic former student, John Leal. He has an enigmatic past that involves North Korea and Phoebe's Korean American family. Meanwhile, Will struggles to confront the fundamentalism he's tried to escape, and the obsession consuming the one he loves. When the group bombs several buildings in the name of faith, killing five people, Phoebe disappears. Will devotes himself to finding her, tilting into obsession himself, seeking answers to what happened to Phoebe and if she could have been responsible for this violent act.<br /><br /> <i>The Incendiaries</i> is a fractured love story and a brilliant examination of the minds of extremist terrorists, and of what can happen to people who lose what they love most.",3.25,214,Hardcover, ,2121,https://www.goodreads.com/book/show/36679056-the-incendiaries,https://www.goodreads.com/book/show/36679056-the-incendiaries
36679186,Never Have I Ever, , , , ,ID,https://i.gr-assets.com/images/S/compressed.photo.goodreads.com/books/1546016946l/36679186._SX98_.jpg,https://i.gr-assets.com/images/S/compressed.photo.goodreads.com/books/1546016946l/36679186._SY75_.jpg,https://i.gr-assets.com/images/S/compressed.photo.goodreads.com/books/1546016946l/36679186.jpg,2019,7,30,William Morrow,eng,false,"<b>In this game, even winning can be deadly...</b><br /><br />Amy Whey is proud of her ordinary life and the simple pleasures that come with it—teaching diving lessons, baking cookies for new neighbors, helping her best friend, Charlotte, run their local book club. Her greatest joy is her family: her devoted professor husband, her spirited fifteen-year-old stepdaughter, her adorable infant son. And, of course, the steadfast and supportive Charlotte. But Amy’s sweet, uncomplicated life begins to unravel when the mysterious and alluring Angelica Roux arrives on her doorstep one book club night.<br /><br />Sultry and magnetic, Roux beguiles the group with her feral charm. She keeps the wine flowing and lures them into a game of spilling secrets. Everyone thinks it’s naughty, harmless fun. Only Amy knows better. Something wicked has come her way—a she-devil in a pricey red sports car who seems to know the terrible truth about who she is and what she once did.<br /><br />When they’re alone, Roux tells her that if she doesn’t give her what she asks for, what she deserves, she’s going to make Amy pay for her sins. One way or another.<br /><br />To protect herself and her family and save the life she’s built, Amy must beat the devil at her own clever game, matching wits with Roux in an escalating war of hidden pasts and unearthed secrets. Amy knows the consequences if she can’t beat Roux. What terrifies her is everything she could lose if she wins.<br /><br />A diabolically entertaining tale of betrayal, deception, temptation, and love filled with dark twists leavened by Joshilyn Jackson’s trademark humor, Never Have I Ever explores what happens when the transgressions of our past come back with a vengeance.",3.76,352,Paperback, ,3135,https://www.goodreads.com/book/show/36679186-never-have-i-ever,https://www.goodreads.com/book/show/36679186-never-have-i-ever
36679614,"Broken Places (Cass Raines, #1)", , ,B075C4KDLT, ,ID,https://i.gr-assets.com/images/S/compressed.photo.goodreads.com/books/1511893226l/36679614._SX98_.jpg,https://i.gr-assets.com/images/S/compressed.photo.goodreads.com/books/1511893226l/36679614._SX50_.jpg,https://i.gr-assets.com/images/S/compressed.photo.goodreads.com/books/1511893226l/36679614._SX318_.jpg,,,,,,true,"<b> Former cop Cass Raines has found the world of private investigation a less stressful way to eke out a living in the Windy City. But when she stumbles across the dead body of a respected member of the community, it’s up to her to prove a murderer is on the loose . . . </b><br /> <br />Cops can make mistakes, even when they’re not rookies. If anyone knows that it’s Cass Raines, who took a bullet two years ago after an incompetent colleague screwed up a tense confrontation with an armed suspect. Deeply traumatized by the incident, Cass resigned from the Chicago PD, leaving one less female African-American on the force. Now she’s the head of a one-woman private investigation agency, taking on just enough work to pay the bills. She spends the rest of her time keeping an eye on the tenants in her little Hyde Park apartment building, biking along the lakefront, and playing chess with the only father figure she’s ever known, Father Ray Heaton. <br /> <br />When Father Ray asks Cass to look into a recent spate of vandalism at his church, she readily agrees to handle the case. But only hours later she’s horrified to discover his murdered body in the church confessional, a dead gangbanger sprawled out nearby. She knew Pop, as she called him, had ticked off plenty of people, from slumlords to drug dealers and even some parishioners and politicians, with his uncompromising defense of the downtrodden. But a late-night random theft doesn’t seem like much of a motive at a cash-strapped parish like Saint Brendan’s.<br /> <br />The lead detective assigned to the case is all too ready to dismiss it as an interrupted burglary gone awry, just another statistic in a violent city. But Cass’s instincts tell her otherwise, and badge or no badge, she intends to see justice done . . .",3.82,352,Kindle Edition, ,95,https://www.goodreads.com/book/show/36679614-broken-places,https://www.goodreads.com/book/show/36679614-broken-places
36679740,A Morbid Taste for Bones (Chronicles of Brother Cadfael #1), , ,B00LUZNVQO, ,ID,https://i.gr-assets.com/images/S/compressed.photo.goodreads.com/books/1511895289l/36679740._SX98_.jpg,https://i.gr-assets.com/images/S/compressed.photo.goodreads.com/books/1511895289l/36679740._SY75_.jpg,https://i.gr-assets.com/images/S/compressed.photo.goodreads.com/books/1511895289l/36679740._SY475_.jpg,2014,8,5,MysteriousPress.com/Open Road,eng,true,"On an expedition to acquire a saint’s remains, Brother Cadfael instead finds intrigue and murder<br /><br />It is 1137, and the ambitious head of Shrewsbury Abbey wishes to acquire the remains of Saint Winifred for the glory of his Benedictine order. Brother Cadfael is part of the expedition sent to the saint’s final resting place in Wales, where he finds the villagers divided over the Benedictines’ quest.<br /> <br />When the leading opponent to moving the grave is shot dead with a mysterious arrow, some believe Winifred herself delivered the blow. Brother Cadfael knows that an earthly hand did the killing. But he doesn’t know that his plan to root out a murderer may dig up a case of love and justice, where the waves of sin may be scandal—or his own ruin.",3.97,264,Kindle Edition, ,106,https://www.goodreads.com/book/show/36679740-a-morbid-taste-for-bones,https://www.goodreads.com/book/show/36679740-a-morbid-taste-for-bones
36680918,A Complicated Kindness,0571341004,9780571341009, , ,ID,https://i.gr-assets.com/images/S/compressed.photo.goodreads.com/books/1536375820l/36680918._SX98_.jpg,https://i.gr-assets.com/images/S/compressed.photo.goodreads.com/books/1536375820l/36680918._SY75_.jpg,https://i.gr-assets.com/images/S/compressed.photo.goodreads.com/books/1536375820l/36680918._SY475_.jpg,2018,9,6,Faber  Faber,,false,"<i>
  <b>We're Mennonites. As far as I know, we are the most embarrassing sub-sect of people to belong to if you're a teenager.</b>
</i><br /><i>
  <b></b>
</i><br /><i>
  <b></b>
</i>Sixteen-year-old Nomi Nickel longs to hang out with Lou Reed and Marianne Faithfull in New York City's East Village. Instead she's trapped in East Village, Manitoba: a town with no train station, no bar, and where job prospects consist of slaughtering chickens at the Happy Family Farms abattoir.<br />Since her mother and sister have left home, Nomi lives with her father, Ray, a sweet yet hapless schoolteacher. Fighting against the restraints of the town, Nomi's longing for a future of opportunity and hope sets her on course towards a climax at once startling and inevitable.",3.66, ,Paperback, ,2,https://www.goodreads.com/book/show/36680918-a-complicated-kindness,https://www.goodreads.com/book/show/36680918-a-complicated-kindness
36680919,A Boy of Good Breeding,0571341012,9780571341016, , ,ID,https://i.gr-assets.com/images/S/compressed.photo.goodreads.com/books/1536375773l/36680919._SX98_.jpg,https://i.gr-assets.com/images/S/compressed.photo.goodreads.com/books/1536375773l/36680919._SY75_.jpg,https://i.gr-assets.com/images/S/compressed.photo.goodreads.com/books/1536375773l/36680919._SY475_.jpg,2018,9,6,Faber  Faber,,false,"Knute is a twenty-four-year-old single mother who returns home to Algren with her daughter to look after her father Tom, who has suffered a heart attack. Meanwhile, Hosea Funk, a friend of Tom's and the mayor of Algren has a lot on his mind. The prime minister has promised to pay a visit to whichever town in Canada has the smallest population. Algren has held this position for some time but recent baby booms and returning families, like Knute, threaten to tip Algren over the magic 1500 . . .",3.66, ,Paperback, ,0,https://www.goodreads.com/book/show/36680919-a-boy-of-good-breeding,https://www.goodreads.com/book/show/36680919-a-boy-of-good-breeding
36680980,Leaving Time, , ,B00HXYKYIE, ,ID,https://i.gr-assets.com/images/S/compressed.photo.goodreads.com/books/1511909674l/36680980._SX98_.jpg,https://i.gr-assets.com/images/S/compressed.photo.goodreads.com/books/1511909674l/36680980._SY75_.jpg,https://i.gr-assets.com/images/S/compressed.photo.goodreads.com/books/1511909674l/36680980._SY475_.jpg,2014,10,14,Ballantine Books,eng,true,"For more than a decade, Jenna Metcalf has never stopped thinking about her mother, Alice, who mysteriously disappeared in the wake of a tragic accident. Refusing to believe she was abandoned, Jenna searches for her mother regularly online and pores over the pages of Alice’s old journals. A scientist who studied grief among elephants, Alice wrote mostly of her research among the animals she loved, yet Jenna hopes the entries will provide a clue to her mother’s whereabouts.<br /><br />As Jenna’s memories dovetail with the events in her mother’s journals, the story races to a mesmerizing finish.",3.96,417,Kindle Edition, ,310,https://www.goodreads.com/book/show/36680980-leaving-time,https://www.goodreads.com/book/show/36680980-leaving-time
36681211,"Holy Island (DCI Ryan Mysteries, #1)", , ,B00RPSQAG8, ,ID,https://i.gr-assets.com/images/S/compressed.photo.goodreads.com/books/1511912572l/36681211._SX98_.jpg,https://i.gr-assets.com/images/S/compressed.photo.goodreads.com/books/1511912572l/36681211._SY75_.jpg,https://i.gr-assets.com/images/S/compressed.photo.goodreads.com/books/1511912572l/36681211._SY475_.jpg,2015,1,1,Kindle Direct Publishing,eng,true,"Detective Chief Inspector Ryan retreats to Holy Island seeking sanctuary when he is forced to take sabbatical leave from his duties as a homicide detective. A few days before Christmas, his peace is shattered and he is thrust back into the murky world of murder when a young woman is found dead amongst the ancient ruins of the nearby Priory.<br /><br />When former local girl Dr Anna Taylor arrives back on the island as a police consultant, old memories swim to the surface making her confront her difficult past. She and Ryan struggle to work together to hunt a killer who hides in plain sight, while pagan ritual and small-town politics muddy the waters of their investigation.",3.98,316,Kindle Edition, ,406,https://www.goodreads.com/book/show/36681211-holy-island,https://www.goodreads.com/book/show/36681211-holy-island
36681252,A Scanner Darkly, , ,B005LVR6NC, ,ID,https://i.gr-assets.com/images/S/compressed.photo.goodreads.com/books/1511913118l/36681252._SX98_.jpg,https://i.gr-assets.com/images/S/compressed.photo.goodreads.com/books/1511913118l/36681252._SY75_.jpg,https://i.gr-assets.com/images/S/compressed.photo.goodreads.com/books/1511913118l/36681252._SY475_.jpg,2011,10,18,Mariner Books,eng,true,"Substance D is not known as Death for nothing. It is the most toxic drug ever to find its way on to the streets of LA. It destroys the links between the brain's two hemispheres, causing, first, disorientation and then complete and irreversible brain damage.<br /><br />The undercover narcotics agent who calls himself Bob Arctor is desperate to discover the ultimate source of supply. But to find any kind of lead he has to pose as a user and, inevitably, without realising what is happening, Arctor is soon as addicted as the junkies he works among...",4.01,307,Kindle Edition, ,94,https://www.goodreads.com/book/show/36681252-a-scanner-darkly,https://www.goodreads.com/book/show/36681252-a-scanner-darkly
36681425,Uprooted, , ,B00KUQIU7O, ,ID,https://i.gr-assets.com/images/S/compressed.photo.goodreads.com/books/1511915893l/36681425._SX98_.jpg,https://i.gr-assets.com/images/S/compressed.photo.goodreads.com/books/1511915893l/36681425._SY75_.jpg,https://i.gr-assets.com/images/S/compressed.photo.goodreads.com/books/1511915893l/36681425._SY475_.jpg,2015,5,19,Del Rey,eng,true,"<i>“Our Dragon doesn’t eat the girls he takes, no matter what stories they tell outside our valley. We hear them sometimes, from travelers passing through. They talk as though we were doing human sacrifice, and he were a real dragon. Of course that’s not true: he may be a wizard and immortal, but he’s still a man, and our fathers would band together and kill him if he wanted to eat one of us every ten years. He protects us against the Wood, and we’re grateful, but not that grateful.”</i><br /><br />Agnieszka loves her valley home, her quiet village, the forests and the bright shining river. But the corrupted Wood stands on the border, full of malevolent power, and its shadow lies over her life.<br /><br />Her people rely on the cold, driven wizard known only as the Dragon to keep its powers at bay. But he demands a terrible price for his help: one young woman handed over to serve him for ten years, a fate almost as terrible as falling to the Wood.<br /><br />But Agnieszka fears the wrong things. For when the Dragon comes, it is not Kasia he will choose.",4.06,465,Kindle Edition, ,515,https://www.goodreads.com/book/show/36681425-uprooted,https://www.goodreads.com/book/show/36681425-uprooted
36681678,"Beauty (Folktales, #1)", , ,B00OGWASXC, ,ID,https://i.gr-assets.com/images/S/compressed.photo.goodreads.com/books/1511919760l/36681678._SX98_.jpg,https://i.gr-assets.com/images/S/compressed.photo.goodreads.com/books/1511919760l/36681678._SY75_.jpg,https://i.gr-assets.com/images/S/compressed.photo.goodreads.com/books/1511919760l/36681678._SY475_.jpg,2014,11,18,Open Road Media Teen,eng,true,"When the family business collapses, Beauty and her two sisters are forced to leave the city and begin a new life in the countryside. However, when their father accepts hospitality from the elusive and magical Beast, he is forced to make a terrible promise - to send one daughter to the Beast's castle, with no guarantee that she will be seen again. Beauty accepts the challenge, and there begins an extraordinary story of magic and love that overcomes all boundaries. This is another spellbinding and emotional tale embroidered around a fairytale from Robin McKinley, an award-winning American author.",4.05,264,Kindle Edition, ,63,https://www.goodreads.com/book/show/36681678-beauty,https://www.goodreads.com/book/show/36681678-beauty
36681909,"Conspiracy: Peter Thiel, Hulk Hogan, Gawker, and the Anatomy of Intrigue", , ,B07637TDJJ, ,ID,https://i.gr-assets.com/images/S/compressed.photo.goodreads.com/books/1511922947l/36681909._SX98_.jpg,https://i.gr-assets.com/images/S/compressed.photo.goodreads.com/books/1511922947l/36681909._SY75_.jpg,https://i.gr-assets.com/images/S/compressed.photo.goodreads.com/books/1511922947l/36681909._SY475_.jpg,2018,2,27,Portfolio,,true,"<b>An NPR Book Concierge Best Book of 2018!<br /><br />A stunning story about how power works in the modern age--the book the New York Times called ""one helluva page-turner"" and The Sunday Times of London celebrated as ""riveting...an astonishing modern media conspiracy that is a fantastic read."" Pick up the book everyone is talking about.</b><br /><br />In 2007, a short blogpost on Valleywag, the Silicon Valley-vertical of Gawker Media, outed PayPal founder and billionaire investor Peter Thiel as gay. Thiel's sexuality had been known to close friends and family, but he didn't consider himself a public figure, and believed the information was private. <br /><br />This post would be the casus belli for a meticulously plotted conspiracy that would end nearly a decade later with a $140 million dollar judgment against Gawker, its bankruptcy and with Nick Denton, Gawker's CEO and founder, out of a job. Only later would the world learn that Gawker's demise was not incidental--it had been masterminded by Thiel.<br /><br />For years, Thiel had searched endlessly for a solution to what he'd come to call the ""Gawker Problem."" When an unmarked envelope delivered an illegally recorded sex tape of Hogan with his best friend's wife, Gawker had seen the chance for millions of pageviews and to say the things that others were afraid to say. Thiel saw their publication of the tape as the opportunity he was looking for. He would come to pit Hogan against Gawker in a multi-year proxy war through the Florida legal system, while Gawker remained confidently convinced they would prevail as they had over so many other lawsuit--until it was too late. <br /><br />The verdict would stun the world and so would Peter's ultimate unmasking as the man who had set it all in motion. Why had he done this? How had no one discovered it? What would this mean--for the First Amendment? For privacy? For culture?<br /><br />In Holiday's masterful telling of this nearly unbelievable conspiracy, informed by interviews with all the key players, this case transcends the narrative of how one billionaire took down a media empire or the current state of the free press. It's a study in power, strategy, and one of the most wildly ambitious--and successful--secret plots in recent memory.<br /><br />Some will cheer Gawker's destruction and others will lament it, but after reading these pages--and seeing the access the author was given--no one will deny that there is something ruthless and brilliant about Peter Thiel's shocking attempt to shake up the world.",3.99,331,Kindle Edition, ,488,https://www.goodreads.com/book/show/36681909-conspiracy,https://www.goodreads.com/book/show/36681909-conspiracy
36686229,Exit Stage Left: The Snagglepuss Chronicles,1401275214,9781401275211, , ,ID,https://i.gr-assets.com/images/S/compressed.photo.goodreads.com/books/1535544342l/36686229._SX98_.jpg,https://i.gr-assets.com/images/S/compressed.photo.goodreads.com/books/1535544342l/36686229._SY75_.jpg,https://i.gr-assets.com/images/S/compressed.photo.goodreads.com/books/1535544342l/36686229.jpg,2018,8,28,DC Comics,eng,false,"Heavens to Murgatroyd! Hanna-Barbera’s very own Snagglepuss is reimagined in a brand-new series, EXIT STAGE LEFT: THE SNAGGLEPUSS CHRONICLES, by author Mark Russell (THE FLINTSTONES)!<br /><br />It’s 1953. While the United States is locked in a nuclear arms race with the Soviet Union, the gay Southern playwright known as Snagglepuss is the toast of Broadway. But success has made him a target. As he plans for his next hit play, Snagglepuss becomes the focus of the House Committee on Un-American Activities. And when powerful forces align to purge show business of its most subversive voices, no one is safe!<br /><br />Written by Mark Russell, the critically acclaimed mastermind behind the award-winning PREZ VOL. 1 and THE FLINTSTONES, EXIT STAGE LEFT: THE SNAGGLEPUSS CHRONICLES, enters the Hanna-Barbera reimagined universe! Collects issues #1-6",4.26,168,Paperback, ,341,https://www.goodreads.com/book/show/36686229-exit-stage-left,https://www.goodreads.com/book/show/36686229-exit-stage-left
