id,title,isbn,isbn13,asin,kindle_asin,country_code,image_url,small_image_url,large_image_url,publication_year,publication_month,publication_day,publisher,language_code,is_ebook,description,average_rating,num_pages,format,edition_information,text_reviews_count,url,link
2931749,چنین گفت زرتشت, , , , ,ID,https://i.gr-assets.com/images/S/compressed.photo.goodreads.com/books/1212580742l/2931749._SY160_.jpg,https://i.gr-assets.com/images/S/compressed.photo.goodreads.com/books/1212580742l/2931749._SY75_.jpg,https://i.gr-assets.com/images/S/compressed.photo.goodreads.com/books/1212580742l/2931749.jpg,2005,,,اهورا,per,false,کتابی برای همه کس و هیچکس,4.05,598,Unknown Binding, ,6,https://www.goodreads.com/book/show/2931749,https://www.goodreads.com/book/show/2931749
2933377,وداع با اسلحه, , , , ,ID,https://i.gr-assets.com/images/S/compressed.photo.goodreads.com/books/1494066488l/2933377._SX98_.jpg,https://i.gr-assets.com/images/S/compressed.photo.goodreads.com/books/1494066488l/2933377._SY75_.jpg,https://i.gr-assets.com/images/S/compressed.photo.goodreads.com/books/1494066488l/2933377._SY475_.jpg,1970,,,جيبی,,false,"<i>A Farewell to Arms</i> is the unforgettable story of an American ambulance driver on the Italian front and his passion for a beautiful English nurse. Set against the looming horrors of the battlefield—weary, demoralized men marching in the rain during the German attack on Caporetto; the profound struggle between loyalty and desertion—this gripping, semiautobiographical work captures the harsh realities of war and the pain of lovers caught in its inexorable sweep. Ernest Hemingway famously said that he rewrote the ending to <i>A Farewell to Arms</i> thirty-nine times to get the words right.",3.81,232, , ,0,https://www.goodreads.com/book/show/2933377,https://www.goodreads.com/book/show/2933377
2936415,Where Men Win Glory: The Odyssey of Pat Tillman,0385522266,9780385522267, , ,ID,https://i.gr-assets.com/images/S/compressed.photo.goodreads.com/books/1439088374l/2936415._SX98_.jpg,https://i.gr-assets.com/images/S/compressed.photo.goodreads.com/books/1439088374l/2936415._SY75_.jpg,https://i.gr-assets.com/images/S/compressed.photo.goodreads.com/books/1439088374l/2936415._SY475_.jpg,2009,9,15,Doubleday Books,en-US,false,"<b>The bestselling author of <i>Into the Wild</i>, <i>Into Thin Air</i>, and <i>Under the Banner of Heaven</i> delivers a stunning, eloquent account of a remarkable young man’s haunting journey.</b><br /><br />Like the men whose epic stories Jon Krakauer has told in his previous bestsellers, Pat Tillman was an irrepressible individualist and iconoclast. In May 2002, Tillman walked away from his $3.6 million NFL contract to enlist in the United States Army. He was deeply troubled by 9/11, and he felt a strong moral obligation to join the fight against al-Qaeda and the Taliban. Two years later, he died on a desolate hillside in southeastern Afghanistan.<br /><br />Though obvious to most of the two dozen soldiers on the scene that a ranger in Tillman’s own platoon had fired the fatal shots, the Army aggressively maneuvered to keep this information from Tillman’s wife, other family members, and the American public for five weeks following his death. During this time, President Bush repeatedly invoked Tillman’s name to promote his administration’s foreign policy. Long after Tillman’s nationally televised memorial service, the Army grudgingly notified his closest relatives that he had “probably” been killed by friendly fire while it continued to dissemble about the details of his death and who was responsible.<br /><br />In <i>Where Men Win Glory</i>, Jon Krakauer draws on Tillman’s journals and letters, interviews with his wife and friends, conversations with the soldiers who served alongside him, and extensive research on the ground in Afghanistan to render an intricate mosaic of this driven, complex, and uncommonly compelling figure as well as the definitive account of the events and actions that led to his death. Before he enlisted in the army, Tillman was familiar to sports aficionados as an undersized, overachieving Arizona Cardinals safety whose virtuosity in the defensive backfield was spellbinding. With his shoulder-length hair, outspoken views, and boundless intellectual curiosity, Tillman was considered a maverick. America was fascinated when he traded the bright lights and riches of the NFL for boot camp and a buzz cut. Sent first to Iraq—a war he would openly declare was “illegal as hell”—and eventually to Afghanistan, Tillman was driven by complicated, emotionally charged, sometimes contradictory notions of duty, honor, justice, patriotism, and masculine pride, and he was determined to serve his entire three-year commitment. But on April 22, 2004, his life would end in a barrage of bullets fired by his fellow soldiers.<br /><br />Krakauer chronicles Tillman’s riveting, tragic odyssey in engrossing detail highlighting his remarkable character and personality while closely examining the murky, heartbreaking circumstances of his death. Infused with the power and authenticity readers have come to expect from Krakauer’s storytelling, <i>Where Men Win Glory </i>exposes shattering truths about men and war.<br /><i>From the inside cover of ISBN 0385522266 / 9780385522267</i>",4.03,383,Hardcover, ,2646,https://www.goodreads.com/book/show/2936415-where-men-win-glory,https://www.goodreads.com/book/show/2936415-where-men-win-glory
2940211,The Persian Girl,0352345012,9780352345011, , ,ID,https://i.gr-assets.com/images/S/compressed.photo.goodreads.com/books/1311998668l/2940211._SY160_.jpg,https://i.gr-assets.com/images/S/compressed.photo.goodreads.com/books/1311998668l/2940211._SY75_.jpg,https://i.gr-assets.com/images/S/compressed.photo.goodreads.com/books/1311998668l/2940211.jpg,2008,10,2,Nexus,eng,false,"The auction catalogue read: <i>Lot # 217. A tin trunk, circa 1860, containing a number of esoteric volumes, many with curious woodcuts, all in poor condition<br /></i>The trunk held the secret diaries of Sir Richard Francis Burton, soldier, spy, explorer, linguist, diplomat, master of disguise, the greatest swordsman of all time, hero, scoundrel, rake. His deeds are legendary, from single-handedly routing a score of attacking tribesmen to translating the <i>Kama Sutra</i> after having tested every single position it describes.<br />Long periods of Burton's life have been shrouded in mystery. His lovely wife, Isabel, burned many of his papers, 'to protect his reputation.' Now it can be revealed that Burton's remarkable skill with the sabre was exceeded by his incredible sexual prowess. During the period of his life that he describes in <i>The Persian Girl</i>, he futtered his way from London to the Himalayas, coupling with two women at once, as an <i>hors d'oeuvre</i>, then taking his pleasure from gorgeous trios and beautiful quartets until his <i>magnum opus</i> - an extended orgy with a dozen female participants, with Burton as the only male. <br />After that, saving the British Empire from a perfidious Russian plot was easy.",3.00,256,Paperback, ,5,https://www.goodreads.com/book/show/2940211-the-persian-girl,https://www.goodreads.com/book/show/2940211-the-persian-girl
2942566,The Pitchfork 500: Our Guide to the Greatest Songs From Punk to the Present,1416562028,9781416562023, , ,ID,https://i.gr-assets.com/images/S/compressed.photo.goodreads.com/books/1421732653l/2942566._SX98_.jpg,https://i.gr-assets.com/images/S/compressed.photo.goodreads.com/books/1421732653l/2942566._SX50_.jpg,https://i.gr-assets.com/images/S/compressed.photo.goodreads.com/books/1421732653l/2942566.jpg,2008,11,11,Touchstone,en-US,false,"FROM THE BRAIN TRUST BEHIND PITCHFORKMEDIA.COM -- THE WEBSITE <i>THE LOS ANGELES TIMES</i> DECLARED ""AN ESSENTIAL PART OF THE IPO D GENERATION'S LEXICON, A MUST-READ"" -- A FRESH GUIDE TO THE 500 BEST SONGS OF THE PAST THIRTY YEARS. <br /><br /> Named the ""best site for music criticism on the web"" by <i>The New York Times Magazine,</i> Pitchforkmedia.com has become the leading independent resource for music journalism, the place people turn to find out what's happening in new music. Founded in 1995, Pitchfork has developed one of the web's most devoted followings, with more than 1.6 million readers monthly who tune in for daily reviews, news, features, videos, and interviews. <br /> <br /> In <i>The Pitchfork 500: Our Guide to the Greatest Songs from Punk to the Present,</i> Pitchfork offers up their take on the 500 best songs of the past three decades. Focusing on indie rock (Arcade Fire, the Shins), hiphop (Public Enemy, Jay-Z), electronic (Daft Punk, Boards of Canada), pop (Madonna, Justin Timberlake), metal (Metallica, Boris), and experimental underground music (Suicide, Boredoms), it features all-new essays and reviews written with the sharp wit and insight for which the site is known. <br /> <br /> Kicking it off in 1977 with the birth of punk and independent music, <i>The Pitchfork 500</i> runs chronologically, with each chapter representing a distinct period and offering a narrative of how the musical landscape of the day influenced its artists. The book opens with David Bowie, Lou Reed, Iggy Pop, Kraftwerk, and Brian Eno, the ""art-rock godfathers"" who set the tone and tenor for the next thirty years, and wraps up in the present, when bands connect with new audiences through social networking sites and prime-time TV placements -- and when a single mp3 can turn a niche indie artist into a global sensation. Sidebars like ""Yacht Rock,"" ""Runaway Trainwrecks,"" ""Nanofads,"" and ""Career Killers"" call out some far-from-classic musical trends and identify the guiltiest offenders. <br /> <br /> Modernizing the music-guide format, <i>The Pitchfork 500</i> reflects the way listeners are increasingly processing music -- by song rather than by album. These 500 tracks condense thirty years of essential music into the ultimate chronological playlist, each song advancing the narrative and, by extension, the music itself.",3.65,208,Paperback, ,30,https://www.goodreads.com/book/show/2942566-the-pitchfork-500,https://www.goodreads.com/book/show/2942566-the-pitchfork-500
2942581,"My Miserable, Lonely, Lesbian Pregnancy",1573443158,9781573443159, , ,ID,https://i.gr-assets.com/images/S/compressed.photo.goodreads.com/books/1328748300l/2942581._SX98_.jpg,https://i.gr-assets.com/images/S/compressed.photo.goodreads.com/books/1328748300l/2942581._SY75_.jpg,https://i.gr-assets.com/images/S/compressed.photo.goodreads.com/books/1328748300l/2942581.jpg,2008,4,28,Cleis Press,eng,false,"In this memoir of her 40 weeks and five days in hell, Andrea Askowitz takes an unflinching look at her pregnant life from struggling with hormones to poor body image to a self imposed exile from family to take us on a ride through the turbulence of single lesbian motherhood. Along the way we meet her liberal parents as they struggle with their daughter's choices, the lover she longs to reconnect with who goes M.I.A. before the pregnancy, the friends who turn out to be no help at all and strangers who offer up some unlikely kindness. Andrea presents herself real, raw, impossibly cranky yet deeply touching with her self-deprecating dark sense of humor that will make you wince or better yet send you into uncontrollable fits of laughter.",3.37,256,Paperback, ,47,https://www.goodreads.com/book/show/2942581-my-miserable-lonely-lesbian-pregnancy,https://www.goodreads.com/book/show/2942581-my-miserable-lonely-lesbian-pregnancy
2945672,Love in the Time of Fridges,0553384414,9780553384413, , ,ID,https://i.gr-assets.com/images/S/compressed.photo.goodreads.com/books/1320406544l/2945672._SX98_.jpg,https://i.gr-assets.com/images/S/compressed.photo.goodreads.com/books/1320406544l/2945672._SY75_.jpg,https://i.gr-assets.com/images/S/compressed.photo.goodreads.com/books/1320406544l/2945672.jpg,2008,7,29,Spectra,eng,false,"Tim Scott’s <b>Outrageous Fortune</b> marked the debut of one of the most wildly inventive writers to hit the sci-fi scene in years. Now he returns with a hilarious yet poignant novel of love, loss, and itinerant appliances.<br /><b>
  <br />
</b>“New Seattle Health and Safety. Do not die for no reason.” This is the motto of a city so obsessed with the danger of sharp corners that it has almost forgotten how to live. But Huckleberry Lindbergh is about to find his trip to the city most decidedly <i>unsafe</i>. For a chance encounter leads him into the heart of a dark conspiracy. And in order to stop it, this former cop is about to do something so unsafe—so monumentally stupid—that its reverberations will be felt all the way to the Pentagon.<br /><br />Soon he is on the run from more authorities than he has had hot meals, his staunchest allies a bunch of feral fridges that give new meaning to the words “chill out.” But sometimes a dose of chaos is just what the doctor ordered, and Huck’s quest to remain among the living teaches not only him but those around him the true meaning of survival . . . in all its forms.",3.30,384,Paperback, ,30,https://www.goodreads.com/book/show/2945672-love-in-the-time-of-fridges,https://www.goodreads.com/book/show/2945672-love-in-the-time-of-fridges
2946246,Romeo und Julia,3872911279,9783872911278, , ,ID,https://i.gr-assets.com/images/S/compressed.photo.goodreads.com/books/1353750465l/2946246._SX98_.jpg,https://i.gr-assets.com/images/S/compressed.photo.goodreads.com/books/1353750465l/2946246._SY75_.jpg,https://i.gr-assets.com/images/S/compressed.photo.goodreads.com/books/1353750465l/2946246.jpg,2011,,,Hamburger Lesehefte,ger,false,"Als Quelle diente Shakespeare das epische Gedicht ""Romeo und Juliet"", das 1562 erschien. Shakespeare schuf daraus das unsterbliche Liebespaar, dessen Liebe die verfeindeten Elternhäuser Montagnes und Capulets entgegenstanden. Noch heute zieht es Liebespaare aus aller Welt zum Schauplatz der Handlung nach Verona, wo die Szenen spielen, deren Liebesgespräche als die schönsten der Weltliteratur gelten.<br />Eine Einführung in das Drama enthält das Nachwort. Ausführliche Anmerkungen erleichtern das Verständnis der Dichtung.",3.75,95,Paperback, ,6,https://www.goodreads.com/book/show/2946246-romeo-und-julia,https://www.goodreads.com/book/show/2946246-romeo-und-julia
2946249,Running Xen: A Hands-On Guide to the Art of Virtualization,0132349663,9780132349666, , ,ID,https://i.gr-assets.com/images/S/compressed.photo.goodreads.com/books/1349052480l/2946249._SX98_.jpg,https://i.gr-assets.com/images/S/compressed.photo.goodreads.com/books/1349052480l/2946249._SX50_.jpg,https://i.gr-assets.com/images/S/compressed.photo.goodreads.com/books/1349052480l/2946249.jpg,2008,4,16,Prentice Hall,en-GB,false,"<i>""This accessible and immediately useful book expertly provides the Xen community with everything it needs to know to download, build, deploy and manage Xen implementations.""</i> --Ian Pratt, Xen Project Leader VP Advanced Technology, Citrix Systems <b>The Real-World, 100% Practical Guide to Xen Virtualization in Production Environments</b> <b> </b> Using free, open source Xen virtualization software, you can save money, gain new flexibility, improve utilization, and simplify everything from disaster recovery to software testing. Running Xen brings together all the knowledge you need to create and manage high-performance Xen virtual machines in any environment. Drawing on the unparalleled experience of a world-class Xen team, it covers everything from installation to administration--sharing field-tested insights, best practices, and case studies you can find nowhere else. The authors begin with a primer on virtualization: its concepts, uses, and advantages. Next, they tour Xen's capabilities, explore the Xen LiveCD, introduce the Xen hypervisor, and walk you through configuring your own hard-disk-based Xen installation. After you're running, they guide you through each leading method for creating ""guests"" and migrating existing systems to run as Xen guests. Then they offer comprehensive coverage of managing and securing Xen guests, devices, networks, and distributed resources. Whether you're an administrator, data center manager, developer, system integrator, or ISP, Running Xen will help you achieve your goals with Xen-reliably, efficiently, with outstanding performance, and at a surprisingly low cost<i>.</i> <i> </i> -Understanding the Xen hypervisor: what it does, and how it works -Using pre-built system images, including compressed file systems -Managing domains with the xm console -Populating and storing guest images -Planning, designing, and configuring networks in Xen -Utilizing Xen security: special purpose VMs, virtual network segments, remote access, firewalls, network monitors, sHype access control, Xen Security Modules (XSM), and more -Managing guest resources: memory, CPU, and I/O -Employing Xen in the enterprise: tools, products, and techniques",3.50,586,Paperback, ,0,https://www.goodreads.com/book/show/2946249-running-xen,https://www.goodreads.com/book/show/2946249-running-xen
2949878,The Almost Moon,0316067369,9780316067362, , ,ID,https://i.gr-assets.com/images/S/compressed.photo.goodreads.com/books/1295715523l/2949878._SX98_.jpg,https://i.gr-assets.com/images/S/compressed.photo.goodreads.com/books/1295715523l/2949878._SY75_.jpg,https://i.gr-assets.com/images/S/compressed.photo.goodreads.com/books/1295715523l/2949878.jpg,2008,9,8,Back Bay Books,en-US,false,"For years Helen Knightly has given her life to others: to her haunted mother, to her enigmatic father, to her husband and now grown children. When she finally crosses a terrible boundary, her life comes rushing in at her in a way she never could have imagined. Unfolding over the next twenty-four hours, this searing, fast-paced novel explores the complex ties between mothers and daughters, wives and lovers, the meaning of devotion, and the line between love and hate. It is a challenging, moving, gripping story, written with the fluidity and strength of voice that only Alice Sebold can bring to the page.",2.69,291,Paperback, ,278,https://www.goodreads.com/book/show/2949878-the-almost-moon,https://www.goodreads.com/book/show/2949878-the-almost-moon
2952666,Emberismeret,9637875964, , , ,ID,https://i.gr-assets.com/images/S/compressed.photo.goodreads.com/books/1204712220l/2952666._SX98_.jpg,https://i.gr-assets.com/images/S/compressed.photo.goodreads.com/books/1204712220l/2952666._SY75_.jpg,https://i.gr-assets.com/images/S/compressed.photo.goodreads.com/books/1204712220l/2952666.jpg,2000,,,Göncöl,hun,false,"Az individuálpszichológia kézikönyveként régóta elismert, Emberismeret című mű közérthető bevezetést kínál Adler elképzelésének alapjaiba, mely során eltávolodott kollégája, Freud gondolataitól. Ez magába foglalja a kisebbrendűségi és felsőbbrendűségi komplexust; az emlékeket és álmokat; a szerelmi házasságot és gyermekeket; illetve a szexualitást és szexuális problémákat. Adler szerint az üzleti vagy tudományos téren elkövetett hibák költségesek és keservesek, viszont az életvezetésben vétettek sokszor magát az életet veszélyeztetik.<br /><br />Az eredetileg 1927-ben megjelent könyv célja, hogy az individuálpszichológia<br />alapjait megismertesse a nagyközönséggel. Eközben bemutatja az elvek mindennapi kapcsolatainkban és személyes életünk szervezésében történő gyakorlati megvalósítását is. A bécsi People's Institute hallgatóinak tartott, egy évnyi előadás anyagából összegyűlt kötet rávilágít, hogy az egyének téves viselkedése miként hat a közösségi összhangra; megtanítja az embereket a ballépéseik felismerésére; végül pedig megmutatja nekik, hogyan valósíthatják meg a közösségi élethez történő harmonikus alkalmazkodást.<br /><br />Adler holisztikus, az egyént középpontba helyező megközelítése a mai napig egyaránt meghatározó a hallgatók, a nagyközönség és a szakmabeliek számára is.<br /><br />ALFRED ADLER (1870 - 1937) osztrák orvos, pszichoterapeuta, az individuálpszichológia iskolájának megalapítója. Bécsben kezdte meg orvosi tevékenységét, majd 1935-ben az Amerikai Egyesült Államokba települt át.",3.96,267,Paperback, ,0,https://www.goodreads.com/book/show/2952666-emberismeret,https://www.goodreads.com/book/show/2952666-emberismeret
2953207,"Ojos de agua (Leo Caldas, #1)",8478440488,9788478440481, , ,ID,https://i.gr-assets.com/images/S/compressed.photo.goodreads.com/books/1204753332l/2953207._SX98_.jpg,https://i.gr-assets.com/images/S/compressed.photo.goodreads.com/books/1204753332l/2953207._SY75_.jpg,https://i.gr-assets.com/images/S/compressed.photo.goodreads.com/books/1204753332l/2953207.jpg,2006,6,,Siruela,spa,false,"Entre el aroma del mar y de los pinos gallegos, en una torre residencial junto a la playa, un joven saxofonista de ojos claros, Luis Reigosa, ha aparecido asesinado con una crueldad que apunta a un crimen pasional. Sin embargo, el músico muerto no mantiene una relación estable y la casa, limpia de huellas, no muestra más que partituras ordenadas en los estantes y saxofones colgados en las paredes. Leo Caldas, un solitario y melancólico inspector de policía que compagina su trabajo en comisaría con un consultorio radiofónico, se hará cargo de una investigación que le llevará de la bruma del anochecer al humo de las tabernas y los clubes de jazz. A su lado está el ayudante Rafael Estévez, un aragonés demasiado impetuoso para una Galicia irónica y ambigua, e incluso demasiado impetuoso para el propio Leo, que busca entre sorbos de vino los fantasmas ocultos en los demás mientras intenta sobrevivir a los suyos. Gracias a la labor de este singular tándem Caldas-Estévez la verdad termina por aflorar, llevándonos a desentrañar el secreto que esconden los Ojos de agua.",3.65,187,Paperback, ,116,https://www.goodreads.com/book/show/2953207-ojos-de-agua,https://www.goodreads.com/book/show/2953207-ojos-de-agua
2957388,La Mauvaise Vie,2221092252,9782221092255, , ,ID,https://i.gr-assets.com/images/S/compressed.photo.goodreads.com/books/1330340690l/2957388._SX98_.jpg,https://i.gr-assets.com/images/S/compressed.photo.goodreads.com/books/1330340690l/2957388._SY75_.jpg,https://i.gr-assets.com/images/S/compressed.photo.goodreads.com/books/1330340690l/2957388.jpg,,,,,,false,,3.40,350, , ,2,https://www.goodreads.com/book/show/2957388-la-mauvaise-vie,https://www.goodreads.com/book/show/2957388-la-mauvaise-vie
2958990,Designing Engineers,0262023776,9780262023771, , ,ID,https://i.gr-assets.com/images/S/compressed.photo.goodreads.com/books/1267399749l/2958990._SX98_.jpg,https://i.gr-assets.com/images/S/compressed.photo.goodreads.com/books/1267399749l/2958990._SX50_.jpg,https://i.gr-assets.com/images/S/compressed.photo.goodreads.com/books/1267399749l/2958990.jpg,2006,2,8,MIT Press (MA),en-GB,false,"The products of engineering design are everywhere, but who or what determines their form and function? Their surfaces are usually cold, seemingly objective, as if they existed outside of history of the technologies that are so much a part of our lives. Written by a practising engineer, Designing Engineers yields clues to this mystery by probing deeply into the everyday world of engineering. In doing so, it reveals significant discrepancies between our ideal image of design as an instrumental process and the reality of design as a historically-situated social process that is full of uncertainty and ambiguity. This text describes the evolution of three disparate projects: an x-ray inspection system for airports, a photoprint machine, and a residential photovoltaic energy system.",3.40,220,Paperback, ,0,https://www.goodreads.com/book/show/2958990-designing-engineers,https://www.goodreads.com/book/show/2958990-designing-engineers
2963442,"The United States of Atlantis  (Atlantis, #2)",045146236X,9780451462367, , ,ID,https://i.gr-assets.com/images/S/compressed.photo.goodreads.com/books/1434135307l/2963442._SX98_.jpg,https://i.gr-assets.com/images/S/compressed.photo.goodreads.com/books/1434135307l/2963442._SY75_.jpg,https://i.gr-assets.com/images/S/compressed.photo.goodreads.com/books/1434135307l/2963442._SY475_.jpg,2008,12,2,Roc,eng,false,"England has driven the French from Atlantis, giving King George leave to tighten his control over the colonies. The Redcoats have seized the continentas eastern coastal towns, depriving the Atlanteans of the markets where they sell their goods as part of a strategy to bend the colonists to their will. Instead, Englandas tactics have only strengthened the Atlanteansa resolve to be free. As leader of the revolutionaries, Victor Radcliff will make the English pay for each and every piece of land they dare to occupy, and will stop at nothing to preserve the liberty of his people as a new nation is bornaa nation that will change the face of the world.",3.55,438,Hardcover, ,35,https://www.goodreads.com/book/show/2963442-the-united-states-of-atlantis,https://www.goodreads.com/book/show/2963442-the-united-states-of-atlantis
