id,title,isbn,isbn13,asin,kindle_asin,country_code,image_url,small_image_url,large_image_url,publication_year,publication_month,publication_day,publisher,language_code,is_ebook,description,average_rating,num_pages,format,edition_information,text_reviews_count,url,link
272169,Hemingway's Chair,0312205503,9780312205508, , ,ID,https://i.gr-assets.com/images/S/compressed.photo.goodreads.com/books/1388874070l/272169._SX98_.jpg,https://i.gr-assets.com/images/S/compressed.photo.goodreads.com/books/1388874070l/272169._SY75_.jpg,https://i.gr-assets.com/images/S/compressed.photo.goodreads.com/books/1388874070l/272169.jpg,1999,6,23,St. Martin's Griffin,eng,false,"Martin Sproale is an assistant postmaster obsessed with Ernest Hemingway. Martin lives in a small English village, where he studies his hero and putters about harmlessly—until an ambitious outsider, Nick Marshall, is appointed postmaster instead of Martin. Slick and self-assured, Nick steals Martin's girlfriend and decides to modernize the friendly local office by firing dedicated but elderly employees and privatizing the business. Suddenly, gentle Martin is faced with a choice: meekly accept defeat as he always has, or fight for what he believes in, as his hero, Hemingway, would.<br /><br />Filled with Michael Palin's trademark wit and good humor, this novel is for anyone who has ever dreamed of triumphing over the technocrats and backstabbers of the world. Hilarious, touching, and ultimately inspirational,<i> Hemingway's Chair</i> will make readers stand up and cheer.",3.35,288,Paperback, ,131,https://www.goodreads.com/book/show/272169.Hemingway_s_Chair,https://www.goodreads.com/book/show/272169.Hemingway_s_Chair
272180,La Libertad y Sus Enemigos,0307274314,9780307274311, , ,ID,https://i.gr-assets.com/images/S/compressed.photo.goodreads.com/books/1388502988l/272180._SX98_.jpg,https://i.gr-assets.com/images/S/compressed.photo.goodreads.com/books/1388502988l/272180._SX50_.jpg,https://i.gr-assets.com/images/S/compressed.photo.goodreads.com/books/1388502988l/272180.jpg,2005,7,5,Sudamericana,en-US,false,,4.56,320,Paperback, ,0,https://www.goodreads.com/book/show/272180.La_Libertad_y_Sus_Enemigos,https://www.goodreads.com/book/show/272180.La_Libertad_y_Sus_Enemigos
272440,Strip City: A Stripper's Farewell Journey Across America,0786886757,9780786886753, , ,ID,https://i.gr-assets.com/images/S/compressed.photo.goodreads.com/books/1328038993l/272440._SX98_.jpg,https://i.gr-assets.com/images/S/compressed.photo.goodreads.com/books/1328038993l/272440._SX50_.jpg,https://i.gr-assets.com/images/S/compressed.photo.goodreads.com/books/1328038993l/272440.jpg,2003,2,19,Hyperion Books,eng,false,"There's no business like the sex business -- or is there? In this poignant, bittersweet, sometimes funny account of a stripper's odyssey, the reader is allowed many roles. We start innocently enough: reading a journal about finding oneself -- a journey across America to recapture and understand a young woman's history as she prepares for a new life.<br /><br />Along the way, we are alternately voyeurs and witnesses, learning the details and daily grinds of a worker in the sex trade -- an exotic dancer, on her last cross-country tour of the clubs that have been such an important part of her life. Well written and powerful, <i>Strip City</i> becomes, about midway through, the journal of a soul. It asks why we do what we do, what it means to say one is a feminist, and how to understand (with eyes wide open) an industry that is both liberating and degrading -- a job in some ways like many others, yet one ultimately corruptive of our very dreams, nightmares, fears, and desires. <br /><br /><i>Strip City</i> is not a tell-all, although it tells much. It is one woman's attempt to come to terms with her past: to glorify the dance and not to victimize, preach, or pass judgment on the dancers or to mystify the work, the audience drawn to it, and (most of all) the toll on the women themselves. It is both painful and funny and cathartic for both writer and reader. <br /><br />Most of all, it is a very moral tale, honestly told, deftly written, and exhibiting neither shame nor undue pride: an American tale, filled with pop culture images that remind us, over and over again, of the roles a prosperous, bountiful nation has allowed to (or forced on) women. <i>Strip City</i> provides us a dazzling, glitzy, and devastating meditation. (<i> Fall 2001 Selection</i>)",3.53,328,Paperback, ,111,https://www.goodreads.com/book/show/272440.Strip_City,https://www.goodreads.com/book/show/272440.Strip_City
272574,The Dud Avocado (Virago Modern Classics),1853815810,9781853815812, , ,ID,https://i.gr-assets.com/images/S/compressed.photo.goodreads.com/books/1330916775l/272574._SX98_.jpg,https://i.gr-assets.com/images/S/compressed.photo.goodreads.com/books/1330916775l/272574._SY75_.jpg,https://i.gr-assets.com/images/S/compressed.photo.goodreads.com/books/1330916775l/272574.jpg,1993,8,26,Virago,en-GB,false,The Dud Avocado,3.63,336,Paperback, ,34,https://www.goodreads.com/book/show/272574.The_Dud_Avocado,https://www.goodreads.com/book/show/272574.The_Dud_Avocado
272607,"Fade Away (Myron Bolitar, #3)",0440222680,9780440222682, , ,ID,https://i.gr-assets.com/images/S/compressed.photo.goodreads.com/books/1390230993l/272607._SY160_.jpg,https://i.gr-assets.com/images/S/compressed.photo.goodreads.com/books/1390230993l/272607._SY75_.jpg,https://i.gr-assets.com/images/S/compressed.photo.goodreads.com/books/1390230993l/272607.jpg,1996,12,11,Dell,eng,false,"The home was top-notch New Jersey suburban. The living room was Martha Stewart. The basement was Legos—and blood. For sports agent Myron Bolitar, the disappearance of a man he'd once competed against was bringing back memories—of the sport he and Greg Downing had both played and the woman they both loved. Now, among the stars, the wanna-bes, the gamblers and groupies, Myron is unraveling the strange, violent life of a sports hero gone wrong, and coming face-to-face with a past he can't relive, and a present he may not survive.<br />In novels that crackle with wit and suspense, Edgar Award winner Harlan Coben has created one of the most fascinating and complex heroes in suspense fiction—Myron Bolitar—a hotheaded, tenderhearted sports agent who grows more and more engaging and unpredictable with each page-turning appearance.",4.01,368,Mass Market Paperback, ,840,https://www.goodreads.com/book/show/272607.Fade_Away,https://www.goodreads.com/book/show/272607.Fade_Away
272610,Not Fade Away,1841954861,9781841954868, , ,ID,https://i.gr-assets.com/images/S/compressed.photo.goodreads.com/books/1348260310l/272610._SX98_.jpg,https://i.gr-assets.com/images/S/compressed.photo.goodreads.com/books/1348260310l/272610._SY75_.jpg,https://i.gr-assets.com/images/S/compressed.photo.goodreads.com/books/1348260310l/272610.jpg,2004,4,1,Canongate Books,en-GB,false,"""Not Fade Away is a rock 'n' roll road novel with rhythm to burn, traveling in time from the Beat era to the dawn of the sixties. George Gastin is a San Francisco tow-truck operator who wrecks cars as part of an insurance scam. One of the cars Gastin is hired to destroy is a snow-white 1959 Cadillac that was supposed to be a present for the Big Bopper, who dies in a plane crash with Buddy Holly and Ritchie Valens. Instead, Gastin takes off in the car and heads for Texas, where the Big Bopper was buried. Armed with a thousand hits of Benzedrine, Gastin navigates a road trip that will cover many miles and states of mind between the coffeehouses of San Francisco's North Beach and the open plains of the Midwest. Along the way Gastin picks up some extraordinary hitchhikers -- the self-proclaimed ""world's greatest salesman, "" the Reverend Double-Gone Johnson, and a battered housewife with a box of old 45s. As the miles and sleepless hours roll by, Gastin's trip becomes a blur of fantasy and reality fueled by a soundtrack of classic rock 'n' roll.",3.99, ,Paperback, ,3,https://www.goodreads.com/book/show/272610.Not_Fade_Away,https://www.goodreads.com/book/show/272610.Not_Fade_Away
272752,Seedfolks,0064472078,9780064472074, , ,ID,https://i.gr-assets.com/images/S/compressed.photo.goodreads.com/books/1347667817l/272752._SX98_.jpg,https://i.gr-assets.com/images/S/compressed.photo.goodreads.com/books/1347667817l/272752._SY75_.jpg,https://i.gr-assets.com/images/S/compressed.photo.goodreads.com/books/1347667817l/272752.jpg,2004,12,14,HarperTeen,eng,false,"A Vietnamese girl plants six lima beans in a Cleveland vacant lot. Looking down on the immigrant-filled neighborhood, a Romanian woman watches suspiciously. A school janitor gets involved, then a Guatemalan family. Then muscle-bound Curtis, trying to win back Lateesha. Pregnant Maricela. Amir from India. A sense of community sprouts and spreads. <br /><br />Newbery-winning author Paul Fleischman uses thirteen speakers to bring to life a community garden's founding and first year. The book's short length, diverse cast, and suitability for adults as well as children have led it to be used in countless one-book reads in schools and in cities across the country.<br /><br /><em>Seedfolks</em> has been drawn upon to teach tolerance, read in ESL classes, promoted by urban gardeners, and performed in schools and on stages from South Africa to Broadway.",3.74,102,Paperback, ,1956,https://www.goodreads.com/book/show/272752.Seedfolks,https://www.goodreads.com/book/show/272752.Seedfolks
272825,"Stone of Tears (Sword of Truth, #2)",0812548094,9780812548099, , ,ID,https://i.gr-assets.com/images/S/compressed.photo.goodreads.com/books/1478929206l/272825._SY160_.jpg,https://i.gr-assets.com/images/S/compressed.photo.goodreads.com/books/1478929206l/272825._SY75_.jpg,https://i.gr-assets.com/images/S/compressed.photo.goodreads.com/books/1478929206l/272825._SY475_.jpg,1996,8,,Tor ,en-US,false,"In <i>Wizard's First Rule,</i> Richard Cypher's world was turned upside down. Once a simple woods guide, Richard was forced to become the Seeker of Truth, to save the world from the vile dominance of Darken Rahl, the most viciously savage and powerful wizard the world had ever seen. He was joined on this epic quest by his beloved Kahlan, the only survivor among the Confessors, who brought a powerful but benevolent justice to the land before Rahl's evil scourge. Aided by Zedd, the last of the wizards who opposed Rahl, they were able to cast him into the underworld, saving the world from the living hell of life under Rahl.<br /><br />But the veil to the underworld has been torn, and Rahl, from beyond the veil, begins to summon a sinister power more dreadful than any he has wielded before. Horrifying creatures escape through the torn veil, wreaking havoc on the unsuspecting world above.<br /><br />If Rahl isn't stopped, he will free the Keeper itself, an evil entity whose power is so vast and foul that once freed, it can never again be contained.<br /><br />Richard and Kahlan must face Rahl and the Keeper's terrible minions. But first, Richard must endure the ministrations of the Sisters of the Light, or die from the pain of magic that is his birthright and his curse. While Richard undertakes the arduous journey to the forbidden city of the Sisters, Kahlan must embark upon a long and dangerous mission to Aydindril, citadel of the old wizards, where she hopes to find Zedd and the help only he can lend to their desperate cause.<br /><br />War, suffering, torture, and deceit lie in their paths, and nothing will save them from a destiny of violent death, unless their courage and faith are joined with luck and they find the elusive...<i>Stone of Tears</i>.",4.09,979,Mass Market Paperback, ,153,https://www.goodreads.com/book/show/272825.Stone_of_Tears,https://www.goodreads.com/book/show/272825.Stone_of_Tears
272895,"The Black Stallion (The Black Stallion, #1)",0965476022,9780965476027, , ,ID,https://i.gr-assets.com/images/S/compressed.photo.goodreads.com/books/1173319066l/272895._SX98_.jpg,https://i.gr-assets.com/images/S/compressed.photo.goodreads.com/books/1173319066l/272895._SX50_.jpg,https://i.gr-assets.com/images/S/compressed.photo.goodreads.com/books/1173319066l/272895.jpg,1941,,,Random House,eng,false,"Published originally in 1941, this book is about a young boy, Alec Ramsay who finds a wild black stallion at a small Arabian port on the Red Sea. Between the black stallion and young boy, a strange understanding grew that you lead them through untold dangers as they journeyed to America. Nor could Alec understand that his adventures with the black stallion would capture the interest of an entire nation.",4.18,275,Hardcover, ,1049,https://www.goodreads.com/book/show/272895.The_Black_Stallion,https://www.goodreads.com/book/show/272895.The_Black_Stallion
272934,How to Buy and Sell a Business: How You Can Win in the Business Quadrant,0446691348,9780446691345, , ,ID,https://i.gr-assets.com/images/S/compressed.photo.goodreads.com/books/1438710182l/272934._SX98_.jpg,https://i.gr-assets.com/images/S/compressed.photo.goodreads.com/books/1438710182l/272934._SY75_.jpg,https://i.gr-assets.com/images/S/compressed.photo.goodreads.com/books/1438710182l/272934._SY475_.jpg,2003,4,1,Warner Books (NY),en-US,false,Owning your own business may sound like paradise but being the owner also means taking the responsibility for the business's health. Garrett Sutton gives potential business owners the practical information they need to fulfil their dream of owning their own business.,3.86,208,Paperback, ,6,https://www.goodreads.com/book/show/272934.How_to_Buy_and_Sell_a_Business,https://www.goodreads.com/book/show/272934.How_to_Buy_and_Sell_a_Business
272978,Foghorn Outdoors 101 Great Hikes of the San Francisco Bay Area,1566915783,9781566915786, , ,ID,https://i.gr-assets.com/images/S/compressed.photo.goodreads.com/books/1391878541l/272978._SX98_.jpg,https://i.gr-assets.com/images/S/compressed.photo.goodreads.com/books/1391878541l/272978._SY75_.jpg,https://i.gr-assets.com/images/S/compressed.photo.goodreads.com/books/1391878541l/272978.jpg,2003,3,26,Rick Steves,en-US,false,"Think getting away from the more than six million neighbors one has while living in the San Francisco Bay Area is difficult? This region possesses more parkland and a greater number of diversity of trails than any other comparably sized metropolitan region in the country. All of these outdoor havens are remarkably accessible and author Ann Marie Brown offers the best ones in Foghorn Outdoors 101 Great Hikes of the San Francisco Bay Area. This book provides detailed information on the trails found in the regions' numerous state and national parks -- from mountaintop rambles on Mount Diablo and Mount Tamalpais to seashore strolls at Point Reyes and Ano Nuevo. All trails are rated according to difficulty and the time required for hiking, and offer tips on weather, ways to avoid the crowds, best family hikes, and much more. Special attention is also given to wildlife habitats and areas of botanical interest. Insightful, informative, and enlightening, Foghorn Outdoors 101 Great Hikes of the San Francisco Bay Area is a must-have for casual or experienced hikers alike.",4.43,350,Paperback, ,3,https://www.goodreads.com/book/show/272978.Foghorn_Outdoors_101_Great_Hikes_of_the_San_Francisco_Bay_Area,https://www.goodreads.com/book/show/272978.Foghorn_Outdoors_101_Great_Hikes_of_the_San_Francisco_Bay_Area
273200,Who's Afraid of Virginia Woolf?,0451158717,9780451158710, , ,ID,https://i.gr-assets.com/images/S/compressed.photo.goodreads.com/books/1406487337l/273200._SX98_.jpg,https://i.gr-assets.com/images/S/compressed.photo.goodreads.com/books/1406487337l/273200._SY75_.jpg,https://i.gr-assets.com/images/S/compressed.photo.goodreads.com/books/1406487337l/273200.jpg,1983,3,1,Signet,en-US,false,"“Twelve times a week,” answered Uta Hagen, when asked how often she’d like to play Martha in <b>Who’s Afraid of Virginia Woolf?</b> Like her, audiences and critics alike could not get enough of Edward Albee’s masterful play. A dark comedy, it portrays husband and wife George and Martha in a searing night of dangerous fun and games. By the evening’s end, a stunning, almost unbearable revelation provides a climax that has shocked audiences for years. With the play’s razor-sharp dialogue and the stripping away of social pretense, <b>Newsweek</b> rightly foresaw <b>Who’s Afraid of Virginia Woolf?</b> as “a brilliantly original work of art—an excoriating theatrical experience, surging with shocks of recognition and dramatic fire [that] will be igniting Broadway for some time to come.”",4.08,257,Paperback, ,83,https://www.goodreads.com/book/show/273200.Who_s_Afraid_of_Virginia_Woolf_,https://www.goodreads.com/book/show/273200.Who_s_Afraid_of_Virginia_Woolf_
273458,"Check, Please!: Dating, Mating, and Extricating",0060763914,9780060763916, , ,ID,https://i.gr-assets.com/images/S/compressed.photo.goodreads.com/books/1389208873l/273458._SX98_.jpg,https://i.gr-assets.com/images/S/compressed.photo.goodreads.com/books/1389208873l/273458._SY75_.jpg,https://i.gr-assets.com/images/S/compressed.photo.goodreads.com/books/1389208873l/273458.jpg,2006,5,30,HarperEntertainment,en-US,false,"Supermodel Janice Dickinson’s over-the-top quest for Mr. Right is a hilarious rollercoaster of famous names, outrageous stories, and vicarious thrills.<br /><br /><br /><br />The inimitable, outrageous Janice Dickinson—America’s first supermodel and the bestselling author of No Lifeguard on Duty and Everything About Me Is Fake... And I’m Perfect—now serves up her most scintillating kiss and tell-all yet in Check, Please! Loaded with uncensored dish on her dating sagas and her stranger-than-fiction bedroom adventures, Check, Please! shows Dickinson as a real life Samantha Jones, and three decades at the top of the fast-track, glamorous world of modeling have given her a wealth of juicy stories.<br /><br />Dickinson dissects nearly 100 dates over a 25-year span—each one more jaw-droppingly outrageous than anything Jackie Collins could dream up. (There’s the Big Pharma billionaire, for example, who blurts out his fantasy of having Swarovski crystals shoved in every orifice before they’ve finished the first course of their first date—a declaration that forces Dickinson to quickly abandon the fantasy of “free botox forever” that he’d inspired in her.) Dickinson’s dates also reflect the changing times and the evolution of what she’s looking for in a man. From the unfettered hedonism of the 80s, a decade spent in white-hot one night stands and steamy affairs, to her heightened desire to find Mr. Right during the 90s, to her current state of play, Check, Please! is a fun, over-the-top vicarious thrill ride—with a core that’s highly relatable.",3.44,288,Hardcover, ,19,https://www.goodreads.com/book/show/273458.Check_Please_,https://www.goodreads.com/book/show/273458.Check_Please_
273459,Everything About Me Is Fake... and I'm Perfect,0060554703,9780060554705, , ,ID,https://i.gr-assets.com/images/S/compressed.photo.goodreads.com/books/1348235503l/273459._SX98_.jpg,https://i.gr-assets.com/images/S/compressed.photo.goodreads.com/books/1348235503l/273459._SY75_.jpg,https://i.gr-assets.com/images/S/compressed.photo.goodreads.com/books/1348235503l/273459.jpg,2006,9,5,It Books,en-US,false,"The supermodel and author of the Los Angeles Times bestseller No Lifeguard on Duty tackles the perils of looking perfect and offers commonsense advice about how to feel good about yourself no matter what<br /><br /><br /><br />Everything About Me Is Fake is a fast, funny, name-dropping, sexy read about how even the world’s first supermodel doesn’t feel close to perfect and never did—despite appearances to the contrary. This book explores how women spend their lives striving for the unattainable, trying to look like they walked off the pages of a magazine with Jennifer Aniston stick-straight hair bouncing in the breeze and Cover Girl smiles hiding the pain. She discusses why we need to feel perfect, and how our pasts, our unattainable ideas of beauty (thanks to Hollywood), and male expectations all collude to make women feel like they should be perfect.<br /><br />Filled with anecdotes from her personal life that will shock and entertain, as well as concrete beauty tips that she learned while modeling, that will help anyone feel better in a matter of minutes, here is a book that no woman should miss.",3.43,272,Paperback, ,24,https://www.goodreads.com/book/show/273459.Everything_About_Me_Is_Fake_and_I_m_Perfect,https://www.goodreads.com/book/show/273459.Everything_About_Me_Is_Fake_and_I_m_Perfect
273499,The Sweet Hereafter,0060923245,9780060923242, , ,ID,https://i.gr-assets.com/images/S/compressed.photo.goodreads.com/books/1407710624l/273499._SX98_.jpg,https://i.gr-assets.com/images/S/compressed.photo.goodreads.com/books/1407710624l/273499._SY75_.jpg,https://i.gr-assets.com/images/S/compressed.photo.goodreads.com/books/1407710624l/273499.jpg,1997,11,25,Harper Perennial,eng,false,"When fourteen children from the small town of Sam Dent are lost in a tragic accident, its citizens are confronted with one of life’s most difficult and disturbing questions: When the worst happens, whom do you blame, and how do you cope? Masterfully written, it is a large-hearted novel that brings to life a cast of unforgettable small-town characters and illuminates the mysteries and realities of love as well as grief.",3.85,257,Paperback, ,118,https://www.goodreads.com/book/show/273499.The_Sweet_Hereafter,https://www.goodreads.com/book/show/273499.The_Sweet_Hereafter
273669,"The Escoffier Cookbook: And Guide to the Fine Art of Cookery for Connoisseurs, Chefs, Epicures",0517506629,9780517506622, , ,ID,https://i.gr-assets.com/images/S/compressed.photo.goodreads.com/books/1403179349l/273669._SX98_.jpg,https://i.gr-assets.com/images/S/compressed.photo.goodreads.com/books/1403179349l/273669._SX50_.jpg,https://i.gr-assets.com/images/S/compressed.photo.goodreads.com/books/1403179349l/273669.jpg,1941,11,13,Clarkson Potter Publishers,en-US,false,"An American translation of the definitive ""Guide Culinaire,"" the classic guide to French ""haute cuisine,"" the ""Escoffier Cookbook"" includes weights, measurements, quantities, and terms according to American usage. Features 2,973 recipes.",4.36,944,Hardcover, ,21,https://www.goodreads.com/book/show/273669.The_Escoffier_Cookbook,https://www.goodreads.com/book/show/273669.The_Escoffier_Cookbook
273808,"Shoot from the Lip (A Yellow Rose Mystery, #4)",045122017X,9780451220172, , ,ID,https://i.gr-assets.com/images/S/compressed.photo.goodreads.com/books/1395782077l/273808._SX98_.jpg,https://i.gr-assets.com/images/S/compressed.photo.goodreads.com/books/1395782077l/273808._SY75_.jpg,https://i.gr-assets.com/images/S/compressed.photo.goodreads.com/books/1395782077l/273808.jpg,2007,1,2,Signet,eng,false,"The thought of working with a hot-shot producer and her TV crew is about as appealing to Abby as sticking her hand in a bucket of leeches. But ""Reality Check"" is a program that claims to turn American dreams into the real thing, and Abby figures that if anyone deserves that kind of bonanza, it's Emma Lopez, who has been raising her three younger siblings since her mother disappeared. Abby is determined to help Emma realize her dream of a reunion-even when it becomes clear that someone out there doesn't believe in happy endings.",4.03,276,Paperback, ,46,https://www.goodreads.com/book/show/273808.Shoot_from_the_Lip,https://www.goodreads.com/book/show/273808.Shoot_from_the_Lip
273921,The Arabian Nights,0679413383,9780679413387, , ,ID,https://i.gr-assets.com/images/S/compressed.photo.goodreads.com/books/1388182111l/273921._SX98_.jpg,https://i.gr-assets.com/images/S/compressed.photo.goodreads.com/books/1388182111l/273921._SY75_.jpg,https://i.gr-assets.com/images/S/compressed.photo.goodreads.com/books/1388182111l/273921.jpg,1992,6,30,Everyman's Library,eng,false,"<br />These stories (and stories within stories, and stories within stories within stories), told by the Princess Shahrazad under the threat of death if she ceases to amuse, first reached the West around 1700. They fired in the European imagination an appetite for the mysterious and exotic which has never left it. Collected over centuries from India, Persia, and Arabia, and ranging from vivacious erotica, animal fables, and adventure fantasies to pointed Sufi tales, the stories of <i>The Arabian Nights</i> provided the daily entertainment of the medieval Islamic world at the height of its glory.<br /><br />The present new translation by Husain Haddawy is of the Mahdi edition, the definitive Arabic edition of a fourteenth-century Syrian manuscript in the Bibliothèque Nationale in Paris, which is the oldest surviving version of the tales and is considered to be the most authentic. This early version is without the embellishments and additions that appear in later Indian and Egyptian manuscripts, on which all previous English translations were based.",3.96,428,Hardcover, ,36,https://www.goodreads.com/book/show/273921.The_Arabian_Nights,https://www.goodreads.com/book/show/273921.The_Arabian_Nights
