id,title,isbn,isbn13,asin,kindle_asin,country_code,image_url,small_image_url,large_image_url,publication_year,publication_month,publication_day,publisher,language_code,is_ebook,description,average_rating,num_pages,format,edition_information,text_reviews_count,url,link
14740588,"Notorious Nineteen (Stephanie Plum, #19)", , , , ,ID,https://i.gr-assets.com/images/S/compressed.photo.goodreads.com/books/1345653049l/14740588._SX98_.jpg,https://i.gr-assets.com/images/S/compressed.photo.goodreads.com/books/1345653049l/14740588._SY75_.jpg,https://i.gr-assets.com/images/S/compressed.photo.goodreads.com/books/1345653049l/14740588.jpg,2012,11,20,Headline Book Publishing,eng,false,"New Jersey bounty hunter Stephanie Plum is certain of three truths: People don’t just vanish into thin air. Never anger old people. And don’t do what Tiki tells you to do. <br /> <br />After a slow summer of chasing low-level skips for her cousin Vinnie’s bail bonds agency, Stephanie Plum finally lands an assignment that could put her checkbook back in the black. Geoffrey Cubbin, facing trial for embezzling millions from Trenton’s premier assisted-living facility, has mysteriously vanished from the hospital after an emergency appendectomy. Now it’s on Stephanie to track down the con man. Unfortunately, Cubbin has disappeared without a trace, a witness, or his money-hungry wife. Rumors are stirring that he must have had help with the daring escape . . . or that maybe he never made it out of his room alive. Since the hospital staff’s lips seem to be tighter than the security, and it’s hard for Stephanie to blend in to assisted living, Stephanie’s Grandma Mazur goes in undercover. But when a second felon goes missing from the same hospital, Stephanie is forced into working side by side with Trenton’s hottest cop, Joe Morelli, in order to crack the case.<br /> <br />The real problem is, no Cubbin also means no way to pay the rent. Desperate for money—or maybe just desperate—Stephanie accepts a secondary job guarding her secretive and mouthwatering mentor Ranger from a deadly Special Forces adversary. While Stephanie is notorious for finding trouble, she may have found a little more than she bargained for this time around. Then again—a little food poisoning, some threatening notes, and a bridesmaid’s dress with an excess of taffeta never killed anyone . . . or did they? If Stephanie Plum wants to bring in a paycheck, she’ll have to remember: No guts, no glory. . . .",3.94,302,Hardcover, ,4680,https://www.goodreads.com/book/show/14740588-notorious-nineteen,https://www.goodreads.com/book/show/14740588-notorious-nineteen
14742222,Death in the Afternoon,0099285029,9780099285021, , ,ID,https://i.gr-assets.com/images/S/compressed.photo.goodreads.com/books/1338447828l/14742222._SX98_.jpg,https://i.gr-assets.com/images/S/compressed.photo.goodreads.com/books/1338447828l/14742222._SY75_.jpg,https://i.gr-assets.com/images/S/compressed.photo.goodreads.com/books/1338447828l/14742222.jpg,2007,9,6,Vintage Classics,eng,false,"Still considered one of the best books ever written about bullfighting, <i>Death in the Afternoon</i> is an impassioned look at the sport by one of its true aficionados. It reflects Hemingway's conviction that bullfighting was more than mere sport and reveals a rich source of inspiration for his art. The unrivaled drama of bullfighting, with its rigorous combination of athleticism and artistry, and its requisite display of grace under pressure, ignited Hemingway's imagination. Here he describes and explains the technical aspects of this dangerous ritual and ""the emotional and spiritual intensity and pure classic beauty that can be produced by a man, an animal, and a piece of scarlet serge draped on a stick."" Seen through his eyes, bullfighting becomes a richly choreographed ballet, with performers who range from awkward amateurs to masters of great elegance and cunning.<br /><br />A fascinating look at the history and grandeur of bullfighting, <i>Death in the Afternoon</i> is also a deeper contemplation of the nature of cowardice and bravery, sport and tragedy, and is enlivened throughout by Hemingway's sharp commentary on life and literature.",3.70,352,Paperback, ,14,https://www.goodreads.com/book/show/14742222-death-in-the-afternoon,https://www.goodreads.com/book/show/14742222-death-in-the-afternoon
14743788,"Syvissä vesissä (Sandhamn, #1)", ,9789525918687, , ,ID,https://i.gr-assets.com/images/S/compressed.photo.goodreads.com/books/1338528445l/14743788._SX98_.jpg,https://i.gr-assets.com/images/S/compressed.photo.goodreads.com/books/1338528445l/14743788._SY75_.jpg,https://i.gr-assets.com/images/S/compressed.photo.goodreads.com/books/1338528445l/14743788.jpg,2012,,,Crime Time,fin,false,"Keväällä jäiden lähdettyä kalaverkkoon sotkeutuneen miehen ruumis ajautuu rantaan Sandhamnissa Tukholman saaristossa. Tapaus vaikuttaa asiaa selvittävän Nackan poliisin Thomas Andreassonin mielestä aluksi ikävältä kalastusonnettomuudelta, sillä itsemurhaankaan ei mikään tunnu viittaavan.<br /><br />Tutkinta saa uuden käänteen, kun saarelle saapunut hukkuneen sukkulainen löytyy raa'asti surmattuna majapaikastaan.<br /><br />Mikä liittää kuolemat toisiinsa? Mistä löytyy puuttuva linkki kahden ruumiin välillä? Kuka surmasi serkukset ja miksi? Löytyykö syyllinen kesäparatiisista?<br /><br />Vastasyntyneen tyttärensä menettänyt ja avioeroon ajautunut saaristolaispoliisi Thomas paneutuu täydellä tarmolla outoon mysteeriin. Hän saa apua lapsuudenystävältään, Sandhamnissa lomiaan viettävältä tukholmalaisjuristi Nora Lindeltä.<br /><br />Murhaaja on vapaalla, ja median paine kasvaa. Saaristolaisten ja kesäasukkaiden suhteet kiristyvät, kun läpimurtoa ei saada. Murhaaja on löydettävä ennen kuin lisää ihmishenkiä menetetään.",3.69,446,Hardcover, ,8,https://www.goodreads.com/book/show/14743788-syviss-vesiss,https://www.goodreads.com/book/show/14743788-syviss-vesiss
14758455,Telegraph Avenue,006149335X,9780061493355, , ,ID,https://i.gr-assets.com/images/S/compressed.photo.goodreads.com/books/1377712728l/14758455._SX98_.jpg,https://i.gr-assets.com/images/S/compressed.photo.goodreads.com/books/1377712728l/14758455._SX50_.jpg,https://i.gr-assets.com/images/S/compressed.photo.goodreads.com/books/1377712728l/14758455.jpg,2013,9,10,Harper Perennial,eng,false,"As the summer of 2004 draws to a close, Archy Stallings and Nat Jaffe are still hanging in there - longtime friends, bandmates, and co-regents of Brokeland Records, a kingdom of used vinyl located in the borderlands of Berkeley and Oakland. Their wives, Gwen Shanks and Aviva Roth-Jaffe, are the Berkeley Birth Partners, two semi-legendary midwives who have welcomed more than a thousand newly minted citizens into the dented utopia at whose heart - half tavern, half temple - stands Brokeland. <br /><br />When ex–NFL quarterback Gibson Goode, the fifth-richest black man in America, announces plans to build his latest Dogpile megastore on a nearby stretch of Telegraph Avenue, Nat and Archy fear it means certain doom for their vulnerable little enterprise. Meanwhile, Aviva and Gwen also find themselves caught up in a battle for their professional existence, one that tests the limits of their friendship. Adding another layer of complication to the couples' already tangled lives is the surprise appearance of Titus Joyner, the teenage son Archy has never acknowledged and the love of fifteen-year-old Julius Jaffe's life. <br /><br />An intimate epic, a NorCal Middlemarch set to the funky beat of classic vinyl soul-jazz and pulsing with a virtuosic, pyrotechnical style all its own, Telegraph Avenue is the great American novel we've been waiting for. Generous, imaginative, funny, moving, thrilling, humane, triumphant, it is Michael Chabon's most dazzling book yet.",3.38,468,Paperback, ,103,https://www.goodreads.com/book/show/14758455-telegraph-avenue,https://www.goodreads.com/book/show/14758455-telegraph-avenue
14759334,"Lullaby (Watersong, #2)",1250005655,9781250005656, , ,ID,https://i.gr-assets.com/images/S/compressed.photo.goodreads.com/books/1344318994l/14759334._SX98_.jpg,https://i.gr-assets.com/images/S/compressed.photo.goodreads.com/books/1344318994l/14759334._SY75_.jpg,https://i.gr-assets.com/images/S/compressed.photo.goodreads.com/books/1344318994l/14759334.jpg,2012,11,27,St. Martin's Griffin,en-US,false,"<i>Don't miss the next chapter of Watersong, a bold new series that will enchant you, entrance you, and hold you captive under its spell</i><p><br />Now that Gemma Fisher has inherited Penn, Lexi, and Thea's curse - and all the strange new powers that come along with it - she has no choice but to run away with them. Devastated that she has to leave everyone she loves behind, she's still determined not to give in to the unspeakable hungers that plague her.<br />Unfortunately, they're growing stronger every day, and she's not sure how much longer she can resist.<br /></p><p>Harper won't give up on finding her sister Gemma, vowing to get her back no matter what the cost. The search draws her closer to too-gorgeous-for-his-own-good Daniel, and tests her fiercely guarded independence like never before. She's always been the strong one who everyone else depends on.... Can she let herself depend on Daniel?</p><p><br />As Gemma and Harper plunge deeper into a magical world they barely understand, it becomes painfully clear that Gemma's old life may be lost forever. But can she still hold on to her humanity?</p>",3.85,290,Hardcover, ,788,https://www.goodreads.com/book/show/14759334-lullaby,https://www.goodreads.com/book/show/14759334-lullaby
14759500,Bloodbath (A Tim Holt Adventure #1),B0078P9IEE, , , ,ID,https://i.gr-assets.com/images/S/compressed.photo.goodreads.com/books/1338651692l/14759500._SX98_.jpg,https://i.gr-assets.com/images/S/compressed.photo.goodreads.com/books/1338651692l/14759500._SX50_.jpg,https://i.gr-assets.com/images/S/compressed.photo.goodreads.com/books/1338651692l/14759500.jpg,2012,2,,,eng,true,"A neo-noir pulp thriller -- short, violent, dirty and cheap. Tim Holt is a battle-scarred vet, now a soldier of fortune working the darker byways of Latin America in 1954. When a job in Guatemala goes way wrong he's thrown together with a beautiful young woman who, like him, is bent on revenge -- but the cost of it is going to be higher than either of them could possibly imagine.<br /><br />""A seriously done and well done pulp novel -- it's a good read."" -- Charles Ardai, founder and editor of Hard Case Crime<br /><br />Included is a preview of the second Tim Holt adventure, Blowing Cool, due out this fall.<br /><br />Lloyd Fonvielle is a screenwriter (The Mummy, 1999) and director (Gotham, 1988) and author of the Western short story Tracker, also available in the Kindle Store. He lives in Las Vegas, Nevada and plays some poker there from time to time. He publishes an online journal of visual culture at mardecortesbaja.com.",4.83,145,Kindle Edition, ,0,https://www.goodreads.com/book/show/14759500-bloodbath,https://www.goodreads.com/book/show/14759500-bloodbath
14761514,Cryptonomicon, , ,B0080K3J7S, ,ID,https://i.gr-assets.com/images/S/compressed.photo.goodreads.com/books/1349690067l/14761514._SX98_.jpg,https://i.gr-assets.com/images/S/compressed.photo.goodreads.com/books/1349690067l/14761514._SY75_.jpg,https://i.gr-assets.com/images/S/compressed.photo.goodreads.com/books/1349690067l/14761514.jpg,2012,5,31,Cornerstone Digital,en-GB,true,"With this extraordinary first volume in what promises to be an epoch-making masterpiece, Neal Stephenson hacks into the secret histories of nations and the private obsessions of men, decrypting with dazzling virtuosity the forces that shaped this century.<br /><br />In 1942, Lawrence Pritchard Waterhouse - mathematical genius and young Captain in the U.S. Navy - is assigned to detachment 2702. It is an outfit so secret that only a handful of people know it exists, and some of those people have names like Churchill and Roosevelt. The mission of Waterhouse and Detatchment 2702 - commanded by Marine Raider Bobby Shaftoe - is to keep the Nazis ignorant of the fact that Allied Intelligence has cracked the enemy's fabled Enigma code. It is a game, a cryptographic chess match between Waterhouse and his German counterpart, translated into action by the gung-ho Shaftoe and his forces.<br /><br />Fast-forward to the present, where Waterhouse's crypto-hacker grandson, Randy, is attempting to create a ""data haven"" in Southeast Asia - a place where encrypted data can be stored and exchanged free of repression and scrutiny. As governments and multinationals attack the endeavor, Randy joins forces with Shaftoe's tough-as-nails grandaughter, Amy, to secretly salvage a sunken Nazi submarine that holds the key to keeping the dream of a data haven afloat. But soon their scheme brings to light a massive conspiracy with its roots in Detachment 2702 linked to an unbreakable Nazi code called Arethusa. And it will represent the path to unimaginable riches and a future of personal and digital liberty...or to universal totalitarianism reborn.<br /><br />A breathtaking tour de force, and Neal Stephenson's most accomplished and affecting work to date, <i>Cryptonomicon</i> is profound and prophetic, hypnotic and hyper-driven, as it leaps forward and back between World War II and the World Wide Web, hinting all the while at a dark day-after-tomorrow. It is a work of great art, thought, and creative daring; the product of a truly iconoclastic imagination working with white-hot intensity.<br /><br />",4.24,931,Kindle Edition, ,23,https://www.goodreads.com/book/show/14761514-cryptonomicon,https://www.goodreads.com/book/show/14761514-cryptonomicon
14762071,"Informe sobre la Tierra: Fundamentalmente inofensiva (Guía del autoestopista galáctico, #5)",8433976869,9788433976864, , ,ID,https://i.gr-assets.com/images/S/compressed.photo.goodreads.com/books/1355428897l/14762071._SX98_.jpg,https://i.gr-assets.com/images/S/compressed.photo.goodreads.com/books/1355428897l/14762071._SY75_.jpg,https://i.gr-assets.com/images/S/compressed.photo.goodreads.com/books/1355428897l/14762071.jpg,2012,,,Anagrama,spa,false,"¿Fue Elvis Presley secuestrado por los alienígenas? ¿Qué hace el terrícola Arthur Dent convertido en Hacedor de Bocadillos en un remoto y primitivo planeta cuyos habitantes adoran a Bob Todopoderoso? ¿Cómo ha podido la ahora intrépida reportera transgaláctica Trillian tener una hija con el terrícola antes mentado sin el previo concurso de un ayuntamiento carnal? ¿Cómo se consigue que un robot esté perpetuamente al borde del orgasmo? Todos estos inquietantes y trascendentales enigmas tienen su respuesta en esta novela, quinta parte de la Guía del autoestopista galáctico.",3.97,272,Paperback,Compactos #548,13,https://www.goodreads.com/book/show/14762071-informe-sobre-la-tierra,https://www.goodreads.com/book/show/14762071-informe-sobre-la-tierra
14780932,Wise Men,0316126489,9780316126489, , ,ID,https://i.gr-assets.com/images/S/compressed.photo.goodreads.com/books/1342436964l/14780932._SX98_.jpg,https://i.gr-assets.com/images/S/compressed.photo.goodreads.com/books/1342436964l/14780932._SY75_.jpg,https://i.gr-assets.com/images/S/compressed.photo.goodreads.com/books/1342436964l/14780932.jpg,2013,2,5,Reagan Arthur Books,eng,false,"Hilly Wise is the son of one of the most powerful and wealthy lawyers in the United States. When Hilly meets Savannah, a young black girl on the beach at Cape Cod during the summer of 1952, his affection for her collides with his father's secrets. The result shatters his family, and hers. <br /><br />Years later, Hilly sets out to find Savannah, and to right the wrongs he helped set in motion. But can his sense of guilt, and his good intentions, overcome the forces of history, family, and identity? A multi-generational story about love and regret, the evolving struggle for racial dignity, and the crushing weight of familial obligation, WISE MEN confirms that Stuart Nadler is one of the most exciting young writers at work today.",3.45,352,Hardcover, ,213,https://www.goodreads.com/book/show/14780932-wise-men,https://www.goodreads.com/book/show/14780932-wise-men
14781175,"The Baby Book, Revised Edition: Everything You Need to Know About Your Baby from Birth to Age Two",0316198269,9780316198264, , ,ID,https://i.gr-assets.com/images/S/compressed.photo.goodreads.com/books/1340758840l/14781175._SX98_.jpg,https://i.gr-assets.com/images/S/compressed.photo.goodreads.com/books/1340758840l/14781175._SX50_.jpg,https://i.gr-assets.com/images/S/compressed.photo.goodreads.com/books/1340758840l/14781175.jpg,2013,1,8,"Little, Brown Spark",en-US,false,"<b>America's bestselling ""baby bible"" -- an encyclopedic guide to the first two years of your baby's life. <br /><br /></b>The million-copy bestseller by ""the man who remade motherhood"" (<i>TIME</i>) has now been revised, expanded, and bought thoroughly up-to-date -- with the latest information on everything from diapering to day care, from midwifery to hospital birthing rooms, from postpartum nutrition to infant development. <br /><br />The Searses draw from their vast experience both as medical professionals and pas parents to provide comprehensive information on virtually every aspect of infant care. <i>The Baby Book </i>focuses on the essential needs of babies -- eating, sleeping, develipment, health, and comfort -- as it addresses the questions of greatest concern to today's parents. The topics covered include: <br /><br /><br />preparing for a safe and healthy birth<br />bonding with your baby<br />feeding your baby right<br />soothing your fussy baby<br />getting your baby to sleep<br />understanding your baby's development<br />treating common illnesses<br />babyproofing your home<br />understanding toddler behavior<br />dealing with temper tantrums<br />toilet training<br />working parenting<br />first-aid procedures<br />and much more<br /><br /><br />Unrivaled in its scope and authority, <i>The Baby Book </i>presents a practical, contemporary approach to parenting that reflects the way we live today. The Searses acknowledge that there is no one way to parent a baby, and they offer the basic guidance and inspiration you need to develop the parenting style that bests suits you and your child. Their book is a rich and invaluable resource that will help you get the most of of parenting -- for your child, yourself, and for your entire family. <br /><br /><br /><br />",4.17,784,Paperback, ,24,https://www.goodreads.com/book/show/14781175-the-baby-book-revised-edition,https://www.goodreads.com/book/show/14781175-the-baby-book-revised-edition
14781178,American Elsewhere,0316200204,9780316200202, , ,ID,https://i.gr-assets.com/images/S/compressed.photo.goodreads.com/books/1340758848l/14781178._SX98_.jpg,https://i.gr-assets.com/images/S/compressed.photo.goodreads.com/books/1340758848l/14781178._SX50_.jpg,https://i.gr-assets.com/images/S/compressed.photo.goodreads.com/books/1340758848l/14781178.jpg,2013,2,12,Orbit,eng,false,"Some places are too good to be true. <br /><br />Under a pink moon, there is a perfect little town not found on any map. In that town, there are quiet streets lined with pretty houses, houses that conceal the strangest things. After a couple years of hard traveling, ex-cop Mona Bright inherits her long-dead mother's home in Wink, New Mexico. And the closer Mona gets to her mother's past, the more she understands that the people of Wink are very, very different ...<br /><br />From one of our most talented and original new literary voices comes the next great American supernatural novel: a work that explores the dark dimensions of the hometowns and the neighbors we thought we knew.",3.78,662,Paperback, ,731,https://www.goodreads.com/book/show/14781178-american-elsewhere,https://www.goodreads.com/book/show/14781178-american-elsewhere
14781491,"The Time of Contempt (The Witcher, #2)",0316219134,9780316219136, , ,ID,https://i.gr-assets.com/images/S/compressed.photo.goodreads.com/books/1443278961l/14781491._SX98_.jpg,https://i.gr-assets.com/images/S/compressed.photo.goodreads.com/books/1443278961l/14781491._SX50_.jpg,https://i.gr-assets.com/images/S/compressed.photo.goodreads.com/books/1443278961l/14781491._SY475_.jpg,2013,8,27,Orbit,eng,false,"<b>The <i>New York Times</i> bestselling series that inspired the international hit video game: <i>The Witcher</i></b><b>
  <i>
    <br />
  </i>
</b>Geralt is a witcher: guardian of the innocent; protector of those in need; a defender, in dark times, against some of the most frightening creatures of myth and legend. His task, now, is to protect Ciri. A child of prophecy, she will have the power to change the world for good or for ill -- but only if she lives to use it.<br /><br />A coup threatens the Wizard's Guild.<br />War breaks out across the lands.<br />A serious injury leaves Geralt fighting for his life...<br />... and Ciri, in whose hands the world's fate rests, has vanished...<br /><br />The Witcher returns in this sequel to <em>Blood of Elves.</em><br /><em>
  <br />
</em><br /><b>The Witcher series </b><br /><i>The Last Wish</i><br /><i>The Sword of Destiny </i><br /><i>Blood of Elves</i><br /><i>The Time of Contempt</i><br /><i>Baptism of Fire</i><br /><br /><i>The Malady and Other Stories: An Andrzej Sapkowski Sampler</i> (e-only)",4.20,331,Paperback, ,1444,https://www.goodreads.com/book/show/14781491-the-time-of-contempt,https://www.goodreads.com/book/show/14781491-the-time-of-contempt
14781494,The Last Girlfriend on Earth: And Other Love Stories,0316219398,9780316219396, , ,ID,https://i.gr-assets.com/images/S/compressed.photo.goodreads.com/books/1349014283l/14781494._SX98_.jpg,https://i.gr-assets.com/images/S/compressed.photo.goodreads.com/books/1349014283l/14781494._SX50_.jpg,https://i.gr-assets.com/images/S/compressed.photo.goodreads.com/books/1349014283l/14781494.jpg,2013,1,22,Reagan Arthur Books,en-US,false,"In <i>Center of the Universe</i>, God struggles to balance the demands of his career with the needs of his long-term girlfriend. <br /><br /> In <i>Magical Mr. Goat</i>, a young girl's imaginary friend yearns to become ""more than friends."" <br /><br /> In <i>Unprotected</i>, an unused prophylactic recalls his years spent trapped inside a teen boy's wallet. The stories in Simon Rich's new book are bizarre, funny, and yet...relatable. Rich explores love's many complications-losing it, finding it, breaking it, and making it-and turns the ordinary into the absurd. With razor-sharp humor and illustrations, and just in time for Valentine's Day, Rich takes readers for an exhilarating, hilarious ride on the rollercoaster of love.",3.91,213,Hardcover, ,536,https://www.goodreads.com/book/show/14781494-the-last-girlfriend-on-earth,https://www.goodreads.com/book/show/14781494-the-last-girlfriend-on-earth
14820856,Building Our House,0374380236,9780374380236, , ,ID,https://i.gr-assets.com/images/S/compressed.photo.goodreads.com/books/1344318354l/14820856._SX98_.jpg,https://i.gr-assets.com/images/S/compressed.photo.goodreads.com/books/1344318354l/14820856._SX50_.jpg,https://i.gr-assets.com/images/S/compressed.photo.goodreads.com/books/1344318354l/14820856.jpg,2013,1,8,Farrar Straus Giroux,eng,false,"In this unique construction book for kids who love tools and trucks, readers join a girl and her family as they pack up their old house in town and set out to build a new one in the country. Mom and Dad are going to make the new house themselves, from the ground up. From empty lot to finished home, every stage of their year-and-a-half-long building project is here. And at every step their lucky kids are watching and getting their hands dirty, in page after page brimming with machines, vehicles, and all kinds of house-making activities!<br />As he imagines it through the eyes of his older sister, this is Jonathan Bean’s retelling of his own family’s true experience, and includes an afterword with photographs from the author’s collection.",4.18,48,Hardcover, ,288,https://www.goodreads.com/book/show/14820856-building-our-house,https://www.goodreads.com/book/show/14820856-building-our-house
14838452,Table for Seven,055338628X,9780553386288, , ,ID,https://i.gr-assets.com/images/S/compressed.photo.goodreads.com/books/1344371744l/14838452._SX98_.jpg,https://i.gr-assets.com/images/S/compressed.photo.goodreads.com/books/1344371744l/14838452._SY75_.jpg,https://i.gr-assets.com/images/S/compressed.photo.goodreads.com/books/1344371744l/14838452.jpg,2013,4,23,Bantam,eng,false,"On New Year’s Eve, Fran and Will Parrish host a dinner party, serving their friends a gourmet feast. The night is such a success that the group decides to form a monthly dinner party club. But what starts as an excuse to enjoy the company of fellow foodies ends up having lasting repercussions on each member of the Table for Seven Dinner Party Club.<br /><br />Fran and Will face the possibility that their comfortable marriage may not be as infallible as they once thought. Audrey has to figure out how to move on and start a new life after the untimely death of her young husband. Perfectionist Jaime suspects that her husband, Mark, might be having an affair. Coop, a flirtatious bachelor who never commits to a third date, is blindsided when he falls in love for the first time. Leland, a widower, is a wise counselor and firm believer that bacon makes everything taste better.<br /><br />Over the course of a year, against a backdrop of mouthwatering meals, relationships are forged, marriages are tested, and the members of the <i>Table for Seven</i> Dinner Party Club find their lives forever changed.",3.59,389,Paperback, ,156,https://www.goodreads.com/book/show/14838452-table-for-seven,https://www.goodreads.com/book/show/14838452-table-for-seven
