id,title,isbn,isbn13,asin,kindle_asin,country_code,image_url,small_image_url,large_image_url,publication_year,publication_month,publication_day,publisher,language_code,is_ebook,description,average_rating,num_pages,format,edition_information,text_reviews_count,url,link
37542891,مردی به نام اوه, ,9786007141779, , ,ID,https://i.gr-assets.com/images/S/compressed.photo.goodreads.com/books/1513354586l/37542891._SX98_.jpg,https://i.gr-assets.com/images/S/compressed.photo.goodreads.com/books/1513354586l/37542891._SX50_.jpg,https://i.gr-assets.com/images/S/compressed.photo.goodreads.com/books/1513354586l/37542891._SX318_.jpg,2016,9,15,نون,per,false,مردی به نام اوه، اولین رمان فردریک بکمن (نویسنده‌ی سوئدی)، شاهکارهای است که طیف وسیعی از خوانندگان را در سراسر دنیا غافل‌گیر کرده است و لذت مطالعه‌ی رمانی درجه یک و دوست‌داشتنی را برایشان به ارمغان آورده است. این کتاب تاکنون به بیش از سی زبان دنیا ترجمه شده و میلیون‌ها نسخه از آن به فروش رسیده است. محبوبیت مردی به نام اوه چنان است که مجله‌ی آلمانی اشپیگل درباره‌ی آن نوشته است: «کسی که از این رمان خوشش نیاید بهتر است هیچ کتابی نخواند!» بکمن در این رمان تراژیک ـ کمیک احساس‌هایی مثل عشق و نفرت را به زیبایی به تصویر می‌کشد و انسان‌ها و جامعه مدرن را در لفاف طنزی شیرین و جذاب نقد می‌کند؛,4.35,356,Paperback, ,437,https://www.goodreads.com/book/show/37542891,https://www.goodreads.com/book/show/37542891
37543035,Attention Span and other Stories, , , , ,ID,https://i.gr-assets.com/images/S/compressed.photo.goodreads.com/books/1513355811l/37543035._SX98_.jpg,https://i.gr-assets.com/images/S/compressed.photo.goodreads.com/books/1513355811l/37543035._SY75_.jpg,https://i.gr-assets.com/images/S/compressed.photo.goodreads.com/books/1513355811l/37543035._SY475_.jpg,2017,12,13,,eng,true,"Revenge, rejection, resilience and revival: they’re all represented in this collection of fourteen short stories from author Pauline Wiles.<br /><br />Ranging in length from just 99 words to long-enough-for-a-second-cup-of-tea, these stories feature locations from Switzerland to Seattle and the popular fictional English village of Saffron Sweeting in between. Some are light, several are quirky and one or two a little on the darker side. They explore the meaning of family, the search for true love, and the overwhelming importance of home.",4.00,78,ebook, ,0,https://www.goodreads.com/book/show/37543035-attention-span-and-other-stories,https://www.goodreads.com/book/show/37543035-attention-span-and-other-stories
37558445,Boy Swallows Universe,1460753895,9781460753897, , ,ID,https://i.gr-assets.com/images/S/compressed.photo.goodreads.com/books/1519792733l/37558445._SX98_.jpg,https://i.gr-assets.com/images/S/compressed.photo.goodreads.com/books/1519792733l/37558445._SY75_.jpg,https://i.gr-assets.com/images/S/compressed.photo.goodreads.com/books/1519792733l/37558445._SY475_.jpg,2018,6,18,HarperCollins Publishers Australia,eng,false,"A novel of love, crime, magic, fate and coming of age, set in Brisbane's violent working class suburban fringe - from one of Australia's most exciting new writers.<br /><br />Brisbane, 1983: A lost father, a mute brother, a mum in jail, a heroin dealer for a stepfather and a notorious crime for a babysitter. It's not as if Eli's life isn't complicated enough already. He's just trying to follow his heart, learning what it takes to be a good man, but life just keeps throwing obstacles in the way - not least of which is Tytus Broz, legendary Brisbane drug dealer.<br /><br />But if Eli's life is about to get a whole lot more serious. He's about to fall in love. And, oh yeah, he has to break into Boggo Road Gaol on Christmas Day, to save his mum.<br /><br />A story of brotherhood, true love and the most unlikely of friendships, Boy Swallows Universe will be the most heartbreaking, joyous and exhilarating novel you will read all year.",4.40,464,Paperback, ,3165,https://www.goodreads.com/book/show/37558445-boy-swallows-universe,https://www.goodreads.com/book/show/37558445-boy-swallows-universe
37561377,Matchmaking for Beginners, , ,B076CJX3YN, ,ID,https://i.gr-assets.com/images/S/compressed.photo.goodreads.com/books/1513607434l/37561377._SX98_.jpg,https://i.gr-assets.com/images/S/compressed.photo.goodreads.com/books/1513607434l/37561377._SY75_.jpg,https://i.gr-assets.com/images/S/compressed.photo.goodreads.com/books/1513607434l/37561377._SY475_.jpg,2018,6,1,Lake Union Publishing,eng,true,"Marnie MacGraw wants an ordinary life—a husband, kids, and a minivan in the suburbs. Now that she’s marrying the man of her dreams, she’s sure this is the life she’ll get. Then Marnie meets Blix Holliday, her fiancé’s irascible matchmaking great-aunt who’s dying, and everything changes—just as Blix told her it would.<p>When her marriage ends after two miserable weeks, Marnie is understandably shocked. She’s even more astonished to find that she’s inherited Blix’s Brooklyn brownstone along with all of Blix’s unfinished “projects”: the heartbroken, oddball friends and neighbors running from happiness. Marnie doesn’t believe she’s anything special, but Blix somehow knew she was the perfect person to follow in her matchmaker footsteps.</p><p>And Blix was also right about some things Marnie must learn the hard way: love is hard to recognize, and the ones who push love away often are the ones who need it most.</p>",3.97,378,Kindle Edition, ,2228,https://www.goodreads.com/book/show/37561377-matchmaking-for-beginners,https://www.goodreads.com/book/show/37561377-matchmaking-for-beginners
37562956,Dark Age (Red Rising Saga #5), , ,B078G2YS3N, ,ID,https://i.gr-assets.com/images/S/compressed.photo.goodreads.com/books/1525464466l/37562956._SX98_.jpg,https://i.gr-assets.com/images/S/compressed.photo.goodreads.com/books/1525464466l/37562956._SY75_.jpg,https://i.gr-assets.com/images/S/compressed.photo.goodreads.com/books/1525464466l/37562956._SY475_.jpg,2019,7,30,Del Rey,eng,true,"<b>The #1 New York Times bestselling author of Morning Star returns to the Red Rising universe with the thrilling sequel to Iron Gold.</b><br /><br /><b>
  <i>He broke the chains. Then he broke the world….</i>
</b><br /><br />A decade ago Darrow led a revolution, and laid the foundations for a new world. Now he’s an outlaw.<br /><br />Cast out of the very Republic he founded, with half his fleet destroyed, he wages a rogue war on Mercury, in hopes that he can still salvage the dream of Eo. But as he leaves death and destruction in his wake, is he still the hero who broke the chains? Or will he become the very evil he fought to destroy? Will another legend rise to take his place?<br /><br /><b>
  <i>In his darkening shadow, a new hero rises.</i>
</b> <br /><br />Lysander au Lune, the heir to the old empire in exile, has returned to bridge the divide between the Golds of the Rim and Core. Determined to bring peace back to mankind at the edge of his sword, he must overcome or unite the treacherous Gold families of the Core and face down Darrow over the skies of war-torn Mercury. If united, their combined might may prove fatal to the fledgling Republic.<br /><br /><b>
  <i>But theirs are not the only fates hanging in the balance.</i>
</b><br /><br />On Luna, Mustang, the embattled Sovereign of the Republic, Virginia au Augustus campaigns to unite the Republic behind her husband, fights to preserve her precious demokracy and her exiled husband. Beset by political and criminal enemies, can she outwit her opponents in time to save him? But one may cost her the other, and her son is not yet returned.<br /><br />Abducted by a new threat to the Republic, Pax and Electra, the children of Darrow and Sevro, must trust in Ephraim, a Gray thief, for their salvation—and Ephraim must look to them for his chance at redemption.<br /><br />Far across the void, young Lyria, Once a Red refugee, now stands accused of treason, and her only hope is a desperate bid for freedom with the help of two unlikely new allies.<br /><br />Fear dims the hopes of the Rising as alliances shift, break, and re-form—and power is seized, lost, and reclaimed—every player is at risk in a game of conquest and the worlds spin on and on toward a new Dark Age.<br /><br /><b>Don’t miss any of Pierce Brown’s Red Rising Saga:<br />RED RISING • GOLDEN SON • MORNING STAR • IRON GOLD • DARK AGE</b>",4.44,784,Kindle Edition, ,294,https://www.goodreads.com/book/show/37562956-dark-age,https://www.goodreads.com/book/show/37562956-dark-age
37569327,Good Riddance,0544808258,9780544808256, , ,ID,https://i.gr-assets.com/images/S/compressed.photo.goodreads.com/books/1524763503l/37569327._SX98_.jpg,https://i.gr-assets.com/images/S/compressed.photo.goodreads.com/books/1524763503l/37569327._SX50_.jpg,https://i.gr-assets.com/images/S/compressed.photo.goodreads.com/books/1524763503l/37569327.jpg,2019,2,5,Houghton Mifflin Harcourt,,false,"Daphne Maritch doesn't quite know what to make of the heavily annotated high school yearbook she inherits from her mother, who held this relic dear. Too dear. The late June Winter Maritch was the teacher to whom the class of '68 had dedicated its yearbook, and in turn she went on to attend every reunion, scribbling notes and observations after each one—not always charitably—and noting who overstepped boundaries of many kinds.<br /><br /> In a fit of decluttering (the yearbook did not, Daphne concluded, ""spark joy""), she discards it when she moves to a small New York City apartment. But when it's found in the recycling bin by a busybody neighbor/documentary filmmaker, the yearbook's mysteries—not to mention her own family's—take on a whole new urgency, and Daphne finds herself entangled in a series of events both poignant and absurd. ",3.12,290,Hardcover, ,873,https://www.goodreads.com/book/show/37569327-good-riddance,https://www.goodreads.com/book/show/37569327-good-riddance
37569342,Last Woman Standing,0544962532,9780544962538, , ,ID,https://i.gr-assets.com/images/S/compressed.photo.goodreads.com/books/1519262729l/37569342._SX98_.jpg,https://i.gr-assets.com/images/S/compressed.photo.goodreads.com/books/1519262729l/37569342._SY75_.jpg,https://i.gr-assets.com/images/S/compressed.photo.goodreads.com/books/1519262729l/37569342._SY475_.jpg,2019,1,15,Houghton Mifflin Harcourt,eng,false,"<b>“Riveting”—<i>Entertainment Weekly</i><br /><br /> From the author of <i>Good as Gone</i> comes a brilliant and timely thriller: <i>Strangers on a Train</i> by way of <i>Thelma and Louise</i>.</b><br />  <br /> Dana Diaz is an aspiring stand‑up comedian—a woman in a man’s world. When she meets a tough computer programmer named Amanda Dorn, the two bond over their struggles in boys’ club professions. Dana confides that she’s recently been harassed and assaulted while in L.A., and Amanda comes up with a plan: they should go after each other’s assailants, <i>Strangers on a Train</i>–style. But Dana finds that revenge, however sweet, draws her into a more complicated series of betrayals. Soon her distrust turns to paranoia, encompassing strangers, friends—and even herself. At what cost will she get her vengeance? Who will end up getting hurt? And when it’s all over, will there be anyone left to trust?",3.26,320,Hardcover, ,187,https://www.goodreads.com/book/show/37569342-last-woman-standing,https://www.goodreads.com/book/show/37569342-last-woman-standing
37570460,Mastering the Market Cycle: Getting the Odds on Your Side,1328479250,9781328479259, , ,ID,https://i.gr-assets.com/images/S/compressed.photo.goodreads.com/books/1519637578l/37570460._SX98_.jpg,https://i.gr-assets.com/images/S/compressed.photo.goodreads.com/books/1519637578l/37570460._SY75_.jpg,https://i.gr-assets.com/images/S/compressed.photo.goodreads.com/books/1519637578l/37570460._SY475_.jpg,2018,10,2,Houghton Mifflin Harcourt,,false,"<b>The legendary investor shows how to identify and master the cycles that govern the markets.</b><br /><br />We all know markets rise and fall, but when should you pull out, and when should you stay in? The answer is never black or white, but is best reached through a keen understanding of the reasons behind the rhythm of cycles. Confidence about where we are in a cycle comes when you learn the patterns of ups and downs that influence not just economics, markets and companies, but also human psychology and the investing behaviors that result.<br /><br /> If you study past cycles, understand their origins and remain alert for the next one, you will become keenly attuned to the investment environment as it changes. You’ll be aware and prepared while others get blindsided by unexpected events or fall victim to emotions like fear and greed.<br /><br /> By following Marks’s insights — drawn in part from his iconic memos over the years to Oaktree’s clients — you can master these recurring patterns to have the opportunity to improve your results.",3.94,336,Hardcover, ,184,https://www.goodreads.com/book/show/37570460-mastering-the-market-cycle,https://www.goodreads.com/book/show/37570460-mastering-the-market-cycle
37570546,"Maybe You Should Talk to Someone: A Therapist, Her Therapist, and Our Lives Revealed",1328662055,9781328662057, , ,ID,https://i.gr-assets.com/images/S/compressed.photo.goodreads.com/books/1547189796l/37570546._SX98_.jpg,https://i.gr-assets.com/images/S/compressed.photo.goodreads.com/books/1547189796l/37570546._SY75_.jpg,https://i.gr-assets.com/images/S/compressed.photo.goodreads.com/books/1547189796l/37570546.jpg,2019,4,2,Houghton Mifflin Harcourt,eng,false,"<b>From a <i>New York Times</i> best-selling author, psychotherapist, and national advice columnist, a hilarious, thought-provoking, and surprising new book that takes us behind the scenes of a therapist's world -- where her patients are looking for answers (and so is she).</b><br /><br /> One day, Lori Gottlieb is a therapist who helps patients in her Los Angeles practice. The next, a crisis causes her world to come crashing down. Enter Wendell, the quirky but seasoned therapist in whose office she suddenly lands. With his balding head, cardigan, and khakis, he seems to have come straight from Therapist Central Casting. Yet he will turn out to be anything but.<br /><br /> As Gottlieb explores the inner chambers of her patients' lives -- a self-absorbed Hollywood producer, a young newlywed diagnosed with a terminal illness, a senior citizen threatening to end her life on her birthday if nothing gets better, and a twenty-something who can't stop hooking up with the wrong guys -- she finds that the questions they are struggling with are the very ones she is now bringing to Wendell.<br /><br /> With startling wisdom and humor, Gottlieb invites us into her world as both clinician and patient, examining the truths and fictions we tell ourselves and others as we teeter on the tightrope between love and desire, meaning and mortality, guilt and redemption, terror and courage, hope and change.<br /><br /><i>Maybe You Should Talk to Someone </i>is revolutionary in its candor, offering a deeply personal yet universal tour of our hearts and minds and providing the rarest of gifts: a boldly revealing portrait of what it means to be human, and a disarmingly funny and illuminating account of our own mysterious lives and our power to transform them.<br />",4.37,415,Hardcover, ,10307,https://www.goodreads.com/book/show/37570546-maybe-you-should-talk-to-someone,https://www.goodreads.com/book/show/37570546-maybe-you-should-talk-to-someone
37570554,"Miss Kopp Just Won't Quit (Kopp Sisters, #4)",1328736512,9781328736512, , ,ID,https://i.gr-assets.com/images/S/compressed.photo.goodreads.com/books/1519261806l/37570554._SX98_.jpg,https://i.gr-assets.com/images/S/compressed.photo.goodreads.com/books/1519261806l/37570554._SY75_.jpg,https://i.gr-assets.com/images/S/compressed.photo.goodreads.com/books/1519261806l/37570554._SY475_.jpg,2018,9,11,Houghton Mifflin Harcourt,eng,false,"<b>Trailblazing Constance's hard-won job as deputy sheriff is on the line in <i>Miss Kopp Just Won't Quit</i>, the fourth installment of Amy Stewart's Kopp Sisters series.</b><br /><br />After a year on the job, New Jersey's first female deputy sheriff has collared criminals, demanded justice for wronged women, and gained notoriety nationwide for her exploits. But on one stormy night, everything falls apart.<br /><br /> While transporting a woman to an insane asylum, Deputy Kopp discovers something deeply troubling about her story. Before she can investigate, another inmate bound for the asylum breaks free and tries to escape.<br /><br /> In both cases, Constance runs instinctively toward justice. But the fall of 1916 is a high-stakes election year, and any move she makes could jeopardize Sheriff Heath's future--and her own. Although Constance is not on the ballot, her controversial career makes her the target of political attacks.<br /><br /> With wit and verve, book-club favorite Amy Stewart brilliantly conjures the life and times of the real Constance Kopp to give us this ""unforgettable, not-to-be messed-with heroine"" (<i>Marie Claire</i>) under fire in <i>Miss Kopp Just Won't Quit</i><i>.</i><br />",3.95,309,Hardcover, ,418,https://www.goodreads.com/book/show/37570554-miss-kopp-just-won-t-quit,https://www.goodreads.com/book/show/37570554-miss-kopp-just-won-t-quit
37570559,"The Vanderbeekers and the Hidden Garden (The Vanderbeekers, #2)",1328770028,9781328770028, , ,ID,https://i.gr-assets.com/images/S/compressed.photo.goodreads.com/books/1519637567l/37570559._SX98_.jpg,https://i.gr-assets.com/images/S/compressed.photo.goodreads.com/books/1519637567l/37570559._SX50_.jpg,https://i.gr-assets.com/images/S/compressed.photo.goodreads.com/books/1519637567l/37570559._SY475_.jpg,2018,9,25,Houghton Mifflin Harcourt,eng,false,"Return to Harlem's ""wildly entertaining"" family in this funny, heartwarming sequel. When catastrophe strikes their beloved upstairs neighbors, the Vanderbeeker children set out to build the best, most magical healing garden in Harlem—in spite of a locked fence, thistles and trash, and the conflicting plans of a wealthy real estate developer.<br /><br />While Isa is off at sleepaway orchestra camp, Jessie, Oliver, Hyacinth, and Laney are stuck at home in the brownstone with nothing to do but get on one another’s nerves. But when catastrophe strikes their beloved upstairs neighbor, their sleepy summer transforms in an instant as the Vanderbeeker children band together to do what they do best: make a plan. They will create the most magical healing garden in all of Harlem.<br /><br />In this companion to <i>The Vanderbeekers of 141st Street,</i> experience the warmth of a family and their community as they work together to bring a little more beauty and kindness to the world, one thwarted plan at a time.",4.44,336,Hardcover, ,416,https://www.goodreads.com/book/show/37570559-the-vanderbeekers-and-the-hidden-garden,https://www.goodreads.com/book/show/37570559-the-vanderbeekers-and-the-hidden-garden
37570583,"Backyard Bears: Conservation, Habitat Changes, and the Rise of Urban Wildlife",1328858685,9781328858689, , ,ID,https://i.gr-assets.com/images/S/compressed.photo.goodreads.com/books/1519615449l/37570583._SX98_.jpg,https://i.gr-assets.com/images/S/compressed.photo.goodreads.com/books/1519615449l/37570583._SX50_.jpg,https://i.gr-assets.com/images/S/compressed.photo.goodreads.com/books/1519615449l/37570583._SX318_.jpg,2018,10,23,HMH Books for Young Readers,,false,"<b>North Carolina's black bears were once a threatened species, but now their numbers are rising in and around Asheville. But what happens when conservation efforts for a species are so successful that there’s a boom in the population? Can humans and bears live compatibly? What are the long-term effects for the bears? Author Amy Cherrix follows the scientists who, in cooperation with local citizen scientists, are trying to answer to these questions and more. Part field science, part conservation science, <i>Backyard Bears</i> looks at black bears—and other animals around the globe—who are rapidly becoming our neighbors in urban and suburban areas.</b><br /><br />What happens when conservation efforts for a species are so successful that there’s a boom in the population? Part field science, part conservation science, <i>Backyard Bears</i> looks at black bears—and other animals around the globe—who are rapidly becoming our neighbors in urban and suburban areas.<br />      North Carolina's black bears were once a threatened species, but now their numbers are rising in and around Asheville. Can humans and bears live compatibly? What are the long-term effects for the bears? Author Amy Cherrix follows the scientists who, in cooperation with local citizens, are trying to answer to these questions and more. <br />  ",4.30,80,Hardcover,Scientists in the Field,26,https://www.goodreads.com/book/show/37570583-backyard-bears,https://www.goodreads.com/book/show/37570583-backyard-bears
37570595,Friday Black,1328911241,9781328911247, , ,ID,https://i.gr-assets.com/images/S/compressed.photo.goodreads.com/books/1519263290l/37570595._SX98_.jpg,https://i.gr-assets.com/images/S/compressed.photo.goodreads.com/books/1519263290l/37570595._SY75_.jpg,https://i.gr-assets.com/images/S/compressed.photo.goodreads.com/books/1519263290l/37570595._SY475_.jpg,2018,10,23,Mariner Books,,false,"In the stories of Adjei-Brenyah’s debut, an amusement park lets players enter augmented reality to hunt terrorists or shoot intruders played by minority actors, a school shooting results in both the victim and gunman stuck in a shared purgatory, and an author sells his soul to a many-tongued god.<br /><br />Adjei-Brenyah's writing will grab you, haunt you, enrage, and invigorate you. By placing ordinary characters in extraordinary situations, Adjei-Brenyah reveals the violence, injustice, and painful absurdities that black men and women contend with every day. These stories tackle urgent instances of racism and cultural unrest and explore the many ways we fight for humanity in an unforgiving world.",4.09,194,Paperback, ,1734,https://www.goodreads.com/book/show/37570595-friday-black,https://www.goodreads.com/book/show/37570595-friday-black
37584991,"The Proposal (The Wedding Date, #2)",0399587683,9780399587689, , ,ID,https://i.gr-assets.com/images/S/compressed.photo.goodreads.com/books/1550603962l/37584991._SX98_.jpg,https://i.gr-assets.com/images/S/compressed.photo.goodreads.com/books/1550603962l/37584991._SY75_.jpg,https://i.gr-assets.com/images/S/compressed.photo.goodreads.com/books/1550603962l/37584991._SY475_.jpg,2018,10,30,Berkley Books,eng,false,"<b>The author of <i>The Wedding Date </i>serves up a novel about what happens when a public proposal doesn't turn into a happy ending, thanks to a woman who knows exactly how to make one on her own...</b><br /><br /><b>When someone asks you to spend your life with him, it shouldn't come as a surprise--or happen in front of 45,000 people.</b><br /><br />When freelance writer Nikole Paterson goes to a Dodgers game with her actor boyfriend, his man bun, and his bros, the last thing she expects is a scoreboard proposal. Saying no isn't the hard part--they've only been dating for five months, and he can't even spell her name correctly. The hard part is having to face a stadium full of disappointed fans...<br /><br />At the game with his sister, Carlos Ibarra comes to Nik's rescue and rushes her away from a camera crew. He's even there for her when the video goes viral and Nik's social media blows up--in a bad way. Nik knows that in the wilds of LA, a handsome doctor like Carlos can't be looking for anything serious, so she embarks on an epic rebound with him, filled with food, fun, and fantastic sex. But when their glorified hookups start breaking the rules, one of them has to be smart enough to put on the brakes...",3.46,325,Paperback, ,6192,https://www.goodreads.com/book/show/37584991-the-proposal,https://www.goodreads.com/book/show/37584991-the-proposal
37589157,Les Mémoires d'une Jeune Fille (Pas) Rangée, ,9791023001143, , ,ID,https://i.gr-assets.com/images/S/compressed.photo.goodreads.com/books/1513701633l/37589157._SX98_.jpg,https://i.gr-assets.com/images/S/compressed.photo.goodreads.com/books/1513701633l/37589157._SX50_.jpg,https://i.gr-assets.com/images/S/compressed.photo.goodreads.com/books/1513701633l/37589157._SX318_.jpg,2017,9,11,Ellébore,fre,false,"Jeune directrice artistique aussi drôle qu'attachante, un brin maladroite et très exigeante, Aurélie évolue entre sa fabuleuse maman, son amoureux de 30 ans son aîné, son charmant « beau-fils » de 7 ans, son travail de free-lance, ses copines et... son futur bébé. Dans ces scènes de la vie quotidienne et conjugale, où le cynisme côtoie la naïveté, se révèle un personnage irrésistible, sublimé par ses répliques mordantes, dans lequel beaucoup se reconnaîtront.",5.00,192,Paperback, ,1,https://www.goodreads.com/book/show/37589157-les-m-moires-d-une-jeune-fille-pas-rang-e,https://www.goodreads.com/book/show/37589157-les-m-moires-d-une-jeune-fille-pas-rang-e
