id,title,isbn,isbn13,asin,kindle_asin,country_code,image_url,small_image_url,large_image_url,publication_year,publication_month,publication_day,publisher,language_code,is_ebook,description,average_rating,num_pages,format,edition_information,text_reviews_count,url,link
18754961,"Blood Magick (The Cousins O'Dwyer Trilogy, #3)",0425259870,9780425259870, , ,ID,https://i.gr-assets.com/images/S/compressed.photo.goodreads.com/books/1458263077l/18754961._SX98_.jpg,https://i.gr-assets.com/images/S/compressed.photo.goodreads.com/books/1458263077l/18754961._SX50_.jpg,https://i.gr-assets.com/images/S/compressed.photo.goodreads.com/books/1458263077l/18754961.jpg,2014,10,28,Berkley Trade,eng,false,"<b>From #1 <i>New York Times</i> bestselling author Nora Roberts comes a trilogy about the land we’re drawn to, the family we learn to cherish, and the people we long to love…<br /><br /> Book Three of The Cousins O’Dwyer Trilogy<br /><i>Blood Magick</i></b><br /><br /> County Mayo is rich in the traditions of Ireland, legends that Branna O’Dwyer fully embraces in her life and in her work as the proprietor of The Dark Witch shop, which carries soaps, lotions, and candles for tourists, made with Branna’s special touch.<br /><br /> Branna’s strength and selflessness hold together a close circle of friends and family—along with their horses and hawks and her beloved hound. But there’s a single missing link in the chain of her life: love…<br /><br /> She had it once—for a moment—with Finbar Burke, but a shared future is forbidden by history and blood. Which is why Fin has spent his life traveling the world to fill the abyss left in him by Branna, focusing on work rather than passion.<br /><br /> Branna and Fin’s relationship offers them both comfort and torment. And though they succumb to the heat between them, there can be no promises for tomorrow. A storm of shadows threatens everything that their circle holds dear. It will be Fin’s power, loyalty, and heart that will make all the difference in an age-old battle between the bonds that hold their friends together and the evil that has haunted their families for centuries.<br /><br /><b>Don’t miss the first two books in the Cousins O’Dwyer Trilogy<br /><i>Dark Witch</i><br /> and<br /><i>Shadow Spell</i></b><br />",4.12,304,Paperback, ,1566,https://www.goodreads.com/book/show/18754961-blood-magick,https://www.goodreads.com/book/show/18754961-blood-magick
18755501,Day One (Issue 1), , ,B00FDWVIHO, ,ID,https://i.gr-assets.com/images/S/compressed.photo.goodreads.com/books/1383690947l/18755501._SX98_.jpg,https://i.gr-assets.com/images/S/compressed.photo.goodreads.com/books/1383690947l/18755501._SX50_.jpg,https://i.gr-assets.com/images/S/compressed.photo.goodreads.com/books/1383690947l/18755501.jpg,2013,10,30,Day One,eng,true,"In our first issue: Sheila, a short story by newcomer Rebecca Adams Wright, explores the relationship between an elderly widower and his cherished (and robotic) spaniel, Sheila. Humor and humanity blend seamlessly with science fiction in this clever take on love, attachment, and family.<br /><br />""Wrought,"" a poem by Zack Strait, examines the trappings of love and identity through vivid imagery and a wry lyricism.<br /><br />In ""A Conversation between Rebecca and Zack,"" our authors share more about their literary influences, writing collaborations, and their visions for future work.<br /><br />Illustrator Forsyth Harmon shares her creative process, and the meaning behind her cover art.",4.00, ,Kindle Edition, ,0,https://www.goodreads.com/book/show/18755501-day-one,https://www.goodreads.com/book/show/18755501-day-one
18756712,"Sworn to Secrecy (Courtlight, #4)", , ,B00IMPE6PK, ,ID,https://i.gr-assets.com/images/S/compressed.photo.goodreads.com/books/1389935546l/18756712._SX98_.jpg,https://i.gr-assets.com/images/S/compressed.photo.goodreads.com/books/1389935546l/18756712._SX50_.jpg,https://i.gr-assets.com/images/S/compressed.photo.goodreads.com/books/1389935546l/18756712.jpg,2014,2,28,,eng,true,"In the heart of the Imperial Courts, Ciardis Weathervane knows that death is coming for the empire. With her friends by her side and the new triad of Weathervanes, she's in a race against time to convince the courts of the same. <br /><br />She must do her best to unite kith, mages, nobles and merchants under one cause - the fight to prevent a war. Soon she is forced to keep a secret that could exonerate her mother of the Empress's death, and is always one move away from stepping into diplomatic chaos. <br /><br />Throw in a daemoni prince who is showing interest in the youngest Weathervane, a jealous prince heir, and a irritated dragon with her own designs on Ciardis, and you have an imperial court in turmoil. <br /><br />This fourth novel continues the story of Ciardis Weathervane from Sworn To Conflict.",3.98,254,Kindle Edition, ,57,https://www.goodreads.com/book/show/18756712-sworn-to-secrecy,https://www.goodreads.com/book/show/18756712-sworn-to-secrecy
18757209,Bittersweet, , ,B00D5M562C, ,ID,https://i.gr-assets.com/images/S/compressed.photo.goodreads.com/books/1386360764l/18757209._SX98_.jpg,https://i.gr-assets.com/images/S/compressed.photo.goodreads.com/books/1386360764l/18757209._SX50_.jpg,https://i.gr-assets.com/images/S/compressed.photo.goodreads.com/books/1386360764l/18757209.jpg,2013,10,1,HarperCollins,eng,true,"Do bonds between sisters ever break? Edda, Grace, Tufts and Kitty didn't think so. The four Latimer sisters, famous throughout New South Wales for their beauty, wit and ambition, have always been close; always happy. But then they left home to train as nurses, swapping the feather beds of their father's townhouse for the spartan bunks of hospital accommodation. And now, as the Depression casts its shadow across Australia, they are bound by their own secret desires as the world changes around them. Will they find the independence they crave? Or is life - like love - always bittersweet? 'As clever, compelling and as down-to-earth as its four heroines' Australian Women's Weekly",3.40,383,Kindle Edition, ,7,https://www.goodreads.com/book/show/18757209-bittersweet,https://www.goodreads.com/book/show/18757209-bittersweet
18759199,The Signature of All Things, , ,B00BXI0IHS, ,ID,https://i.gr-assets.com/images/S/compressed.photo.goodreads.com/books/1404422820l/18759199._SX98_.jpg,https://i.gr-assets.com/images/S/compressed.photo.goodreads.com/books/1404422820l/18759199._SY75_.jpg,https://i.gr-assets.com/images/S/compressed.photo.goodreads.com/books/1404422820l/18759199.jpg,2013,10,1,Bloomsbury Publishing,eng,true,"In The Signature of All Things, Elizabeth Gilbert returns to fiction, inserting her inimitable voice into an enthralling story of love, adventure and discovery. Spanning much of the eighteenth and nineteenth centuries, the novel follows the fortunes of the extraordinary Whittaker family as led by the enterprising Henry Whittaker—a poor-born Englishman who makes a great fortune in the South American quinine trade, eventually becoming the richest man in Philadelphia. Born in 1800, Henry's brilliant daughter, Alma (who inherits both her father's money and his mind), ultimately becomes a botanist of considerable gifts herself. As Alma's research takes her deeper into the mysteries of evolution, she falls in love with a man named Ambrose Pike who makes incomparable paintings of orchids and who draws her in the exact opposite direction — into the realm of the spiritual, the divine, and the magical. Alma is a clear-minded scientist; Ambrose a utopian artist — but what unites this unlikely couple is a desperate need to understand the workings of this world and the mechanisms behind all life.<br /><br />Exquisitely researched and told at a galloping pace, The Signature of All Things soars across the globe—from London to Peru to Philadelphia to Tahiti to Amsterdam, and beyond. Along the way, the story is peopled with unforgettable characters: missionaries, abolitionists, adventurers, astronomers, sea captains, geniuses, and the quite mad. But most memorable of all, it is the story of Alma Whittaker, who — born in the Age of Enlightenment, but living well into the Industrial Revolution — bears witness to that extraordinary moment in human history when all the old assumptions about science, religion, commerce, and class were exploding into dangerous new ideas. Written in the bold, questing spirit of that singular time, Gilbert's wise, deep, and spellbinding tale is certain to capture the hearts and minds of readers. (less)",3.83,512,Kindle Edition, ,56,https://www.goodreads.com/book/show/18759199-the-signature-of-all-things,https://www.goodreads.com/book/show/18759199-the-signature-of-all-things
18761435,La joven de las naranjas,8467209305,9788467209303, , ,ID,https://i.gr-assets.com/images/S/compressed.photo.goodreads.com/books/1383949918l/18761435._SX98_.jpg,https://i.gr-assets.com/images/S/compressed.photo.goodreads.com/books/1383949918l/18761435._SY75_.jpg,https://i.gr-assets.com/images/S/compressed.photo.goodreads.com/books/1383949918l/18761435.jpg,2003,,,Círculo de Lectores,spa,false,"No escogemos en qué período de la historia vamos a vivir. Tampoco el tiempo que permanecemos en la Tierra. Lo único que sabemos es que igual que entramos en este maravilloso mundo, también tenemos que dejarlo y despedirnos dolorosamente de todo aquello que nos rodea. ¿Cuál habría sido nuestra elección si una fuerza mayor nos hubiera permitido elegir? ¿Nos habríamos negado a participar en el juego por no aceptar las reglas?",3.91,155,Hardcover, ,1,https://www.goodreads.com/book/show/18761435-la-joven-de-las-naranjas,https://www.goodreads.com/book/show/18761435-la-joven-de-las-naranjas
18762203,Plume: Poems,0295993901,9780295993904, , ,ID,https://i.gr-assets.com/images/S/compressed.photo.goodreads.com/books/1384019064l/18762203._SX98_.jpg,https://i.gr-assets.com/images/S/compressed.photo.goodreads.com/books/1384019064l/18762203._SX50_.jpg,https://i.gr-assets.com/images/S/compressed.photo.goodreads.com/books/1384019064l/18762203.jpg,2013,10,11,University of Washington Press,,false,"Winner of the 2013 Washington State Book Award and finalist for the 2013 William Carlos Williams Award, Poetry Society of America""Quiet but damning poems on the history of the Hanford Nuclear Reservation."" "" - Rain Taxi""<br /><br />""""Plume"" is an excellent example of how documentary poetry can blend the personal impulse toward nostalgia with the journalistic imperative for objectivity, and the result is a stunning multifaceted take on this public tragedy."" "" - Orion""<br /><br />""Washington State's new Poet Laureate Kathleen Flenniken gives an elegantly rendered example of another of [John] Morgan's dicta that 'poetry gives form to our feelings and helps us come to terms with them.'"" "" - Bellingham Herald""<br /><br />""Many of the poems wrestle with the bomb factory's legacy of environmental contamination, illness and even death from exposure to radiation. But [Flenniken] also wrote them to honor the people she grew up with."" "" - Seattle Times""<br /><br />The poems in ""Plume"" are nuclear-age songs of innocence and experience set in the ""empty"" desert West. Award-winning poet Kathleen Flenniken grew up in Richland, Washington, at the height of the Cold War, next door to the Hanford Nuclear Reservation, where ""every father I knew disappeared to fuel the bomb,"" and worked at Hanford herself as a civil engineer and hydrologist. By the late 1980s, declassified documents revealed decades of environmental contamination and deception at the plutonium production facility, contradicting a lifetime of official assurances to workers and their families that their community was and always had been safe. Plume, written twenty years later, traces this American betrayal and explores the human capacity to hold truth at bay when it threatens one's fundamental identity.",4.46,80,Paperback, ,15,https://www.goodreads.com/book/show/18762203-plume,https://www.goodreads.com/book/show/18762203-plume
18769271,Six Feet Over It,0449818721,9780449818725, , ,ID,https://i.gr-assets.com/images/S/compressed.photo.goodreads.com/books/1386524324l/18769271._SX98_.jpg,https://i.gr-assets.com/images/S/compressed.photo.goodreads.com/books/1386524324l/18769271._SX50_.jpg,https://i.gr-assets.com/images/S/compressed.photo.goodreads.com/books/1386524324l/18769271.jpg,2014,8,26,Random House Books for Young Readers,eng,false,"No one is more surprised than Leigh when her father buys a graveyard. Less shocking is the fact that he’s too lazy to look farther than the dinner table for employees. Working the literal graveyard shift, she becomes great at predicting headstone choice (mostly granite) and taking notes with one hand while offering Kleenex with the other.<br /><br />Sarcastic and smart, Leigh should be able to quit this stupid after-school job. But her world’s been turned upside down by the sudden loss of her best friend and the appearance of Dario, the slightly-too-old-for-her gravedigger. Can Leigh move on, if moving on means it’s time to get a life?<br /><br />Darkly humorous and heart-wrenchingly beautiful, Jennifer Longo’s YA debut about a girl surrounded by death will change the way you look at friendship, love, and life.",3.57,352,Library Binding, ,190,https://www.goodreads.com/book/show/18769271-six-feet-over-it,https://www.goodreads.com/book/show/18769271-six-feet-over-it
18769769,The Oxford Handbook of Process Philosophy and Organization Studies,019966935X,9780199669356, , ,ID,https://i.gr-assets.com/images/S/compressed.photo.goodreads.com/books/1396830968l/18769769._SX98_.jpg,https://i.gr-assets.com/images/S/compressed.photo.goodreads.com/books/1396830968l/18769769._SX50_.jpg,https://i.gr-assets.com/images/S/compressed.photo.goodreads.com/books/1396830968l/18769769.jpg,2014,7,15,Oxford University Press (UK),,false,"Process approaches to organization studies focus on flow, activities, and evolution, understanding organizations and organizing as processes in the making. They stand in contrast to positivist approaches that see organizations and phenomena as fixed, static, and measurable. <br />Process approaches draw on a range of ideas and philosophies. The Handbook examines 34 philosophers and social theorists, both those commonly linked to process thinking, such as Whitehead, Bergson and James, and those that are not as often addressed from a process perspective such as Dilthey and Tarde. Each chapter addresses the background and context of this thinker, their work (with a focus on the processual elements), and the potential contribution to organization and management research. For students and scholars in the field of Organization Studies this book is an entry point into the work of philosophical thinkers and social theorists for whom the world is far from being a solid place.",4.75,638,Hardcover, ,0,https://www.goodreads.com/book/show/18769769-the-oxford-handbook-of-process-philosophy-and-organization-studies,https://www.goodreads.com/book/show/18769769-the-oxford-handbook-of-process-philosophy-and-organization-studies
18769932,"El proyecto esposa (Don Tillman, #1)",8498385547,9788498385540, , ,ID,https://i.gr-assets.com/images/S/compressed.photo.goodreads.com/books/1488992077l/18769932._SX98_.jpg,https://i.gr-assets.com/images/S/compressed.photo.goodreads.com/books/1488992077l/18769932._SY75_.jpg,https://i.gr-assets.com/images/S/compressed.photo.goodreads.com/books/1488992077l/18769932._SY475_.jpg,2013,10,,Salamandra,spa,false,"Don Tillman, profesor de Genética en la universidad, un hombre atrapado en una visión de la realidad extremadamente rígida, nunca ha tenido una segunda cita con una mujer. Sin embargo, conocedor de los estudios que demuestran que los hombres que viven en pareja son más felices que los solteros, se embarca de lleno en lo que bautiza El Proyecto Esposa, cuyo primer paso consiste en redactar un cuestionario de dieciséis páginas para encontrar la pareja perfecta: una mujer puntual, que no fume ni beba y se adapte a su reglamentada existencia. Y entonces conoce a Rosie Jarman, que es una mujer guapa, capaz y luchadora, pero trabaja en un bar, fuma, bebe, y llega siempre tarde: ¡totalmente descartada para el Proyecto Esposa! Ella tiene un proyecto propio, encontrar a su padre biológico, y nuestro excéntrico profesor se encontrará inventando excusas a diario y saltándose sus estrictas reglas con tal de verla y ayudarla poniendo sus conocimientos de genética al servicio de su causa. Don y Rosie se lanzan así a una intrépida, divertidísima aventura que demuestra que el amor no se busca sino que acude a nosotros cuando menos lo esperamos.<br /><br />Hilarante, sorprendente e irresistiblemente romántica, El Proyecto Esposa tiene un protagonista excepcional: el inteligente, obsesivo y literal Don Tillman, para quien navegar por nuestro mundo de emociones complejas y contradictorias, poblado por gentes que a menudo dicen exactamente lo contrario de lo que piensan, es extraordinariamente difícil.",4.02,315,Paperback, ,211,https://www.goodreads.com/book/show/18769932-el-proyecto-esposa,https://www.goodreads.com/book/show/18769932-el-proyecto-esposa
18770398,Night Film,0812979788,9780812979787, , ,ID,https://i.gr-assets.com/images/S/compressed.photo.goodreads.com/books/1397425352l/18770398._SX98_.jpg,https://i.gr-assets.com/images/S/compressed.photo.goodreads.com/books/1397425352l/18770398._SY75_.jpg,https://i.gr-assets.com/images/S/compressed.photo.goodreads.com/books/1397425352l/18770398.jpg,2014,7,1,Random House Trade Paperbacks,eng,false,"On a damp October night, 24-year-old Ashley Cordova is found dead in an abandoned warehouse in lower Manhattan. Though her death is ruled a suicide, veteran investigative journalist Scott McGrath suspects otherwise. As he probes the strange circumstances surrounding Ashley's life and death, McGrath comes face-to-face with the legacy of her father: the legendary, reclusive cult-horror film director Stanislaus Cordova--a man who hasn't been seen in public for more than thirty years. <br /><br />For McGrath, another death connected to this seemingly cursed family dynasty seems more than just a coincidence. Though much has been written about Cordova's dark and unsettling films, very little is known about the man himself. <br /><br />Driven by revenge, curiosity, and a need for the truth, McGrath, with the aid of two strangers, is drawn deeper and deeper into Cordova's eerie, hypnotic world. The last time he got close to exposing the director, McGrath lost his marriage and his career. This time he might lose even more.",3.78,640,Paperback, ,3975,https://www.goodreads.com/book/show/18770398-night-film,https://www.goodreads.com/book/show/18770398-night-film
18771485,Lugged Bicycle Frame Construction: Third Edition,1492232645,9781492232643, , ,ID,https://i.gr-assets.com/images/S/compressed.photo.goodreads.com/books/1416778785l/18771485._SX98_.jpg,https://i.gr-assets.com/images/S/compressed.photo.goodreads.com/books/1416778785l/18771485._SX50_.jpg,https://i.gr-assets.com/images/S/compressed.photo.goodreads.com/books/1416778785l/18771485.jpg,2013,10,28,Createspace Independent Publishing Platform,eng,false,"Contrary to popular belief, building a strong well-aligned bicycle frame does not require thousands of dollars of tools or weeks of hands-on training. This manual instructs the reader how to construct a quality lugged bicycle frame using inexpensive tools. Sections of this manual describe: principles of bicycle design; brazing technique; the use of inexpensive air-fuel and industrial grade oxy-fuel torches; tube mitering; jigging using inexpensive materials; builds for 26 inch, 650c, 650b, and 700c wheels; builds for tires up to 45 mm wide; and a step-by-step walkthrough of the frame building process. Build the following: road racing bicycles, all-road bicycles, touring bicycles, commuting bicycles, fixies and single speed bicycles, cyclocross and monstercross bicycles.",3.89,228,Paperback, ,0,https://www.goodreads.com/book/show/18771485-lugged-bicycle-frame-construction,https://www.goodreads.com/book/show/18771485-lugged-bicycle-frame-construction
18773666,A Spy Among Friends: Kim Philby and the Great Betrayal,0804136637,9780804136631, , ,ID,https://i.gr-assets.com/images/S/compressed.photo.goodreads.com/books/1413129627l/18773666._SX98_.jpg,https://i.gr-assets.com/images/S/compressed.photo.goodreads.com/books/1413129627l/18773666._SY75_.jpg,https://i.gr-assets.com/images/S/compressed.photo.goodreads.com/books/1413129627l/18773666.jpg,2014,7,29,Crown Publishers,eng,false,"Master storyteller Ben Macintyre’s most ambitious work to date brings to life the twentieth century’s greatest spy story.<br /><br />Kim Philby was the greatest spy in history, a brilliant and charming man who rose to head Britain’s counterintelligence against the Soviet Union during the height of the Cold War—while he was secretly working for the enemy. And nobody thought he knew Philby like Nicholas Elliott, Philby’s best friend and fellow officer in MI6. The two men had gone to the same schools, belonged to the same exclusive clubs, grown close through the crucible of wartime intelligence work and long nights of drink and revelry. It was madness for one to think the other might be a communist spy, bent on subverting Western values and the power of the free world.<br /><br />But Philby was secretly betraying his friend. Every word Elliott breathed to Philby was transmitted back to Moscow—and not just Elliott’s words, for in America, Philby had made another powerful friend: James Jesus Angleton, the crafty, paranoid head of CIA counterintelligence. Angleton's and Elliott’s unwitting disclosures helped Philby sink almost every important Anglo-American spy operation for twenty years, leading countless operatives to their doom. Even as the web of suspicion closed around him, and Philby was driven to greater lies to protect his cover, his two friends never abandoned him—until it was too late. The stunning truth of his betrayal would have devastating consequences on the two men who thought they knew him best, and on the intelligence services he left crippled in his wake.<br /><br />Told with heart-pounding suspense and keen psychological insight, and based on personal papers and never-before-seen British intelligence files, <i>A Spy Among Friends</i> is Ben Macintyre’s best book yet, a high-water mark in Cold War history telling.",4.09,368,Hardcover,First Edition,1030,https://www.goodreads.com/book/show/18773666-a-spy-among-friends,https://www.goodreads.com/book/show/18773666-a-spy-among-friends
18774020,California,0316250813,9780316250818, , ,ID,https://i.gr-assets.com/images/S/compressed.photo.goodreads.com/books/1400863574l/18774020._SX98_.jpg,https://i.gr-assets.com/images/S/compressed.photo.goodreads.com/books/1400863574l/18774020._SY75_.jpg,https://i.gr-assets.com/images/S/compressed.photo.goodreads.com/books/1400863574l/18774020.jpg,2014,7,8,"Little, Brown and Company",eng,false,"A gripping and provocative debut novel by a stunning new talent, California imagines a frighteningly realistic near future, in which clashes between mankind's dark nature and deep-seated resilience force us to question how far we will go to protect the ones we love.<br /><br />The world Cal and Frida have always known is gone, and they've left the crumbling city of Los Angeles far behind them. They now live in a shack in the wilderness, working side-by-side to make their days tolerable in the face of hardship and isolation. Mourning a past they can't reclaim, they seek solace in each other. But the tentative existence they've built for themselves is thrown into doubt when Frida finds out she's pregnant. <br /><br />Terrified of the unknown and unsure of their ability to raise a child alone, Cal and Frida set out for the nearest settlement, a guarded and paranoid community with dark secrets. These people can offer them security, but Cal and Frida soon realize this community poses dangers of its own. In this unfamiliar world, where everything and everyone can be perceived as a threat, the couple must quickly decide whom to trust.",3.23,393,Hardcover, ,2688,https://www.goodreads.com/book/show/18774020-california,https://www.goodreads.com/book/show/18774020-california
