id,title,isbn,isbn13,asin,kindle_asin,country_code,image_url,small_image_url,large_image_url,publication_year,publication_month,publication_day,publisher,language_code,is_ebook,description,average_rating,num_pages,format,edition_information,text_reviews_count,url,link
18916728,"Desire Wears Diamonds (Jaded Gentleman, #6)", , ,B00DR7BGM4, ,ID,https://i.gr-assets.com/images/S/compressed.photo.goodreads.com/books/1385248871l/18916728._SX98_.jpg,https://i.gr-assets.com/images/S/compressed.photo.goodreads.com/books/1385248871l/18916728._SY75_.jpg,https://i.gr-assets.com/images/S/compressed.photo.goodreads.com/books/1385248871l/18916728.jpg,2013,7,1,,eng,true,"""One of the freshest voices I've seen in ages."" --Sherrilyn Kenyon, #1 New York Times bestselling author <br /> <br />WHEN BETRAYAL IS THE ONLY PATH OPEN AND PASSION IS THE ONLY ENEMY HE NEVER ANTICIPATED . . . <br /> <br />The shy soldier and self-appointed guardian of the Jaded, Michael Rutherford, is faced with the ultimate test of his loyalty and honor when he meets the woman who is at once his perfect match and the worst choice he could ever make. The final battle with the Jaded’s greatest enemy will force him to choose between the brotherhood he has vowed to protect and shielding the innocent lady he comes to love. For Michael, it is a dance with the devil for a chance to taste the kisses of an angel. <br /> <br />Grace Porter is no ordinary wallflower or shy spinster hiding in the shadows of her brother’s London home. She is a quiet rebel with secrets of her own and a woman who dreams of an independent life, free to pursue her dreams as a writer. Her imagination holds the key to her survival, but it fuels her retreat from the colorless world around her. Until Michael Rutherford’s arrival upturns her every fantasy and threatens her sanctuary with his lies. His embrace is intoxicating to her senses but Grace isn’t the kind of woman to lose her head—or her heart. <br /> <br />It’s a knuckle-biting race to the finish for fans of the Jaded as fan favorite, Michael Rutherford, discovers the identity of the Jackal and Michael learns that sometimes the price to pay for justice is the sacrifice of hope and happiness. He will risk everything as the Jaded call him out as a traitor and nothing is what it seems. <br /> <br /> <br />***BONUS MATERIALS WITH THIS PURCHASE*** <br />An Original Penny Dreadful by Mr. A.R. Crimson! “Poseidon’s Curse or The Fatal Storm” – A fantasy serial from the creative mind of Crimson himself! <br /> <br />AND Special Reader Notes and Inside Information from the world of The Jaded Gentlemen!",4.15,348,Kindle Edition, ,16,https://www.goodreads.com/book/show/18916728-desire-wears-diamonds,https://www.goodreads.com/book/show/18916728-desire-wears-diamonds
18917440,Skin (Jack Caffery Book 4), , ,B007HB5S1Q, ,ID,https://i.gr-assets.com/images/S/compressed.photo.goodreads.com/books/1388821252l/18917440._SX98_.jpg,https://i.gr-assets.com/images/S/compressed.photo.goodreads.com/books/1388821252l/18917440._SY75_.jpg,https://i.gr-assets.com/images/S/compressed.photo.goodreads.com/books/1388821252l/18917440.jpg,2011,2,8,Grove Press,en-US,true,"When the decomposed body of a young woman is found by near railway tracks just outside Bristol one hot May morning, all indications are that she's committed suicide. That's how the police want it too; all neatly squared and tidied away.<br /><br />But <b>DI Jack Caffery</b> is not so sure. He is on the trail of someone predatory, someone who hides in the shadows and can slip into houses unseen.<br /><br />And for the first time in a very long time, he feels scared.<br /><br /><b>Police Diver Flea Marley </b>is working alongside Caffery<b>.</b>Having come<b> </b>to terms with the loss of her parents, and with the traumas of her past safely behind her, she's beginning to wonder<b> </b>whether their relationship could go beyond the professional.<br /><br />And then she finds something that changes everything. Not only is it far too close to home for comfort - but it's so horrifying that she knows that nothing will ever be the same again.<br /><br />And that this time, no one - not even Caffery - can help her ...",3.82,467,Kindle Edition, ,12,https://www.goodreads.com/book/show/18917440-skin,https://www.goodreads.com/book/show/18917440-skin
18917568,HBR Guide to Better Business Writing,1422184048,9781422184042, , ,ID,https://i.gr-assets.com/images/S/compressed.photo.goodreads.com/books/1408930238l/18917568._SY160_.jpg,https://i.gr-assets.com/images/S/compressed.photo.goodreads.com/books/1408930238l/18917568._SY75_.jpg,https://i.gr-assets.com/images/S/compressed.photo.goodreads.com/books/1408930238l/18917568.jpg,2013,1,8,Harvard Business Review Press,eng,true,"<b>DON'T LET YOUR WRITING HOLD YOU BACK.</b><br /><br />When you’re fumbling for words and pressed for time, you might be tempted to dismiss good business writing as a nicety. But it’s a skill you <i>must</i> cultivate to succeed: You’ll lose time, money, and influence if your e-mails, proposals, and other important documents fail to win people over.<br /><br />The <i>
  <b>HBR Guide to Better Business Writing</b>
</i>, by writing expert Bryan A. Garner, gives you the tools you need to express your ideas clearly and persuasively so clients, colleagues, stakeholders, and partners will get behind them. This book will help you:<br /><br />• Push past writer’s block<br />• Grab—and keep—readers’ attention<br />• Earn credibility with tough audiences<br />• Trim the fat from your writing<br />• Strike the right tone<br />• Brush up on grammar, punctuation, and usage<br />",4.04,208,ebook,HBR Guide Series,4,https://www.goodreads.com/book/show/18917568-hbr-guide-to-better-business-writing,https://www.goodreads.com/book/show/18917568-hbr-guide-to-better-business-writing
18918914,Siblings Without Rivalry: How to Help Your Children Live Together So You Can Live Too, , ,B007HXL1V0, ,ID,https://i.gr-assets.com/images/S/compressed.photo.goodreads.com/books/1385256639l/18918914._SX98_.jpg,https://i.gr-assets.com/images/S/compressed.photo.goodreads.com/books/1385256639l/18918914._SY75_.jpg,https://i.gr-assets.com/images/S/compressed.photo.goodreads.com/books/1385256639l/18918914.jpg,2012,4,9,W. W. Norton & Company,en-US,true,"With a title like this, it's no surprise that authors Adele Faber and Elaine Mazlish had a monster bestseller on their hands when the book first appeared in 1988. From the subsequent deluge of readers' stories, questions, and issues, they have created nearly 50 pages of new material for this, the 10th anniversary edition. The central message remains the same, and sounds almost too simple: avoid comparisons. But parents know that's easier said than done. The value of Faber and Mazlish's discussions is precisely that they talk you through umpteen different situations and outcomes to help you teach your brawling offspring a new set of responses. The highly informative text is punctuated with helpful summary/reminder boxes and cartoons illustrating key points. It's a must-read for parents with (or planning on) multiple children. But parents of young children who get along fine (so far) should read it too--as the authors make very clear, rivalry is inevitable. The only question is how to manage the rivalry with intelligence and compassion, and on that subject they offer a wealth of good advice. <i>--Richard Farr</i> ",4.16,287,Kindle Edition, ,20,https://www.goodreads.com/book/show/18918914-siblings-without-rivalry,https://www.goodreads.com/book/show/18918914-siblings-without-rivalry
18919188,Trojan Horse, , ,B007PP2J9I, ,ID,https://i.gr-assets.com/images/S/compressed.photo.goodreads.com/books/1407288118l/18919188._SX98_.jpg,https://i.gr-assets.com/images/S/compressed.photo.goodreads.com/books/1407288118l/18919188._SY75_.jpg,https://i.gr-assets.com/images/S/compressed.photo.goodreads.com/books/1407288118l/18919188.jpg,2012,9,4,Thomas Dunne Books,en-US,true,,3.77,333,Kindle Edition, ,5,https://www.goodreads.com/book/show/18919188-trojan-horse,https://www.goodreads.com/book/show/18919188-trojan-horse
18919798,Means of Ascent: The Years of Lyndon Johnson II, , ,B005LALFT4, ,ID,https://i.gr-assets.com/images/S/compressed.photo.goodreads.com/books/1386957154l/18919798._SX98_.jpg,https://i.gr-assets.com/images/S/compressed.photo.goodreads.com/books/1386957154l/18919798._SY75_.jpg,https://i.gr-assets.com/images/S/compressed.photo.goodreads.com/books/1386957154l/18919798.jpg,2011,11,23,Vintage,en-US,true,"Robert A. Caro's life of Lyndon Johnson, which began with the greatly acclaimed The Path to Power, also winner of the National Book Critics Circle Award, continues -- one of the richest, most intensive and most revealing examinations ever undertaken of an American President. In Means of Ascent the Pulitzer Prize-winning biographer/historian, chronicler also of Robert Moses in The Power Broker, carries Johnson through his service in World War II and the foundation of his long-concealed fortune and the facts behind the myths he created about it. But the explosive heart of the book is Caro's revelation of the true story of the fiercely contested 1948 senatorial election, for forty years shrouded in rumor, which Johnson had to win or face certain political death, and which he did win -- by ""the 87 votes that changed history."" Caro makes us witness to a momentous turning point in American politics: the tragic last stand of the old politics versus the new -- the politics of issue versus the politics of image, mass manipulation, money and electronic dazzle.<br /><br /><br /><i>From the Trade Paperback edition.</i>",4.20,592,Kindle Edition, ,19,https://www.goodreads.com/book/show/18919798-means-of-ascent,https://www.goodreads.com/book/show/18919798-means-of-ascent
18919843,Rainbow Valley (Anne of Green Gables #7), , ,B008472CWK, ,ID,https://i.gr-assets.com/images/S/compressed.photo.goodreads.com/books/1432296988l/18919843._SX98_.jpg,https://i.gr-assets.com/images/S/compressed.photo.goodreads.com/books/1432296988l/18919843._SY75_.jpg,https://i.gr-assets.com/images/S/compressed.photo.goodreads.com/books/1432296988l/18919843._SY475_.jpg,2012,5,16,Duke Classics,eng,true,This book was converted from its physical edition to the digital format by a community of volunteers. You may find it for free on the web. Purchase of the Kindle edition includes wireless delivery.,4.00,240,Kindle Edition, ,24,https://www.goodreads.com/book/show/18919843-rainbow-valley,https://www.goodreads.com/book/show/18919843-rainbow-valley
18921701,The Enchanted Life of Adam Hope, , ,B0089LOGJI, ,ID,https://i.gr-assets.com/images/S/compressed.photo.goodreads.com/books/1393641422l/18921701._SX98_.jpg,https://i.gr-assets.com/images/S/compressed.photo.goodreads.com/books/1393641422l/18921701._SY75_.jpg,https://i.gr-assets.com/images/S/compressed.photo.goodreads.com/books/1393641422l/18921701.jpg,2013,4,23,Ecco,,true,"<p><em>The Enchanted Life of Adam Hope</em> is an unconventional and passionately romantic love story that is as breathtaking and wondrous as <em>The Time Traveler’s Wife </em>and<em> The Story of Edgar Sawtelle</em>.</p><p>During WWII, teenager Evelyn Roe is sent to manage the family farm in rural North Carolina, where she finds what she takes to be a badly burned soldier on their property. She rescues him, and it quickly becomes clear he is not a man…<em>and not one of us</em>. The rescued body recovers at an unnatural speed, and just as fast, Evelyn and Adam fall deeply in love.<br /><br />In <em>The Enchanted Life of Adam Hope,</em> Rhonda Riley reveals the exhilarating, terrifying mystery inherent in all relationships: No matter how deeply we love someone, and no matter how much we will sacrifice for them, we can only know them so well…</p>",3.80,434,Kindle Edition, ,87,https://www.goodreads.com/book/show/18921701-the-enchanted-life-of-adam-hope,https://www.goodreads.com/book/show/18921701-the-enchanted-life-of-adam-hope
18924200,The Days of Abandonment, , ,B0049U4NIW, ,ID,https://i.gr-assets.com/images/S/compressed.photo.goodreads.com/books/1385274081l/18924200._SX98_.jpg,https://i.gr-assets.com/images/S/compressed.photo.goodreads.com/books/1385274081l/18924200._SY75_.jpg,https://i.gr-assets.com/images/S/compressed.photo.goodreads.com/books/1385274081l/18924200.jpg,2005,9,1,Europa Editions,en-IN,true,"""She is among the greatest Italian authors of recent years.""-<i>Corriere della Sera</i><br /><br />""Ferrante dissects the personal microcosm so well, and with awesome lucidity and precision shows us the meanderings of a woman's mind, the suffering that accompanies being abandoned, and the awful rumbling of time passing.""-<i>El Mundo</i><br /><br />""Elena Ferrante has given us a startlingly beautiful novel of exceptional and bold strength.""-<i>Il Manifesto</i><br /><br />""Severe and rigorously unsentimental, packed full of passages written with dizzying intensity at a rare and acute pitch. Ferrante is at her best when her writing holds tight to those nagging, niggling obsessions that make up our mental landscapes.""-<i>La Stampa</i><br /><br />A national bestseller for almost an entire year, <i>The Days of Abandonment</i> shocked and captivated its Italian public when first published. It is the gripping story of a woman's descent into devastating emptiness after being abandoned by her husband with two young children to care for. When she finds herself literally trapped within the four walls of their high-rise apartment, she is forced to confront her ghosts, the potential loss of her own identity, and the possibility that life may never return to normal.",3.86,188,Kindle Edition, ,28,https://www.goodreads.com/book/show/18924200-the-days-of-abandonment,https://www.goodreads.com/book/show/18924200-the-days-of-abandonment
18924205,"Baptism of Fire (The Witcher, #3)", , ,B00FPQA4KK, ,ID,https://i.gr-assets.com/images/S/compressed.photo.goodreads.com/books/1394582832l/18924205._SX98_.jpg,https://i.gr-assets.com/images/S/compressed.photo.goodreads.com/books/1394582832l/18924205._SY75_.jpg,https://i.gr-assets.com/images/S/compressed.photo.goodreads.com/books/1394582832l/18924205.jpg,2014,6,24,Orbit,eng,true,"The Wizards Guild has been shattered by a coup and, in the uproar, Geralt was seriously injured. The Witcher is supposed to be a guardian of the innocent, a protector of those in need, a defender against powerful and dangerous monsters that prey on men in dark times.<br /><br />But now that dark times have fallen upon the world, Geralt is helpless until he has recovered from his injuries.<br /><br />While war rages across all of the lands, the future of magic is under threat and those sorcerers who survive are determined to protect it. It's an impossible situation in which to find one girl - Ciri, the heiress to the throne of Cintra, has vanished - until a rumor places her in the Niflgaard court, preparing to marry the Emperor.<br /><br />Injured or not, Geralt has a rescue mission on his hands.<br /><br />This is the third of the Witcher novels by Andrzej Sapkowski.",4.29,378,Kindle Edition, ,137,https://www.goodreads.com/book/show/18924205-baptism-of-fire,https://www.goodreads.com/book/show/18924205-baptism-of-fire
18925695,The Stonecutter, , ,B00B3VMM56, ,ID,https://i.gr-assets.com/images/S/compressed.photo.goodreads.com/books/1385282356l/18925695._SX98_.jpg,https://i.gr-assets.com/images/S/compressed.photo.goodreads.com/books/1385282356l/18925695._SY75_.jpg,https://i.gr-assets.com/images/S/compressed.photo.goodreads.com/books/1385282356l/18925695.jpg,2013,2,5,Free Press,eng,true,"<b>
  <b>Critics are raving about this deliciously chilling new thriller from Scandanavian crime-writing sensation Camilla Läckberg.<br /></b>
</b><br /><br />Named by major media outlets, such as <i>USA TODAY</i>, <i>The New York Times</i>, and <i>The Washington Post</i>, as a main successor to Stieg Larsson, Swedish author Läckberg is on the rise. Her new novel, which <i>The Washington Post</i> has already named as one of their “Ten Books We Love This Year” and praised as “richly textured and downright breathtaking,” continues the story of local detective Patrik Hedström and his girlfriend, Erica Falck, the beloved crime-solving duo whose first child has just been born. But while they celebrate this new life, a suspicious drowning claims a little girl they knew well. As the murder’s implications widen, Patrik’s investigation threatens to tear apart the rural fishing village of Fjällbacka, where a secret lurks that spans generations. <br /> <br />A deeply satisfying third installment in her internationally bestselling series, <i>The Stonecutter </i>will establish Läckberg for the U.S. audience once and for all. As <i>USA TODAY</i> says, “If you haven’t yet read the equally entrancing <i>Ice Princess</i> and <i>The Preacher</i>, what are you waiting for?”",3.89,528,Kindle Edition, ,25,https://www.goodreads.com/book/show/18925695-the-stonecutter,https://www.goodreads.com/book/show/18925695-the-stonecutter
18929577,To Die For, , ,B007S7JYWS, ,ID,https://i.gr-assets.com/images/S/compressed.photo.goodreads.com/books/1393798748l/18929577._SX98_.jpg,https://i.gr-assets.com/images/S/compressed.photo.goodreads.com/books/1393798748l/18929577._SY75_.jpg,https://i.gr-assets.com/images/S/compressed.photo.goodreads.com/books/1393798748l/18929577.jpg,2012,4,17,Open Road Media,eng,true,"When her husband is shot dead by her teenage boyfriend, would-be television journalist Suzanne Maretto steps into the role of grieving widow with a brilliant performance. But few suspect her dark side. This chilling novel of ambition and sexual obsession goes behind the mask of an apple-pie beauty to probe the sinister manipulations of a mesmerizing femme fatale.",3.73,258,Kindle Edition, ,25,https://www.goodreads.com/book/show/18929577-to-die-for,https://www.goodreads.com/book/show/18929577-to-die-for
18929854,All Creatures Great and Small: The Warm and Joyful Memoirs of the World's Most Beloved Animal Doctor,1250057833,9781250057839, , ,ID,https://i.gr-assets.com/images/S/compressed.photo.goodreads.com/books/1385661387l/18929854._SX98_.jpg,https://i.gr-assets.com/images/S/compressed.photo.goodreads.com/books/1385661387l/18929854._SX50_.jpg,https://i.gr-assets.com/images/S/compressed.photo.goodreads.com/books/1385661387l/18929854.jpg,2014,5,6,St. Martin's Griffin,eng,false,"<b>The classic multimillion copy bestseller</b><br /><br />Delve into the magical, unforgettable world of James Herriot, the world's most beloved veterinarian, and his menagerie of heartwarming, funny, and tragic animal patients.<br /><br />For over forty years, generations of readers have thrilled to Herriot's marvelous tales, deep love of life, and extraordinary storytelling abilities. For decades, Herriot roamed the remote, beautiful Yorkshire Dales, treating every patient that came his way from smallest to largest, and observing animals and humans alike with his keen, loving eye.<br /><br />In <i>All Creatures Great and Small</i>, we meet the young Herriot as he takes up his calling and discovers that the realities of veterinary practice in rural Yorkshire are very different from the sterile setting of veterinary school. Some visits are heart-wrenchingly difficult, such as one to an old man in the village whose very ill dog is his only friend and companion, some are lighthearted and fun, such as Herriot's periodic visits to the overfed and pampered Pekinese Tricki Woo who throws parties and has his own stationery, and yet others are inspirational and enlightening, such as Herriot's recollections of poor farmers who will scrape their meager earnings together to be able to get proper care for their working animals. From seeing to his patients in the depths of winter on the remotest homesteads to dealing with uncooperative owners and critically ill animals, Herriot discovers the wondrous variety and never-ending challenges of veterinary practice as his humor, compassion, and love of the animal world shine forth.<br /><br />James Herriot's memoirs have sold 80 million copies worldwide, and continue to delight and entertain readers of all ages.",4.31,448,Paperback, ,1180,https://www.goodreads.com/book/show/18929854-all-creatures-great-and-small,https://www.goodreads.com/book/show/18929854-all-creatures-great-and-small
18931346,"Foundation: Redefine Your Core, Conquer Back Pain, and Move with Confidence", ,9781609617721, , ,ID,https://i.gr-assets.com/images/S/compressed.photo.goodreads.com/books/1440116146l/18931346._SX98_.jpg,https://i.gr-assets.com/images/S/compressed.photo.goodreads.com/books/1440116146l/18931346._SX50_.jpg,https://i.gr-assets.com/images/S/compressed.photo.goodreads.com/books/1440116146l/18931346._SX318_.jpg,2011,5,10,Rodale,eng,false,"<b>This Enhanced Edition of <i>Foundation</i> includes 10 original videos created exclusively for the enhanced eBook edition, featuring exercise demonstrations for proper form and technique.</b><br /><br />A sense of fatigue dogs the fitness world. Many of the new programs that are tagged as groundbreaking are actually recycled ideas. <i>Foundation</i> offers something completely different for novices and athletes alike: a simple program with powerful and proven results that will remedy bad posture, alleviate back pain, and help readers break through fitness challenges and plateaus.<br /><br />Dr. Eric Goodman, a brilliant and dynamic young chiropractor, teams up with Peter Park, one of the top trainers in the United States, to radically redefine the core—shifting the focus from the front of the body to the back. Their groundbreaking approach works to strengthen the lower back and the full posterior chain and correct poor movement patterns by addressing mechanical imbalances and weaknesses. <i>Foundation</i> training involves simple movement patterns and is equipment free, creating maximum power, flexibility, and endurance.<br /><br /><br />Word-of-mouth enthusiasm has inspired both Hollywood luminaries and world-class athletes to make <i>Foundation</i> training the core of their fitness programs. Eric and Peter's client list has grown exponentially to include Lance Armstrong, NBA star Derek Fisher, world-champion surfer Kelly Slater, and actor Matthew McConaughey.",4.17,288,Kindle Edition with Audio/Video,Enhanced edition,2,https://www.goodreads.com/book/show/18931346-foundation,https://www.goodreads.com/book/show/18931346-foundation
18931638,The Victory Season: The End of World War II and the Birth of Baseball's Golden Age, , ,B008TV4NA0, ,ID,https://i.gr-assets.com/images/S/compressed.photo.goodreads.com/books/1393735824l/18931638._SX98_.jpg,https://i.gr-assets.com/images/S/compressed.photo.goodreads.com/books/1393735824l/18931638._SY75_.jpg,https://i.gr-assets.com/images/S/compressed.photo.goodreads.com/books/1393735824l/18931638.jpg,2013,4,2,"Little, Brown and Company",en-US,true,"<strong><em>""</em>Weintraub is a big-league storyteller .... He loads the bases with the kind of entertaining anecdotes, minutiae, and quotes that separate baseball-and baseball writing-from other sports."" <em>-- USA Today<br /><br /></em></strong>In the spring of 1946, Americans were ready to heal. The war was finally over, and as America's fathers and brothers were coming home so too were baseball's greats. Ted Williams, Stan Musial, and Joe DiMaggio returned with bats blazing, making the season a true classic that ended in a thrilling seven-game World Series. America also witnessed the beginning of a new era in baseball- it was a year of attendance records, the first year Yankee Stadium held night games, the last year the Green Monster wasn't green, and Jackie Robinson's first year playing in the Brooklyn Dodgers' system.<br /><br />THE VICTORY SEASON thrillingly recounts these years of baseball and war, including the little-known ""world series"" that servicemen played in a captured Hitler Youth stadium in the fall of 1945. Robert Weintraub's extensive research and vibrant storytelling enliven the legendary season that embodies what we now think of as the game's golden era.",3.96,464,Kindle Edition, ,1,https://www.goodreads.com/book/show/18931638-the-victory-season,https://www.goodreads.com/book/show/18931638-the-victory-season
