id,title,isbn,isbn13,asin,kindle_asin,country_code,image_url,small_image_url,large_image_url,publication_year,publication_month,publication_day,publisher,language_code,is_ebook,description,average_rating,num_pages,format,edition_information,text_reviews_count,url,link
37954897,"The Expertise Economy: How the smartest companies use learning to engage, compete, and succeed",1473677009,9781473677005, , ,ID,https://i.gr-assets.com/images/S/compressed.photo.goodreads.com/books/1528967152l/37954897._SX98_.jpg,https://i.gr-assets.com/images/S/compressed.photo.goodreads.com/books/1528967152l/37954897._SX50_.jpg,https://i.gr-assets.com/images/S/compressed.photo.goodreads.com/books/1528967152l/37954897.jpg,2018,9,18,Nicholas Brealey,,false,"The workplace is going through a large-scale transition with digitization, automation, and acceleration. Critical skills and expertise are imperative for companies and their employees to succeed in the future, and the most forward-thinking companies are being proactive in adapting to the shift in the workforce. Kelly Palmer, Silicon Valley thought-leader from LinkedIn, Degreed, and Yahoo, and David Blake, co-founder of Ed-tech pioneer Degreed, share their experiences and describe how some of the smartest companies in the world are making learning and expertise a major competitive advantage.<br /><br />The authors provide the latest scientific research on how people really learn and concrete examples from companies in both Silicon Valley and worldwide who are driving the conversation about how to create experts and align learning innovation with business strategy. It includes interviews with people from top companies like Google, LinkedIn, Airbnb, Unilever, NASA, and MasterCard; thought leaders in learning and education like Sal Khan and Todd Rose; as well as Thinkers50 list-makers Clayton Christensen, Daniel Pink, and Whitney Johnson. <br /><br />The <i>Expertise Economy</i> dares you to let go of outdated and traditional ways of closing the skills gap, and challenges CEOs and business leaders to embrace the urgency of re-skilling and upskilling the workforce.",4.02,240,Hardcover, ,10,https://www.goodreads.com/book/show/37954897-the-expertise-economy,https://www.goodreads.com/book/show/37954897-the-expertise-economy
37955631,The Fallen,1538761386,9781538761380, , ,ID,https://i.gr-assets.com/images/S/compressed.photo.goodreads.com/books/1518212494l/37955631._SX98_.jpg,https://i.gr-assets.com/images/S/compressed.photo.goodreads.com/books/1518212494l/37955631._SY75_.jpg,https://i.gr-assets.com/images/S/compressed.photo.goodreads.com/books/1518212494l/37955631.jpg,2018,9,11,Grand Central Publishing,,false,"<b>Star FBI detective Amos Decker and his colleague Alex Jamison must solve four increasingly bizarre murders in a dying rust belt town--and the closer they come to the truth, the deadlier it gets in this rapid-fire #1 <i>New York Times</i> bestseller.</b><br /><br />Something sinister is going on in Baronville. The rust belt town has seen four bizarre murders in the space of two weeks. Cryptic clues left at the scenes--obscure bible verses, odd symbols--have the police stumped.<br /><br />Amos Decker and his FBI colleague Alex Jamison are in Baronville visiting Alex's sister and her family. It's a bleak place: a former mill and mining town with a crumbling economy and rampant opioid addiction. Decker has only been there a few hours when he stumbles on a horrific double murder scene.<br /><br />Then the next killing hits sickeningly close to home. And with the lives of people he cares about suddenly hanging in the balance, Decker begins to realize that the recent string of deaths may be only one small piece of a much larger scheme--with consequences that will reach far beyond Baronville.<br /><br />Decker, with his singular talents, may be the only one who can crack this bizarre case. Only this time--when one mistake could cost him everything--Decker finds that his previously infallible memory may not be so trustworthy after all...<br />",4.20,464,Paperback, ,66,https://www.goodreads.com/book/show/37955631-the-fallen,https://www.goodreads.com/book/show/37955631-the-fallen
37955748,In Pieces,1549143077,9781549143076, , ,ID,https://i.gr-assets.com/images/S/compressed.photo.goodreads.com/books/1527406438l/37955748._SX98_.jpg,https://i.gr-assets.com/images/S/compressed.photo.goodreads.com/books/1527406438l/37955748._SY75_.jpg,https://i.gr-assets.com/images/S/compressed.photo.goodreads.com/books/1527406438l/37955748.jpg,2018,9,18,Hachette Audio,eng,false,"10 hours, 41 minutes <br /><br />One of the most celebrated, beloved, and enduring actors of our time, Sally Field has an infectious charm that has captivated the nation for more than five decades, beginning with her first TV role at the age of seventeen.<br /><br />With raw honesty and with all the humility and authenticity her fans have come to expect, Field brings readers behind-the-scenes for not only the highs and lows of her star-studded early career in Hollywood, but deep into the truth of her lifelong relationships--including her complicated love for her own mother. Powerful and unforgettable, <i>In Pieces</i> is an inspiring account of life as a woman in the second half of the twentieth century.<br /><br />",3.89,11,Audiobook,Unabridged,2405,https://www.goodreads.com/book/show/37955748-in-pieces,https://www.goodreads.com/book/show/37955748-in-pieces
37959891,The Real Lolita: The Kidnapping of Sally Horner and the Novel that Scandalized the World,0062661957,9780062661951, , ,ID,https://i.gr-assets.com/images/S/compressed.photo.goodreads.com/books/1536686960l/37959891._SX98_.jpg,https://i.gr-assets.com/images/S/compressed.photo.goodreads.com/books/1536686960l/37959891._SX50_.jpg,https://i.gr-assets.com/images/S/compressed.photo.goodreads.com/books/1536686960l/37959891._SX318_.jpg,2018,9,11,HarperAudio,eng,false,"7 Hours and 26 Minutes<br /><br />Vladimir Nabokov’s <em>Lolita</em> is one of the most beloved and notorious novels of all time. And yet, very few of its readers know that the subject of the novel was inspired by a real-life case: the 1948 abduction of eleven-year-old Sally Horner.<br /><br />Weaving together suspenseful crime narrative, cultural and social history, and literary investigation, <em>The Real Lolita</em> tells Sally Horner’s full story for the very first time. Drawing upon extensive investigations, legal documents, public records, and interviews with remaining relatives, Sarah Weinman uncovers how much Nabokov knew of the Sally Horner case and the efforts he took to disguise that knowledge during the process of writing and publishing <em>Lolita.</em><br /><br />Sally Horner’s story echoes the stories of countless girls and women who never had the chance to speak for themselves. By diving deeper in the publication history of <em>Lolita </em>and restoring Sally to her rightful place in the lore of the novel’s creation, <em>The Real Lolita </em>casts a new light on the dark inspiration for a modern classic.",3.40, ,Audiobook, ,450,https://www.goodreads.com/book/show/37959891-the-real-lolita,https://www.goodreads.com/book/show/37959891-the-real-lolita
37959904,Unsheltered,0062865501,9780062865502, , ,ID,https://i.gr-assets.com/images/S/compressed.photo.goodreads.com/books/1539624556l/37959904._SX98_.jpg,https://i.gr-assets.com/images/S/compressed.photo.goodreads.com/books/1539624556l/37959904._SX50_.jpg,https://i.gr-assets.com/images/S/compressed.photo.goodreads.com/books/1539624556l/37959904._SX318_.jpg,2018,10,16,HarperAudio,eng,false,"A timely novel that interweaves past and present to explore the human capacity for resiliency and compassion in times of great upheaval.<br /><br />Willa Knox has always prided herself on being the embodiment of responsibility for her family. Which is why it’s so unnerving that she’s arrived at middle age with nothing to show for her hard work and dedication but a stack of unpaid bills and an inherited brick home in Vineland, New Jersey, that is literally falling apart. The magazine where she worked has folded, and the college where her husband had tenure has closed. The dilapidated house is also home to her ailing and cantankerous Greek father-in-law and her two grown children: her stubborn, free-spirited daughter, Tig, and her dutiful debt-ridden, ivy educated son, Zeke, who has arrived with his unplanned baby in the wake of a life-shattering development.<br /><br />In an act of desperation, Willa begins to investigate the history of her home, hoping that the local historical preservation society might take an interest and provide funding for its direly needed repairs. Through her research into Vineland’s past and its creation as a Utopian community, she discovers a kindred spirit from the 1880s, Thatcher Greenwood.<br /><br />A science teacher with a lifelong passion for honest investigation, Thatcher finds himself under siege in his community for telling the truth: his employer forbids him to speak of the exciting new theory recently published by Charles Darwin. Thatcher’s friendships with a brilliant woman scientist and a renegade newspaper editor draw him into a vendetta with the town’s most powerful men. At home, his new wife and status-conscious mother-in-law bristle at the risk of scandal, and dismiss his financial worries and the news that their elegant house is structurally unsound.<br /><br /><em>Unsheltered</em> is the story of two families, in two centuries, who live at the corner of Sixth and Plum, as they navigate the challenges of surviving a world in the throes of major cultural shifts. In this mesmerizing story told in alternating chapters, Willa and Thatcher come to realize that though the future is uncertain, even unnerving, shelter can be found in the bonds of kindred—whether family or friends—and in the strength of the human spirit.",3.62, ,Audiobook, ,4564,https://www.goodreads.com/book/show/37959904-unsheltered,https://www.goodreads.com/book/show/37959904-unsheltered
37959925,Tony's Wife,0062866648,9780062866646, , ,ID,https://i.gr-assets.com/images/S/compressed.photo.goodreads.com/books/1548793837l/37959925._SX98_.jpg,https://i.gr-assets.com/images/S/compressed.photo.goodreads.com/books/1548793837l/37959925._SX50_.jpg,https://i.gr-assets.com/images/S/compressed.photo.goodreads.com/books/1548793837l/37959925._SX318_.jpg,2018,11,20,HarperAudio,eng,false,"Set in the lush Big Band era of the 1940s and World War II, this spellbinding saga from beloved <em>New York Times</em> bestselling author Adriana Trigiani tells the story of two talented working class kids who marry and become a successful singing act, until time, temptation, and the responsibilities of home and family derail their dreams<br /><br />Shortly before World War II, Chi Chi Donatelli and Saverio Armandonada meet one summer on the Jersey shore and fall in love. Both are talented and ambitious, and both share the dream of becoming singers for the legendary orchestras of the time: Glenn Miller, Tommy Dorsey, Benny Goodman. They’re soon married, and it isn’t long before Chiara and Tony find that their careers are on the way up as they navigate the glamorous worlds of night clubs, radio and television. All goes well until it becomes clear that they must make a choice: Which of them will put their ambitions aside to raise a family and which will pursue a career? And how will they cope with the impact that decision has on their lives and their marriage?<br /><br />From the Jersey shore to Las Vegas to Hollywood, and all the dance halls in between, this multi-layered story is vivid with historical color and steeped in the popular music that serves as its score. <em>Tony’s Wife</em> is a magnificent epic of life in a traditional Italian family undergoing seismic change in a fast paced, modern world. Filled with vivid, funny and unforgettable characters, this richly human story showcases Adriana Trigiani’s gifts as a storyteller and her deep understanding of family, love and the pursuit of the American dream.",3.65, ,Audiobook, ,548,https://www.goodreads.com/book/show/37959925-tony-s-wife,https://www.goodreads.com/book/show/37959925-tony-s-wife
37969722,What If This Were Enough?,0385542887,9780385542883, , ,ID,https://i.gr-assets.com/images/S/compressed.photo.goodreads.com/books/1525158777l/37969722._SX98_.jpg,https://i.gr-assets.com/images/S/compressed.photo.goodreads.com/books/1525158777l/37969722._SY75_.jpg,https://i.gr-assets.com/images/S/compressed.photo.goodreads.com/books/1525158777l/37969722._SY475_.jpg,2018,10,2,Doubleday Books,,false,"<b>By the author of the <i>New York Times</i> Love and Relationships bestseller <i>How to Be a Person in the World, </i> an impassioned and inspiring collection about the expectations of modern life and the sweet imperfections of the everyday.</b><br /><br />Heather Havrilesky's writing has been called ""whip-smart and profanely funny"" (<i>Entertainment Weekly</i>) and ""required reading for all humans"" (Celeste Ng). In her work for <i>New York, The Baffler, The New York Times Magazine, </i> and <i>The Atlantic, </i> as well as in her advice column for <i>The Cut</i>, ""Ask Polly,"" she dispenses a singular, cutting wisdom--an ability to inspire, provoke, and put a name to our most insidious cultural delusions.<br /><br /><i>What If This Were Enough?</i> is a mantra and a clarion call. In its chapters--many of them original to the book, others expanded from their initial publication--Havrilesky takes on those cultural forces that shape us. From the enforced cheer of American life to the celebration of survivalism, from the allure of materialism to our misunderstandings of romance and success, Havrilesky deconstructs some of the most poisonous and misleading messages we ingest today, all the while suggesting new ways we might navigate our increasingly bewildering world.<br /><br />Through her incisive and witty inquiries, Havrilesky emphasizes the importance of locating the miraculous within the mundane. In these timely, provocative, and often hilarious chapters, she urges readers to embrace the flawed--to connect with what already is, who we already are, what we already have. She asks us to consider: What if this were enough? Our salvation, Havrilesky asserts, can be found right here, right now, in this imperfect moment.",3.67,240,Hardcover, ,332,https://www.goodreads.com/book/show/37969722-what-if-this-were-enough,https://www.goodreads.com/book/show/37969722-what-if-this-were-enough
37970853,The Paragon Hotel,0735210756,9780735210752, , ,ID,https://i.gr-assets.com/images/S/compressed.photo.goodreads.com/books/1522566322l/37970853._SX98_.jpg,https://i.gr-assets.com/images/S/compressed.photo.goodreads.com/books/1522566322l/37970853._SY75_.jpg,https://i.gr-assets.com/images/S/compressed.photo.goodreads.com/books/1522566322l/37970853.jpg,2019,1,8,G.P. Putnam’s Sons,eng,false,"The new and exciting historial thriller by Lyndsay Faye, author of Edgar-nominated <i>Jane Steele</i> and <i>Gods of Gotham</i>, which follows Alice “Nobody” from Prohibition-era Harlem to Portland’s the Paragon Hotel.<br /><br />The year is 1921, and “Nobody” Alice James is on a cross-country train, carrying a bullet wound and fleeing for her life following an illicit drug and liquor deal gone horribly wrong. Desperate to get as far away as possible from New York City and those who want her dead, she has her sights set on Oregon: a distant frontier that seems the end of the line.<br /><br />She befriends Max, a black Pullman porter who reminds her achingly of Harlem, who leads Alice to the Paragon Hotel upon arrival in Portland. Her unlikely sanctuary turns out to be the only all-black hotel in the city, and its lodgers seem unduly terrified of a white woman on the premises. But as she meets the churlish Dr. Pendleton, the stately Mavereen, and the unforgettable club chanteuse Blossom Fontaine, she begins to understand the reason for their dread. The Ku Klux Klan has arrived in Portland in fearful numbers–burning crosses, inciting violence, electing officials, and brutalizing blacks. And only Alice, along with her new “family” of Paragon residents, are willing to search for a missing mulatto child who has mysteriously vanished into the Oregon woods.<br /><br />Why was “Nobody” Alice James forced to escape Harlem? Why do the Paragon’s denizens live in fear–and what other sins are they hiding? Where did the orphaned child who went missing from the hotel, Davy Lee, come from in the first place? And, perhaps most important, why does Blossom DuBois seem to be at the very center of this tangled web?",3.76,432,Hardcover, ,891,https://www.goodreads.com/book/show/37970853-the-paragon-hotel,https://www.goodreads.com/book/show/37970853-the-paragon-hotel
37975867,سورمه‌سرا, , , , ,ID,https://i.gr-assets.com/images/S/compressed.photo.goodreads.com/books/1516125159l/37975867._SY160_.jpg,https://i.gr-assets.com/images/S/compressed.photo.goodreads.com/books/1516125159l/37975867._SY75_.jpg,https://i.gr-assets.com/images/S/compressed.photo.goodreads.com/books/1516125159l/37975867._SY475_.jpg,2018,1,8,آگه - بان,per,false,من، شما و تمام آدم­‌هایی که می­‌شناسیم و نمی‌­شناسیم در زندگی چیزهای با ارزشی را از دست داده­‌ایم؛ گاهی با ارز­ش‌­ترین چیزمان را. این چیزهای با ارزش بعدِ از دست رفتن به کجا می‌­روند؟ به جایی به نام سورمه­ سرا. سه سال پیش همسرم را از دست دادم یعنی سه سال پیش همسرم خودش را کشت. حالا بعد از سه سال نامه‌ه­ایی از او به دستم رسیده است. خط و ربط خودش است و نامه را همین دیشب یا پریشب نوشته است. روی پاکت نامه مهر اداره پست سورمه‌سرا است. می‌­خواهم تا سورمه‌سرا بروم و ببینم که چه‌­جور جایی است؟ اگر شما هم ارزشمند­ترین چیز زندگی‌تان را از دست داده‌­اید، شال و کلاه کنید با هم برویم...,3.17,115,Paperback, ,48,https://www.goodreads.com/book/show/37975867,https://www.goodreads.com/book/show/37975867
37976541,Bad Blood: Secrets and Lies in a Silicon Valley Startup,152473165X,9781524731656, , ,ID,https://i.gr-assets.com/images/S/compressed.photo.goodreads.com/books/1556268702l/37976541._SX98_.jpg,https://i.gr-assets.com/images/S/compressed.photo.goodreads.com/books/1556268702l/37976541._SX50_.jpg,https://i.gr-assets.com/images/S/compressed.photo.goodreads.com/books/1556268702l/37976541.jpg,2018,5,21,Knopf Publishing Group,eng,false,"<b>The full inside story of the breathtaking rise and shocking collapse of a multibillion-dollar startup, by the prize-winning journalist who first broke the story and pursued it to the end in the face of pressure and threats from the CEO and her lawyers.</b><br /><br />In 2014, Theranos founder and CEO Elizabeth Holmes was widely seen as the female Steve Jobs: a brilliant Stanford dropout whose startup ""unicorn"" promised to revolutionize the medical industry with a machine that would make blood tests significantly faster and easier. Backed by investors such as Larry Ellison and Tim Draper, Theranos sold shares in a fundraising round that valued the company at $9 billion, putting Holmes's worth at an estimated $4.7 billion. There was just one problem: The technology didn't work.<br /><br />For years, Holmes had been misleading investors, FDA officials, and her own employees. When Carreyrou, working at <i>The Wall Street Journal,</i> got a tip from a former Theranos employee and started asking questions, both Carreyrou and the <i>Journal</i> were threatened with lawsuits. Undaunted, the newspaper ran the first of dozens of Theranos articles in late 2015. By early 2017, the company's value was zero and Holmes faced potential legal action from the government and her investors. Here is the riveting story of the biggest corporate fraud since Enron, a disturbing cautionary tale set amid the bold promises and gold-rush frenzy of Silicon Valley.",4.40,339,Hardcover, ,13267,https://www.goodreads.com/book/show/37976541-bad-blood,https://www.goodreads.com/book/show/37976541-bad-blood
37977136,The Virtue of Nationalism,1541645375,9781541645370, , ,ID,https://i.gr-assets.com/images/S/compressed.photo.goodreads.com/books/1531164007l/37977136._SX98_.jpg,https://i.gr-assets.com/images/S/compressed.photo.goodreads.com/books/1531164007l/37977136._SY75_.jpg,https://i.gr-assets.com/images/S/compressed.photo.goodreads.com/books/1531164007l/37977136.jpg,2018,9,4,Basic Books,,false,"<b>A leading conservative thinker argues that a nationalist order is the only realistic safeguard of liberty in the world today</b><br /><br /> Nationalism is the issue of our age. From Donald Trump's ""America First"" politics to Brexit to the rise of the right in Europe, events have forced a crucial debate: Should we fight for international government? Or should the world's nations keep their independence and self-determination? <br /><br /> In <i>The Virtue of Nationalism</i>, Yoram Hazony contends that a world of sovereign nations is the only option for those who care about personal and collective freedom. He recounts how, beginning in the sixteenth century, English, Dutch, and American Protestants revived the Old Testament's love of national independence, and shows how their vision eventually brought freedom to peoples from Poland to India, Israel to Ethiopia. It is this tradition we must restore, he argues, if we want to limit conflict and hate -- and allow human difference and innovation to flourish.",3.89,285,Hardcover, ,66,https://www.goodreads.com/book/show/37977136-the-virtue-of-nationalism,https://www.goodreads.com/book/show/37977136-the-virtue-of-nationalism
38058478,In Other Lands, , ,B06W59CR9K, ,ID,https://i.gr-assets.com/images/S/compressed.photo.goodreads.com/books/1516176465l/38058478._SX98_.jpg,https://i.gr-assets.com/images/S/compressed.photo.goodreads.com/books/1516176465l/38058478._SY75_.jpg,https://i.gr-assets.com/images/S/compressed.photo.goodreads.com/books/1516176465l/38058478._SY475_.jpg,2018,1,,Big Mouth House,eng,true,"The Borderlands aren’t like anywhere else. Don’t try to smuggle a phone or any other piece of technology over the wall that marks the Border — unless you enjoy a fireworks display in your backpack. (Ballpoint pens are okay.) There are elves, harpies, and — best of all as far as Elliot is concerned — mermaids.<br /><br /><i>""What’s your name?""<br />""Serene.""<br />""Serena?"" Elliot asked.<br />""Serene,"" said Serene. ""My full name is Serene-Heart-in-the-Chaos-of-Battle.""<br />Elliot’s mouth fell open. ""That is badass.""</i><br /><br />Elliot? Who’s Elliot? Elliot is thirteen years old. He’s smart and just a tiny bit obnoxious. Sometimes more than a tiny bit. When his class goes on a field trip and he can see a wall that no one else can see, he is given the chance to go to school in the Borderlands.<br /><br />It turns out that on the other side of the wall, classes involve a lot more weaponry and fitness training and fewer mermaids than he expected. On the other hand, there’s Serene-Heart-in-the-Chaos-of-Battle, an elven warrior who is more beautiful than anyone Elliot has ever seen, and then there’s her human friend Luke: sunny, blond, and annoyingly likeable. There are lots of interesting books. There’s even the chance Elliot might be able to change the world.<br /><br /><i>In Other Lands</i> is the exhilarating new book from beloved and bestselling author Sarah Rees Brennan. It’s a novel about surviving four years in the most unusual of schools, about friendship, falling in love, diplomacy, and finding your own place in the world — even if it means giving up your phone.",4.35,432,Kindle Edition, ,66,https://www.goodreads.com/book/show/38058478-in-other-lands,https://www.goodreads.com/book/show/38058478-in-other-lands
38085195,A Walker in the City, , , , ,ID,https://i.gr-assets.com/images/S/compressed.photo.goodreads.com/books/1516206263l/38085195._SX98_.jpg,https://i.gr-assets.com/images/S/compressed.photo.goodreads.com/books/1516206263l/38085195._SX50_.jpg,https://i.gr-assets.com/images/S/compressed.photo.goodreads.com/books/1516206263l/38085195._SX318_.jpg,1958,,,Grove Press,eng,false,Kazin’s memorable description of his life as a young man as he makes the journey from Brooklyn to “americanca”-the larger world that begins at the other end of the subway in Manhattan. A classic portrayal of the Jewish immigrant culture of the 1930s. Drawings by Marvin Bileck.<br />,3.91,176,Paperback, ,0,https://www.goodreads.com/book/show/38085195-a-walker-in-the-city,https://www.goodreads.com/book/show/38085195-a-walker-in-the-city
