id,title,isbn,isbn13,asin,kindle_asin,country_code,image_url,small_image_url,large_image_url,publication_year,publication_month,publication_day,publisher,language_code,is_ebook,description,average_rating,num_pages,format,edition_information,text_reviews_count,url,link
1555239,"No Coins, Please",0590334662,9780590334662, , ,ID,https://i.gr-assets.com/images/S/compressed.photo.goodreads.com/books/1393701883l/1555239._SX98_.jpg,https://i.gr-assets.com/images/S/compressed.photo.goodreads.com/books/1393701883l/1555239._SX50_.jpg,https://i.gr-assets.com/images/S/compressed.photo.goodreads.com/books/1393701883l/1555239.jpg,1985,3,1,Scholastic,eng,false,How much trouble can six 11-year-olds cause on a tour across the United States? A lot when Artie is along. His knack for making money impresses everyone--except the FBI.,4.28,184,Paperback, ,6,https://www.goodreads.com/book/show/1555239.No_Coins_Please,https://www.goodreads.com/book/show/1555239.No_Coins_Please
1555845,We Won't Budge: An African Exile In The World,0465017096,9780465017096, , ,ID,https://i.gr-assets.com/images/S/compressed.photo.goodreads.com/books/1185163414l/1555845._SX98_.jpg,https://i.gr-assets.com/images/S/compressed.photo.goodreads.com/books/1185163414l/1555845._SY75_.jpg,https://i.gr-assets.com/images/S/compressed.photo.goodreads.com/books/1185163414l/1555845.jpg,2003,5,22,Civitas Books,eng,false,"In this deeply personal and unflinchingly honest exploration of what it means to be African, Manthia Diawara recounts the bittersweet experience of an expatriate who no longer lives life as an ""African"" yet is the object of others' fantasies and fears about people of the dark continent. Comparing his fortunes in America with those of his cousins in Paris, Diawara assesses the way tradition and community give meaning to their lives, despite the ugliness of modern French attitudes toward Africans. At the same time, he confronts the trauma experienced by Africans in America such as Amadou Diallo. Diawara's experience of life as an African and an African American yields fresh and stunning insights about race, ethnic identity, immigration, and assimilation in the modern globalized world.This important and original book will shatter many cherished notions about what it means to experience race as an African in the world today. Beautifully written and shrewdly argued, its unsentimental view of African culture and traditions, as well as its debunking of the idealized promise of an unracialized life abroad, is certain to ignite debate.",3.91,288,Hardcover, ,5,https://www.goodreads.com/book/show/1555845.We_Won_t_Budge,https://www.goodreads.com/book/show/1555845.We_Won_t_Budge
1556109,The Malice Box ,1933648481,9781933648484, , ,ID,https://i.gr-assets.com/images/S/compressed.photo.goodreads.com/books/1348857828l/1556109._SX98_.jpg,https://i.gr-assets.com/images/S/compressed.photo.goodreads.com/books/1348857828l/1556109._SX50_.jpg,https://i.gr-assets.com/images/S/compressed.photo.goodreads.com/books/1348857828l/1556109.jpg,2007,9,1,Pegasus Books,eng,false,"When Robert is sent what seems to be a simple copper puzzle box, he has no idea his life is about to undergo a violent transformation. That night an acquaintance commits suicide in curious circumstances; the following day an old friend reveals the existence of an arcane weapon that could destroy all of New York City.<br /><br />The responsibility of hunting down and destroying this weapon, this Malice Box, lies with Robert. The weapon is primed to explode in seven days and Robert must undergo a spiritual and physical quest—a series of trials around Manhattan—in order to track down the keys that will prevent detonation. In a desperate race against the clock, Robert scours the streets of New York while plagued by doubts of the motives of those closest to him. Robert has only Terri, a beautiful and mysterious psychic, to guide him.<br /><br />Intricately plotted and brilliantly imagined, <em>The Malice Box</em> is the debut novel by a new master of the thriller.",2.79,432,Hardcover, ,28,https://www.goodreads.com/book/show/1556109.The_Malice_Box,https://www.goodreads.com/book/show/1556109.The_Malice_Box
1556303,Surviving the Fall: The Personal Journey of An AIDS Doctor,0300071264,9780300071269, , ,ID,https://i.gr-assets.com/images/S/compressed.photo.goodreads.com/books/1223625483l/1556303._SX98_.jpg,https://i.gr-assets.com/images/S/compressed.photo.goodreads.com/books/1223625483l/1556303._SX50_.jpg,https://i.gr-assets.com/images/S/compressed.photo.goodreads.com/books/1223625483l/1556303.jpg,1998,2,,Yale University Press,eng,false,"This poignant and eloquent book is a memoir of the first decade of the AIDS epidemic, written by a physician whose encounters with his dying patients allowed him to come to terms with his own losses, history, and family secrets. It is a story with an important message for anyone dealing with the challenges of living, dying, and being human.",3.87,176,Hardcover, ,1,https://www.goodreads.com/book/show/1556303.Surviving_the_Fall,https://www.goodreads.com/book/show/1556303.Surviving_the_Fall
1556580,Microtrends: The Small Forces Behind Tomorrow's Big Changes,0446580961,9780446580960, , ,ID,https://i.gr-assets.com/images/S/compressed.photo.goodreads.com/books/1442426773l/1556580._SX98_.jpg,https://i.gr-assets.com/images/S/compressed.photo.goodreads.com/books/1442426773l/1556580._SX50_.jpg,https://i.gr-assets.com/images/S/compressed.photo.goodreads.com/books/1442426773l/1556580._SX318_.jpg,2007,10,3,Twelve,eng,false,"Mark Penn argues that the biggest trends in America are the Microtrends, the smaller trends that go unnoticed or ignored. One million people can create new market for a business, spark a social movement, or effect political change. In 1996, a microtrend identified by Penn (""soccer moms"") was crucial in re-electing President Clinton. With years of experience as one of world's most highly regarded pollsters, Mark Penn identifies the new microtrends sweeping the world: <br />*Single women by choice: More often than ever before, they aren't waiting for Mr. Right. They are raising children by themselves and buying their own homes.<br />*Splitters: A growing number of middle-class residents are shuttling between two homes, creating new communities and dynamics in the real estate market.<br />*Sun Haters: Environmentalists, skin cancer survivors, and parents concerned about the impact the sun is having on our health.<br />*Philo-semites: A growing number of people want to date Jewish men and women.<br />*Classical Music Dads: Older men who are fathers in their 40's and 50's and taking on a larger role in the nurturing of their children and becoming an important factor in consumer culture for kids. <br />Penn highlights everything from religion to politics, from leisure pursuits to relationships. MICROTRENDS will take the reader deep into the worlds of polling, targeting, and psychographic analysis, reaching tantalizing conclusions through engaging analysis.",3.47,425,Hardcover, ,226,https://www.goodreads.com/book/show/1556580.Microtrends,https://www.goodreads.com/book/show/1556580.Microtrends
1557528,از ندارد تا دارا, ,9789645772787, , ,ID,https://i.gr-assets.com/images/S/compressed.photo.goodreads.com/books/1347785635l/1557528._SX98_.jpg,https://i.gr-assets.com/images/S/compressed.photo.goodreads.com/books/1347785635l/1557528._SY75_.jpg,https://i.gr-assets.com/images/S/compressed.photo.goodreads.com/books/1347785635l/1557528.jpg,2013,,,اشاره,per,false,کتاب «از ندارد تا دارا» برگزیده‌ای از از داستان‌های کوتاه علی‌اشرف درویشیان است که از سال ۱۳۵۲ تا سال ۱۳۷۳ را در برمی‌گیرد. بسیاری از داستان‌های این مجموعه به زبان انگلیسی، فرانسوی، روسی، آلمانی، عربی، کردی، ارمنی و نروژی ترجمه شده‌اند. علی‌اشرف درویشیان در سوم شهریور ۱۳۲۰ خورشیدی در شهر کرمانشاه به دنیا آمد. از همان دوران کودکی به کارهای سخت و طاقت‌فرسا پرداخت. دوره‌ی دبستان، دبیرستان و دانشسرای مقدماتی را در کرمانشاه گذراند و در سن هجده سالگی به مدت ده سال در روستای کردنشین کرمانشاه آموزگار شد. او در ضمن تدریس به تحصیل در دانشگاه تهران و دانشسرای عالی مشغول شد. از سال ۱۳۵۰ تا ۱۳۵۷ به مدت شش سال زندانی شد که با انقلاب مردم آزاد گردید.,3.66,390,Paperback, ,3,https://www.goodreads.com/book/show/1557528._,https://www.goodreads.com/book/show/1557528._
1559625,غزلیات سعدی, , , , ,ID,https://i.gr-assets.com/images/S/compressed.photo.goodreads.com/books/1543673272l/1559625._SX98_.jpg,https://i.gr-assets.com/images/S/compressed.photo.goodreads.com/books/1543673272l/1559625._SY75_.jpg,https://i.gr-assets.com/images/S/compressed.photo.goodreads.com/books/1543673272l/1559625.jpg,1963,,,شرکت نسبی حاج محمدحسین اقبال و شرکا,per,false,غزلیات سعدی؛ طیبات، بدایع، خواتیم، غزلیات قدیم و ترجیعات، ملمعات، رباعیات، مفردات,4.62,598,Hardcover, ,70,https://www.goodreads.com/book/show/1559625._,https://www.goodreads.com/book/show/1559625._
1559633,بوستان سعدی, , , , ,ID,https://i.gr-assets.com/images/S/compressed.photo.goodreads.com/books/1603558353l/1559633._SX98_.jpg,https://i.gr-assets.com/images/S/compressed.photo.goodreads.com/books/1603558353l/1559633._SX50_.jpg,https://i.gr-assets.com/images/S/compressed.photo.goodreads.com/books/1603558353l/1559633.jpg,2007,,,,,false,با معنی واژه‌ها و شرح بیت‌ها و برخی نکته‌های دستوری و ادبی,4.34,196, , ,47,https://www.goodreads.com/book/show/1559633._,https://www.goodreads.com/book/show/1559633._
1559650,دوبیتی های بابا طاهر, , , , ,ID,https://i.gr-assets.com/images/S/compressed.photo.goodreads.com/books/1185273109l/1559650.jpg,https://i.gr-assets.com/images/S/compressed.photo.goodreads.com/books/1185273109l/1559650.jpg,https://i.gr-assets.com/images/S/compressed.photo.goodreads.com/books/1185273109l/1559650.jpg,2007,,,,,false,"مجموعه‏ای از رباعیات و دوبیتی‏های باباطاهر عریان شاعر شوریده حال سده پنجم هجری است. اشعار باباطاهر را از نوع فهلویات یعنی عامیانه‏های قدیم كه از عصر باستان نمایان‏گر شور و رقص و طرب بوده و در شعر فارسی تحولات ویژه‏ای ایجاد كرده، می‏دانند، شعر عرفانی كه در این عامیانه‏ها ممزوج شده , با باباطاهر و ابوسعید آغاز و تكامل آن در عصر سنایی و عطار و اوج آن در مولوی و حافظ بوجود می‏آید. در این اشعار باباطاهر رندی كامل است كه با سرایش اشعار كوتاه غنایی، بلند مرتبگی خود را در ریاضت و معنویت و گمنامی و عشق و شور نشان می‏دهد. سادگی و بی‏پیرایگی، شفافیت، یكدست بودن مضامین عاطفی و معنوی كه همگی برای بیان حال رابطه عاشق و معشوق نشان داده می‏شوند , اشعار غنایی باباطاهر را در سطحی والا و گرانقدر در ادبیات عرفانی و فولكلوریك قرار داده است.",3.82, ,pdf, ,5,https://www.goodreads.com/book/show/1559650._,https://www.goodreads.com/book/show/1559650._
1559671,پنج دفتر شعر از مشیری, , , , ,ID,https://i.gr-assets.com/images/S/compressed.photo.goodreads.com/books/1428561222l/1559671._SX98_.jpg,https://i.gr-assets.com/images/S/compressed.photo.goodreads.com/books/1428561222l/1559671._SX50_.jpg,https://i.gr-assets.com/images/S/compressed.photo.goodreads.com/books/1428561222l/1559671.jpg,2007,,,,per,false,پنج دفتر شعر از شاعر محبوب معاصر، فریدون مشیری به نام های ؛ گناه دریا ، ابر و کوچه ، بهار را باور کن ، از خاموشی ، لحظه ها و احساس,4.15,222,pdf, ,6,https://www.goodreads.com/book/show/1559671._,https://www.goodreads.com/book/show/1559671._
1559701,لیلی و مجنون, , , , ,ID,https://i.gr-assets.com/images/S/compressed.photo.goodreads.com/books/1185223722l/1559701.jpg,https://i.gr-assets.com/images/S/compressed.photo.goodreads.com/books/1185223722l/1559701.jpg,https://i.gr-assets.com/images/S/compressed.photo.goodreads.com/books/1185223722l/1559701.jpg,2007,,,,,true,لیلی و مجنون داستان پر سوز و گداز عشقِ قیس از قبیله بنی عامر به لیلی دختر سعد است که شامل 4500 بیت و در سال 584 هجری سروده شده است,3.99, ,ebook, ,1,https://www.goodreads.com/book/show/1559701._,https://www.goodreads.com/book/show/1559701._
1561086,Walt Disney Aladdin,0717283372,9780717283378, , ,ID,https://i.gr-assets.com/images/S/compressed.photo.goodreads.com/books/1560909048l/1561086._SX98_.jpg,https://i.gr-assets.com/images/S/compressed.photo.goodreads.com/books/1560909048l/1561086._SX50_.jpg,https://i.gr-assets.com/images/S/compressed.photo.goodreads.com/books/1560909048l/1561086._SX318_.jpg,1993,1,1,Stoddart Publishing,eng,false,"A retelling of the adventures of Aladdin, who, with the aid of a genie from a magic lamp, fights an evil sorcerer and wins the hand of a beautiful princess.",4.37,40,Paperback, ,68,https://www.goodreads.com/book/show/1561086.Walt_Disney_Aladdin,https://www.goodreads.com/book/show/1561086.Walt_Disney_Aladdin
1562428,Coming Home,0340646853,9780340646854, , ,ID,https://i.gr-assets.com/images/S/compressed.photo.goodreads.com/books/1387736556l/1562428._SX98_.jpg,https://i.gr-assets.com/images/S/compressed.photo.goodreads.com/books/1387736556l/1562428._SY75_.jpg,https://i.gr-assets.com/images/S/compressed.photo.goodreads.com/books/1387736556l/1562428.jpg,1996,4,1,Hodder & Stoughton,eng,false,"Born in Colombo, Judith Dunbar spends her teenage years at boarding school, while her beloved mother and younger sister live abroad with her father. When her new friend Loveday Carey-Lewis invites Judith home for the weekend to Nancherrow, the Carey-Lewises' beautiful estate on the Cornish coast, it is love at first sight. She falls in love too with the generous Carey-Lewises themselves. With their generosity and kindness, Judith grows from naive girl to confident young woman, basking in the warm affection of a surrogate family whose flame burns brightly. But it is a flame soon to be extinguished in the gathering storm of war. And Judith herself has far to travel before at last ...coming home.",4.31,1016,Paperback, ,7,https://www.goodreads.com/book/show/1562428.Coming_Home,https://www.goodreads.com/book/show/1562428.Coming_Home
1562898,Forbes Greatest Investing Stories,0471356247,9780471356240, , ,ID,https://i.gr-assets.com/images/S/compressed.photo.goodreads.com/books/1357699724l/1562898._SX98_.jpg,https://i.gr-assets.com/images/S/compressed.photo.goodreads.com/books/1357699724l/1562898._SY75_.jpg,https://i.gr-assets.com/images/S/compressed.photo.goodreads.com/books/1357699724l/1562898.jpg,2001,9,17,John Wiley & Sons,eng,false,"An exciting follow-up to the bestselling Forbes Greatest Business Stories of All Time<br /> In the tradition of the bestselling Forbes(r) Greatest Business Stories of All Time, Forbes(r) Greatest Investing Stories focuses on profiles of fascinating people who have achieved success in a range of investing arenas. This volume chronicles old-time innovators like Benjamin Graham, the father of value investing; Hetty Green, the Street's first female stock picker; T. Rowe Price, founder of one of the largest mutual fund families; and Georges F. Doriot, the driving force behind the first publicly owned venture firm in the United States. Others featured include such modern-day legends as Tom Bailey, founder of Janus Funds; Marty Whitman, value investor supreme and manager of the Third Avenue Value Fund; and Muriel F. Siebert, the first woman admitted to the New York Stock Exchange. Packed with investing lessons, wisdom and even the story of the swindle of the century, Forbes(r) Greatest Investing Stories makes an engrossing read and a great gift for any investor or market mogul. Richard Phalon (New York, NY) has been a contributing editor at Forbes since 1980. He covered personal finance, Wall Street, urban affairs, and politics at the New York Times for sixteen years before joining Forbes. He is the author of The Takeover Barons of Wall Street and Your Money: How to Make It Work Harder Than You Do.",3.20, ,Hardcover, ,1,https://www.goodreads.com/book/show/1562898.Forbes_Greatest_Investing_Stories,https://www.goodreads.com/book/show/1562898.Forbes_Greatest_Investing_Stories
1564357,پاریس تگزاس, , , , ,ID,https://s.gr-assets.com/assets/nophoto/book/111x148-bcc042a9c91a29c1d680899eff700a03.png,https://s.gr-assets.com/assets/nophoto/book/50x75-a91bf249278a81aabab721ef782c4a74.png,https://s.gr-assets.com/assets/nophoto/book/111x148-bcc042a9c91a29c1d680899eff700a03.png,2007,,,,,false,,4.04, , , ,0,https://www.goodreads.com/book/show/1564357._,https://www.goodreads.com/book/show/1564357._
1564398,روزی با جماعت صوفیان, , , , ,ID,https://i.gr-assets.com/images/S/compressed.photo.goodreads.com/books/1575319911l/1564398._SX98_.jpg,https://i.gr-assets.com/images/S/compressed.photo.goodreads.com/books/1575319911l/1564398._SY75_.jpg,https://i.gr-assets.com/images/S/compressed.photo.goodreads.com/books/1575319911l/1564398._SY475_.jpg,1995,,,نشر مولی,per,false,رساله‏ی پیش رو، رساله‏ی فارسی «روزی با جماعت صوفیان»، اثر حکیم و عارف بزرگ قرن ششم، شیخ «شهاب‏الدین ابوالفتوح یحیی بن حبش بن امیرک سهروردی (587 ـ 549)» است. رساله‏ی حاضر، شامل عکس و پیاده‏شده‏ی صفحه به صفحه و سطر به سطر از روی نسخه‏ای در مجموعه‏ای کهن‏سال، متعلق به کتابخانه‏ی ملی، تحت شماره‏ی 2412، که تاریخ تحریر آن 659 هجری قمری و به خط «محمّدعلی بن علی دامغانی جاجرمی» می‏باشد، پیاده شده است. این نسخه، که با درگذشت مؤلف تنها هفتادودو سال فاصله دارد. صفحه نخست رساله پیش رو با صفحه نخست نسخه خطی و بقیه صفحات نیز یک به یک مطابقت دارد,4.09, ,Hardcover, ,4,https://www.goodreads.com/book/show/1564398._,https://www.goodreads.com/book/show/1564398._
1564627,قوچعلی و دختر پادشاه, , , , ,ID,https://i.gr-assets.com/images/S/compressed.photo.goodreads.com/books/1378213550l/1564627._SX98_.jpg,https://i.gr-assets.com/images/S/compressed.photo.goodreads.com/books/1378213550l/1564627._SX50_.jpg,https://i.gr-assets.com/images/S/compressed.photo.goodreads.com/books/1378213550l/1564627.jpg,1967,,,ابن سینا در تبریز,per,false,,3.62,29,Paperback,چاپ نخست,1,https://www.goodreads.com/book/show/1564627._,https://www.goodreads.com/book/show/1564627._
1564700,جنایت و مکافات, ,9789644870026, , ,ID,https://i.gr-assets.com/images/S/compressed.photo.goodreads.com/books/1222700123l/1564700._SX98_.jpg,https://i.gr-assets.com/images/S/compressed.photo.goodreads.com/books/1222700123l/1564700._SY75_.jpg,https://i.gr-assets.com/images/S/compressed.photo.goodreads.com/books/1222700123l/1564700.jpg,2007,,,خوارزمی,per,false,این کتاب داستان دانشجویی به نام «راسکولْنیکُف» را روایت می‌کند که به خاطر اصول مرتکب قتل می‌شود. بنابر انگیزه‌های پیچیده‌ای که حتی خود او از تحلیلشان عاجز است؛ زن رباخواری را همراه با خواهرش که غیر منتظره به هنگام وقوع قتل در صحنه حاضر می‌شوند، می‌کشد و پس از قتل خود را ناتوان از خرج کردن پول و جواهراتی که برداشته می‌بیند و آنها را پنهان می‌کند. بعد از چند روز بیماری و بستری شدن در خانه راسکولنیکف این تصور را که هر کس را که می‌بیند به او مظنون است و با این افکار کارش به جنون می‌رسد در این بین او عاشق سونیا دختری که به خاطر مشکلات مالی خانواده‌اش دست به تن‌فروشی زده بود می‌شود. داستایوسکی این رابطه را به نشانهٔ مهر خداوندی به انسان خطاکار استفاده کرده است و همان عشق، نیروی رستگاری بخش است .البته راسکولنیکف بعد از اقرار به گناه و زندان شدن در سیبری به این حقیقت رسید .,4.22,777,Hardcover, ,225,https://www.goodreads.com/book/show/1564700._,https://www.goodreads.com/book/show/1564700._
1565047,"Sea Strike (Amanda Garrett, #2)",0399143246,9780399143243, , ,ID,https://i.gr-assets.com/images/S/compressed.photo.goodreads.com/books/1387707276l/1565047._SX98_.jpg,https://i.gr-assets.com/images/S/compressed.photo.goodreads.com/books/1387707276l/1565047._SX50_.jpg,https://i.gr-assets.com/images/S/compressed.photo.goodreads.com/books/1387707276l/1565047.jpg,1997,12,29,Putnam Adult,eng,false,"James Cobb's first novel in the Amanda Garrett series, ""Choosers of the Slain,"" was acclaimed for its ""breathtaking sea battles"" and its achievement as ""the rare military thriller whose message is gender-blind and leading edge"" ( ""Publishers Weekly"" ). It was hailed as ""first-rate military suspence"" ( ""Kirkus Reviews,"" starred review) and ""a page-turner as hot as a Sea SLAM missile with target lock"" ( ""Library Journal"" ) When Taiwan's Nationalist navy charges accross the East China Sea in attack formation, the People's Republic rushes battalions into the defensive lines along the coast and hurriedly prepares its Han nuclear subs for deployment. Commander Amanda Lee Garrett and the hypertech stealth destroyer ""USS Cunnungham"" are ordered to lead the dangerous sub hunt. Commander Garrett employs the Cunningham's full arsenal with swift and exacting precision. She corners a Han sub in heart-stopping, slow-speed chase that results in an accident miles below the surface, and in the harrowing finale, steers her five-hundred-foot destroyer up into a narrow, muddy Shanghai estuary in pursuit of a submarine only to find her exit blocked. ""Sea Strike"" - like the novels of Tom Clancy and Dale Brown - brims with exciting ""heat-of-battle"" action and authentic, state-of-the-art stealth technology. James H. Cobb is clearly a master of the military thriller.",4.16,357,Hardcover, ,1,https://www.goodreads.com/book/show/1565047.Sea_Strike,https://www.goodreads.com/book/show/1565047.Sea_Strike
1565295,شوایک, ,9789649139852, , ,ID,https://i.gr-assets.com/images/S/compressed.photo.goodreads.com/books/1531382199l/1565295._SX98_.jpg,https://i.gr-assets.com/images/S/compressed.photo.goodreads.com/books/1531382199l/1565295._SX50_.jpg,https://i.gr-assets.com/images/S/compressed.photo.goodreads.com/books/1531382199l/1565295.jpg,2007,,,چشمه,per,false,مترجم دیگر این کتاب:حسن قائمیان,4.11,908,Hardcover, ,11,https://www.goodreads.com/book/show/1565295._,https://www.goodreads.com/book/show/1565295._
1566955,عشق در زمان وبا,9643115895,9789643115890, , ,ID,https://i.gr-assets.com/images/S/compressed.photo.goodreads.com/books/1505581396l/1566955._SX98_.jpg,https://i.gr-assets.com/images/S/compressed.photo.goodreads.com/books/1505581396l/1566955._SY75_.jpg,https://i.gr-assets.com/images/S/compressed.photo.goodreads.com/books/1505581396l/1566955.jpg,2006,,,ققنوس ,per,false,اندیشه‌های مارکز به گونه‌ای است که هرگز کسی جز خود او، نمی‌تواند در ذهن بپروراند و این از شگفتی‌های روزگار به حساب می‌آید که انسانی بتواند مطالبی را به تصویر بکشد که خوانندگان آثارش را به شگفتی و تحسین وادار سازد. به همین کتاب عشق سال‌های وبا استناد می‌کنیم. چگونه به ذهن کسی خطور می‌‌کند که بتوان شخصیت به ظاهر نخست داستان را با آن همه دانش و آگاهی، به گونه‌ای به قتل رساند که خواننده، پس از چند بار مطالعه‌ی کتاب، متوجه شود که ماجرای به آن سادگی و کاملا اتفاقی و غیرارادی نیز پایه و اساسی جز عشق نداشته است؟ چگونه می‌توان در مدتی به اندازه‌ی نیم قرن، احساسی را زنده نگه داشت که آن را عشق می‌نامند؟ چگونه می‌توان زیباترین زن خو گرفته به زندگی اشرافی را به آغوش مردی سپرد که زشتی چهره‌اش، زبانزد خاص و عام است؟,3.92,544,Hardcover, ,119,https://www.goodreads.com/book/show/1566955._,https://www.goodreads.com/book/show/1566955._
