id,title,isbn,isbn13,asin,kindle_asin,country_code,image_url,small_image_url,large_image_url,publication_year,publication_month,publication_day,publisher,language_code,is_ebook,description,average_rating,num_pages,format,edition_information,text_reviews_count,url,link
25845497,"Ruina y ascenso (Grisha, #3)",8415709374,9788415709374, , ,ID,https://i.gr-assets.com/images/S/compressed.photo.goodreads.com/books/1445613260l/25845497._SX98_.jpg,https://i.gr-assets.com/images/S/compressed.photo.goodreads.com/books/1445613260l/25845497._SX50_.jpg,https://i.gr-assets.com/images/S/compressed.photo.goodreads.com/books/1445613260l/25845497._SX318_.jpg,2015,11,15,Hidra,spa,false,"Bajo tierra, en la red de túneles y cuevas que forman la Catedral Blanca, Alina es a la vez prisionera y objeto de adoración. Está muy débil, y la idea de embarcarse en un nuevo viaje en busca del tercer amplificador, el pájaro de fuego, parece una locura. Pero su poder ha cambiado desde la última batalla, y sus nuevas habilidades podrían aterrorizar incluso a sus propios aliados.<br /><br /><b>LA CAPITAL HA CAÍDO.</b><br /><br />El Oscuro gobierna Ravka desde su trono de sombras.<br />Ahora el destino de la nación está en manos de una Invocadora del Sol sin poderes, un rastreador caído en desgracia y los últimos vestigios de lo que alguna vez fue un gran ejército de magos.<br />En las profundidades de una antigua red de túneles y cuevas, una debilitada Alina debe someterse a la dudosa protección del Apparat y de aquellos que la veneran como a una Santa. Pero tiene otros planes, como lanzarse a la caza del elusivo pájaro de fuego y comprobar si la supervivencia de cierto príncipe forajido es algo más que una esperanza.<br />Alina deberá forjar nuevas alianzas y dejar de lado antiguas rivalidades para, junto con Mal, encontrar el último amplificador de Morozova. Pero tan pronto como empieza a desvelar los secretos del Oscuro, sale a la luz un pasado que alterará para siempre su visión del lazo que los une y el poder que ella detenta. El pájaro de fuego es lo único que se interpone entre Ravka y la destrucción, y Alina podría pagar un alto precio por conseguirlo: el mismísimo futuro por el que está luchando.",4.09,505,Paperback, ,363,https://www.goodreads.com/book/show/25845497-ruina-y-ascenso,https://www.goodreads.com/book/show/25845497-ruina-y-ascenso
25852784,Evicted: Poverty and Profit in the American City,0553447432,9780553447439, , ,ID,https://i.gr-assets.com/images/S/compressed.photo.goodreads.com/books/1453060710l/25852784._SX98_.jpg,https://i.gr-assets.com/images/S/compressed.photo.goodreads.com/books/1453060710l/25852784._SX50_.jpg,https://i.gr-assets.com/images/S/compressed.photo.goodreads.com/books/1453060710l/25852784.jpg,2016,3,1,Crown Publishers,eng,false,"In <i>Evicted</i>, Princeton sociologist and MacArthur ""Genius"" Matthew Desmond follows eight families in Milwaukee as they struggle to keep a roof over their heads. <i>Evicted</i> transforms our understanding of poverty and economic exploitation while providing fresh ideas for solving one of 21st-century America's most devastating problems. Its unforgettable scenes of hope and loss remind us of the centrality of home, without which nothing else is possible.",4.47,418,Hardcover,First Edition,7609,https://www.goodreads.com/book/show/25852784-evicted,https://www.goodreads.com/book/show/25852784-evicted
25852828,A Little Life,0804172706,9780804172707, , ,ID,https://i.gr-assets.com/images/S/compressed.photo.goodreads.com/books/1453060759l/25852828._SX98_.jpg,https://i.gr-assets.com/images/S/compressed.photo.goodreads.com/books/1453060759l/25852828._SY75_.jpg,https://i.gr-assets.com/images/S/compressed.photo.goodreads.com/books/1453060759l/25852828._SY475_.jpg,2016,1,26,Anchor,eng,false,"<p><i>A Little Life</i> follows four college classmates—broke, adrift, and buoyed only by their friendship and ambition—as they move to New York in search of fame and fortune. While their relationships, which are tinged by addiction, success, and pride, deepen over the decades, the men are held together by their devotion to the brilliant, enigmatic Jude, a man scarred by an unspeakable childhood trauma. A hymn to brotherly bonds and a masterful depiction of love in the twenty-first century, Hanya Yanagihara’s stunning novel is about the families we are born into, and those that we make for ourselves.</p>",4.31,816,Paperback, ,1543,https://www.goodreads.com/book/show/25852828-a-little-life,https://www.goodreads.com/book/show/25852828-a-little-life
25852870,"Eligible: A Modern Retelling of Pride & Prejudice (The Austen Project, #4)",1400068320,9781400068326, , ,ID,https://i.gr-assets.com/images/S/compressed.photo.goodreads.com/books/1460477855l/25852870._SX98_.jpg,https://i.gr-assets.com/images/S/compressed.photo.goodreads.com/books/1460477855l/25852870._SY75_.jpg,https://i.gr-assets.com/images/S/compressed.photo.goodreads.com/books/1460477855l/25852870.jpg,2016,4,19,Random House Publishing Group,eng,false,"This version of the Bennet family and Mr. Darcy is one that you have and haven't met before: Liz is a magazine writer in her late thirties who, like her yoga instructor older sister, Jane, lives in New York City. When their father has a health scare, they return to their childhood home in Cincinnati to help and discover that the sprawling Tudor they grew up in is crumbling and the family is in disarray. <br /><br />Youngest sisters Kitty and Lydia are too busy with their CrossFit workouts and Paleo diets to get jobs. Mary, the middle sister, is earning her third online master's degree and barely leaves her room, except for those mysterious Tuesday-night outings she won't discuss. And Mrs. Bennet has one thing on her mind: how to marry off her daughters, especially as Jane's fortieth birthday fast approaches. <br /><br />Enter Chip Bingley, a handsome new-in-town doctor who recently appeared on the juggernaut reality TV dating show <i>Eligible</i>. At a Fourth of July barbecue, Chip takes an immediate interest in Jane, but Chip's friend, neurosurgeon Fitzwilliam Darcy, reveals himself to Liz to be much less charming. . . . And yet, first impressions can be deceiving.",3.61,492,Hardcover, ,8786,https://www.goodreads.com/book/show/25852870-eligible,https://www.goodreads.com/book/show/25852870-eligible
25855506,"Adulthood Is a Myth (Sarah's Scribbles, #1)",1449474195,9781449474195, , ,ID,https://i.gr-assets.com/images/S/compressed.photo.goodreads.com/books/1481219756l/25855506._SX98_.jpg,https://i.gr-assets.com/images/S/compressed.photo.goodreads.com/books/1481219756l/25855506._SX50_.jpg,https://i.gr-assets.com/images/S/compressed.photo.goodreads.com/books/1481219756l/25855506._SX318_.jpg,2016,3,8,Andrews McMeel Publishing,eng,false,"Are you a special snowflake? <br />Do you enjoy networking to advance your career? <br />Is adulthood an exciting new challenge for which you feel fully prepared? <br /><br />Ugh. Please go away.<br /><br />This book is for the rest of us. These comics document the wasting of entire beautiful weekends on the internet, the unbearable agony of holding hands on the street with a gorgeous guy, dreaming all day of getting home and back into pajamas, and wondering when, exactly, this adulthood thing begins. In other words, the horrors and awkwardnesses of young modern life.",4.12,112,Paperback, ,5746,https://www.goodreads.com/book/show/25855506-adulthood-is-a-myth,https://www.goodreads.com/book/show/25855506-adulthood-is-a-myth
25855650,"Steel: From Mine to Mill, the Metal that Made America", , ,B00YI4O726, ,ID,https://i.gr-assets.com/images/S/compressed.photo.goodreads.com/books/1436128706l/25855650._SX98_.jpg,https://i.gr-assets.com/images/S/compressed.photo.goodreads.com/books/1436128706l/25855650._SX50_.jpg,https://i.gr-assets.com/images/S/compressed.photo.goodreads.com/books/1436128706l/25855650._SX318_.jpg,2015,5,30,Zenith Press,en-US,true,"Steel provides the backbone for modern civilization - read all about its history, journey, and place in the world.<br /><br />What is steel? How does it work? Why has it been so important? Who are the people who make it? How do they make it? Steel: From Mine to Mill, the Metal that Made America answers these questions.<br /><br />Improperly understood until about 150 years ago and available until then only in small quantities, the metal itself is a delicate dance of iron crystals interspersed with carbon and - depending on intended service - other elements such as nickel, chromium, and molybdenum. Once deciphered, steel began to flow from hearths in increasing amounts for the building of railroads, steel ships, skyscrapers, and bridges, in the process raising to world economic dominance Great Britain, Germany, the United States, Japan, and the Soviet Union. The world's current largest producer is China.<br /><br />While researching this book, author Brooke C. Stoddard descended into Mesabi Iron Range open-pit iron mines, rode with 58,000 tons of iron ore on a 1,000-foot ore boat from Duluth to Cleveland, climbed to the top of the hemisphere's largest blast furnace, interviewed men as they toiled next to their furnaces of liquid steel, and walked the immense rolling mills where steel is pressed into finished products.<br /><br />Along the way, he wrote a narrative of iron and steel from pre-history through the Industrial Revolution and into the present age.<br /><br />Steel is the sinew of modern civilization.",4.10,307,Kindle Edition, ,1,https://www.goodreads.com/book/show/25855650-steel,https://www.goodreads.com/book/show/25855650-steel
25859062,Lenormand Thirty Six Cards (2015 Edition): An Introduction to the Petit Lenormand, , ,B010EAA5YQ, ,ID,https://i.gr-assets.com/images/S/compressed.photo.goodreads.com/books/1440714515l/25859062._SX98_.jpg,https://i.gr-assets.com/images/S/compressed.photo.goodreads.com/books/1440714515l/25859062._SY75_.jpg,https://i.gr-assets.com/images/S/compressed.photo.goodreads.com/books/1440714515l/25859062._SY475_.jpg,2015,6,24,CreateSpace,en-CA,true,"For over 150 years, fortune tellers in Europe and Brazil have cherished the Petit Lenormand method for its ability to answer questions on love, family, wealth, career, health and even pets! <br /> <br />In this complete and illustrated guide, written by Andy Boroveshengra, who authored the first English courses on the Petit Lenormand, the whole method is explained in easy to understand English. <br /> <br />This new edition has been revised and expanded. Topics include the method of distance and direction. With this text, you can learn two practical versions of the famous Grand Tableau, how to describe people and the real meanings of the suits and how they can be utilised in readings. Others spreads include yes and no, fans of five and nine, the pyramid and the 3 x 3. <br /> <br />Nothing is left out. Nothing is half explained.",4.26,286,Kindle Edition, ,5,https://www.goodreads.com/book/show/25859062-lenormand-thirty-six-cards-2015-edition,https://www.goodreads.com/book/show/25859062-lenormand-thirty-six-cards-2015-edition
25862750,"Year of Yes: How to Dance It Out, Stand In the Sun and Be Your Own Person", , ,B00YTG3C0G, ,ID,https://i.gr-assets.com/images/S/compressed.photo.goodreads.com/books/1471204847l/25862750._SX98_.jpg,https://i.gr-assets.com/images/S/compressed.photo.goodreads.com/books/1471204847l/25862750._SX50_.jpg,https://i.gr-assets.com/images/S/compressed.photo.goodreads.com/books/1471204847l/25862750._SX318_.jpg,2015,11,10,Simon & Schuster,,true,"The mega-talented creator of <i>Grey’s Anatomy</i> and <i>Scandal</i> and executive producer of <i>How to Get Away With Murder</i> chronicles how saying YES for one year changed her life―and how it can change yours, too.<br /><br />With three hit shows on television and three children at home, the uber-talented Shonda Rhimes had lots of good reasons to say NO when an unexpected invitation arrived. Hollywood party? No. Speaking engagement? No. Media appearances? No.<br /><br /> And there was the side benefit of saying No for an introvert like Shonda: nothing new to fear.<br /><br /> Then Shonda’s sister laid down a challenge: just for one year, try to say YES to the unexpected invitations that come your way. Shonda reluctantly agreed―and the result was nothing short of transformative. In <i>Year of Yes</i>, Shonda Rhimes chronicles the powerful impact saying Yes had on every aspect of her life―and how we can all change our lives with one little word. Yes.",4.06,337,Kindle Edition, ,402,https://www.goodreads.com/book/show/25862750-year-of-yes,https://www.goodreads.com/book/show/25862750-year-of-yes
25862989,The One-in-a-Million Boy,1472228359,9781472228352, , ,ID,https://i.gr-assets.com/images/S/compressed.photo.goodreads.com/books/1459991006l/25862989._SX98_.jpg,https://i.gr-assets.com/images/S/compressed.photo.goodreads.com/books/1459991006l/25862989._SY75_.jpg,https://i.gr-assets.com/images/S/compressed.photo.goodreads.com/books/1459991006l/25862989._SY475_.jpg,2016,4,5,Headline Review,eng,false,"<i>The story of your life never starts at the beginning. Don't they teach you anything at school?</i><br /><br />So says 104-year-old Ona to the 11-year-old boy who's been sent to help her out every Saturday morning. As he refills the bird feeders and tidies the garden shed, Ona tells him about her long life, from first love to second chances. Soon she's confessing secrets she has kept hidden for decades.<br /><br />One Saturday, the boy doesn't show up. Ona starts to think he's not so special after all, but then his father arrives on her doorstep, determined to finish his son's good deed. The boy's mother is not so far behind. Ona is set to discover that the world can surprise us at any age, and that sometimes sharing a loss is the only way to find ourselves again.",4.09,416,Hardcover, ,3368,https://www.goodreads.com/book/show/25862989-the-one-in-a-million-boy,https://www.goodreads.com/book/show/25862989-the-one-in-a-million-boy
25864535,Todos deberíamos ser feministas,8439730489,9788439730484, , ,ID,https://i.gr-assets.com/images/S/compressed.photo.goodreads.com/books/1436250862l/25864535._SX98_.jpg,https://i.gr-assets.com/images/S/compressed.photo.goodreads.com/books/1436250862l/25864535._SX50_.jpg,https://i.gr-assets.com/images/S/compressed.photo.goodreads.com/books/1436250862l/25864535._SX318_.jpg,2015,9,3,Literatura Random House,spa,false,"Ser feminista no es solo cosa de mujeres. Chimamanda Ngozi Adichie lo demuestra en este elocuente y perspicaz texto, en el que nos brinda una definición singular de lo que significa ser feminista en el siglo XXI. Con un estilo claro y directo, y sin dejar de lado el humor, esta carismática autora explora el papel de la mujer actual y apunta ideas para hacer de este mundo un lugar más justo.<br />«Hoy me gustaría pedir que empecemos a soñar con un plan para un mundo distinto. Un mundo más justo. Un mundo de hombres y mujeres más felices y más honestos consigo mismos. Y esta es la forma de empezar: tenemos que criar a nuestras hijas de otra forma. Y también a nuestros hijos.»",4.44,54,Paperback, ,234,https://www.goodreads.com/book/show/25864535-todos-deber-amos-ser-feministas,https://www.goodreads.com/book/show/25864535-todos-deber-amos-ser-feministas
25870599,El Reino,8433979329,9788433979322, , ,ID,https://i.gr-assets.com/images/S/compressed.photo.goodreads.com/books/1436335248l/25870599._SX98_.jpg,https://i.gr-assets.com/images/S/compressed.photo.goodreads.com/books/1436335248l/25870599._SY75_.jpg,https://i.gr-assets.com/images/S/compressed.photo.goodreads.com/books/1436335248l/25870599._SY475_.jpg,2015,9,9,Anagrama ,spa,false,"Hace ya tiempo que Emmanuel Carrère ha acostumbrado a sus lectores a esperar de él lo inesperado, y en esta obra monumental, casi diríamos épica y sin duda radical, aborda nada menos que la fe y los orígenes del cristianismo. En sus páginas se entrecruzan dos tramas, dos tiempos: la propia vivencia del autor, que abraza la fe en un momento de crisis personal marcado por una compleja relación amorosa y el abuso del alcohol, y la historia de Pablo el Converso y de Lucas el Evangelista. Pablo que cae del caballo, tiene una iluminación mística y pasa de lapidador de cristianos a propagador de la nueva fe que transmuta todos los valores. Y Lucas que escribe la vida de Jesús y a partir del cual nos adentramos en los evangelios primigenios, tan diferentes al Apocalipsis de fuegos artificiales de Juan. <br /><br />En estas dos historias entrecruzadas sobre la fe se suceden abundantes personajes, episodios y reflexiones: la serie televisiva sobre muertos que resucitan en la que participa Carrère como guionista, la canguro ex hippie y amiga de Philip K. Dick a la que contrata, los bolcheviques con los que compara a los primeros cristianos, webs porno, visiones eruditas sobre las fuentes originales del cristianismo, la desaparición –¿resurrección?– del cadáver de Jesús... Lo que a Carrère le interesa del cristianismo es su mensaje de transgresión de lo establecido y la desmesura de la fe. Y este libro provocador y deslumbrante es una indagación rabiosamente contemporánea sobre el cristianismo que nos habla de la perplejidad, el dogma, la duda, la redención y la construcción de una fe con mensajes rupturistas y extraños rituales.",3.92,520,Paperback, ,47,https://www.goodreads.com/book/show/25870599-el-reino,https://www.goodreads.com/book/show/25870599-el-reino
25870749,Mrs Funnybones,0143424467,9780143424468, , ,ID,https://i.gr-assets.com/images/S/compressed.photo.goodreads.com/books/1438770897l/25870749._SX98_.jpg,https://i.gr-assets.com/images/S/compressed.photo.goodreads.com/books/1438770897l/25870749._SY75_.jpg,https://i.gr-assets.com/images/S/compressed.photo.goodreads.com/books/1438770897l/25870749._SY475_.jpg,2015,8,18,Penguin Books India,eng,false,"Good morning, it’s 6 a.m. and I am wide awake because the man of the house has decided that he needs to perform a series of complex manoeuvres that involve him balancing on his left elbow. When I fell asleep last night, there was a baby lying next to me. Her smelly diaper is still wedged on my head but aside from this rather damp clue, I can't seem to find her anywhere. I could ask my mother-in-law if she has seen the baby, but she may just tell me that I need to fast on alternate Mondays, and God will deliver the baby back to me . . . Full of wit and delicious observations, Mrs Funnybones captures the life of the modern Indian woman—a woman who organizes dinner each evening, even as she goes to work all day, who runs her own life but has to listen to her Mummyji, who worries about her weight and the state of the country. Based on Twinkle Khanna’s super-hit column, Mrs Funnybones marks the debut of one of our funniest, most original voices.",3.51,235,Paperback,"First, paperback",1126,https://www.goodreads.com/book/show/25870749-mrs-funnybones,https://www.goodreads.com/book/show/25870749-mrs-funnybones
25875281,Travelogue: A Fantasy Diary Comic, , , , ,ID,https://i.gr-assets.com/images/S/compressed.photo.goodreads.com/books/1436402954l/25875281._SX98_.jpg,https://i.gr-assets.com/images/S/compressed.photo.goodreads.com/books/1436402954l/25875281._SY75_.jpg,https://i.gr-assets.com/images/S/compressed.photo.goodreads.com/books/1436402954l/25875281._SY475_.jpg,,,,,eng,false,"Collects the first eleven strips from the webcomic, Travelogue. <br /><br />Travelogue follows a group of friends as they travel an invented fantasy world, and focuses on character and world-building. <br /><br />12 pages, full-color, digitally printed.",4.38, ,Paperback, ,0,https://www.goodreads.com/book/show/25875281-travelogue,https://www.goodreads.com/book/show/25875281-travelogue
25876967,"A Symphony of Echoes (The Chronicles of St. Mary's, #2)",1910939501,9781910939505, , ,ID,https://i.gr-assets.com/images/S/compressed.photo.goodreads.com/books/1436438322l/25876967._SX98_.jpg,https://i.gr-assets.com/images/S/compressed.photo.goodreads.com/books/1436438322l/25876967._SY75_.jpg,https://i.gr-assets.com/images/S/compressed.photo.goodreads.com/books/1436438322l/25876967._SY475_.jpg,2015,8,20,Accent Press,eng,false,"Book Two in the madcap time-travel series based at the St Mary's Institute of Historical Research that seems to be everyone's cup of tea.<br /><br />In the second book in the Chronicles of St Mary's series, Max and the team visit Victorian London in search of Jack the Ripper, witness the murder of Archbishop Thomas a Becket in Canterbury Cathedral, and discover that dodos make a grockling noise when eating cucumber sandwiches.<br /><br />But they must also confront an enemy intent on destroying St Mary's - an enemy willing, if necessary, to destroy History itself to do it.",4.13,235,Paperback, ,706,https://www.goodreads.com/book/show/25876967-a-symphony-of-echoes,https://www.goodreads.com/book/show/25876967-a-symphony-of-echoes
25877074,"A Second Chance (The Chronicles of St. Mary's, #3)", ,9781910939512, , ,ID,https://i.gr-assets.com/images/S/compressed.photo.goodreads.com/books/1436440829l/25877074._SX98_.jpg,https://i.gr-assets.com/images/S/compressed.photo.goodreads.com/books/1436440829l/25877074._SY75_.jpg,https://i.gr-assets.com/images/S/compressed.photo.goodreads.com/books/1436440829l/25877074._SY475_.jpg,2015,9,24,Accent Press,eng,false,"St Mary’s is back and nothing is going right for Max. Once again, it’s just one damned thing after another.<br /><br />The action jumps from an encounter with a mirror-stealing Isaac Newton to the bloody battlefield at Agincourt. Discover how a simple fact-finding assignment to witness the ancient and murderous cheese- rolling ceremony in Gloucester can result in CBC – concussion by cheese. The long awaited jump to Bronze Age Troy ends in personal catastrophe for Max and just when it seems things couldn’t get any worse – it’s back to the Cretaceous Period again to confront an old enemy who has nothing to lose.<br /><br />So, make the tea, grab the chocolate biscuits, settle back and discover exactly why the entire history department has painted itself blue …",4.29,298,Paperback, ,489,https://www.goodreads.com/book/show/25877074-a-second-chance,https://www.goodreads.com/book/show/25877074-a-second-chance
25877103,"A Trail Through Time (The Chronicles of St. Mary's, #4)",1910939498,9781910939499, , ,ID,https://i.gr-assets.com/images/S/compressed.photo.goodreads.com/books/1436441543l/25877103._SX98_.jpg,https://i.gr-assets.com/images/S/compressed.photo.goodreads.com/books/1436441543l/25877103._SY75_.jpg,https://i.gr-assets.com/images/S/compressed.photo.goodreads.com/books/1436441543l/25877103._SY475_.jpg,2015,9,24,Accent Press,eng,false,"St Mary’s is back and is facing a battle to survive in this, the fourth instalment of the Chronicles.<br /><br />Max and Leon are re-united and looking forward to a peaceful lifetime together. But, sadly, they don’t even make it to lunchtime.<br /><br />The action races from 17th century London to Ancient Egypt and from Pompeii to 14th century Southwark as they’re pursued up and down the timeline, playing a perilous game of hide and seek until they’re finally forced to take refuge at St Mary’s – where new dangers await them.<br /><br />As usual, there are plenty of moments of humour, but the final, desperate, Battle of St Mary’s is in grim earnest. Overwhelmed and outnumbered and with the building crashing down around them, how can St Mary’s possibly survive?<br /><br />So, make sure the tea’s good and strong…",4.31,379,Paperback, ,331,https://www.goodreads.com/book/show/25877103-a-trail-through-time,https://www.goodreads.com/book/show/25877103-a-trail-through-time
25877522,"No Time Like the Past (The Chronicles of St. Mary's, #5)",1783759054,9781783759057, , ,ID,https://i.gr-assets.com/images/S/compressed.photo.goodreads.com/books/1436450342l/25877522._SX98_.jpg,https://i.gr-assets.com/images/S/compressed.photo.goodreads.com/books/1436450342l/25877522._SY75_.jpg,https://i.gr-assets.com/images/S/compressed.photo.goodreads.com/books/1436450342l/25877522._SY475_.jpg,2015,10,22,Accent Press,eng,false,"Jodi Taylor’s best-selling series The Chronicles of St Mary is back with a bang…<br /><br />St Mary’s has been rebuilt and it’s business as usual for the History department.<br /><br />But first, there’s the little matter of a seventeenth-century ghost that only Mr Markham can see.<br /><br />Not to mention the minor inconvenience of being trapped in the Great Fire of London…and an unfortunately-timed comfort break at Thermopylae leaving the fate of the western world hanging in the balance.<br /><br />Re-join Max’s madcap journey through time in Jodi Taylor’s fifth inter-dimensional instalment No Time Like the Past.",4.35,374,Paperback, ,305,https://www.goodreads.com/book/show/25877522-no-time-like-the-past,https://www.goodreads.com/book/show/25877522-no-time-like-the-past
