id,title,isbn,isbn13,asin,kindle_asin,country_code,image_url,small_image_url,large_image_url,publication_year,publication_month,publication_day,publisher,language_code,is_ebook,description,average_rating,num_pages,format,edition_information,text_reviews_count,url,link
2755020,Alone with All That Could Happen: Rethinking Conventional Wisdom about the Craft of Fiction,1582975388,9781582975382, , ,ID,https://i.gr-assets.com/images/S/compressed.photo.goodreads.com/books/1432528155l/2755020._SX98_.jpg,https://i.gr-assets.com/images/S/compressed.photo.goodreads.com/books/1432528155l/2755020._SY75_.jpg,https://i.gr-assets.com/images/S/compressed.photo.goodreads.com/books/1432528155l/2755020._SY475_.jpg,2008,7,8,Writer's Digest Books,en-US,false,"In a satisfying story or novel, all of the pieces seem to fit together so effortlessly, so seamlessly, that it's easy to find yourself wondering, ""How on earth did the author do this?"" The answer is simple: He sat alone at his desk, considered an array of options, and made smart, careful choices.<br /><br />In <i>Alone With All That Could Happen</i>, award-winning author and respected creative writing professor <b>David Jauss</b> addresses overlooked or commonly misunderstood aspects of fiction writing, offering practical information and advice that will help you make smart creative and technical decisions about such topics as:<br /><br /><br />writing prose whose syntax and rhythm create a ""soundtrack"" for the story it tells<br />choosing the right point of view to create the appropriate degree of ""distance"" between your characters and the reader<br />writing valid and convincing epiphanies<br />harnessing the power of contradiction in the creative process<br />In one thought-provoking essay after another, Jauss sorts through unique fiction-writing conundrums, including how to create those exquisite intersections between truth and fabrication that make all great works of fiction so much more resonant and powerful than fiction that follows the generic ""write what you know"" approach that's so often preached.",4.31,241,Hardcover, ,20,https://www.goodreads.com/book/show/2755020-alone-with-all-that-could-happen,https://www.goodreads.com/book/show/2755020-alone-with-all-that-could-happen
2756451,La feria,9682709008,9789682709005, , ,ID,https://i.gr-assets.com/images/S/compressed.photo.goodreads.com/books/1233509960l/2756451.jpg,https://i.gr-assets.com/images/S/compressed.photo.goodreads.com/books/1233509960l/2756451._SY75_.jpg,https://i.gr-assets.com/images/S/compressed.photo.goodreads.com/books/1233509960l/2756451.jpg,2003,4,14,Joaquín Mortiz,spa,false,"Arreola, uno de los mejores escritores de ficción breve de México, nos ofrece en La feria, un texto fenomenal que pertenece al género de los apocalipsis de bolsillo. Sus páginas recogen fragmentos, textuales o deformados, de la más variada tradición oral y escrita, procedente sobre todo de Ezequiel y de Isaías, de los Apócrifos, del cartulario colonial y de los anales de un pueblo imaginado al sur de Jalisco. <br />Se trata en realidad de puros recuerdos de infancia, de cosas leídas, vistas y oídas, puestas una tras otra, al azar. La fidelidad a los giros populares y el realismo mágico de ciertos personajes son tal vez las mejores cualidades de este libro desordenado, múltiple y singular, breve y abundante.<br />",3.94,183,Hardcover, ,31,https://www.goodreads.com/book/show/2756451-la-feria,https://www.goodreads.com/book/show/2756451-la-feria
2761171,Company of Liars,0718153227,9780718153229, , ,ID,https://i.gr-assets.com/images/S/compressed.photo.goodreads.com/books/1327931234l/2761171._SX98_.jpg,https://i.gr-assets.com/images/S/compressed.photo.goodreads.com/books/1327931234l/2761171._SY75_.jpg,https://i.gr-assets.com/images/S/compressed.photo.goodreads.com/books/1327931234l/2761171.jpg,2008,1,31,Michael Joseph,eng,false,"<b>In this extraordinary novel, Karen Maitland delivers a dazzling reinterpretation of Chaucer's <em>Canterbury Tales</em>, an ingenious alchemy of history, mystery, and powerful human drama.</b><br /><br />The year is 1348. The Black Plague grips the country. In a world ruled by faith and fear, nine desperate strangers, brought together by chance, attempt to outrun the certain death that is running inexorably toward them.<br /><br />Each member of this motley company has a story to tell. From Camelot, the relic-seller who will become the group's leader, to Cygnus, the one-armed storyteller . . . from the strange, silent child called Narigorm to a painter and his pregnant wife, each has a secret. None is what they seem. And one among them conceals the darkest secret of all—propelling these liars to a destiny they never saw coming.<br /><br />Magical, heart-quickening, and raw, <em>Company of Liars</em> is a work of vaulting imagination from a powerful new voice in historical fiction.<br /><br />(Length: 17 hours, 40 minutes)",3.82,576,Hardcover, ,1157,https://www.goodreads.com/book/show/2761171-company-of-liars,https://www.goodreads.com/book/show/2761171-company-of-liars
2763494,The Man Who Loved China: The Fantastic Story of the Eccentric Scientist Who Unlocked the Mysteries of the Middle Kingdom,0060884592,9780060884598, , ,ID,https://i.gr-assets.com/images/S/compressed.photo.goodreads.com/books/1348219384l/2763494._SX98_.jpg,https://i.gr-assets.com/images/S/compressed.photo.goodreads.com/books/1348219384l/2763494._SY75_.jpg,https://i.gr-assets.com/images/S/compressed.photo.goodreads.com/books/1348219384l/2763494.jpg,2008,5,6,Harper (NYC),eng,false,"In illuminating detail, Winchester, bestselling author of <em>The Professor &amp; the Madman</em> (""Elegant &amp; scrupulous""—<em>NY Times Book Review</em>) &amp; <em>Krakatoa</em> (""A mesmerizing page-turner""—<em>Time</em>) tells the story of Joseph Needham, the Cambridge scientist who unlocked the most closely held secrets of China, long the world's most technologically advanced country.<br /><br /> No cloistered don, this tall, married Englishman was a freethinking intellectual. A nudist, he was devoted to quirky folk dancing. In 1937, while working as a biochemist at Cambridge, he fell in love with a visiting Chinese student, with whom he began a lifelong affair. His mistress persuaded him to travel to her home country, where he embarked on a series of expeditions to the frontiers of the ancient empire. He searched for evidence to bolster a conviction that the Chinese were responsible for hundreds of humankind's most familiar innovations—including printing, the compass, explosives, suspension bridges, even toilet paper—often centuries before others. His journeys took him across war-torn China, consolidating his admiration for the Chinese. After the war, he determined to announce what he'd discovered &amp; began writing <em>Science &amp; Civilization in China</em>, describing the country's long history of invention &amp; technology. By the time he died, he'd produced, almost single-handedly, 17 volumes, making him the greatest one-man encyclopedist ever.<br /><br /> Epic &amp; intimate, <em>The Man Who Loved China</em> tells the sweeping story of China thru Needham's life. Here's a tale of what makes men, nations &amp; humankind great—related by one of the world's best storytellers.",3.81,316,Hardcover,First Harper Perennial Edition,507,https://www.goodreads.com/book/show/2763494-the-man-who-loved-china,https://www.goodreads.com/book/show/2763494-the-man-who-loved-china
2766546,The Paris Enigma,0061479675,9780061479670, , ,ID,https://i.gr-assets.com/images/S/compressed.photo.goodreads.com/books/1349053044l/2766546._SX98_.jpg,https://i.gr-assets.com/images/S/compressed.photo.goodreads.com/books/1349053044l/2766546._SY75_.jpg,https://i.gr-assets.com/images/S/compressed.photo.goodreads.com/books/1349053044l/2766546.jpg,2008,11,11,Harper,eng,false,"<blockquote>In the tradition of Caleb Carr's <em>The Alienist</em> and Eric Larsen's <em>The Devil in the White City</em> comes a gripping tale of murder and the art of crime solving, atmospherically set during the 1889 Paris World's Fair.<br /><br /></blockquote>It is 1889, and the entire world breathlessly anticipates the Paris World's Fair and the opening of Monsieur Eiffel's iconic tower. The Twelve Detectives—a society of the twelve most famous, compelling, and dazzling detectives from around the world—have been asked to discuss the secrets of their trade as part of the fair's lineup of events. The Twelve travel to Paris to convene as a single body for the first time, but also, if some whispers are to be believed, to debate the very philosophy that underlies their pursuit of the world's most wanted criminals.<br /><br />But one detective is conspicuously absent: the legendary founding member of The Twelve, Renato Craig, will not attend. In his place he sends his novice assistant, Sigmundo Salvatrio—son of a shoemaker, a lifelong detective-arts devotee, and the only remaining student of Craig's famed Academy for Detectives in Buenos Aires. Salvatrio arrives in Paris, carrying a secret message meant only for Craig's best friend and cofounder of The Twelve, the brilliant, brooding, and fiercely competitive Viktor Arzaky.<br /><br />When a member of The Twelve is discovered dead at the foot of the gleaming Eiffel Tower, the first in what turns into a series of grisly murders, Arzaky and Salvatrio find themselves in a race against time around glorious fin de siècle Paris, encountering all manner of secret societies, solving philosophical puzzles, while also trying to save a dangerously beautiful woman.<br /><br />The pair soon realizes that the stakes involved are unimaginably high; they must not only catch the stalking murderer but also alter the fate of their precious brotherhood.<br /><br />Written in a strikingly original voice, and poignantly evoking a world about to lose its innocence forever, The Paris Enigma opens a window onto crime solving's early days, when wit, common sense, and intelligence were the only tools a detective could rely on.",3.30,256,Hardcover, ,81,https://www.goodreads.com/book/show/2766546-the-paris-enigma,https://www.goodreads.com/book/show/2766546-the-paris-enigma
2766862,Instrucciones para vivir en México,9682704057,9789682704055, , ,ID,https://i.gr-assets.com/images/S/compressed.photo.goodreads.com/books/1497751406l/2766862._SX98_.jpg,https://i.gr-assets.com/images/S/compressed.photo.goodreads.com/books/1497751406l/2766862._SY75_.jpg,https://i.gr-assets.com/images/S/compressed.photo.goodreads.com/books/1497751406l/2766862._SY475_.jpg,1990,10,,Joaquín Mortiz,spa,false,"<p>Se concentran en este volumen una seleccion de los articulos que Jorge Ibargüengoitia escribio para el periodico Excelsior de 1969 a 1976. <br />Este material explora el aspecto ''sentimental e ironico'', en palabras de Guillermo Sheridan, de la vida en un pais como Mexico. A pesar de ser casi siempre Ibargüengoitia mismo el directamente afectado por los amagos de la burocracia, las fallas de los servicios publicos, stcetera, su capacidad de mirar dichos avatares con desprendimiento, lo lleva a extraer del tedio y el mal humor que generalmente producen, anecdotas divertidas y sobre todo criticas.</p>",4.19,295,Paperback,1st edition Obras de Jorge Ibargüengoitia,68,https://www.goodreads.com/book/show/2766862-instrucciones-para-vivir-en-m-xico,https://www.goodreads.com/book/show/2766862-instrucciones-para-vivir-en-m-xico
2767052,"The Hunger Games (The Hunger Games, #1)",0439023483,9780439023481, , ,ID,https://i.gr-assets.com/images/S/compressed.photo.goodreads.com/books/1586722975l/2767052._SX98_.jpg,https://i.gr-assets.com/images/S/compressed.photo.goodreads.com/books/1586722975l/2767052._SY75_.jpg,https://i.gr-assets.com/images/S/compressed.photo.goodreads.com/books/1586722975l/2767052.jpg,2008,9,14,Scholastic Press,eng,false,"<b>Could you survive on your own in the wild, with every one out to make sure you don't live to see the morning?</b><br /><br />In the ruins of a place once known as North America lies the nation of Panem, a shining Capitol surrounded by twelve outlying districts. The Capitol is harsh and cruel and keeps the districts in line by forcing them all to send one boy and one girl between the ages of twelve and eighteen to participate in the annual Hunger Games, a fight to the death on live TV.<br /><br />Sixteen-year-old Katniss Everdeen, who lives alone with her mother and younger sister, regards it as a death sentence when she steps forward to take her sister's place in the Games. But Katniss has been close to dead before—and survival, for her, is second nature. Without really meaning to, she becomes a contender. But if she is to win, she will have to start making choices that weight survival against humanity and life against love.",4.33,374,Hardcover,First Edition,155812,https://www.goodreads.com/book/show/2767052-the-hunger-games,https://www.goodreads.com/book/show/2767052-the-hunger-games
2767330,Voyage de Babar,2010025180,9782010025181, , ,ID,https://i.gr-assets.com/images/S/compressed.photo.goodreads.com/books/1371350638l/2767330._SX98_.jpg,https://i.gr-assets.com/images/S/compressed.photo.goodreads.com/books/1371350638l/2767330._SX50_.jpg,https://i.gr-assets.com/images/S/compressed.photo.goodreads.com/books/1371350638l/2767330.jpg,2002,1,1,Distribooks,fre,false,,4.67,0,Hardcover, ,0,https://www.goodreads.com/book/show/2767330-voyage-de-babar,https://www.goodreads.com/book/show/2767330-voyage-de-babar
2767368,آینه در آینه, , , , ,ID,https://i.gr-assets.com/images/S/compressed.photo.goodreads.com/books/1221896297l/2767368._SX98_.jpg,https://i.gr-assets.com/images/S/compressed.photo.goodreads.com/books/1221896297l/2767368._SY75_.jpg,https://i.gr-assets.com/images/S/compressed.photo.goodreads.com/books/1221896297l/2767368.jpg,1991,,,نشر چشمه,per,false,برگزیده‌ی اشعار هوشنگ ابتهاج به انتخاب دکتر محمدرضا شفیعی کدکنی,4.17,221, , ,35,https://www.goodreads.com/book/show/2767368,https://www.goodreads.com/book/show/2767368
2767793,"The Hero of Ages (Mistborn, #3)",0765316897,9780765316899, , ,ID,https://i.gr-assets.com/images/S/compressed.photo.goodreads.com/books/1480717763l/2767793._SX98_.jpg,https://i.gr-assets.com/images/S/compressed.photo.goodreads.com/books/1480717763l/2767793._SY75_.jpg,https://i.gr-assets.com/images/S/compressed.photo.goodreads.com/books/1480717763l/2767793._SY475_.jpg,2008,10,14,Tor Books,eng,false,"Tricked into releasing the evil spirit Ruin while attempting to close the Well of Ascension, new emperor Elend Venture and his wife, the assassin Vin, are now hard-pressed to save the world.",4.48,572,Hardcover, ,10545,https://www.goodreads.com/book/show/2767793-the-hero-of-ages,https://www.goodreads.com/book/show/2767793-the-hero-of-ages
2769831,A Couple of Boys Have the Best Week Ever,0152060200,9780152060206, , ,ID,https://i.gr-assets.com/images/S/compressed.photo.goodreads.com/books/1442806041l/2769831._SX98_.jpg,https://i.gr-assets.com/images/S/compressed.photo.goodreads.com/books/1442806041l/2769831._SX50_.jpg,https://i.gr-assets.com/images/S/compressed.photo.goodreads.com/books/1442806041l/2769831._SX318_.jpg,2008,3,1,HMH Books for Young Readers,en-US,false,"<b>A 2009 Caldecott Honor Book</b><br /><br /> When James and Eamon go to a week of Nature Camp and stay at Eamon's grandparents' house, it turns out that their free time spent staying inside, eating waffles, and playing video games is <i>way</i> more interesting than nature. But sometimes things work out best when they <i>don't</i> go exactly as planned.  <br /><br /> This Caldecott Honor-winning book is a moving and hilarious celebration of young boys, childhood friendships, and the power of the imagination, where Marla Frazee captures the very essence of summer vacation and what it means to be a kid.",3.91,32,Hardcover, ,409,https://www.goodreads.com/book/show/2769831-a-couple-of-boys-have-the-best-week-ever,https://www.goodreads.com/book/show/2769831-a-couple-of-boys-have-the-best-week-ever
2769844,The Fidelity of Betrayal: Towards a Church Beyond Belief,1557255601,9781557255600, , ,ID,https://i.gr-assets.com/images/S/compressed.photo.goodreads.com/books/1432303062l/2769844._SX98_.jpg,https://i.gr-assets.com/images/S/compressed.photo.goodreads.com/books/1432303062l/2769844._SY75_.jpg,https://i.gr-assets.com/images/S/compressed.photo.goodreads.com/books/1432303062l/2769844._SY475_.jpg,2008,6,1,Paraclete Press,en-US,false,"<b></b>""About 30 years ago, I came across the evocative phrase 'religionless Christianity' in Dietrich Bonhoeffer's later writings, and it has stayed with me ever since. In his new book <i>The Fidelity of Betrayal</i>, Peter Rollins has teased out - as Bonhoeffer never had the chance to do - profound possibilities hidden in the phrase. As a huge fan of Peter's first book, I find his second no less thoughtful, stimulating, and at times unsettling - always in a most (de)constructive way. His subversive parables, his clever turns of phrase, and his beguiling clarity all conspire to tempt the reader into that most fertile and terrifying of activities - to think to the very rim of one's understanding, and then to faithfully imagine the Truth that lies far beyond.""<br /><br />- Brian McLaren, author/activist (<a target=""_blank"" rel=""noopener nofollow"" href=""http://www.brianmclaren.net"">www.brianmclaren.net</a>) What if one of the core demands of a radical Christianity lay in a call for its betrayal, while the ultimate act of affirming God required the forsaking of God? And what if fidelity to the Judeo-Christian Scriptures demanded their renunciation? In short, what would it mean if the only way of finding real faith involved betraying it with a kiss?<br /><br />Employing the insights of mysticism and deconstructive theory, <i>The Fidelity of Betrayal</i> delves into the subversive and revolutionary nature of a Christianity that dwells within the church while simultaneously undermining it.",4.17,196,Paperback, ,31,https://www.goodreads.com/book/show/2769844-the-fidelity-of-betrayal,https://www.goodreads.com/book/show/2769844-the-fidelity-of-betrayal
2770176,East Of The Mountains,0754003981,9780754003984, , ,ID,https://s.gr-assets.com/assets/nophoto/book/111x148-bcc042a9c91a29c1d680899eff700a03.png,https://s.gr-assets.com/assets/nophoto/book/50x75-a91bf249278a81aabab721ef782c4a74.png,https://s.gr-assets.com/assets/nophoto/book/111x148-bcc042a9c91a29c1d680899eff700a03.png,1999,,,Chivers Audio Books,eng,false,"Dr Ben Givens had been a heart surgeon, admired in his field. The fallibility of the human body had been distant from him until a diagnosis of his own condition, which he concealed even from his family. Therefore, when Ben left his home in Seattle, he never intended to return. It was to be a journey past snow-covered mountains to a place of canyons, where, on the verges of the Columbia River, Ben had entered the world and would now take his leave of it. What transpired was not the journey he had anticipated.",3.61,10,Audio Cassette, ,1,https://www.goodreads.com/book/show/2770176-east-of-the-mountains,https://www.goodreads.com/book/show/2770176-east-of-the-mountains
2774104,"Conquistador: Hernán Cortés, King Montezuma, and the Last Stand of the Aztecs",055380538X,9780553805383, , ,ID,https://i.gr-assets.com/images/S/compressed.photo.goodreads.com/books/1320469597l/2774104._SX98_.jpg,https://i.gr-assets.com/images/S/compressed.photo.goodreads.com/books/1320469597l/2774104._SY75_.jpg,https://i.gr-assets.com/images/S/compressed.photo.goodreads.com/books/1320469597l/2774104.jpg,2008,6,24,Bantam,eng,false,"In an astonishing work of scholarship that reads like an adventure thriller, historian Buddy Levy records the last days of the Aztec empire and the two men at the center of an epic clash of cultures. <br /><b>
  <br />
</b><i>“I and my companions suffer from a disease of the heart which can be cured only with gold.”</i> —<i>Hernán Cortés<br /><br /></i>It was a moment unique in human history, the face-to-face meeting between two men from civilizations a world apart. Only one would survive the encounter. In 1519, Hernán Cortés arrived on the shores of Mexico with a roughshod crew of adventurers and the intent to expand the Spanish empire. Along the way, this brash and roguish conquistador schemed to convert the native inhabitants to Catholicism and carry off a fortune in gold. That he saw nothing paradoxical in his intentions is one of the most remarkable—and tragic—aspects of this unforgettable story of conquest.<br /><br />In Tenochtitlán, the famed City of Dreams, Cortés met his Aztec counterpart, Montezuma: king, divinity, ruler of fifteen million people, and commander of the most powerful military machine in the Americas. Yet in less than two years, Cortés defeated the entire Aztec nation in one of the most astonishing military campaigns ever waged. Sometimes outnumbered in battle thousands-to-one, Cortés repeatedly beat seemingly impossible odds. Buddy Levy meticulously researches the mix of cunning, courage, brutality, superstition, and finally disease that enabled Cortés and his men to survive.<b><br /><br />Conquistador </b>is the story of a lost kingdom—a complex and sophisticated civilization where floating gardens, immense wealth, and reverence for art stood side by side with bloodstained temples and gruesome rites of human sacrifice. It’s the story of Montezuma—proud, spiritual, enigmatic, and doomed to misunderstand the stranger he thought a god. Epic in scope, as entertaining as it is enlightening,<i> Conquistador</i> is history at its most riveting.<br /><br /><br /><i>From the Hardcover edition.</i>",4.19,432,Hardcover, ,183,https://www.goodreads.com/book/show/2774104-conquistador,https://www.goodreads.com/book/show/2774104-conquistador
2776527,Traffic: Why We Drive the Way We Do and What It Says About Us,0307264785,9780307264787, , ,ID,https://i.gr-assets.com/images/S/compressed.photo.goodreads.com/books/1320428955l/2776527._SX98_.jpg,https://i.gr-assets.com/images/S/compressed.photo.goodreads.com/books/1320428955l/2776527._SX50_.jpg,https://i.gr-assets.com/images/S/compressed.photo.goodreads.com/books/1320428955l/2776527.jpg,2008,7,29,Knopf Publishing Group,eng,false,"Would you be surprised that road rage can be good for society? Or that most crashes happen on sunny, dry days? That our minds can trick us into thinking the next lane is moving faster? Or that you can gauge a nation s driving behavior by its levels of corruption? These are only a few of the remarkable dynamics that Tom Vanderbilt explores in this fascinating tour through the mysteries of the road. <br />Based on exhaustive research and interviews with driving experts and traffic officials around the globe, <i>Traffic</i> gets under the hood of the everyday activity of driving to uncover the surprisingly complex web of physical, psychological, and technical factors that explain how traffic works, why we drive the way we do, and what our driving says about us. Vanderbilt examines the perceptual limits and cognitive underpinnings that make us worse drivers than we think we are. He demonstrates why plans to protect pedestrians from cars often lead to more accidents. He shows how roundabouts, which can feel dangerous and chaotic, actually make roads safer and reduce traffic in the bargain. He uncovers who is more likely to honk at whom, and why. He explains why traffic jams form, outlines the unintended consequences of our quest for safety, and even identifies the most common mistake drivers make in parking lots. <br />The car has long been a central part of American life; whether we see it as a symbol of freedom or a symptom of sprawl, we define ourselves by what and how we drive. As Vanderbilt shows, driving is a provocatively revealing prism for examining how our minds work and the ways in which we interact with one another. Ultimately, <i>Traffic</i> is about more than driving: it s about human nature. This book will change the way we see ourselves and the world around us. And who knows? It may even make us better drivers.""",3.71,402,Hardcover, ,1035,https://www.goodreads.com/book/show/2776527-traffic,https://www.goodreads.com/book/show/2776527-traffic
2777633,"Le Barbare (Thorgal, #27)",2803617757,9782803617753, , ,ID,https://i.gr-assets.com/images/S/compressed.photo.goodreads.com/books/1332610730l/2777633._SX98_.jpg,https://i.gr-assets.com/images/S/compressed.photo.goodreads.com/books/1332610730l/2777633._SX50_.jpg,https://i.gr-assets.com/images/S/compressed.photo.goodreads.com/books/1332610730l/2777633.jpg,2002,11,2,Le Lombard,fre,false,"Thorgal et les siens ont été capturés par des marchands d'esclaves. Des acheteurs se présentent, parmi lesquels l'intendant du gouverneur d'une province romaine à la recherche de ""Barbares"" en vue d'une surprenante partie de chasse.<br /><br />A 18 ans, les jeunes nobles de la cour passent leurs examens d'officier : l'une des épreuves consiste à poursuivre et abattre des prisonniers. Cela permet d'évaluer leur habileté à tirer à l'arc. Thorgal sera l'un des gibiers !",3.79, ,Hardcover, ,5,https://www.goodreads.com/book/show/2777633-le-barbare,https://www.goodreads.com/book/show/2777633-le-barbare
