id,title,isbn,isbn13,asin,kindle_asin,country_code,image_url,small_image_url,large_image_url,publication_year,publication_month,publication_day,publisher,language_code,is_ebook,description,average_rating,num_pages,format,edition_information,text_reviews_count,url,link
1456662,داستان خرس‌های پاندا به روايت يك ساكسيفونيت كه دوست‌دختری در فرانكفورت دارد, , , , ,ID,https://i.gr-assets.com/images/S/compressed.photo.goodreads.com/books/1213549313l/1456662._SX98_.jpg,https://i.gr-assets.com/images/S/compressed.photo.goodreads.com/books/1213549313l/1456662._SX50_.jpg,https://i.gr-assets.com/images/S/compressed.photo.goodreads.com/books/1213549313l/1456662.jpg,2006,,,ماه‌ریز,per,false,"The premise is that of a romantic comedy: A slacker-ly young man wakes up with a girl in his bed whose name he does not remember. Nor does he remember where and how they met, their journey to his squalid apartment or what they did after they got there. The young woman is happy to explain, however—indeed, so reassuring is her recollection of the facts that he pleads with her to stay. She promises to return that night. He promises to wait for her.<br /><br />Nine nights are a lifetime to a man and woman brought together under curious circumstances. Bound by a promise and a bottle of wine they travel through a dream like caged lightening. Together they discover sometimes, all you need to approach perfection is a saxophone and a broken alarm clock.",3.99,88, , ,7,https://www.goodreads.com/book/show/1456662._,https://www.goodreads.com/book/show/1456662._
1456757,The Pregnant Widow,0224076124,9780224076128, , ,ID,https://i.gr-assets.com/images/S/compressed.photo.goodreads.com/books/1329535179l/1456757._SX98_.jpg,https://i.gr-assets.com/images/S/compressed.photo.goodreads.com/books/1329535179l/1456757._SY75_.jpg,https://i.gr-assets.com/images/S/compressed.photo.goodreads.com/books/1329535179l/1456757.jpg,2010,2,4,Jonathan Cape,en-GB,false,"The 1960s, as is well known, saw the launch of the sexual revolution, which radically affected the lives of every Westerner fortunate enough to be born after the Second World War. But a revolution is a revolution - contingent and sanguinary. In the words of the Russian thinker Alexander Herzen: The death of the contemporary forms of social order ought to gladden rather than trouble the soul. Yet what is frightening is that what the departing world leaves behind it is not an heir but a pregnant widow. Between the death of the one and the birth of the other, much water will flow by, a long night of chaos and desolation will pass. In many senses, including the literal, it was a velvet revolution; but it wasn't bloodless. Nor was it complete. Even today, in 2009, the pregnancy is still in its second trimester. Martin Amis, in <i>The Pregnant Widow</i>, takes as his control experiment a long, hot summer holiday in a castle in Italy, where half a dozen young lives are afloat on the sea change of 1970. The result is a tragicomedy of manners, combining the wit of <i>Money</i> with the historical sense of <i>Time's Arrow</i> and <i>House of Meetings</i>.<br /><br />It was summer 1970 - a long, hot summer. In a castle in Italy, half a dozen young lives are afloat on the sea of change, trapped inside the history of the sexual revolution. The girls are acting like boys, and the boys are going on acting like boys, and Keith Nearing - twenty years old, a literature student all clogged up with the English novel - is struggling to twist feminism and the rise of women towards his own ends. The sexual revolution may have been a velvet revolution (in at least two senses), but it wasn't bloodless - and now, in the twenty-first century, the year 1970 finally catches up with Keith Nearing. ""The Pregnant Widow"" is a comedy of manners and a nightmare, brilliant, haunting and gloriously risque. It is the most eagerly anticipated novel of the year and Martin Amis at his fearless best.<br /><br />About the Author<br /><br />Martin Amis is the author of ten novels, the memoir <i>Experience</i>, two collections of stories and six collections of non-fiction, most recently The Second Plane. He lives in London.",3.09,480,Hardcover, ,246,https://www.goodreads.com/book/show/1456757.The_Pregnant_Widow,https://www.goodreads.com/book/show/1456757.The_Pregnant_Widow
1456838,Stung: The Incredible Obsession of Brian Molony,0771075324,9780771075322, , ,ID,https://i.gr-assets.com/images/S/compressed.photo.goodreads.com/books/1320457298l/1456838._SX98_.jpg,https://i.gr-assets.com/images/S/compressed.photo.goodreads.com/books/1320457298l/1456838._SY75_.jpg,https://i.gr-assets.com/images/S/compressed.photo.goodreads.com/books/1320457298l/1456838.jpg,2002,8,27,McClelland & Stewart,en-US,false,"He was one of the brightest stars at the Canadian Imperial Bank of Commerce, a brilliant young banker on his way to the top. But Brian Molony had a secret obsession: he loved to gamble. The unsuspecting bank was soon fuelling that obsession, as Molony helped himself to hundreds of thousands, then millions, of dollars in fraudulent loans. Despite falling deeper and deeper in the hole, Molony convinced himself he could win it all back. Before long, the mild-mannered assistant manager had become one of the biggest high-rollers the casinos had ever seen and earned himself a place in the annals of criminal history.",4.08,368,Paperback, ,10,https://www.goodreads.com/book/show/1456838.Stung,https://www.goodreads.com/book/show/1456838.Stung
1457070,Princess Margaret: A Life Unravelled,0297848208,9780297848202, , ,ID,https://i.gr-assets.com/images/S/compressed.photo.goodreads.com/books/1328830067l/1457070._SX98_.jpg,https://i.gr-assets.com/images/S/compressed.photo.goodreads.com/books/1328830067l/1457070._SX50_.jpg,https://i.gr-assets.com/images/S/compressed.photo.goodreads.com/books/1328830067l/1457070.jpg,2007,7,5,Orion Publishing,en-GB,false,"The almost universal conception is that the life of Princess Margaret (1930–2002) was a tragic failure, a history of unfulfilment. Tim Heald's vivid and elegant biography portrays a woman who was beautiful and sexually alluring—even more so than Princess Diana years later—and whose reputation for naughtiness co-existed with the glamour. The mythology is that Margaret's life was ""ruined"" by her not being allowed to marry the one true love of her life—Group Captain Peter Townsend. Therefore her marriage to Lord Snowdon and her well-attested relationships with Roddy Llewellyn and others were mere consolation prizes. Margaret's often exotic personal life in places like Mustique is a key part of her story. The author received extraordinary help from those closest to Princess Margaret, including her family (Lord Snowdon and her son, Lord Linley), three of her private secretaries, and many of her ladies in waiting; as well as gaining the Queen's permission to use the royal archives. Heald asks why one of the most famous and loved little girls in the world, who became a juvenile wartime sweetheart, ended her life a sad wheelchairbound figure, publicly reviled and ignored. This is a story of a life in which the private and the public seemed permanently in conflict.",3.29,368,Hardcover, ,13,https://www.goodreads.com/book/show/1457070.Princess_Margaret,https://www.goodreads.com/book/show/1457070.Princess_Margaret
1457975,All the President's Men,0446890936,9780446890939, , ,ID,https://i.gr-assets.com/images/S/compressed.photo.goodreads.com/books/1240060451l/1457975._SY160_.jpg,https://i.gr-assets.com/images/S/compressed.photo.goodreads.com/books/1240060451l/1457975._SY75_.jpg,https://i.gr-assets.com/images/S/compressed.photo.goodreads.com/books/1240060451l/1457975.jpg,1976,,,Warner Books,eng,false,"The full account of the Watergate scandal from the two <i>Washington Post</i> reporters who broke the story. This is “the work that brought down a presidency— perhaps the most influential piece of journalism in history” (<i>Time</i>, All-Time 100 Best Nonfiction Books).<br /><br />This is the book that changed America. Published just two months before President Nixon’s resignation, <i>All the President’s Men</i> revealed the full scope of the Watergate scandal and introduced for the first time the mysterious “Deep Throat.” Beginning with the story of a simple burglary at Democratic headquarters and then continuing through headline after headline, Bernstein and Woodward deliver the stunning revelations and pieces in the Watergate puzzle that brought about Nixon’s shocking downfall. Their explosive reports won a Pulitzer Prize for <i>The Washington Post</i>, toppled the president, and have since inspired generations of reporters.<br /><br /><i>All the President’s Men</i> is a riveting detective story, capturing the exhilarating rush of the biggest presidential scandal in U.S. history as it unfolded in real time. It is, as former <i>New York Times</i> managing editor Gene Roberts has called it, “maybe the single greatest reporting effort of all time.”",4.18,382,Paperback,Movie tie-in cover,52,https://www.goodreads.com/book/show/1457975.All_the_President_s_Men,https://www.goodreads.com/book/show/1457975.All_the_President_s_Men
1460445,Are You Afraid of the Dark?,0060738324,9780060738327, , ,ID,https://i.gr-assets.com/images/S/compressed.photo.goodreads.com/books/1348825815l/1460445._SX98_.jpg,https://i.gr-assets.com/images/S/compressed.photo.goodreads.com/books/1348825815l/1460445._SX50_.jpg,https://i.gr-assets.com/images/S/compressed.photo.goodreads.com/books/1348825815l/1460445.jpg,2004,9,14,HarperAudio,eng,false,"All around the globe, people are being reported dead or missing.<br /><br />In Berlin, a woman vanishes from the city streets. In Paris, a man plunges from the Eiffel Tower. In Denver, a small plane crashes into the mountains. In Manhattan, a body washes ashore from the East River. At first these seem to be random incidents, but the police soon discover that all four of the victims are connected to Kingsley International Group (KIG), the largest think tank in the world.<br /><br />Kelly Harris and Diane Stevens -- young widows of two of the victims -- encounter each other in New York, where Tanner Kingsley, the head of KIG, assures them that he is using every resource to solve the mysterious deaths of their husbands. But he may be too late. Someone is intent on murdering both women, and they suffer a harrowing series of close escapes. Who is trying to kill them and why?<br /><br />Forced together for protection, and suspicious of each other and everyone around them, the two widows embark on a terrifying game of cat-and-mouse against the unknown forces out to destroy them.<br /><br />Taut with suspense and vivid characterization, full of shocking twists, and with an unnervingly realistic premise, the long-awaited <em>Are You Afraid of the Dark?</em> is Sidney Sheldon at the top of his game.<br /><br />Performed by Kit Flanagan",3.67,0,Audiobook, ,10,https://www.goodreads.com/book/show/1460445.Are_You_Afraid_of_the_Dark_,https://www.goodreads.com/book/show/1460445.Are_You_Afraid_of_the_Dark_
1460788,"Jalan Raya Pos, Jalan Daendels",9799731283, , , ,ID,https://i.gr-assets.com/images/S/compressed.photo.goodreads.com/books/1420953152l/1460788._SX98_.jpg,https://i.gr-assets.com/images/S/compressed.photo.goodreads.com/books/1420953152l/1460788._SY75_.jpg,https://i.gr-assets.com/images/S/compressed.photo.goodreads.com/books/1420953152l/1460788.jpg,2006,,,Lentera Dipantara,ind,false,"Sebuah buku tentang kesaksian. Dan buku ini adalah kesaksian tentang peristiwa genosida kemanusiaan paling mengerikan di balik pembangunan Jalan Raya Pos atau yang lebih dikenal dengan Jalan Daendels; jalan yang membentang 1000 kilometer sepanjang utara pulau Jawa, dari Anyer hingga Panarukan. Inilah satu dari beberapa kisah tragedi kerjapaksa terbesar sepanjang sejarah di Tanah Hindia.",3.76,148,Paperback, ,164,https://www.goodreads.com/book/show/1460788.Jalan_Raya_Pos_Jalan_Daendels,https://www.goodreads.com/book/show/1460788.Jalan_Raya_Pos_Jalan_Daendels
1461360,Excursion-Pa,0813108810,9780813108810, , ,ID,https://i.gr-assets.com/images/S/compressed.photo.goodreads.com/books/1348924250l/1461360._SX98_.jpg,https://i.gr-assets.com/images/S/compressed.photo.goodreads.com/books/1348924250l/1461360._SY75_.jpg,https://i.gr-assets.com/images/S/compressed.photo.goodreads.com/books/1348924250l/1461360.jpg,1996,12,12,University Press of Kentucky,eng,false,"Frances Brooke (1724-1789), journalist, translator, playwright, novelist, and even co-manager of a theater, was described as ""perhaps the first female novel-writer who attained a perfect purity and polish of style."" Today, Brooke is known primarily for <i>The History of Emily Montague, </i> one of the earliest novels about Canada, where she lived for a number of years. But it is her third novel, <i>The Excursion</i>, that is an important example of the fashionable and popular English novels of the late 1770s.<br /><br />Written for the very audience it portrays, this novel introduces the heroine, Maria Villiers, to London's ""gentle"" society and its glittering pastimes. Brooke drew upon the English courtship novel in the tradition of Eliza Haywood, Henry Fielding, and Frances Burney for her novel's overarching plot structure. But instead of concentrating on Maria's romantic adventures, she experiments with unusual treatments of subplots and unconventional characters.<br /><br />The most interesting aspect of her story is the development of Maria's ambition to win fame and fortune as a writer; it is one of the few portraits of a woman with literary ambitions by an early woman writer. Brooke's wry narrative voice foreshadows that of Jane Austen.<br /><br />The editors' introduction places <i>The Excursion</i> firmly in the tradition of the English novel, provides a fresh biography of Brooke, and brings together the most important eighteenth- and twentieth-century criticism of Brooke's work.<br /><br />The second volume in the series Eighteenth-Century Novels by Women, <i>The Excursion</i> contributes to our understanding of the development of the novel and offers a lively view of women's position in eighteenth-century English society.",3.17,240,Paperback, ,1,https://www.goodreads.com/book/show/1461360.Excursion_Pa,https://www.goodreads.com/book/show/1461360.Excursion_Pa
1462451,"Cat in a Kiwi Con (Midnight Louie, #12)",0812584252,9780812584257, , ,ID,https://i.gr-assets.com/images/S/compressed.photo.goodreads.com/books/1389554053l/1462451._SX98_.jpg,https://i.gr-assets.com/images/S/compressed.photo.goodreads.com/books/1389554053l/1462451._SY75_.jpg,https://i.gr-assets.com/images/S/compressed.photo.goodreads.com/books/1389554053l/1462451.jpg,2001,4,15,Forge Books,eng,false,"Midnight Louie, the purring P.I., is a jet-black sleuth making his twelfth outing in Carole Nelson Douglas's <i>Cat in a Kiwi Con.</i> While his human partner, public relations whiz Temple Barr, and her significant other, ex-magician Max Kinsella, are bespelled by murder most magical on a Las Vegas university campus, Louie has followed the lethal and lovely Siamese, Hyacinth, into the world's largest science fiction and fantasy convention, GigantiCon.<br /><br />They're all there: Hercules and Xena, elves and aliens, captains and crew, and Godzillions of fans--both in costume and out. When a prominent player is killed, not only is the method of death perplexing, but the suspects in this case are a very unusual cast of thousands. Soon it becomes clear that none of the investigators are safe in an atmosphere that provides cover not only for an unknown murderer, but for an antagonist in an alien guise who is after the hides of each and every one of them.<br /><br />Joining in the fantasy-in-progress may be their only hope.<br />",3.94,432,Paperback, ,17,https://www.goodreads.com/book/show/1462451.Cat_in_a_Kiwi_Con,https://www.goodreads.com/book/show/1462451.Cat_in_a_Kiwi_Con
1462455,"Cat in a Leopard Spot (Midnight Louie, #13)",0812570227,9780812570229, , ,ID,https://i.gr-assets.com/images/S/compressed.photo.goodreads.com/books/1388697356l/1462455._SY160_.jpg,https://i.gr-assets.com/images/S/compressed.photo.goodreads.com/books/1388697356l/1462455._SY75_.jpg,https://i.gr-assets.com/images/S/compressed.photo.goodreads.com/books/1388697356l/1462455.jpg,2002,5,19,Forge Books,eng,false,"Murder shows its teeth and claws for Midnight Louie readers when that jet-black feline sleuth who thinks he's Sam Spade returns to delight his legions of fans. This time, not only does Louie have to bail out his favorite investigative partner, public relations woman Temple Barr, but he has to save a fellow feline from a charge of Murder One. When a big-game hunter is found dead with only a leopard for company, all of Louie's and Temple's allies and enemies converge on the case. And the fun really begins when the unofficial investigators learn the leopard is Osiris, a performing Big Cat who was kidnapped from his magician owner only days before the murder. Things get <i>really</i> wild when a cadre of ardent animal rights protestors secretly stakes out the premises, determined to stop the illegal killing at any price, even their own lives....<br /><br />Or someone else's.<br />",3.99,416,Paperback, ,14,https://www.goodreads.com/book/show/1462455.Cat_in_a_Leopard_Spot,https://www.goodreads.com/book/show/1462455.Cat_in_a_Leopard_Spot
1462456,"Cat in a Diamond Dazzle (Midnight Louie, #5)",0812555066,9780812555066, , ,ID,https://i.gr-assets.com/images/S/compressed.photo.goodreads.com/books/1312024859l/1462456._SY160_.jpg,https://i.gr-assets.com/images/S/compressed.photo.goodreads.com/books/1312024859l/1462456._SY75_.jpg,https://i.gr-assets.com/images/S/compressed.photo.goodreads.com/books/1312024859l/1462456.jpg,1997,2,15,Tor Books,eng,false,"Midnight Louie is back!...along with the human the black tomcat condescends to spend his days with: Temple Barr, a redheaded publicist whose love for expensive shoes is matched only by her affinity for trouble.<br /><br />This time trouble shows up on her doorstep, in the form of a boyfriend previously gone missing...during a murder investigation. No fool she, Temple decides it's time for a break. A romance writers' convention--complete with a male-model Incredible Hunk pageant--sounds like just what the doctor ordered.<br /><br />Unfortunately, a pair of dazzling Cinderella shoes goes missing, one of the would-be Fabios ends up dead, and Temple's investigations into the matters get more complicated--and more dangerous--than she planned.<br /><br />Luckily, there's a smart and smart-mouthed cat prowling around.<br />",3.97,416,Paperback, ,18,https://www.goodreads.com/book/show/1462456.Cat_in_a_Diamond_Dazzle,https://www.goodreads.com/book/show/1462456.Cat_in_a_Diamond_Dazzle
1462715,Traversa,0715637029,9780715637029, , ,ID,https://i.gr-assets.com/images/S/compressed.photo.goodreads.com/books/1327265008l/1462715._SX98_.jpg,https://i.gr-assets.com/images/S/compressed.photo.goodreads.com/books/1327265008l/1462715._SX50_.jpg,https://i.gr-assets.com/images/S/compressed.photo.goodreads.com/books/1327265008l/1462715.jpg,2007,,,Duckworth,en-GB,false,"Inspired by the legendary explorers who first crossed the African heartland, Fran Sandham left the daily grind of London to undertake an extraordinary adventure. He traveled on foot across Africa from the Skeleton Coast on the southwest tip of the African continent through Namibia, Zambia, Malawi, and Tanzania, until he reached the Indian Ocean. <i>Traversa</i> is the fascinating account of the hardships and hilarity that he experienced during his epic solo journey. <p>Sandham describes his brushes with lions and snakes, land mines and bandits, his two-month battle with a syphilitic donkey, malaria, cockroaches the size of mice, and the other everyday troubles that arise when walking across Africa. Underpinned with the stories of his forerunners--David Livingstone, Sir H. M. Stanley, and Sir Francis Galton, among others--<i>Traversa</i> is the enthralling account of a real-life modern-day adventure against the elements.</p>",3.78,274, , ,22,https://www.goodreads.com/book/show/1462715.Traversa,https://www.goodreads.com/book/show/1462715.Traversa
1466040,The Natural House,0452004454,9780452004450, , ,ID,https://s.gr-assets.com/assets/nophoto/book/111x148-bcc042a9c91a29c1d680899eff700a03.png,https://s.gr-assets.com/assets/nophoto/book/50x75-a91bf249278a81aabab721ef782c4a74.png,https://s.gr-assets.com/assets/nophoto/book/111x148-bcc042a9c91a29c1d680899eff700a03.png,1970,5,1,Plume,eng,false,,3.86, ,Paperback, ,4,https://www.goodreads.com/book/show/1466040.The_Natural_House,https://www.goodreads.com/book/show/1466040.The_Natural_House
1466294,اعتماد, , , , ,ID,https://i.gr-assets.com/images/S/compressed.photo.goodreads.com/books/1368739235l/1466294._SX98_.jpg,https://i.gr-assets.com/images/S/compressed.photo.goodreads.com/books/1368739235l/1466294._SY75_.jpg,https://i.gr-assets.com/images/S/compressed.photo.goodreads.com/books/1368739235l/1466294.jpg,2001,,,مؤسسه انتشارات آگاه,per,false,"Ariel Dorfman construye en 'Konfidenz' una compleja novela de amor y de espionaje en diferentes planos narrativos y temporales, cuyos protagonistas pueden situarse en cualquier epoca y parte del mundo donde deba pelearse contra las dictaduras y las guerras, donde haya que luchar por darle cuerpo a los suenos.",3.55,182, , ,0,https://www.goodreads.com/book/show/1466294._,https://www.goodreads.com/book/show/1466294._
1466455,Three Wishes,0060586133,9780060586133, , ,ID,https://i.gr-assets.com/images/S/compressed.photo.goodreads.com/books/1183888822l/1466455._SX98_.jpg,https://i.gr-assets.com/images/S/compressed.photo.goodreads.com/books/1183888822l/1466455._SY75_.jpg,https://i.gr-assets.com/images/S/compressed.photo.goodreads.com/books/1183888822l/1466455._SY475_.jpg,2020,8,18,Harper Paperbacks,eng,false,"Lyn, Cat, and Gemma Kettle, beautiful thirty-three-year-old triplets, seem to attract attention everywhere they go. Whenever they're together, laughter, drama, and mayhem seem to follow. But apart, each is very much her own woman, dealing with her own share of ups and downs. Lyn has organized her life into one big checklist, juggling the many balls of work, marriage, and motherhood with expert precision, but is she as together as her datebook would have her seem? Cat has just learned a startling secret about her marriage -- can she bring another life into her very precarious world? And can free-spirited Gemma, who bolts every time a relationship hits the six-month mark, ever hope to find lasting love? In this wise, witty, hilarious new novel, we follow the Kettle sisters through their thirty-third-year, as they struggle to survive their divorced parents' dating each other, their technologically savvy grandmother, a cheating husband, champagne hangovers, and the fabulous, frustrating .",3.78,356,Paperback, ,5432,https://www.goodreads.com/book/show/1466455.Three_Wishes,https://www.goodreads.com/book/show/1466455.Three_Wishes
1468264,قلعۀ مالویل,964448262X,9789644482625, , ,ID,https://i.gr-assets.com/images/S/compressed.photo.goodreads.com/books/1506463317l/1468264._SX98_.jpg,https://i.gr-assets.com/images/S/compressed.photo.goodreads.com/books/1506463317l/1468264._SX50_.jpg,https://i.gr-assets.com/images/S/compressed.photo.goodreads.com/books/1506463317l/1468264.jpg,2005,,,نیلوفر,per,false,"À la suite d'une explosion, sans doute nucléaire, qui a selon toute vraisemblance ravagé la Terre entière, Emmanuel Comte et ses six compagnons font du château de Malevil, dont la profonde cave leur a permis de survivre, la base de départ de leurs efforts de reconstruction de la civilisation, qui passera également par l'affrontement avec d'autres groupes de survivants, que ce soient des bandes errantes ou des groupes structurés nomades ou sédentaires.<br /><br />La qualification de science-fiction peut être considérée comme exagérée, concernant ce roman, puisque seule la situation de départ (la destruction de la civilisation humaine par une explosion d'origine inconnue) rejoint le thème post-apocalyptique, alors très populaire en science-fiction. Tout le reste du roman raconte comment un groupe de survivants miraculés relève le défi de la reconstruction d'une société humaine. De ce point de vue, on peut dire que le roman relève du genre de la robinsonade.<br /><br />De nombreux thèmes sont abordés dans ce roman : la religion, la politique, la place des femmes dans la société, le monde rural, le rôle du chef, certes sous l'angle d'une mini-communauté mais qui renvoient à notre société.",4.25,582,Paperback, ,11,https://www.goodreads.com/book/show/1468264._,https://www.goodreads.com/book/show/1468264._
