id,title,isbn,isbn13,asin,kindle_asin,country_code,image_url,small_image_url,large_image_url,publication_year,publication_month,publication_day,publisher,language_code,is_ebook,description,average_rating,num_pages,format,edition_information,text_reviews_count,url,link
30841953,How Not to Hate Your Husband After Kids,0316267104,9780316267106, , ,ID,https://i.gr-assets.com/images/S/compressed.photo.goodreads.com/books/1482348602l/30841953._SX98_.jpg,https://i.gr-assets.com/images/S/compressed.photo.goodreads.com/books/1482348602l/30841953._SY75_.jpg,https://i.gr-assets.com/images/S/compressed.photo.goodreads.com/books/1482348602l/30841953._SY475_.jpg,2017,3,21,"Little, Brown and Company",,false,"<b>""Get this for your pregnant friends, or yourself."" --<i>People</i></b><br /><b>
  <i>
    <br />
  </i>
</b><b>Recommended by Nicole Cliffe in <i>Slate</i></b><br /><br /><b>Featured in <i>People </i>Picks<br /></b><b>A <i>Red Tricycle</i> Best Baby and Toddler Parenting Book of the year</b><br /><b>One of <i>Mother</i> magazine's favorite parenting books of the year</b><br /><br /><br /><b>A hilariously candid account of one woman's quest to bring her post-baby marriage back from the brink, with life-changing, real-world advice.</b><br /><br /><i>How Not To Hate Your Husband After Kids</i> tackles the last taboo subject of parenthood: the startling, white-hot fury that new (and not-so-new) mothers often have for their mates. After Jancee Dunn had her baby, she found that she was doing virtually all the household chores, even though she and her husband worked equal hours. She asked herself: How did I become the 'expert' at changing a diaper?<br /><br />Many expectant parents spend weeks researching the best crib or safest car seat, but spend little if any time thinking about the titanic impact the baby will have on their marriage - and the way their marriage will affect their child. <br /><br />Enter Dunn, her well-meaning but blithely unhelpful husband, their daughter, and her boisterous extended family, who show us the ways in which outmoded family patterns and traditions thwart the overworked, overloaded parents of today. <br /><br />On the brink of marital Armageddon, Dunn plunges into the latest relationship research, solicits the counsel of the country's most renowned couples' and sex therapists, canvasses fellow parents, and even consults an FBI hostage negotiator on how to effectively contain an ""explosive situation."" Instead of having the same fights over and over, Dunn and her husband must figure out a way to resolve their larger issues and fix their family while there is still time. As they discover, adding a demanding new person to your relationship means you have to reevaluate--and rebuild--your marriage. In an exhilarating twist, they work together to save the day, happily returning to the kind of peaceful life they previously thought was the sole province of couples without children. <br /><br />Part memoir, part self-help book with actionable and achievable advice, <i>How Not To Hate Your Husband After Kids</i> is an eye-opening look at how the man who got you into this position in this first place is the ally you didn't know you had. <br /><br />",4.09,288,Hardcover, ,322,https://www.goodreads.com/book/show/30841953-how-not-to-hate-your-husband-after-kids,https://www.goodreads.com/book/show/30841953-how-not-to-hate-your-husband-after-kids
30841980,Phenomena: The Secret History of the U.S. Government's Investigations into Extrasensory Perception and Psychokinesis,0316349364,9780316349369, , ,ID,https://i.gr-assets.com/images/S/compressed.photo.goodreads.com/books/1490361746l/30841980._SX98_.jpg,https://i.gr-assets.com/images/S/compressed.photo.goodreads.com/books/1490361746l/30841980._SY75_.jpg,https://i.gr-assets.com/images/S/compressed.photo.goodreads.com/books/1490361746l/30841980.jpg,2017,3,28,"Little, Brown and Company",eng,false,"<strong>The definitive history of the military's decades-long investigation into mental powers and phenomena, from the author of Pulitzer Prize finalist <em>The Pentagon's Brain</em> and international bestseller <em>Area 51</em></strong><br /><br />This is a book about a team of scientists and psychics with top secret clearances.<br /><br />For more than forty years, the U.S. government has researched extrasensory perception, using it in attempts to locate hostages, fugitives, secret bases, and downed fighter jets, to divine other nations' secrets, and even to predict future threats to national security. The intelligence agencies and military services involved include CIA, DIA, NSA, DEA, the Navy, Air Force, and Army-and even the Joint Chiefs of Staff.<br /><br />Now, for the first time, <i>New York Times</i> bestselling author Annie Jacobsen tells the story of these radical, controversial programs, using never before seen declassified documents as well as exclusive interviews with, and unprecedented access to, more than fifty of the individuals involved. Speaking on the record, many for the first time, are former CIA and Defense Department scientists, analysts, and program managers, as well as the government psychics themselves.<br /><br />Who did the U.S. government hire for these top secret programs, and how do they explain their military and intelligence work? How do scientists approach such enigmatic subject matter? What interested the government in these supposed powers and does the research continue? <i>Phenomena</i> is a riveting investigation into how far governments will go in the name of national security.",3.81,544,Hardcover, ,126,https://www.goodreads.com/book/show/30841980-phenomena,https://www.goodreads.com/book/show/30841980-phenomena
30841984,"Kings of the Wyld (The Band, #1)",0316362476,9780316362474, , ,ID,https://i.gr-assets.com/images/S/compressed.photo.goodreads.com/books/1477027207l/30841984._SX98_.jpg,https://i.gr-assets.com/images/S/compressed.photo.goodreads.com/books/1477027207l/30841984._SY75_.jpg,https://i.gr-assets.com/images/S/compressed.photo.goodreads.com/books/1477027207l/30841984.jpg,2017,2,21,Orbit,eng,false,"Clay Cooper and his band were once the best of the best -- the meanest, dirtiest, most feared crew of mercenaries this side of the Heartwyld. <br /><br />Their glory days long past, the mercs have grown apart and grown old, fat, drunk - or a combination of the three. Then an ex-bandmate turns up at Clay's door with a plea for help. His daughter Rose is trapped in a city besieged by an enemy one hundred thousand strong and hungry for blood. Rescuing Rose is the kind of mission that only the very brave or the very stupid would sign up for.<br /><br />It's time to get the band back together for one last tour across the Wyld.",4.31,502,Paperback, ,3395,https://www.goodreads.com/book/show/30841984-kings-of-the-wyld,https://www.goodreads.com/book/show/30841984-kings-of-the-wyld
30842405,"Explorers' Sketchbooks: The Art of Discovery & Adventure (Artist Sketchbook, Drawing Book for Adults and Kids, Exploration Sketchbook)",1452158274,9781452158273, , ,ID,https://i.gr-assets.com/images/S/compressed.photo.goodreads.com/books/1489468476l/30842405._SX98_.jpg,https://i.gr-assets.com/images/S/compressed.photo.goodreads.com/books/1489468476l/30842405._SX50_.jpg,https://i.gr-assets.com/images/S/compressed.photo.goodreads.com/books/1489468476l/30842405._SX318_.jpg,2017,3,28,Chronicle Books,eng,false,"The sketchbook has been the one constant in explorers' kits for centuries of adventure. Often private, they are records of immediate experiences and discoveries, and in their pages we can see what the explorers themselves encountered. This remarkable book showcases 70 such sketchbooks, kept by intrepid men and women as they journeyed perilous and unknown environments—frozen wastelands, high mountains, barren deserts, and dense rainforests—with their senses wide open. Figures such as Charles Darwin and Sir Edmund Hillary are joined here by lesser-known explorers such as Adela Breton, who braved the jungles of Mexico to make a record of Mayan monuments. Here are profiles, expedition details, and the artwork of pioneering explorers and mapmakers, botanists and artists, ecologists and anthropologists, eccentrics and visionaries. Here is the art of discovery.",4.39,320,Hardcover, ,20,https://www.goodreads.com/book/show/30842405-explorers-sketchbooks,https://www.goodreads.com/book/show/30842405-explorers-sketchbooks
30846727,"Love Will Always Remember (Shades of Love, #3)", , ,B01GZS3624, ,ID,https://i.gr-assets.com/images/S/compressed.photo.goodreads.com/books/1501257275l/30846727._SX98_.jpg,https://i.gr-assets.com/images/S/compressed.photo.goodreads.com/books/1501257275l/30846727._SY75_.jpg,https://i.gr-assets.com/images/S/compressed.photo.goodreads.com/books/1501257275l/30846727._SY475_.jpg,2017,8,29,Avon Impulse,eng,true,"<p>
  <em>An accident changed Leighton Clarke's life forever.</em>
</p><p><em></em> </p><p>After waking from a coma, Leighton Clarke can’t remember anything from the past six years. She’s stunned when her doctors inform her she has amnesia, something she didn’t think occurred outside of soap operas. Anxious and disoriented, the only person who elicits any feelings is Jonathan Moran, a gorgeous chef with compassionate brown eyes . . . who also happens to be her fiancé. </p><p> </p><p>Jonathan isn’t her fiancé. But when his estranged brother—her real husband-to-be—asks him to step in while he’s away in London, Jonathan doesn’t think he has a choice, especially after seeing how the previously aloof Leighton now responds to him. The more time they spend together, the more Jonathan begins to fall for his brother’s fiancé, until he’s wishing the pretense were reality. </p><p> </p><p>When Leighton’s memories come flooding back, can she forgive the man she’s fallen in love with or will his lie ruin the only thing that feels true?</p>",3.89,257,Kindle Edition, ,26,https://www.goodreads.com/book/show/30846727-love-will-always-remember,https://www.goodreads.com/book/show/30846727-love-will-always-remember
30849547,American Ulysses: A Life of Ulysses S. Grant, , , , ,ID,https://i.gr-assets.com/images/S/compressed.photo.goodreads.com/books/1467756440l/30849547._SX98_.jpg,https://i.gr-assets.com/images/S/compressed.photo.goodreads.com/books/1467756440l/30849547._SY75_.jpg,https://i.gr-assets.com/images/S/compressed.photo.goodreads.com/books/1467756440l/30849547._SY475_.jpg,2016,10,4,Random House,eng,true,"<b>From the author of the <i>New York Times </i>bestseller <i>A. Lincoln, </i>a major new biography of one of America’s greatest generals—and most misunderstood presidents</b><br />  <br /> In his time, Ulysses S. Grant was routinely grouped with George Washington and Abraham Lincoln in the “Trinity of Great American Leaders.” But the battlefield commander-turned-commander-in-chief fell out of favor in the twentieth century. In <i>American Ulysses,</i> Ronald C. White argues that we need to once more revise our estimates of him in the twenty-first.<br />  <br /> Based on seven years of research with primary documents—some of them never examined by previous Grant scholars—this is destined to become <i>the </i>Grant biography of our time. White, a biographer exceptionally skilled at writing momentous history from the inside out, shows Grant to be a generous, curious, introspective man and leader—a willing delegator with a natural gift for managing the rampaging egos of his fellow officers. His wife, Julia Dent Grant, long marginalized in the historic record, emerges in her own right as a spirited and influential partner.<br />  <br /> Grant was not only a brilliant general but also a passionate defender of equal rights in post-Civil War America. After winning election to the White House in 1868, he used the power of the federal government to battle the Ku Klux Klan. He was the first president to state that the government’s policy toward American Indians was immoral, and the first ex-president to embark on a world tour, and he cemented his reputation for personal courage by racing against death to complete his <i>Personal Memoirs</i>. Published by Mark Twain, it is widely considered to be the greatest memoir by an American leader, but its place in Grant’s life story has never been fully explored—until now.<br />  <br /> One of those rare books that successfully recast our impression of an iconic historical figure, <i>American Ulysses</i> gives us a finely honed, three-dimensional portrait of Grant the man—husband, father, writer, leader—that should set the standard by which all future biographies of him will be measured.<br />  <br /> <b>Advance praise for <i>American Ulysses</i></b><br /> <b> </b><br /> “Certain to be recognized as the classic work on Ulysses S. Grant, <i>American Ulysses</i> is a monumental examination of one of the most compelling figures in American history.”<b>—General David H. Petraeus (Ret.)</b><br />  <br /> “In this thorough and engaging new book, Ronald C. White restores Ulysses S. Grant to the pantheon of great Americans. As a soldier and a president, Grant rendered his nation invaluable service, and White’s epic biography is invaluable as well.”<b>—Jon Meacham, Pulitzer Prize winner and #1 <i>New York Times</i> bestselling author</b><br /><br /> “White at last solves the Grant Enigma—reconciling in character and ability the hero of Appomattox with the (allegedly) failed president. This is the biography that Grant deserves.”<b>—Richard Norton Smith, former director of the Lincoln, Reagan, Eisenhower, Ford, and Hoover presidential libraries</b><br />  <br /> “Ronald C. White is a master biographer, and his <i>American Ulysses</i> is the beautifully told culmination of a major revival of Grant studies; rarely has an epic life met so fruitfully with its talented author.”<b>—David W. Blight, author of <i>Frederick Douglass: A Life</i></b><br /><br /><br /><i>From the Hardcover edition.</i>",4.10,864,Kindle Edition, ,22,https://www.goodreads.com/book/show/30849547-american-ulysses,https://www.goodreads.com/book/show/30849547-american-ulysses
30900302,The Strivers' Row Spy, , ,B0190HGUC0, ,ID,https://i.gr-assets.com/images/S/compressed.photo.goodreads.com/books/1467815458l/30900302._SX98_.jpg,https://i.gr-assets.com/images/S/compressed.photo.goodreads.com/books/1467815458l/30900302._SY75_.jpg,https://i.gr-assets.com/images/S/compressed.photo.goodreads.com/books/1467815458l/30900302.jpg,2016,8,30,Dafina,eng,true,"<i>Stunning, suspenseful, and unforgettably evocative, Jason Overstreet’s debut novel glitters with the vibrant dreams and dangerous promise of the 1920s Harlem Renaissance, as one man crosses the perilous lines between the law, loyalty, and deadly lies…</i><br /><br />For college graduate Sidney Temple, the Roaring Twenties bring opportunities even members of his accomplished black bourgeois family couldn’t have imagined. His impulsive marriage to independent artist Loretta is a happiness he never thought he’d find. And when he’s tapped by J. Edgar Hoover to be the FBI’s first African-American agent, he sees a once-in-a-lifetime chance to secure real justice.<br /><br />Instead of providing evidence against Marcus Garvey, prominent head of the “dangerously radical” back-to-Africa movement, Sidney uses his unexpected knack for deception and undercover work to thwart the Bureau’s biased investigation. And by giving renowned leader W. E. B. Du Bois insider information, Sidney gambles on change that could mean a fair destiny for all Americans...<br /><br />But the higher Sidney and Loretta climb in Harlem’s most influential and glamorous circles, the more dangerous the stakes. An unexpected friendship and a wrenching personal tragedy threaten to shatter Loretta’s innocent trust in her husband—and turn his double life into a fast-closing trap. For Sidney, ultimately squeezed between the Bureau and one too many ruthless factions, the price of escape could be heartbreak and betrayal no amount of skill can help him survive.",3.66,448,Kindle Edition, ,5,https://www.goodreads.com/book/show/30900302-the-strivers-row-spy,https://www.goodreads.com/book/show/30900302-the-strivers-row-spy
30900771,"""You're in the Wrong Bathroom!"": And 20 Other Myths and Misconceptions about Transgender and Gender-Nonconforming People",0807033898,9780807033890, , ,ID,https://i.gr-assets.com/images/S/compressed.photo.goodreads.com/books/1471282460l/30900771._SX98_.jpg,https://i.gr-assets.com/images/S/compressed.photo.goodreads.com/books/1471282460l/30900771._SY75_.jpg,https://i.gr-assets.com/images/S/compressed.photo.goodreads.com/books/1471282460l/30900771.jpg,2017,9,1,Beacon Press,,false,"Debunks the twenty-one most common myths and misperceptions about transgender issues <br />From Laverne Cox to Caitlyn Jenner to Thomas Beattie ( the pregnant man ) to transgender youth, coverage of transgender lives has been exploding over the last few years. Despite being prolifically covered in the media, much misinformation about the trans community persists. Bringing together the medical, social, psychological, and political aspects of being transgender today in the United States, "" You re in the Wrong Bathroom!: And 20 Other Myths About Transgender and Gender-Nonconforming People"" unpacks the twenty-one most common myths about transgender people. Authors Laura Erickson-Schroth, MD, a psychiatrist, and Laura A. Jacobs, LCSW-R, a psychotherapist, address myths about trans identity ( all trans people are trapped in the wrong body ), sex and relationships ( most trans people do sex work and have HIV ), health and safety ( trans people are mentally ill and therapy can change them ), and history and community ( trans people and feminists don t get along ).""",3.88,200,Paperback, ,50,https://www.goodreads.com/book/show/30900771-you-re-in-the-wrong-bathroom,https://www.goodreads.com/book/show/30900771-you-re-in-the-wrong-bathroom
30901607,The Gargoyle Hunters,1101946881,9781101946886, , ,ID,https://i.gr-assets.com/images/S/compressed.photo.goodreads.com/books/1488819265l/30901607._SX98_.jpg,https://i.gr-assets.com/images/S/compressed.photo.goodreads.com/books/1488819265l/30901607._SX50_.jpg,https://i.gr-assets.com/images/S/compressed.photo.goodreads.com/books/1488819265l/30901607._SX318_.jpg,2017,3,21,Knopf Publishing Group,eng,false,"Hilarious and poignant, <i>The Gargoyle Hunters</i> is a love letter to a vanishing city, and a deeply emotional story of fathers and sons. Intimately portraying New York's elbow-jostling relationship with time, the novel solves the mystery of a brazen and seemingly impossible architectural heist: the theft of an entire historic Manhattan building that stunned the city and made the front page of <i>The New York Times</i> in 1974. <br /><br />With both his family and his city fracturing, thirteen-year-old Griffin Watts is recruited into his estranged father's illicit and dangerous architectural salvage business. Small and nimble, Griffin is charged with stealing exuberantly expressive nineteenth-century architectural sculptures gargoyles right off the faces of unsung tenements and iconic skyscrapers all over town. As his father explains it, these gargoyles, carved and cast by immigrant artisans during the city's architectural glory days, are an endangered species in this era of sweeping urban renewal.<br /><br />Desperate both to connect with his father and to raise cash to pay the mortgage on the brownstone where he lives with his mother and sister, Griffin is slow to recognize that his father s deepening obsession with preserving the architectural treasures of Beaux Arts New York is also a destructive force, imperiling Griffin's friendships, his relationship with his very first girlfriend, and even his life.<br /><br />As his father grows increasingly possessive of both Griffin's mother and his scavenged touchstones of the lost city, Griffin must learn how to build himself into the person he wants to become and discover which parts of his life can be salvaged and which parts must be let go. Maybe loss, he reflects, is the only thing no one can ever take away from you.<br /> Tender, funny, and achingly sad, <i>The Gargoyle Hunters</i> introduces an extraordinary new novelist.",3.67,352,Hardcover, ,151,https://www.goodreads.com/book/show/30901607-the-gargoyle-hunters,https://www.goodreads.com/book/show/30901607-the-gargoyle-hunters
30901609,The Night Ocean,1101981083,9781101981085, , ,ID,https://i.gr-assets.com/images/S/compressed.photo.goodreads.com/books/1474585616l/30901609._SX98_.jpg,https://i.gr-assets.com/images/S/compressed.photo.goodreads.com/books/1474585616l/30901609._SY75_.jpg,https://i.gr-assets.com/images/S/compressed.photo.goodreads.com/books/1474585616l/30901609.jpg,2017,3,7,Penguin Press,,false,"<b>From the award-winning author and <i>New Yorker</i> contributor, a riveting novel about secrets and scandals, psychiatry and pulp fiction, inspired by the lives of H.P. Lovecraft and his circle.</b> <br /><br />Marina Willett, M.D., has a problem. Her husband, Charlie, has become obsessed with H.P. Lovecraft, in particular with one episode in the legendary horror writer's life: In the summer of 1934, the ""old gent"" lived for two months with a gay teenage fan named Robert Barlow, at Barlow's family home in central Florida. What were the two of them up to? Were they friends--or something more? Just when Charlie thinks he's solved the puzzle, a new scandal erupts, and he disappears. The police say it's suicide. Marina is a psychiatrist, and she doesn't believe them.<br /><br />A tour-de-force of storytelling, <i>The Night Ocean</i> follows the lives of some extraordinary people: Lovecraft, the most influential American horror writer of the 20th century, whose stories continue to win new acolytes, even as his racist views provoke new critics; Barlow, a seminal scholar of Mexican culture who killed himself after being blackmailed for his homosexuality (and who collaborated with Lovecraft on the beautiful story <i>The Night Ocean</i>); his student, future Beat writer William S. Burroughs; and L.C. Spinks, a kindly Canadian appliance salesman and science-fiction fan -- the only person who knows the origins of <i>The Erotonomicon</i>, purported to be the intimate diary of Lovecraft himself.<br /><br />As a heartbroken Marina follows her missing husband's trail in an attempt to learn the truth, the novel moves across the decades and along the length of the continent, from a remote Ontario town, through New York and Florida to Mexico City.<br /><br /><i>The Night Ocean</i> is about love and deception -- about the way that stories earn our trust, and betray it.",3.32,389,Hardcover, ,450,https://www.goodreads.com/book/show/30901609-the-night-ocean,https://www.goodreads.com/book/show/30901609-the-night-ocean
