id,title,isbn,isbn13,asin,kindle_asin,country_code,image_url,small_image_url,large_image_url,publication_year,publication_month,publication_day,publisher,language_code,is_ebook,description,average_rating,num_pages,format,edition_information,text_reviews_count,url,link
30672,Darkness at Noon,0553265954,9780553265958, , ,ID,https://i.gr-assets.com/images/S/compressed.photo.goodreads.com/books/1290053535l/30672._SY160_.jpg,https://i.gr-assets.com/images/S/compressed.photo.goodreads.com/books/1290053535l/30672._SY75_.jpg,https://i.gr-assets.com/images/S/compressed.photo.goodreads.com/books/1290053535l/30672.jpg,1984,3,,Bantam Books,eng,false,"Darkness at Noon (from the German: Sonnenfinsternis) is a novel by the Hungarian-born British novelist Arthur Koestler, first published in 1940. His best-known work tells the tale of Rubashov, a Bolshevik 1917 revolutionary who is cast out, imprisoned and tried for treason by the Soviet government he'd helped create.<br /><br />Darkness at Noon stands as an unequaled fictional portrayal of the nightmare politics of our time. Its hero is an aging revolutionary, imprisoned and psychologically tortured by the Party to which he has dedicated his life. As the pressure to confess preposterous crimes increases, he relives a career that embodies the terrible ironies and human betrayals of a totalitarian movement masking itself as an instrument of deliverance. Almost unbearably vivid in its depiction of one man's solitary agony, it asks questions about ends and means that have relevance not only for the past but for the perilous present. It is —- as the Times Literary Supplement has declared —- ""A remarkable book, a grimly fascinating interpretation of the logic of the Russian Revolution, indeed of all revolutionary dictatorships, and at the same time a tense and subtly intellectualized drama.""",4.04,216,Mass Market Paperback, ,947,https://www.goodreads.com/book/show/30672.Darkness_at_Noon,https://www.goodreads.com/book/show/30672.Darkness_at_Noon
30673,Darkness at Noon,1416540261,9781416540267, , ,ID,https://i.gr-assets.com/images/S/compressed.photo.goodreads.com/books/1492573553l/30673._SX98_.jpg,https://i.gr-assets.com/images/S/compressed.photo.goodreads.com/books/1492573553l/30673._SY75_.jpg,https://i.gr-assets.com/images/S/compressed.photo.goodreads.com/books/1492573553l/30673._SY475_.jpg,2006,10,17,Scribner,eng,false,"<i>Darkness at Noon</i> (from the German: <i>Sonnenfinsternis</i>) is a novel by the Hungarian-born British novelist Arthur Koestler, first published in 1940. His best-known work tells the tale of Rubashov, a Bolshevik 1917 revolutionary who is cast out, imprisoned and tried for treason by the Soviet government he'd helped create.<br /><br /><i>Darkness at Noon</i> stands as an unequaled fictional portrayal of the nightmare politics of our time. Its hero is an aging revolutionary, imprisoned and psychologically tortured by the Party to which he has dedicated his life. As the pressure to confess preposterous crimes increases, he relives a career that embodies the terrible ironies and human betrayals of a totalitarian movement masking itself as an instrument of deliverance. Almost unbearably vivid in its depiction of one man's solitary agony, it asks questions about ends and means that have relevance not only for the past but for the perilous present. It is —- as the Times Literary Supplement has declared —- ""A remarkable book, a grimly fascinating interpretation of the logic of the Russian Revolution, indeed of all revolutionary dictatorships, and at the same time a tense and subtly intellectualized drama.""",4.04,273,Paperback, ,167,https://www.goodreads.com/book/show/30673.Darkness_at_Noon,https://www.goodreads.com/book/show/30673.Darkness_at_Noon
30675,The Thirteenth Tribe ,0330250698,9780330250696, , ,ID,https://i.gr-assets.com/images/S/compressed.photo.goodreads.com/books/1307678724l/30675._SX98_.jpg,https://i.gr-assets.com/images/S/compressed.photo.goodreads.com/books/1307678724l/30675._SX50_.jpg,https://i.gr-assets.com/images/S/compressed.photo.goodreads.com/books/1307678724l/30675.jpg,1977,9,9,Picador,eng,false,"This book traces the history of the ancient Khazar Empire, a major but almost forgotten power in E. Europe, which in the Dark Ages became converted to Judaism. Khazaria was finally wiped out by the forces of Genghis Khan, but evidence indicates that the Khazars themselves migrated to Poland &amp; formed the cradle of Western Jewry. To the general reader the Khazars, who flourished from the 7th to 11th century, may seem remote today. Yet they have a close &amp; unexpected bearing on our world, which emerges as Koestler recounts the fascinating history of the ancient Khazar Empire. At about the time that Charlemagne was Emperor in the West. The Khazars' sway extended from the Black Sea to the Caspian, from the Caucasus to the Volga. They were instrumental in stopping the Muslim onslaught against Byzantium, the eastern jaw of the gigantic pincer movement that in the West swept across N. Africa &amp; into Spain. Thereafter the Khazars found themselves in a precarious position between the two major world powers: the Eastern Roman Empire in Byzantium &amp; the triumphant followers of Mohammed. As Koestler points out, the Khazars were the 3rd World of their day. They chose a surprising method of resisting both the Western pressure to become Christian &amp; the Eastern to adopt Islam. Rejecting both, they converted to Judaism. Koestler speculates about the ultimate faith of the Khazars &amp; their impact on the racial composition &amp; social heritage of modern Jewry. He produces a large body of meticulously detailed research.",3.93,224,Paperback, ,3,https://www.goodreads.com/book/show/30675.The_Thirteenth_Tribe,https://www.goodreads.com/book/show/30675.The_Thirteenth_Tribe
30679,The Invisible Writing,0099490684,9780099490685, , ,ID,https://i.gr-assets.com/images/S/compressed.photo.goodreads.com/books/1168080504l/30679._SX98_.jpg,https://i.gr-assets.com/images/S/compressed.photo.goodreads.com/books/1168080504l/30679._SY75_.jpg,https://i.gr-assets.com/images/S/compressed.photo.goodreads.com/books/1168080504l/30679._SY475_.jpg,2005,9,1,Vintage Classics,eng,false,"Taken together, Arthur Koestler's volumes of autobiography constitute an unrivalled study of twentieth-century man and his dilemma. <i>Arrow in the Blue</i> ended with his joining the Communist Party and <i>The Invisible Writing</i> covers some of the most important experiences in his life.<br /><br />This book tells of Koestler's travels through Russia and remote parts of Soviet Central Asia and of his life as an exile. It puts in perspective his experiences in Franco's prisons under sentence of death and in concentration camps in Occupied France and ends with his escape in 1940 to England, where he found stability and a new home.",4.30,544,Paperback, ,17,https://www.goodreads.com/book/show/30679.The_Invisible_Writing,https://www.goodreads.com/book/show/30679.The_Invisible_Writing
30680,Up in the Air,0385722370,9780385722377, , ,ID,https://i.gr-assets.com/images/S/compressed.photo.goodreads.com/books/1388972789l/30680._SX98_.jpg,https://i.gr-assets.com/images/S/compressed.photo.goodreads.com/books/1388972789l/30680._SY75_.jpg,https://i.gr-assets.com/images/S/compressed.photo.goodreads.com/books/1388972789l/30680.jpg,2002,9,24,Anchor,eng,false,"Ryan Bingham’s job as a Career Transition Counselor—he fires people—has kept him airborne for years. Although he has come to despise his line of work, he has come to love the culture of what he calls “Airworld,” finding contentment within pressurized cabins, anonymous hotel rooms, and a wardrobe of wrinkle-free slacks. With a letter of resignation sitting on his boss’s desk, and the hope of a job with a mysterious consulting firm, Ryan Bingham is agonizingly close to his ultimate goal, his Holy Grail: one million frequent flier miles. But before he achieves this long-desired freedom, conditions begin to deteriorate. <br /><br />With perception, wit, and wisdom, <i>Up in the Air</i> combines brilliant social observation with an acute sense of the psychic costs of our rootless existence, and confirms Walter Kirn as one of the most savvy chroniclers of American life.",2.86,320,Paperback, ,497,https://www.goodreads.com/book/show/30680.Up_in_the_Air,https://www.goodreads.com/book/show/30680.Up_in_the_Air
30681,Thumbsucker,0385497091,9780385497091, , ,ID,https://i.gr-assets.com/images/S/compressed.photo.goodreads.com/books/1386924546l/30681._SX98_.jpg,https://i.gr-assets.com/images/S/compressed.photo.goodreads.com/books/1386924546l/30681._SY75_.jpg,https://i.gr-assets.com/images/S/compressed.photo.goodreads.com/books/1386924546l/30681.jpg,1999,10,19,Broadway Books,eng,false,"This eighties-centric, Ritalin-fueled, pitch-perfect comic novel by a writer to watch brings energy and originality to the classic Midwestern coming-of-age story.Meet Justin Cobb, ""the King Kong of oral obsessives"" (as his dentist dubs him) and the most appealingly bright and screwed-up fictional adolescent since Holden Caulfield donned his hunter's cap. For years, no remedy--not orthodontia, not the escalating threats of his father, Mike, a washed-out linebacker turned sporting goods entrepreneur, not the noxious cayenne pepper-based Suk-No-Mor--can cure Justin's thumbsucking habit.Then a course of hypnosis seemingly does the trick, but true to the conservation of neurotic energy, the problem doesn't so much disappear as relocate. Sex, substance abuse, speech team, fly-fishing, honest work, even Mormonism--Justin throws himself into each pursuit with a hyperactive energy that even his daily Ritalin dose does little to blunt.Each time, however, he discovers that there is no escaping the unruly imperatives of his self and the confines of his deeply eccentric family. The only ""cure"" for the adolescent condition is time and distance.Always funny, sometimes hilariously so, occasionally poignant, and even disturbing, deeply wise on the vexed subject of fathers and sons, Walter Kirn's <b>Thumbsucker</b> is an utterly fresh and all-American take on the painful process of growing up.",3.44,300,Paperback, ,113,https://www.goodreads.com/book/show/30681.Thumbsucker,https://www.goodreads.com/book/show/30681.Thumbsucker
30728,Numbers in the Dark and Other Stories,0679743537,9780679743538, , ,ID,https://i.gr-assets.com/images/S/compressed.photo.goodreads.com/books/1386919364l/30728._SX98_.jpg,https://i.gr-assets.com/images/S/compressed.photo.goodreads.com/books/1386919364l/30728._SY75_.jpg,https://i.gr-assets.com/images/S/compressed.photo.goodreads.com/books/1386919364l/30728.jpg,1996,10,1,Vintage,eng,false,"For the first time in paperback--a volume of thirty-seven diabolically inventive stories, fables, and ""impossible interviews"" from one of the great fantasists of the 20th century, displaying the full breadth of his vision and wit.  Written between 1943 and 1984 and masterfully translated by Tim Parks, the fictions in <b>Numbers in the Dark</b> display all of Calvino's dazzling gifts: whimsy and horror, exuberance of style, and a cheerful grasp of the absurdities of the human condition.",3.96,288,Paperback, ,112,https://www.goodreads.com/book/show/30728.Numbers_in_the_Dark_and_Other_Stories,https://www.goodreads.com/book/show/30728.Numbers_in_the_Dark_and_Other_Stories
30755,The Stories (So Far),0374524920,9780374524920, , ,ID,https://i.gr-assets.com/images/S/compressed.photo.goodreads.com/books/1498814422l/30755._SX98_.jpg,https://i.gr-assets.com/images/S/compressed.photo.goodreads.com/books/1498814422l/30755._SY75_.jpg,https://i.gr-assets.com/images/S/compressed.photo.goodreads.com/books/1498814422l/30755._SY475_.jpg,1997,3,13,"Farrar, Straus and Giroux",eng,false,"When Deborah Eisenberg's first book of stories, <i>Transactions in a Foreign Currency</i>, was published, John Updike noted: ""Whenever a new writer arrives, a new window of life is opened, and this has happened here."" The scope and depth of Eisenberg's idiosyncratic vision were even more apparent in her second collection, <i>Under the 82nd Airborne</i>, which <i>The New York Times Book Review </i>called ""nothing short of extraordinary.""<br /><br /><br />As these two collections gathered here into one volume show, Eisenberg's stories have an astonishing power and range. Her characters, whether they are walking in the streets of Manhattan or seemingly abandoned in foreign countries, continually make disquieting and sometimes life-threatening discoveries about themselves, discoveries that illuminate not only their own lives but also the wider net of relationships in which they are enmeshed.",4.00,496,Paperback, ,19,https://www.goodreads.com/book/show/30755.The_Stories,https://www.goodreads.com/book/show/30755.The_Stories
30810,"Reefer Madness: Sex, Drugs, and Cheap Labor in the American Black Market",0618446702,9780618446704, , ,ID,https://i.gr-assets.com/images/S/compressed.photo.goodreads.com/books/1442689427l/30810._SX98_.jpg,https://i.gr-assets.com/images/S/compressed.photo.goodreads.com/books/1442689427l/30810._SY75_.jpg,https://i.gr-assets.com/images/S/compressed.photo.goodreads.com/books/1442689427l/30810.jpg,2004,4,1,Mariner Books,eng,false,"America's black market is much larger than we realize, and it affects us all deeply, whether or not we smoke pot, rent a risqué video, or pay our kid's nannies in cash. In Reefer Madness the best-selling author of Fast Food Nation turns his exacting eye on the underbelly of the American marketplace and its far-reaching influence on our society. Exposing three American mainstays — pot, porn, and illegal immigrants — Eric Schlosser shows how the black market has burgeoned over the past several decades. He also draws compelling parallels between underground and overground: how tycoons and gangsters rise and fall, how new technology shapes a market, how government intervention can reinvigorate black markets as well as mainstream ones, and how big business learns — and profits — from the underground. <br /><br />Reefer Madness is a powerful investigation that illuminates the shadow economy and the culture that casts that shadow.<br />(back cover)",3.78,352,Paperback,First Mariner Books edition,353,https://www.goodreads.com/book/show/30810.Reefer_Madness,https://www.goodreads.com/book/show/30810.Reefer_Madness
30815,The Cyclist,0743249399,9780743249393, , ,ID,https://i.gr-assets.com/images/S/compressed.photo.goodreads.com/books/1410170202l/30815._SX98_.jpg,https://i.gr-assets.com/images/S/compressed.photo.goodreads.com/books/1410170202l/30815._SY75_.jpg,https://i.gr-assets.com/images/S/compressed.photo.goodreads.com/books/1410170202l/30815.jpg,2003,6,6,Simon  Schuster,en-US,false,"The controversial novel about food, love, and terrorism. <br /> Somewhere in the Middle East, an aspiring terrorist has been entrusted with a mission that will reverberate around the world: to deliver a bomb to a hotel in Beirut, where the detonation will destroy hundreds of innocent lives. If he remains true to his cause, he will bring about his own death. Yet life holds such tantalizing delights: food (his secret vice), the heady pleasures of bicycle racing, the joys of unexpected love. As the days count down to the final, chilling moment of reckoning, this angst-ridden gourmand ponders his existential quandary -- with horrifying and hilarious results. <br /> A slyly subversive black comedy about a food-fixated terrorist who dreams of liberation through a world of eroticism and sensuality, <i>The Cyclist</i> combines absurdist humor and edgy lyricism to tell a provocative, page-turning tale of individual freedom and political violence.",3.83,192,Paperback, ,34,https://www.goodreads.com/book/show/30815.The_Cyclist,https://www.goodreads.com/book/show/30815.The_Cyclist
30818,"The Rapture: In the Twinkling of an Eye   (Before They Were Left Behind, #3)",1414305818,9781414305813, , ,ID,https://i.gr-assets.com/images/S/compressed.photo.goodreads.com/books/1388445839l/30818._SX98_.jpg,https://i.gr-assets.com/images/S/compressed.photo.goodreads.com/books/1388445839l/30818._SY75_.jpg,https://i.gr-assets.com/images/S/compressed.photo.goodreads.com/books/1388445839l/30818.jpg,2007,2,1,Tyndale House Publishers,en-GB,false,"<b>Book 3 of the 3-book prequel to the best-selling Christian fiction series that sold over 63 million copies!</b><br /><br />""The Left Behind series . . . is among the best-selling fiction books of our times--right up there with Tom Clancy and Stephen King."" --<i>Time</i><br /><br />Get a glimpse into the lives of your favorite characters before they were left behind.<br />What was life like before the Rapture for Rayford, Irene, and Chloe Steele, Bruce Barnes, Buck Williams, and Tsion Ben Judah?<br />Why does Viv Ivins play such a pivotal role in Nicolae Carpathia's life?<br />What were the events surrounding Nicolae's sudden rise to power?<br />How did he become filled with evil?<br /><b>You will find all these answers and more in this exciting series!<br /><br />The Rapture: In the Twinkling of an Eye / Countdown to Earth's Last Days</b><br />In this the final prequel to the blockbuster series, the story alternates between events on earth immediately after the Rapture and characters in heaven as they view the chaotic events on earth.",4.16,351,Paperback, ,122,https://www.goodreads.com/book/show/30818.The_Rapture,https://www.goodreads.com/book/show/30818.The_Rapture
30833,The Death and Life of Great American Cities,0375508732,9780375508738, , ,ID,https://i.gr-assets.com/images/S/compressed.photo.goodreads.com/books/1168135326l/30833._SX98_.jpg,https://i.gr-assets.com/images/S/compressed.photo.goodreads.com/books/1168135326l/30833._SY75_.jpg,https://i.gr-assets.com/images/S/compressed.photo.goodreads.com/books/1168135326l/30833.jpg,2002,9,10,Random House,eng,false,"A direct and fundamentally optimistic indictment of the short-sightedness and intellectual arrogance that has characterized much of urban planning in this century, <i>The Death and Life of Great American Cities</i> has, since its first publication in 1961, become the standard against which all endeavors in that field are measured. In prose of outstanding immediacy, Jane Jacobs writes about what makes streets safe or unsafe; about what constitutes a neighborhood, and what function it serves within the larger organism of the city; about why some neighborhoods remain impoverished while others regenerate themselves. She writes about the salutary role of funeral parlors and tenement windows, the dangers of too much development money and too little diversity. Compassionate, bracingly indignant, and always keenly detailed, Jane Jacobs's monumental work provides an essential framework for assessing the vitality of all cities.",4.31,472,Hardcover, ,833,https://www.goodreads.com/book/show/30833.The_Death_and_Life_of_Great_American_Cities,https://www.goodreads.com/book/show/30833.The_Death_and_Life_of_Great_American_Cities
30842,Riot,0143030906,9780143030904, , ,ID,https://i.gr-assets.com/images/S/compressed.photo.goodreads.com/books/1433758971l/30842._SX98_.jpg,https://i.gr-assets.com/images/S/compressed.photo.goodreads.com/books/1433758971l/30842._SY75_.jpg,https://i.gr-assets.com/images/S/compressed.photo.goodreads.com/books/1433758971l/30842.jpg,2003,9,30,Penguin India,eng,false,"Who killed twenty-four-year-old Priscilla Hart? And why would anyone want to murder this idealistic American student who had come to India to volunteer in a women's health programme? Had her work made a killer out of an enraged husband? Or was her death the result of a xenophobic attack? Was she involved in an indiscriminate love affair that had spun out of control? Or was she simply the innocent victim of a riot that had exploded in that fateful year of 1987 between Hindus and Muslims?Shashi Tharoor experiments brilliantly with narrative form, chronicling the mystery of Priscilla Hart's death through the often contradictory accounts of a dozen or more characters. Intellectually provocative and emotionally charged, Riot is a novel about the ownership of history, about love, hate, cultural collision, religious fanaticism and the impossibility of knowing the truth.",3.71,272,Paperback, ,137,https://www.goodreads.com/book/show/30842.Riot,https://www.goodreads.com/book/show/30842.Riot
30843,The Great Indian Novel,1559701943,9781559701945, , ,ID,https://i.gr-assets.com/images/S/compressed.photo.goodreads.com/books/1599943210l/30843._SX98_.jpg,https://i.gr-assets.com/images/S/compressed.photo.goodreads.com/books/1599943210l/30843._SY75_.jpg,https://i.gr-assets.com/images/S/compressed.photo.goodreads.com/books/1599943210l/30843._SY475_.jpg,1993,2,26,Arcade Publishing,eng,false,"In this award-winning, internationally acclaimed novel, Tharoor has masterfully recast the 2,000 year-old epic, The Mahabharata, with fictional but highly recognizable events and characters from twentieth-century Indian politics. Chronicling the Indian struggle for freedom and independence from Great Britain, Tharoor directs his hilarious satire as much against Indian foibles as the bumbling of the British rulers.",3.88,423,Paperback, ,365,https://www.goodreads.com/book/show/30843.The_Great_Indian_Novel,https://www.goodreads.com/book/show/30843.The_Great_Indian_Novel
30844,India: From Midnight to the Millennium,0060977531,9780060977535, , ,ID,https://i.gr-assets.com/images/S/compressed.photo.goodreads.com/books/1168143890l/30844._SX98_.jpg,https://i.gr-assets.com/images/S/compressed.photo.goodreads.com/books/1168143890l/30844._SY75_.jpg,https://i.gr-assets.com/images/S/compressed.photo.goodreads.com/books/1168143890l/30844.jpg,1998,9,1,Harper Perennial,eng,false,"Few books in recent years, if any, offer such a comprehensive overview of what ails India, its politicians and its people; and few writers, apart from Nirad Chaudhury and V. S. Naipaul, benefit so obviously from the perspective Tharoor offers, that of an Indian with a profound empathy for his native culture, combined with the insight made possible by following India's progress from afar. --New York Times A hard-hitting, powerfully analytical and supremely articulate new book. . . . Tharoor discusses the 'flawed miracle of Indian democracy' from various angles, opting for a take-no-prisoners approach as he criticizes politicians, unpacks layers of misguided governmental policies and exposes the atavistic tendencies of special-interest pols. --Newsday Tharoor looks back at his country's first 50 years of independence, describing its challenges (illiteracy, poverty, sectarian violence and the ever-present caste problem) and its triumphs (a thriving democracy, a burgeoning economy) in lively, informative prose. He is particularly adept at describing all that India and Indians are not--not the same ethnicity, religion or language--to arrive at the nation's essence: that 'the singular thing about India was that you could only speak of it in the plural'. --Seattle Times",3.81,416,Paperback, ,1,https://www.goodreads.com/book/show/30844.India,https://www.goodreads.com/book/show/30844.India
30852,The Woman Warrior,0679721886,9780679721888, , ,ID,https://i.gr-assets.com/images/S/compressed.photo.goodreads.com/books/1541333110l/30852._SX98_.jpg,https://i.gr-assets.com/images/S/compressed.photo.goodreads.com/books/1541333110l/30852._SY75_.jpg,https://i.gr-assets.com/images/S/compressed.photo.goodreads.com/books/1541333110l/30852.jpg,1989,4,23,Vintage Books USA,eng,false,"A Chinese American woman tells of the Chinese myths, family stories and events of her California childhood that have shaped her identity.",3.73,204,Paperback, ,1314,https://www.goodreads.com/book/show/30852.The_Woman_Warrior,https://www.goodreads.com/book/show/30852.The_Woman_Warrior
30858,When God Was a Woman,0880295333,9780880295338, , ,ID,https://i.gr-assets.com/images/S/compressed.photo.goodreads.com/books/1348390229l/30858._SX98_.jpg,https://i.gr-assets.com/images/S/compressed.photo.goodreads.com/books/1348390229l/30858._SX50_.jpg,https://i.gr-assets.com/images/S/compressed.photo.goodreads.com/books/1348390229l/30858.jpg,1990,1,1,Marboro Books,en-GB,false,"Here, archaeologically documented, is the story of the religion of the Goddess. Under her, women's roles were far more prominent than in patriarchal Judeo-Christian cultures. Stone describes this ancient system and, with its disintegration, the decline in women's status. Index, maps and illustrations.",3.91,265,Hardcover, ,220,https://www.goodreads.com/book/show/30858.When_God_Was_a_Woman,https://www.goodreads.com/book/show/30858.When_God_Was_a_Woman
30868,"The Bean Trees (Greer Family, #1)",0812474945,9780812474947, , ,ID,https://i.gr-assets.com/images/S/compressed.photo.goodreads.com/books/1443483961l/30868._SX98_.jpg,https://i.gr-assets.com/images/S/compressed.photo.goodreads.com/books/1443483961l/30868._SY75_.jpg,https://i.gr-assets.com/images/S/compressed.photo.goodreads.com/books/1443483961l/30868.jpg,1989,3,1,Perfection Learning,eng,false,"Clear-eyed and spirited, Taylor Greer grew up poor in rural Kentucky with the goals of avoiding pregnancy and getting away. But when she heads west with high hopes and a barely functional car, she meets the human condition head-on. By the time Taylor arrives in Tucson, Arizona, she has acquired a completely unexpected child, a three-year-old American Indian girl named Turtle, and must somehow come to terms with both motherhood and the necessity for putting down roots. Hers is a story about love and friendship, abandonment and belonging, and the discovery of surprising resources in apparently empty places.",3.97,232,Hardcover, ,5589,https://www.goodreads.com/book/show/30868.The_Bean_Trees,https://www.goodreads.com/book/show/30868.The_Bean_Trees
