id,title,isbn,isbn13,asin,kindle_asin,country_code,image_url,small_image_url,large_image_url,publication_year,publication_month,publication_day,publisher,language_code,is_ebook,description,average_rating,num_pages,format,edition_information,text_reviews_count,url,link
15856,Nights of Rain and Stars,1552784924,9781552784921, , ,ID,https://i.gr-assets.com/images/S/compressed.photo.goodreads.com/books/1166694851l/15856._SX98_.jpg,https://i.gr-assets.com/images/S/compressed.photo.goodreads.com/books/1166694851l/15856._SX50_.jpg,https://i.gr-assets.com/images/S/compressed.photo.goodreads.com/books/1166694851l/15856._SX318_.jpg,,,,,,false,"""Four strangers, with nothing in common but a need to escape, meet in a Greek taverna high above the small village of Aghia Anna. From Ireland, America, Germany and England, they have each left their homes and old lives, when a shocking tragedy throws them unexpectedly together."" ""Fiona is a young nurse, trying to make her family understand her need to follow her own path. Thomas desperately misses his young son and fears that his ex-wife will come between them. Elsa abruptly left her career as a television presenter, but someone from her past refuses to let her go. And shy, quiet David is determined to make a stand against his overbearing father. With these four is Andreas, the taverna owner, who badly misses the son who left home nine years ago and has never returned."" Nights of Rain and Stars is the story of one summer and four people, each with a life in turmoil. With the help of Vonni, a middle-aged Irish woman who lives in the village and is now a near-native, they find solutions - though not necessarily the ones they anticipated.",3.71,392, , ,8,https://www.goodreads.com/book/show/15856.Nights_of_Rain_and_Stars,https://www.goodreads.com/book/show/15856.Nights_of_Rain_and_Stars
15858,Mirror Mirror,0060988657,9780060988654, , ,ID,https://i.gr-assets.com/images/S/compressed.photo.goodreads.com/books/1407710336l/15858._SX98_.jpg,https://i.gr-assets.com/images/S/compressed.photo.goodreads.com/books/1407710336l/15858._SY75_.jpg,https://i.gr-assets.com/images/S/compressed.photo.goodreads.com/books/1407710336l/15858.jpg,2004,10,1,Regan Books,eng,false,"The world was called Montefiore, as far as she knew, and from her aerie on every side all the world descended.<br /><br />The year is 1502, and seven-year-old Bianca de Nevada lives perched high above the rolling hills and valleys of Tuscany and Umbria at Montefiore, the farm of her beloved father, Don Vicente. There she spends her days cosseted by Primavera Vecchia, the earthy cook, and Fra Ludovico, a priest who tends to their souls between bites of ham and sips of wine.<br /><br />But one day a noble entourage makes its way up the winding slopes to the farm - and the world comes to Montefiore. In the presence of Cesare Borgia and his sister, the lovely and vain Lucrezia - decadent children of a wicked pope - no one can claim innocence for very long. When Borgia sends Don Vicente on a years-long quest to reclaim a relic of the original Tree of Knowledge, he leaves Bianca under the care - so to speak - of Lucrezia. She plots a dire fate for the young girl in the woods below the farm, but in the dark forest there can be found salvation as well ...<br /><br />The eye is always caught by light, but shadows have more to say.",3.28,280,Paperback, ,1569,https://www.goodreads.com/book/show/15858.Mirror_Mirror,https://www.goodreads.com/book/show/15858.Mirror_Mirror
15859,"Unnatural Exposure (Kay Scarpetta, #8)",0425163407,9780425163405, , ,ID,https://i.gr-assets.com/images/S/compressed.photo.goodreads.com/books/1390174724l/15859._SX98_.jpg,https://i.gr-assets.com/images/S/compressed.photo.goodreads.com/books/1390174724l/15859._SY75_.jpg,https://i.gr-assets.com/images/S/compressed.photo.goodreads.com/books/1390174724l/15859.jpg,1998,7,1,Berkley Books ,eng,false,"A body is discovered in a Virginia landfill. The details --- expert removal of head and limbs --- mirror that of a case Dr. Kay Scarpetta has been investigating in Ireland. But for Scarpetta, the game has only just begun. The killer boldly contacts her via the Internet, signing off with the ominous screen name <i>deadoc.</i> As her investigation deepens, Scarpetta discovers that the victim in Virginia was exposed to a rare smallpox-like virus before she was killed, and that Scarpetta herself could be infected.<br /><br />Now she knows she is up against a killer unlike any she has pursued before --- a relentless psychopath with access to an incredibly sophisticated arsenal of deadly force. And with a very personal interest in seeing Kay Scarpetta suffer.",4.07,367,Mass Market Paperback, ,37,https://www.goodreads.com/book/show/15859.Unnatural_Exposure,https://www.goodreads.com/book/show/15859.Unnatural_Exposure
15860,State of Fear, , , , ,ID,https://i.gr-assets.com/images/S/compressed.photo.goodreads.com/books/1554227284l/15860._SX98_.jpg,https://i.gr-assets.com/images/S/compressed.photo.goodreads.com/books/1554227284l/15860._SY75_.jpg,https://i.gr-assets.com/images/S/compressed.photo.goodreads.com/books/1554227284l/15860._SY475_.jpg,2005,11,1,Avon,eng,false,"In Paris, a physicist dies after performing a laboratory experiment for a beautiful visitor. In the jungles of Malaysia, a mysterious buyer purchases deadly cavitation technology, built to his specifications. In Vancouver, a small research submarine is leased for use in the waters off New Guinea. And in Tokyo, an intelligence agent tries to understand what it all means. Thus begins Michael Crichton's exciting and provocative technothriller, State of Fear. Only Michael Crichton's unique ability to blend science fact and pulse-pounding fiction could bring such disparate elements to a heart-stopping conclusion. This is Michael Crichton's most wide-ranging thriller. State of Fear takes the reader from the glaciers of Iceland to the volcanoes of Antarctica, from the Arizona desert to the deadly jungles of the Solomon Islands, from the streets of Paris to the beaches of Los Angeles. The novel races forward, taking the reader on a rollercoaster thrill ride, all the while keeping the brain in high gear. Gripping and thought-provoking, State of Fear is Michael Crichton at his very best.",3.71,672,Mass Market Paperback, ,2714,https://www.goodreads.com/book/show/15860.State_of_Fear,https://www.goodreads.com/book/show/15860.State_of_Fear
15863,State of Fear,0739448153,9780739448151, , ,ID,https://i.gr-assets.com/images/S/compressed.photo.goodreads.com/books/1285611956l/15863.jpg,https://i.gr-assets.com/images/S/compressed.photo.goodreads.com/books/1285611956l/15863._SY75_.jpg,https://i.gr-assets.com/images/S/compressed.photo.goodreads.com/books/1285611956l/15863.jpg,,,,Harper Collins,eng,false,"In Paris, a physicist dies after performing a laboratory experiment for a beautiful visitor. In the jungles of Malaysia, a mysterious buyer purchases deadly cavitation technology, built to his specifications. In Vancouver, a small research submarine is leased for use in the waters off New Guinea. And in Tokyo, an intelligence agent tries to understand what it all means. Thus begins Michael Crichton's exciting and provocative technothriller, State of Fear. Only Michael Crichton's unique ability to blend science fact and pulse-pounding fiction could bring such disparate elements to a heart-stopping conclusion. This is Michael Crichton's most wide-ranging thriller. State of Fear takes the reader from the glaciers of Iceland to the volcanoes of Antarctica, from the Arizona desert to the deadly jungles of the Solomon Islands, from the streets of Paris to the beaches of Los Angeles. The novel races forward, taking the reader on a rollercoaster thrill ride, all the while keeping the brain in high gear. Gripping and thought-provoking, State of Fear is Michael Crichton at his very best.",3.71,1005,Hardcover, ,34,https://www.goodreads.com/book/show/15863.State_of_Fear,https://www.goodreads.com/book/show/15863.State_of_Fear
15867,"Mugglenet.Com's What Will Happen in Harry Potter 7: Who Lives, Who Dies, Who Falls in Love and How Will the Adventure Finally End?",1569755833,9781569755839, , ,ID,https://i.gr-assets.com/images/S/compressed.photo.goodreads.com/books/1421633655l/15867._SX98_.jpg,https://i.gr-assets.com/images/S/compressed.photo.goodreads.com/books/1421633655l/15867._SY75_.jpg,https://i.gr-assets.com/images/S/compressed.photo.goodreads.com/books/1421633655l/15867.jpg,2006,10,19,Ulysses Press,en-GB,false,"As anticipation of the final Harry Potter book intensifies, a debate is raging among fans about what’s in store for Harry and the rest of the gang at Hogwarts. In this book, the experts at MuggleNet.com present a wide range of hard facts and bold predictions about the most popular storylines, favorite characters, and final outcome of the Harry Potter saga. Drawing on their intimate knowledge of the previous six books as well as tips and suggestions made by millions of MuggleNet.com fans (not to mention a personal interview with J.K. Rowling), the authors offer answers to the burning questions of Harry Potter readers everywhere: Will Hogwarts School be open for Harry’s final year, and will Harry even be in attendance? Will Harry’s quest for the remaining Horcruxes be rewarded? Where do Severus Snape’s true loyalties lie? And, most importantly, will Harry survive the final battle with Lord Voldemort?",4.25,216,Paperback, ,112,https://www.goodreads.com/book/show/15867.Mugglenet_Com_s_What_Will_Happen_in_Harry_Potter_7,https://www.goodreads.com/book/show/15867.Mugglenet_Com_s_What_Will_Happen_in_Harry_Potter_7
15868,"Harry Potter y la piedra filosofal (Harry Potter, #1)",8478886540,9788478886548, , ,ID,https://i.gr-assets.com/images/S/compressed.photo.goodreads.com/books/1550337333l/15868._SX98_.jpg,https://i.gr-assets.com/images/S/compressed.photo.goodreads.com/books/1550337333l/15868._SY75_.jpg,https://i.gr-assets.com/images/S/compressed.photo.goodreads.com/books/1550337333l/15868._SY475_.jpg,1999,8,,Salamandra,spa,false,"Harry Potter se ha quedado huérfano y vive en casa de sus abominables tíos y el insoportable primo Dudley. Se siente muy triste y solo, hasta que un buen día recibe una carta que cambiará su vida para siempre. En ella le comunican que ha sido aceptado como alumno en el Colegio Hogwarts de Magia. A partir de ese momento, la suerte de Harry da un vuelco espectacular. En esa escuela tan especial aprenderá encantamientos, trucos fabulosos y tácticas de defensa contra las malas artes. Se convertirá en el campeón escolar de quidditch, una especie de fútbol aéreo que se juega montado sobre escobas, y hará un puñado de buenos amigos... aunque también algunos temibles enemigos. Pero, sobre todo, conocerá los secretos que le permitirán cumplir con su destino. Pues, aunque no lo parezca a primera vista, Harry no es un chico normal y corriente: ¡es un verdadero mago!",4.47,254,Hardcover,27th edition,1576,https://www.goodreads.com/book/show/15868.Harry_Potter_y_la_piedra_filosofal,https://www.goodreads.com/book/show/15868.Harry_Potter_y_la_piedra_filosofal
15872,"Harry Potter y el misterio del príncipe (Harry Potter, #6)",8478889930,9788478889938, , ,ID,https://i.gr-assets.com/images/S/compressed.photo.goodreads.com/books/1415727688l/15872._SY160_.jpg,https://i.gr-assets.com/images/S/compressed.photo.goodreads.com/books/1415727688l/15872._SY75_.jpg,https://i.gr-assets.com/images/S/compressed.photo.goodreads.com/books/1415727688l/15872.jpg,2006,2,28,Salamandra,spa,false,"Con dieciséis años cumplidos, Harry Potter inicia el sexto curso en Hogwarts en medio de terribles acontecimientos que asolan Inglaterra. Elegido capitán del equipo de Quidditch, los entrenamientos, los exámenes y las chicas ocupan todo su tiempo, pero la tranquilidad dura poco. A pesar de los férreos controles de seguridad que protegen la escuela, dos alumnos son brutalmente atacados. Dumbledore sabe que se acerca el momento, anunciado por la Profecía, en que Harry Potter y Voldemort se enfrentarán a muerte: «El único con poder para vencer al Señor Tenebroso se acerca... Uno de los dos debe morir a manos del otro, pues ninguno de los dos podrá vivir mientras siga el otro con vida.». El anciano director solicitará la ayuda de Harry y juntos emprenderán peligrosos viajes para intentar debilitar al enemigo, para lo cual el joven mago contará con la ayuda de un viejo libro de pociones perteneciente a un misterioso príncipe, alguien que se hace llamar Príncipe Mestizo.",4.57,602,Hardcover, ,526,https://www.goodreads.com/book/show/15872.Harry_Potter_y_el_misterio_del_pr_ncipe,https://www.goodreads.com/book/show/15872.Harry_Potter_y_el_misterio_del_pr_ncipe
15875,"Harry Potter y la cámara secreta (Harry Potter, #2)",8498380138,9788498380132, , ,ID,https://i.gr-assets.com/images/S/compressed.photo.goodreads.com/books/1166695836l/15875._SX98_.jpg,https://i.gr-assets.com/images/S/compressed.photo.goodreads.com/books/1166695836l/15875._SY75_.jpg,https://i.gr-assets.com/images/S/compressed.photo.goodreads.com/books/1166695836l/15875._SY475_.jpg,2006,3,28,Salamandra,spa,false,"Tras derrotar una vez más a lord Voldemort, su siniestro enemigo en Harry Potter y la piedra filosofal, Harry espera impaciente en casa de sus insoportables tíos el inicio del segundo curso del Colegio Hogwarts de Magia y Hechicería.<br />Sin embargo, la espera dura poco, pues un elfo aparece en su habitación y le advierte que una amenaza mortal se cierne sobre la escuela. Así pues, Harry no se lo piensa dos veces y, acompañado por Ron, su mejor amigo, se dirige a Hogwarts en un coche volador. Pero ¿puede un aprendiz de mago defender la escuela de los malvados que pretenden destruirla? Sin saber que alguien ha abierto la Cámara de los Secretos, dejando escapar una serie de monstruos peligrosos, Harry y sus amigos Ron y Hermione tendrán que enfrentarse con arañas gigantes, serpientes encantadas, fantasmas enfurecidos, y sobre todo, con la mismísima reencarnación de su más temible adversario.",4.43,288,Paperback, ,16,https://www.goodreads.com/book/show/15875.Harry_Potter_y_la_c_mara_secreta,https://www.goodreads.com/book/show/15875.Harry_Potter_y_la_c_mara_secreta
15876,"Harry Potter y la Orden del Fénix (Harry Potter, #5)",8478888845,9788478888849, , ,ID,https://i.gr-assets.com/images/S/compressed.photo.goodreads.com/books/1411644258l/15876._SX98_.jpg,https://i.gr-assets.com/images/S/compressed.photo.goodreads.com/books/1411644258l/15876._SY75_.jpg,https://i.gr-assets.com/images/S/compressed.photo.goodreads.com/books/1411644258l/15876.jpg,2004,2,21,Emece Editores,spa,false,"Las tediosas vacaciones en casa de sus tíos todavía no han acabado y Harry Potter se encuentra más inquieto que nunca. Apenas ha tenido nocitias de Ron y Hermiones, y presiente que algo extraño está sucediendo en Hogwarts. En efecto, cuando por fin comienza otro curso en el famoso colegio de magia y hechicería, sus temores se vuelven realidad. El Ministerio de Magia niega que Voldemort haya regresado y ha iniciado una campaña de desprestigio contra Harry Pottery Dumbledore, para lo cual ha asignado a la horrible profesora Dolores Umbridge la tarea de vigilar todos sus movimientos. Así pues, además de sentirse solo e incomprendido, Harry sospecha que Voldemort puede adivinar sus pensamientos, e intuye que el temible mago trata de apoderarse de un objeto secreto que le permitiría recuperar su poder destructivo.",4.50,893,Hardcover, ,655,https://www.goodreads.com/book/show/15876.Harry_Potter_y_la_Orden_del_F_nix,https://www.goodreads.com/book/show/15876.Harry_Potter_y_la_Orden_del_F_nix
15881,"Harry Potter and the Chamber of Secrets (Harry Potter, #2)",0439064864,9780439064866, , ,ID,https://i.gr-assets.com/images/S/compressed.photo.goodreads.com/books/1474169725l/15881._SX98_.jpg,https://i.gr-assets.com/images/S/compressed.photo.goodreads.com/books/1474169725l/15881._SY75_.jpg,https://i.gr-assets.com/images/S/compressed.photo.goodreads.com/books/1474169725l/15881._SY475_.jpg,1999,6,2,Arthur A. Levine Books / Scholastic Inc.,eng,false,"Ever since Harry Potter had come home for the summer, the Dursleys had been so mean and hideous that all Harry wanted was to get back to the Hogwarts School for Witchcraft and Wizardry. But just as he’s packing his bags, Harry receives a warning from a strange impish creature who says that if Harry returns to Hogwarts, disaster will strike.<br /><br />And strike it does. For in Harry’s second year at Hogwarts, fresh torments and horrors arise, including an outrageously stuck-up new professor and a spirit who haunts the girls’ bathroom. But then the real trouble begins – someone is turning Hogwarts students to stone. Could it be Draco Malfoy, a more poisonous rival than ever? Could it possible be Hagrid, whose mysterious past is finally told? Or could it be the one everyone at Hogwarts most suspects… Harry Potter himself!",4.43,341,Hardcover,First American Edition,38645,https://www.goodreads.com/book/show/15881.Harry_Potter_and_the_Chamber_of_Secrets,https://www.goodreads.com/book/show/15881.Harry_Potter_and_the_Chamber_of_Secrets
15886,The Facts Behind the Helsinki Roccamatios,0739455311,9780739455319, , ,ID,https://i.gr-assets.com/images/S/compressed.photo.goodreads.com/books/1602360002l/15886._SX98_.jpg,https://i.gr-assets.com/images/S/compressed.photo.goodreads.com/books/1602360002l/15886._SY75_.jpg,https://i.gr-assets.com/images/S/compressed.photo.goodreads.com/books/1602360002l/15886.jpg,1993,,,"Hancourt, Inc.",eng,false,"The appearance of a young storyteller with a unique fictional voice is cause for celebration. Yann Martel's title story (described as ""unforgettable...a truly stunning piece of fiction""*), won the 1991 Journey Prize to universal acclaim. The intensely human tragedy that lies at its heart is told with a spare, careful elegance that resonates long after it has ended--and is matched through all the stories by an immediacy an dazzling freshness.",3.49,208,Paperback, ,234,https://www.goodreads.com/book/show/15886.The_Facts_Behind_the_Helsinki_Roccamatios,https://www.goodreads.com/book/show/15886.The_Facts_Behind_the_Helsinki_Roccamatios
15888,An Instance of the Fingerpost,1573227951,9781573227957, , ,ID,https://i.gr-assets.com/images/S/compressed.photo.goodreads.com/books/1548147833l/15888._SX98_.jpg,https://i.gr-assets.com/images/S/compressed.photo.goodreads.com/books/1548147833l/15888._SY75_.jpg,https://i.gr-assets.com/images/S/compressed.photo.goodreads.com/books/1548147833l/15888.jpg,2000,4,1,Riverhead Books,eng,false,"An ingenious tour de force: an utterly compelling historical mystery with a plot that twists and turns and keeps the reader guessing until the very last page.<br /><br />We are in England in the 1660s. Charles II has been restored to the throne following years of civil war and Cromwell's short-lived republic. Oxford is the intellectual seat of the country, a place of great scientific, religious, and political ferment. A fellow of New College is found dead in suspicious circumstances. A young woman is accused of his murder. We hear the story of the death from four witnesses: an Italian physician intent on claiming credit for the invention of blood transfusion; the son of an alleged Royalist traitor; a master cryptographer who has worked for both Cromwell and the king; and a renowned Oxford antiquarian. Each tells his own version of what happened. Only one reveals the extraordinary truth.<br /><br />With rights sold for record-breaking sums around the world, <i>An Instance of the Fingerpost</i> is destined to become a major international publishing event. Deserving of comparison to the works of John Fowles and Umberto Eco, Iain Pears's novel is an ingenious tour de force: an utterly compelling historical mystery with a plot that twists and turns and keeps the reader guessing until the very last page.",3.94,691,Paperback, ,1141,https://www.goodreads.com/book/show/15888.An_Instance_of_the_Fingerpost,https://www.goodreads.com/book/show/15888.An_Instance_of_the_Fingerpost
15901,"Friends, Lovers, Chocolate (Isabel Dalhousie, #2)",0375422994,9780375422997, , ,ID,https://i.gr-assets.com/images/S/compressed.photo.goodreads.com/books/1438615734l/15901._SX98_.jpg,https://i.gr-assets.com/images/S/compressed.photo.goodreads.com/books/1438615734l/15901._SY75_.jpg,https://i.gr-assets.com/images/S/compressed.photo.goodreads.com/books/1438615734l/15901._SY475_.jpg,2005,9,20,Pantheon Books,eng,false,"ISABEL DALHOUSIE - Book 2 <br />Nothing captures the charm of Edinburgh like the bestselling Isabel Dalhousie series of novels featuring the insatiably curious philosopher and woman detective. Whether investigating a case or a problem of philosophy, the indefatigable Isabel Dalhousie, one of fiction's most richly developed amateur detectives, is always ready to pursue the answers to all of life's questions, large and small. <br />In this delightful second installment in Alexander McCall Smith's best-selling new detective series, the irrepressibly curious Isabel Dalhousie, editor of the Review of Applied Ethics, gets caught up in an affair of the heart--this one a transplant. <br /> When Isabel's niece, Cat, asks Isabel to run her delicatessen while she attends a wedding in Italy, Isabel meets a man with a most interesting problem. He recently had a heart transplant and is suddenly plagued with memories of events that never happened to him. The situation appeals to Isabel as a philosophical question: Is the heart truly the seat of the soul? And it piques her insatiable curiosity: Could the memories be connected with the donor's demise? Of course, Grace--Isabel's no-nonsense housekeeper--and Isabel's friend Jamie think it is none of Isabel's business. Meanwhile, Cat brings home an Italian lothario, who, in accordance with all that Isabel knows about Italian lotharios, shouldn't be trusted . . . but, goodness, he is charming. <br /> That makes two mysteries of the heart to be solved--just the thing for Isabel Dalhousie.",3.63,261,Hardcover, ,787,https://www.goodreads.com/book/show/15901.Friends_Lovers_Chocolate,https://www.goodreads.com/book/show/15901.Friends_Lovers_Chocolate
15902,"The Right Attitude to Rain (Isabel Dalhousie, #3)",0375423001,9780375423000, , ,ID,https://i.gr-assets.com/images/S/compressed.photo.goodreads.com/books/1442622728l/15902._SX98_.jpg,https://i.gr-assets.com/images/S/compressed.photo.goodreads.com/books/1442622728l/15902._SY75_.jpg,https://i.gr-assets.com/images/S/compressed.photo.goodreads.com/books/1442622728l/15902._SY475_.jpg,2006,9,19,Pantheon Books,eng,false,"The delectable new installment in the bestselling and already beloved adventures of Isabel Dalhousie and her no-nonsense housekeeper, Grace.<br /><br />When friends from Dallas arrive in Edinburgh and introduce Isabel to Tom Bruce – a bigwig at home in Texas – several confounding situations unfurl at once. Tom’s young fiancée’s roving eye leads Isabel to believe that money may be the root of her love for Tom. But what, Isabel wonders, is the root of the interest Tom begins to show for Isabel herself? And she can’t forget about her niece, Cat, who’s busy falling for a man whom Isabel suspects of being an incorrigible mama’s boy. Of course Grace and Isabel’s friend Jamie counsel Isabel to stay out of all of it, but there are irresistible philosophical issues at stake – when to tell the truth and when to keep one’s mouth shut, to be precise – and philosophical issues are meat and drink to Isabel Dalhousie, editor of the Review of Applied Ethics. In any case, she’s certain of the ethical basis for a little sleuthing now and again – especially when the problems involve matters of the heart.",3.76,276,Hardcover, ,577,https://www.goodreads.com/book/show/15902.The_Right_Attitude_to_Rain,https://www.goodreads.com/book/show/15902.The_Right_Attitude_to_Rain
15903,"Espresso Tales (44 Scotland Street, #2)", , , , ,ID,https://i.gr-assets.com/images/S/compressed.photo.goodreads.com/books/1402601846l/15903._SX98_.jpg,https://i.gr-assets.com/images/S/compressed.photo.goodreads.com/books/1402601846l/15903._SY75_.jpg,https://i.gr-assets.com/images/S/compressed.photo.goodreads.com/books/1402601846l/15903.jpg,2006,7,11,Anchor,en-US,false,"<b>44 SCOTLAND STREET - Book 2<br /></b><br /><b>The residents and neighbors of 44 Scotland Street and the city of Edinburgh come to vivid life in these gently satirical, wonderfully perceptive serial novels, featuring six-year-old Bertie, a remarkably precocious boy—just ask his mother.  </b><br />  <br />Back are all our favorite denizens of a Georgian townhouse in Edinburgh. Bertie the immensely talented six year old is now enrolled in kindergarten, and much to his dismay, has been clad in pink overalls for his first day of class. Bruce has lost his job as a surveyor, and between admiring glances in the mirror, is contemplating becoming a wine merchant. Pat is embarking on a new life at Edinburgh University and perhaps on a new relationship, courtesy of Domenica, her witty and worldly-wise neighbor. McCall Smith has much in store for them as the brief spell of glorious summer sunshine gives way to fall a season cursed with more traditionally Scottish weather.<br /><br />Full of McCall Smith’s gentle humor and sympathy for his characters, <i>Espresso Tales</i> is also an affectionate portrait of a city and its people who, in the author’s own words, “make it one of the most vibrant and interesting places in the world.”",3.87,345,Paperback, ,700,https://www.goodreads.com/book/show/15903.Espresso_Tales,https://www.goodreads.com/book/show/15903.Espresso_Tales
