id,title,isbn,isbn13,asin,kindle_asin,country_code,image_url,small_image_url,large_image_url,publication_year,publication_month,publication_day,publisher,language_code,is_ebook,description,average_rating,num_pages,format,edition_information,text_reviews_count,url,link
2575908,True Evil,1423318005,9781423318002, , ,ID,https://i.gr-assets.com/images/S/compressed.photo.goodreads.com/books/1348776149l/2575908._SY160_.jpg,https://i.gr-assets.com/images/S/compressed.photo.goodreads.com/books/1348776149l/2575908._SY75_.jpg,https://i.gr-assets.com/images/S/compressed.photo.goodreads.com/books/1348776149l/2575908.jpg,2007,9,28,Brilliance Audio,eng,false,"“If you wanted to kill your spouse and get away with it, you had to do something truly ingenious: something that wouldn’t even be perceived as murder. And that was the service that Andrew Rusk had found a way to provide. Like any quality product, it did not come cheap. Nor did it come quickly. And perhaps most important of all, it was not for those with weak constitutions. Demand was high, of course, but few people were truly suitable clients. It took a deep-rooted hatred to watch your spouse die in agony, knowing that you had brought about that pain. But on the other hand, some people bore up remarkably well.”<br /><br />With these words, New York Times bestselling author Greg Iles returns to his trademark Southern milieu in this terrifying thriller, an unnerving tale of evil lurking beneath the veneer of idyllic suburban life. Brimming with the masterful suspense and intense psychological drama that made Turning Angel, Blood Memory, and The Quiet Game bestsellers, True Evil tells the chilling story of a divorce attorney who may be orchestrating the deaths of his clients’ spouses, bringing new meaning to the phrase “’til death do us part.”<br /><br />Dr. Chris Shepard is thirty-six years old, newly married, and well on his way to a perfect life. Or so he believes. But that future is forever cast into doubt the day Special Agent Alexandra Morse walks into his office and drops a bombshell: Dr. Shepard’s beautiful new wife is plotting his murder. Shepard is so shocked that he almost throws Agent Morse out of his office. Yet once he is alone, doubt begins to gnaw at him. Paranoia magnifies the small cracks in his marital relationship, and soon he can have no peace unless he knows the truth. When Agent Morse reappears, Chris agrees to act as bait to help her unravel the divorce lawyer’s scheme, which may already have cost nine unsuspecting spouses their lives.<br /><br />At the center of the mystery lies a maddeningly simple question: If these people really were murdered, why can’t the FBI prove it? Rigorous autopsies have uncovered no forensic evidence of foul play, and the police believe no crimes have occurred. As Dr. Shepard and Agent Morse struggle against an invisible adversary, Shepard realizes that he’s working with a desperate woman. The reason: the killer’s last known victim was Alex Morse’s sister, who from her deathbed accused her husband of murder and extracted a vow that Alex save her ten-year-old nephew from his father. This has driven Alex to risk both her life and her career to fulfill that vow. But Chris Shepard soon feels desperation of his own. As he probes his wife’s hidden past, he is confronted by the probability that the woman he loves wants him dead.<br /><br />He has adopted her son and given her everything he has to give, and yet somewhere out there, a killer with the brilliance to outwit the top forensic scientists in the world is closing in on him.<br /><br />Who is this merciless assassin? Why is murder an art form for him? And what clues could exist to lead them to a man of such twisted talents? Not even the clients who hire him know his identity, and the lawyer who works with him fears him above all else. Most terrifying, those who choose murder over divorce soon learn a terrible truth: once set in motion, the instrument of their anger cannot be stopped.",4.09,6,Audio CD,Abridged,19,https://www.goodreads.com/book/show/2575908-true-evil,https://www.goodreads.com/book/show/2575908-true-evil
2577005,گلهای رنج: گزیدۀ اشعار, , , , ,ID,https://i.gr-assets.com/images/S/compressed.photo.goodreads.com/books/1554451015l/2577005._SY160_.jpg,https://i.gr-assets.com/images/S/compressed.photo.goodreads.com/books/1554451015l/2577005._SY75_.jpg,https://i.gr-assets.com/images/S/compressed.photo.goodreads.com/books/1554451015l/2577005._SY475_.jpg,2005,,,هرمس,per,false,گل‌های رنج یا گل‌های بدی مجموعه شعری از شارل بودلر شاعر قرن نوزدهم فرانسه است. این کتاب که مهم‌ترین اثر شاعر نیز محسوب می‌شود در هنگام انتشارش در ۱۸۴۰ سر و صدای زیادی به پا کردو حتی باعث شد تعدادی از شعرها سانسور شود. در این اثر، بودلر به دنبال کشف زیبایی از درون زشتی است و مبانی زیبایی‌شناسی جدیدی را پایه‌ریزی می‌کند.,4.25,144,Paperback, ,12,https://www.goodreads.com/book/show/2577005,https://www.goodreads.com/book/show/2577005
2578863,Havana Nocturne: How the Mob Owned Cuba & Then Lost it to the Revolution,1606711989,9781606711989, , ,ID,https://i.gr-assets.com/images/S/compressed.photo.goodreads.com/books/1388636435l/2578863._SX98_.jpg,https://i.gr-assets.com/images/S/compressed.photo.goodreads.com/books/1388636435l/2578863._SY75_.jpg,https://i.gr-assets.com/images/S/compressed.photo.goodreads.com/books/1388636435l/2578863.jpg,2008,6,1,William Morrow/HarperCollins (NY),eng,false,"In modern-day Havana, the remnants of the glamorous past are everywhere—old hotel-casinos, vintage American cars &amp; flickering neon signs speak of a bygone era that is widely familiar &amp; often romanticized, but little understood. In <em>Havana Nocturne</em>, T.J. English offers a multifaceted true tale of organized crime, political corruption, roaring nightlife, revolution &amp; international conflict that interweaves the dual stories of the Mob in Havana &amp; the event that would overshadow it, the Cuban Revolution.<br /><br />As the Cuban people labored under a violently repressive regime throughout the 50s, Mob leaders Meyer Lansky &amp; Charles ""Lucky"" Luciano turned their eye to Havana. To them, Cuba was the ultimate dream, the greatest hope for the future of the US Mob in the post-Prohibition years of intensified government crackdowns. But when it came time to make their move, it was Lansky, the brilliant Jewish mobster, who reigned supreme. Having cultivated strong ties with the Cuban government &amp; in particular the brutal dictator Fulgencio Batista, Lansky brought key mobsters to Havana to put his ambitious business plans in motion. <br /><br />Before long, the Mob, with Batista's corrupt government in its pocket, owned the biggest luxury hotels &amp; casinos in Havana, launching an unprecedented tourism boom complete with the most lavish entertainment, the world's biggest celebrities, the most beautiful women &amp; gambling galore. But their dreams collided with those of Fidel Castro, Che Guevara &amp; others who would lead the country's disenfranchised to overthrow their corrupt government &amp; its foreign partners—an epic cultural battle that English captures in all its sexy, decadent, ugly glory. <br /><br />Bringing together long-buried historical information with English's own research in Havana—including interviews with the era's key survivors—<em>Havana Nocturne</em> takes readers back to Cuba in the years when it was a veritable devil's playground for mob leaders. English deftly weaves together the parallel stories of the Havana Mob—featuring notorious criminals such as Santo Trafficante Jr &amp; Albert Anastasia—&amp; Castro's 26th of July Movement in a riveting, up-close look at how the Mob nearly attained its biggest dream in Havana—&amp; how Fidel Castro trumped it all with the revolution.",3.91,416,Hardcover, ,441,https://www.goodreads.com/book/show/2578863-havana-nocturne,https://www.goodreads.com/book/show/2578863-havana-nocturne
2580447,جزیره خارک، در یتیم خلیج فارس, , , , ,ID,https://i.gr-assets.com/images/S/compressed.photo.goodreads.com/books/1220338195l/2580447._SX98_.jpg,https://i.gr-assets.com/images/S/compressed.photo.goodreads.com/books/1220338195l/2580447._SX50_.jpg,https://i.gr-assets.com/images/S/compressed.photo.goodreads.com/books/1220338195l/2580447.jpg,2008,,,,,false,سفرنامه,3.18, , , ,3,https://www.goodreads.com/book/show/2580447,https://www.goodreads.com/book/show/2580447
2586627,"The Cracked Pot (Clay and Crime, #2)",0425221261,9780425221266, , ,ID,https://i.gr-assets.com/images/S/compressed.photo.goodreads.com/books/1347506333l/2586627._SX98_.jpg,https://i.gr-assets.com/images/S/compressed.photo.goodreads.com/books/1347506333l/2586627._SY75_.jpg,https://i.gr-assets.com/images/S/compressed.photo.goodreads.com/books/1347506333l/2586627.jpg,2008,5,6,Berkley,eng,false,"When the body of a new potter with a mysterious past is found in Carolyn Emerson’s raku firing pit, she calls upon her studio’s pottery club, The Firing Squad, to dig up evidence and crack the case.",3.32,224,Paperback, ,30,https://www.goodreads.com/book/show/2586627-the-cracked-pot,https://www.goodreads.com/book/show/2586627-the-cracked-pot
2586771,The 19th Wife,1400063973,9781400063970, , ,ID,https://i.gr-assets.com/images/S/compressed.photo.goodreads.com/books/1255632165l/2586771._SX98_.jpg,https://i.gr-assets.com/images/S/compressed.photo.goodreads.com/books/1255632165l/2586771._SY75_.jpg,https://i.gr-assets.com/images/S/compressed.photo.goodreads.com/books/1255632165l/2586771.jpg,2008,8,5,Random House,en-US,false,"<p>
  <i>Faith, I tell them, is a mystery, elusive to many, and never easy to explain.</i>
</p><p>Sweeping and lyrical, spellbinding and unforgettable, David Ebershoff’s <i>The 19th Wife </i>combines epic historical fiction with a modern murder mystery to create a brilliant novel of literary suspense. It is 1875, and Ann Eliza Young has recently separated from her powerful husband, Brigham Young, prophet and leader of the Mormon Church. Expelled and an outcast, Ann Eliza embarks on a crusade to end polygamy in the United States. A rich account of a family’s polygamous history is revealed, including how a young woman became a plural wife.</p><p>Soon after Ann Eliza’s story begins, a second exquisite narrative unfolds–a tale of murder involving a polygamist family in present-day Utah. Jordan Scott, a young man who was thrown out of his fundamentalist sect years earlier, must reenter the world that cast him aside in order to discover the truth behind his father’s death.</p><p>And as Ann Eliza’s narrative intertwines with that of Jordan’s search, readers are pulled deeper into the mysteries of love and faith.</p>",3.64,514,Hardcover, ,5668,https://www.goodreads.com/book/show/2586771-the-19th-wife,https://www.goodreads.com/book/show/2586771-the-19th-wife
2586899,Fascinating String Figures,0486404005,9780486404004, , ,ID,https://i.gr-assets.com/images/S/compressed.photo.goodreads.com/books/1328866950l/2586899._SX98_.jpg,https://i.gr-assets.com/images/S/compressed.photo.goodreads.com/books/1328866950l/2586899._SX50_.jpg,https://i.gr-assets.com/images/S/compressed.photo.goodreads.com/books/1328866950l/2586899.jpg,1998,6,15,Dover Publications,en-US,false,"The art of creating figures from pieces of string is an ancient and rewarding diversion that has entertained practitioners for centuries. Popular today with a wide range of hobbyists, string figure models vary from simple constructions easy enough for children to sophisticated, elaborate figures that challenge even the most experienced enthusiast.<br />This easy-to-follow guide, complied from the pages of <i>String Figure Magazine</i>, contains clearly detailed diagrams and simple instructions for making 23 different and delightful string figures, among them a turtle, an elegantly symmetrical cobweb, a miniaturized hammock, a polar bear, a little girl with pigtails, a graceful swan, seven diamonds all in a row. And 16 other intriguing designs. All you need to make even the most difficult figure is a length of ordinary string that can easily be knotted.<br />An ideal way to help develop a youngster's interest, attention span, and manual dexterity, this book also offers older hobbyists hours of challenging fun as they learn new twists to an age-old pastime.",4.11,80,Paperback, ,0,https://www.goodreads.com/book/show/2586899-fascinating-string-figures,https://www.goodreads.com/book/show/2586899-fascinating-string-figures
2587940,فاصله و داستان‌های دیگر، به‌همراهِ مقالاتی در شناختِ ریموند کاروِر, ,9789643056513, , ,ID,https://i.gr-assets.com/images/S/compressed.photo.goodreads.com/books/1200482672l/2587940._SX98_.jpg,https://i.gr-assets.com/images/S/compressed.photo.goodreads.com/books/1200482672l/2587940._SX50_.jpg,https://i.gr-assets.com/images/S/compressed.photo.goodreads.com/books/1200482672l/2587940.jpg,2005,,,نشرِ مرکز,per,false,کارور از تواناترین داستان‌نویسانِ معاصر آمریکا و جهان است و مجموعه‌ی حاضر دربردارنده‌ی برخی‌از به‌ترین داستان‌های کوتاهِ او است، هرچند که همه‌ی آثارش از چنان‌کیفیت و قدرتی برخوردارند که انتخاب به‌ترین از میانِ آن‌ها کاری‌دشوار است. داستان‌های کارور اغلب درباره‌ی زنان و مردانی است‌که گویی از درون ویران شده‌اند و این‌ویرانی در تنهایی و عدم امکانِ ارتباطِ آنان با دیگران نمود پیدا می‌کند. گاهی خوش‌بختی را بیرون‌از زنده‌گی ِ خود و در زنده‌گی ِ دیگران می‌بینند اما کارور نشان می‌دهد این‌تصوّر ِ آنان نیز چندان متکی به‌واقعیت نیست و فقط به‌دلیل ِ آن است‌که دستی از دور بر آتش دارند. شخصیت‌های او در صحنه‌پردازیِ حداقل‌گرایانه‌ی داستان‌هایش به‌شدت برای خواننده ملموس و قابل‌درک می‌شوند و در پایانِ داستان‌هایش خواننده که ابتدا حس می‌کند اتفاق ِ مهمّی رخ نداده، ناگهان متوجهِ هیبت و هول‌ناکی ِ آن‌چه رخ داده می‌شود,3.61,225,Paperback, ,12,https://www.goodreads.com/book/show/2587940,https://www.goodreads.com/book/show/2587940
2587992,شیطان در بهشت,9646205151, , , ,ID,https://i.gr-assets.com/images/S/compressed.photo.goodreads.com/books/1240732051l/2587992._SX98_.jpg,https://i.gr-assets.com/images/S/compressed.photo.goodreads.com/books/1240732051l/2587992._SY75_.jpg,https://i.gr-assets.com/images/S/compressed.photo.goodreads.com/books/1240732051l/2587992.jpg,2000,,,انتشارات ناهیدT 1379,per,false,"The devil in Henry Miller's Big Sur paradise is Conrad Moricand: A friend of his Paris days, who, having been financed and brought over from Europe as an act of mercy by Mr. Miller, turns out as exacting, sponging, evil, cunning and ungrateful a guest as can be found in contemporary literature.",3.68,255, , ,5,https://www.goodreads.com/book/show/2587992,https://www.goodreads.com/book/show/2587992
2588309,آخرین سفر شاه, , , , ,ID,https://i.gr-assets.com/images/S/compressed.photo.goodreads.com/books/1200554418l/2588309._SX98_.jpg,https://i.gr-assets.com/images/S/compressed.photo.goodreads.com/books/1200554418l/2588309._SX50_.jpg,https://i.gr-assets.com/images/S/compressed.photo.goodreads.com/books/1200554418l/2588309.jpg,2002,,,نشر آسیم,,false,"s/t: The story of the exile, misadventures and death of the Emperor",3.71, , , ,2,https://www.goodreads.com/book/show/2588309,https://www.goodreads.com/book/show/2588309
2588885,Acts of the Apostles,0800660188,9780800660185, , ,ID,https://i.gr-assets.com/images/S/compressed.photo.goodreads.com/books/1347262607l/2588885._SX98_.jpg,https://i.gr-assets.com/images/S/compressed.photo.goodreads.com/books/1347262607l/2588885._SX50_.jpg,https://i.gr-assets.com/images/S/compressed.photo.goodreads.com/books/1347262607l/2588885.jpg,1988,1,1,Fortress Press,en-US,false,"Filled with compact, almost aphoristic observations about the text, its background, and its theology. Its insight should sustain its value for a full generation.",3.12,342,Hardcover, ,2,https://www.goodreads.com/book/show/2588885-acts-of-the-apostles,https://www.goodreads.com/book/show/2588885-acts-of-the-apostles
2589374,Stitch,0810151480,9780810151482, , ,ID,https://i.gr-assets.com/images/S/compressed.photo.goodreads.com/books/1328812844l/2589374._SX98_.jpg,https://i.gr-assets.com/images/S/compressed.photo.goodreads.com/books/1328812844l/2589374._SY75_.jpg,https://i.gr-assets.com/images/S/compressed.photo.goodreads.com/books/1328812844l/2589374.jpg,2004,10,26,Triquarterly,eng,false,"Set against the splendor of Venice, <i>Stitch</i> is the moving story of the meeting between a group of Americans and a world-famous sculptor. Stitch, a character whom certain critics have recognized as one of the most remarkable portraits of Ezra Pound, is a man who has shaped and been shaped by the most profound intellectual and political experiences of the 20th century. What the Americans learn from him comprises the brilliant center of this novel.<br />",3.67,220,Paperback, ,1,https://www.goodreads.com/book/show/2589374-stitch,https://www.goodreads.com/book/show/2589374-stitch
2590136,"Barracoon: The Story of the Last ""Black Cargo""",0060921706,9780060921705, , ,ID,https://i.gr-assets.com/images/S/compressed.photo.goodreads.com/books/1524663392l/2590136._SX98_.jpg,https://i.gr-assets.com/images/S/compressed.photo.goodreads.com/books/1524663392l/2590136._SY75_.jpg,https://i.gr-assets.com/images/S/compressed.photo.goodreads.com/books/1524663392l/2590136._SY475_.jpg,2018,5,8,HarperCollins Publishers,eng,false,"In 1927, Zora Neale Hurston went to Plateau, Alabama, just outside Mobile, to interview eighty-six-year-old Cudjo Lewis. Of the millions of men, women, and children transported from Africa to America as slaves, Cudjo was then the only person alive to tell the story of this integral part of the nation's history. Hurston was there to record Cudjo's firsthand account of the raid that led to his capture and bondage fifty years after the Atlantic slave trade was outlawed in the United States.<br /><br />In 1931, Hurston returned to Plateau, the African-centric community three miles from Mobile founded by Cudjo and other former slaves from his ship. Spending more than three months there, she talked in depth with Cudjo about the details of his life. During those weeks, the young writer and the elderly formerly enslaved man ate peaches and watermelon that grew in the backyard and talked about Cudjo's past--memories from his childhood in Africa, the horrors of being captured and held in a barracoon for selection by American slavers, the harrowing experience of the Middle Passage packed with more than 100 other souls aboard the <em>Clotilda</em>, and the years he spent in slavery until the end of the Civil War.<br /><br />Based on those interviews, featuring Cudjo's unique vernacular, and written from Hurston's perspective with the compassion and singular style that have made her one of the preeminent American authors of the twentieth-century, <em>Barracoon</em> masterfully illustrates the tragedy of slavery and of one life forever defined by it. Offering insight into the pernicious legacy that continues to haunt us all, black and white, this poignant and powerful work is an invaluable contribution to our shared history and culture.",4.00,193,Paperback, ,2157,https://www.goodreads.com/book/show/2590136-barracoon,https://www.goodreads.com/book/show/2590136-barracoon
2590304,به من بگو چرا - 4 جلدی, , , , ,ID,https://s.gr-assets.com/assets/nophoto/book/111x148-bcc042a9c91a29c1d680899eff700a03.png,https://s.gr-assets.com/assets/nophoto/book/50x75-a91bf249278a81aabab721ef782c4a74.png,https://s.gr-assets.com/assets/nophoto/book/111x148-bcc042a9c91a29c1d680899eff700a03.png,1988,,,مؤسسه انجام کتاب,per,false,,3.90, , , ,1,https://www.goodreads.com/book/show/2590304---4,https://www.goodreads.com/book/show/2590304---4
2590505,A New Earth: Awakening to Your Life's Purpose,0452289963,9780452289963, , ,ID,https://i.gr-assets.com/images/S/compressed.photo.goodreads.com/books/1395619063l/2590505._SX98_.jpg,https://i.gr-assets.com/images/S/compressed.photo.goodreads.com/books/1395619063l/2590505._SY75_.jpg,https://i.gr-assets.com/images/S/compressed.photo.goodreads.com/books/1395619063l/2590505._SY475_.jpg,2008,1,30,Penguin Books,eng,false,"<b>“A wake-up call for the entire planet . . . [<i>A New Earth</i>] helps us to stop creating our own suffering and obsessing over the past and what the future might be, and to put ourselves in the now.” —Oprah Winfrey</b><br /><br />With his bestselling spiritual guide <i>The Power of Now</i>, Eckhart Tolle inspired millions of readers to discover the freedom and joy of a life lived “in the now.” In <i>A New Earth</i>, Tolle expands on these powerful ideas to show how transcending our ego-based state of consciousness is not only essential to personal happiness, but also the key to ending conflict and suffering throughout the world. Tolle describes how our attachment to the ego creates the dysfunction that leads to anger, jealousy, and unhappiness, and shows readers how to awaken to a new state of consciousness and follow the path to a truly fulfilling existence.<br /><br />Illuminating, enlightening, and uplifting, <i>A New Earth</i> is a profoundly spiritual manifesto for a better way of life—and for building a better world.",4.09,309,Paperback, ,401,https://www.goodreads.com/book/show/2590505-a-new-earth,https://www.goodreads.com/book/show/2590505-a-new-earth
2590729,هرگز رهایم مکن,9643116271,9789643116279, , ,ID,https://i.gr-assets.com/images/S/compressed.photo.goodreads.com/books/1380908362l/2590729._SX98_.jpg,https://i.gr-assets.com/images/S/compressed.photo.goodreads.com/books/1380908362l/2590729._SX50_.jpg,https://i.gr-assets.com/images/S/compressed.photo.goodreads.com/books/1380908362l/2590729.jpg,,,,انتشارات ققنوس,per,false,"From the Booker Prize-winning author of <i>The Remains of the Day</i> and <i>When We Were Orphans</i>, comes an unforgettable edge-of-your-seat mystery that is at once heartbreakingly tender and morally courageous about what it means to be human.<br /><br />Hailsham seems like a pleasant English boarding school, far from the influences of the city. Its students are well tended and supported, trained in art and literature, and become just the sort of people the world wants them to be. But, curiously, they are taught nothing of the outside world and are allowed little contact with it.<br /><br />Within the grounds of Hailsham, Kathy grows from schoolgirl to young woman, but it’s only when she and her friends Ruth and Tommy leave the safe grounds of the school (as they always knew they would) that they realize the full truth of what Hailsham is.<br /><br /><i>Never Let Me Go</i> breaks through the boundaries of the literary novel. It is a gripping mystery, a beautiful love story, and also a scathing critique of human arrogance and a moral examination of how we treat the vulnerable and different in our society. In exploring the themes of memory and the impact of the past, Ishiguro takes on the idea of a possible future to create his most moving and powerful book to date.",3.82,367,Paperback, ,87,https://www.goodreads.com/book/show/2590729,https://www.goodreads.com/book/show/2590729
