id,title,isbn,isbn13,asin,kindle_asin,country_code,image_url,small_image_url,large_image_url,publication_year,publication_month,publication_day,publisher,language_code,is_ebook,description,average_rating,num_pages,format,edition_information,text_reviews_count,url,link
18626829,A Feast for Crows (A Song of Ice and Fire #4), , , , ,ID,https://i.gr-assets.com/images/S/compressed.photo.goodreads.com/books/1428883061l/18626829._SY160_.jpg,https://i.gr-assets.com/images/S/compressed.photo.goodreads.com/books/1428883061l/18626829._SY75_.jpg,https://i.gr-assets.com/images/S/compressed.photo.goodreads.com/books/1428883061l/18626829.jpg,2005,11,8,Bantam,eng,true,"<i>Crows will fight over a dead man's flesh, and kill each other for his eyes</i>.<br /><br />Bloodthirsty, treacherous and cunning, the Lannisters are in power on the Iron Throne in the name of the boy-king Tommen. The war in the Seven Kingdoms has burned itself out, but in its bitter aftermath new conflicts spark to life.<br /><br />The Martells of Dorne and the Starks of Winterfell seek vengeance for their dead. Euron Crow's Eye, as black a pirate as ever raised a sail, returns from the smoking ruins of Valyria to claim the Iron Isles. From the icy north, where Others threaten the Wall, apprentice Maester Samwell Tarly brings a mysterious babe in arms to the Citadel.<br /><br />Against a backdrop of incest and fratricide, alchemy and murder, victory will go to the men and women possessed of the coldest steel and the coldest hearts.",4.13,937,Kindle Edition, ,267,https://www.goodreads.com/book/show/18626829-a-feast-for-crows,https://www.goodreads.com/book/show/18626829-a-feast-for-crows
18626849,Stories of Your Life and Others, , ,B0048EKOP0, ,ID,https://i.gr-assets.com/images/S/compressed.photo.goodreads.com/books/1499943597l/18626849._SX98_.jpg,https://i.gr-assets.com/images/S/compressed.photo.goodreads.com/books/1499943597l/18626849._SY75_.jpg,https://i.gr-assets.com/images/S/compressed.photo.goodreads.com/books/1499943597l/18626849._SY475_.jpg,2010,10,22,Vintage,eng,true,"<i>Stories of Your Life and Others</i> delivers dual delights of the very, very strange and the heartbreakingly familiar, often presenting characters who must confront sudden change—the inevitable rise of automatons or the appearance of aliens—with some sense of normalcy. <br /><br />With sharp intelligence and humor, Chiang examines what it means to be alive in a world marked by uncertainty, but also by beauty and wonder. An award-winning collection from one of today's most lauded writers, <i>Stories of Your Life and Others</i> is a contemporary classic.<br /><br />Contents:<br />Tower of Babylon --<br />Understand --<br />Division by Zero --<br />Story of Your Life --<br />Seventy-Two Letters --<br />The Evolution of Human Science --<br />Hell is the Absence of God --<br />Liking What You See: A Documentary --<br />Story Notes.",4.23,285,Kindle Edition, ,466,https://www.goodreads.com/book/show/18626849-stories-of-your-life-and-others,https://www.goodreads.com/book/show/18626849-stories-of-your-life-and-others
18626858,"The Hunger Games (The Hunger Games, #1)", , , , ,ID,https://i.gr-assets.com/images/S/compressed.photo.goodreads.com/books/1382604459l/18626858._SX98_.jpg,https://i.gr-assets.com/images/S/compressed.photo.goodreads.com/books/1382604459l/18626858._SY75_.jpg,https://i.gr-assets.com/images/S/compressed.photo.goodreads.com/books/1382604459l/18626858.jpg,2009,9,1,Scholastic Press,eng,true,"In the ruins of a place once known as North America lies the nation of Panem, a shining Capitol surrounded by twelve outlying districts. Long ago the districts waged war on the Capitol and were defeated. As part of the surrender terms, each district agreed to send one boy and one girl to appear in an annual televised event called, ""The Hunger Games,"" a fight to the death on live TV. Sixteen-year-old Katniss Everdeen, who lives alone with her mother and younger sister, regards it as a death sentence when she is forced to represent her district in the Games. The terrain, rules, and level of audience participation may change but one thing is constant: kill or be killed.",4.33,387,Kindle Edition,Reprint Edition,854,https://www.goodreads.com/book/show/18626858-the-hunger-games,https://www.goodreads.com/book/show/18626858-the-hunger-games
18626895,"Assassin's Apprentice (Farseer Trilogy, #1)", , , , ,ID,https://i.gr-assets.com/images/S/compressed.photo.goodreads.com/books/1476397035l/18626895._SY160_.jpg,https://i.gr-assets.com/images/S/compressed.photo.goodreads.com/books/1476397035l/18626895._SY75_.jpg,https://i.gr-assets.com/images/S/compressed.photo.goodreads.com/books/1476397035l/18626895._SY475_.jpg,2002,11,5,Spectra,eng,true,"Young Fitz is the bastard son of the noble Prince Chivalry, raised in the shadow of the royal court by his father's gruff stableman. He is treated like an outcast by all the royalty except the devious King Shrewd, who has him sectetly tutored in the arts of the assassin. For in Fitz's blood runs the magic Skill--and the darker knowledge of a child raised with the stable hounds and rejected by his family. As barbarous raiders ravage the coasts, Fitz is growing to manhood. Soon he will face his first dangerous, soul-shattering mission. And though some regard him as a threat to the throne, he may just be the key to the survival of the kingdom.",4.15,464,Kindle Edition, ,377,https://www.goodreads.com/book/show/18626895-assassin-s-apprentice,https://www.goodreads.com/book/show/18626895-assassin-s-apprentice
18627715,Sex Love Repeat, , , , ,ID,https://i.gr-assets.com/images/S/compressed.photo.goodreads.com/books/1383777358l/18627715._SX98_.jpg,https://i.gr-assets.com/images/S/compressed.photo.goodreads.com/books/1383777358l/18627715._SY75_.jpg,https://i.gr-assets.com/images/S/compressed.photo.goodreads.com/books/1383777358l/18627715.jpg,2013,11,18,Alessandra Torre,eng,true,"In Malibu, I sleep late in our worn out bed. Dance to Bob Marley in the sand. Find love and peace in Paul's arms. <br /><br />In Hollywood, I drink champagne and watch our chef fix dinner. I visit Stewart at work and let him take me on top of his desk.<br /><br />Two separate lives. Two separate men. A woman that watched us all.<br /><br />I should have known that it wouldn't work out.",3.95,197,ebook,1st Edition,1074,https://www.goodreads.com/book/show/18627715-sex-love-repeat,https://www.goodreads.com/book/show/18627715-sex-love-repeat
18628601,"More Than Forever (More Than, #4)",150045205X,9781500452056, , ,ID,https://i.gr-assets.com/images/S/compressed.photo.goodreads.com/books/1398578431l/18628601._SX98_.jpg,https://i.gr-assets.com/images/S/compressed.photo.goodreads.com/books/1398578431l/18628601._SY75_.jpg,https://i.gr-assets.com/images/S/compressed.photo.goodreads.com/books/1398578431l/18628601.jpg,2014,7,11,CreateSpace,eng,false,-LUCY-<br />There is a love so fierce it cannot be measured. <br />A heart so strong it will never slow. <br />There is a promise so sure it can never lie.<br />He promised me that love forever.<br />Even when it wasn't enough.<br /> <br />-CAMERON-<br />Forever. Everlasting. Eternal.<br />There is no measure of time. <br />No sounds of the ticking of a clock. <br />Just the rising and falling of the sun.<br />And our own sense of forever. <br /> <br />But our forever isn't always.,4.47,348,Paperback, ,1239,https://www.goodreads.com/book/show/18628601-more-than-forever,https://www.goodreads.com/book/show/18628601-more-than-forever
18628853,گات ها,9645960932, , , ,ID,https://i.gr-assets.com/images/S/compressed.photo.goodreads.com/books/1380990999l/18628853._SX98_.jpg,https://i.gr-assets.com/images/S/compressed.photo.goodreads.com/books/1380990999l/18628853._SX50_.jpg,https://i.gr-assets.com/images/S/compressed.photo.goodreads.com/books/1380990999l/18628853.jpg,1998,,,انتشارات اساطیر,per,false,,4.05,592,Hardcover, ,7,https://www.goodreads.com/book/show/18628853,https://www.goodreads.com/book/show/18628853
18630531,My Salinger Year,0307958000,9780307958006, , ,ID,https://i.gr-assets.com/images/S/compressed.photo.goodreads.com/books/1388374724l/18630531._SX98_.jpg,https://i.gr-assets.com/images/S/compressed.photo.goodreads.com/books/1388374724l/18630531._SY75_.jpg,https://i.gr-assets.com/images/S/compressed.photo.goodreads.com/books/1388374724l/18630531.jpg,2014,6,3,Knopf,eng,false,"Poignant, keenly observed, and irresistibly funny: a memoir about literary New York in the late nineties, a pre-digital world on the cusp of vanishing, where a young woman finds herself entangled with one of the last great figures of the century.<br /><br /> At twenty-three, after leaving graduate school to pursue her dreams of becoming a poet, Joanna Rakoff moves to New York City and takes a job as assistant to the storied literary agent for J. D. Salinger. She spends her days in a plush, wood-paneled office, where Dictaphones and typewriters still reign and old-time agents doze at their desks after martini lunches. At night she goes home to the tiny, threadbare Williamsburg apartment she shares with her socialist boyfriend. Precariously balanced between glamour and poverty, surrounded by titanic personalities, and struggling to trust her own artistic instinct, Rakoff is tasked with answering Salinger’s voluminous fan mail. But as she reads the candid, heart-wrenching letters from his readers around the world, she finds herself unable to type out the agency’s decades-old form response. Instead, drawn inexorably into the emotional world of Salinger’s devotees, she abandons the template and begins writing back. Over the course of the year, she finds her own voice by acting as Salinger’s, on her own dangerous and liberating terms. <br /><br /> Rakoff paints a vibrant portrait of a bright, hungry young woman navigating a heady and longed-for world, trying to square romantic aspirations with burgeoning self-awareness, the idea of a life with life itself. Charming and deeply moving, filled with electrifying glimpses of an American literary icon, <i>My Salinger Year</i> is the coming-of-age story of a talented writer. Above all, it is a testament to the universal power of books to shape our lives and awaken our true selves. ",3.74,252,Hardcover, ,938,https://www.goodreads.com/book/show/18630531-my-salinger-year,https://www.goodreads.com/book/show/18630531-my-salinger-year
18630542,Seconds,0345529375,9780345529374, , ,ID,https://i.gr-assets.com/images/S/compressed.photo.goodreads.com/books/1399502867l/18630542._SX98_.jpg,https://i.gr-assets.com/images/S/compressed.photo.goodreads.com/books/1399502867l/18630542._SX50_.jpg,https://i.gr-assets.com/images/S/compressed.photo.goodreads.com/books/1399502867l/18630542.jpg,2014,7,15,Ballantine Books,eng,false,"Katie’s got it pretty good. She’s a talented young chef, she runs a successful restaurant, and she has big plans to open an even better one. Then, all at once, progress on the new location bogs down, her charming ex-boyfriend pops up, her fling with another chef goes sour, and her best waitress gets badly hurt. And just like that, Katie’s life goes from pretty good to not so much. What she needs is a second chance. Everybody deserves one, after all—but they don’t come easy. Luckily for Katie, a mysterious girl appears in the middle of the night with simple instructions for a do-it-yourself do-over:<br />  <br /> 1. <i>Write your mistake</i><br /> 2. <i>Ingest one mushroom</i><br /> 3. <i>Go to sleep</i><br /> 4. <i>Wake anew</i><br />  <br /> And just like that, all the bad stuff never happened, and Katie is given another chance to get things right. She’s also got a dresser drawer full of magical mushrooms—and an irresistible urge to make her life not just good, but perfect. Too bad it’s against the rules. But Katie doesn’t care about the rules—and she’s about to discover the unintended consequences of the best intentions.<br />  <br /> From the mind and pen behind the acclaimed Scott Pilgrim series comes a madcap new tale of existential angst, everyday obstacles, young love, and ancient spirits that’s sharp-witted and tenderhearted, whimsical and wise.",4.06,323,Hardcover, ,2594,https://www.goodreads.com/book/show/18630542-seconds,https://www.goodreads.com/book/show/18630542-seconds
18630545,The Holcroft Covenant: A Novel,0345539168,9780345539168, , ,ID,https://i.gr-assets.com/images/S/compressed.photo.goodreads.com/books/1405292479l/18630545._SY160_.jpg,https://i.gr-assets.com/images/S/compressed.photo.goodreads.com/books/1405292479l/18630545._SY75_.jpg,https://i.gr-assets.com/images/S/compressed.photo.goodreads.com/books/1405292479l/18630545.jpg,2014,7,1,Bantam,,false,"The Fourth Reich is waiting to arise—and the only man who can stop it is about to sign its birth certificate. In 1945 the children of the Third Reich were secretly hidden all over the world, to be concealed until they came of age in the 1970s, at which point $780 million would be waiting in a Swiss bank. But all of these elaborate plans need an unsuspecting outsider to set them in motion: Noel Holcroft, the American son of a high-ranking Nazi officer. He has just been shown an incredible document known as the Holcroft Covenant. If he signs, he will inadvertently deal a serious blow to an already fragile world—and authorize his own death warrant.<br />  <br /><b>Praise for Robert Ludlum and <i>The Holcroft Covenant</i></b><br /><b> </b><br /> “Pleases and seduces . . . [Robert] Ludlum stuffs more surprises into his novels than any other six-pack of thriller writers combined. . . . I sprained my wrist turning his pages and didn’t notice until an hour later.”<b>—John Leonard, <i>The New York Times</i></b><br /><i> </i><br /> “Don’t ever begin a Ludlum novel if you have to go to work the next day.”<b>—<i>Chicago Tribune</i></b>",3.90,528,Paperback, ,1,https://www.goodreads.com/book/show/18630545-the-holcroft-covenant,https://www.goodreads.com/book/show/18630545-the-holcroft-covenant
18631568,"Avatar: The Last Airbender - The Search (Avatar: The Last Airbender, #2)",1616552263,9781616552268, , ,ID,https://i.gr-assets.com/images/S/compressed.photo.goodreads.com/books/1382512919l/18631568._SX98_.jpg,https://i.gr-assets.com/images/S/compressed.photo.goodreads.com/books/1382512919l/18631568._SX50_.jpg,https://i.gr-assets.com/images/S/compressed.photo.goodreads.com/books/1382512919l/18631568.jpg,2014,2,5,Dark Horse Comics,eng,false,"The biggest mystery of Avatar, the fate of Fire Lord Zuko’s mother, is revealed in this remarkable oversized hardcover collecting parts 1–3 of The Search, from Airbender creators Michael Dante DiMartino and Bryan Konietzko!<br /><br />Featuring annotations by Eisner Award–winning writer Gene Luen Yang (American Born Chinese) and artistic team Gurihiru (Thor and the Warriors Four), and a brand-new sketchbook, this is a story that Avatar fans need in an edition they will love!<br /><br />* The official continuation of Airbender from its creators and best-selling writer Gene Luen Yang!<br /><br />* Collecting The Search Parts 1–3, with tons of extras!<br /><br />“A wonderful reintroduction to the world of Aang and his merry band of benders.”—Nerdist",4.55,240,Hardcover,Library Edition,717,https://www.goodreads.com/book/show/18631568-avatar,https://www.goodreads.com/book/show/18631568-avatar
18633478,"Shattered (The Iron Druid Chronicles, #7)", , , , ,ID,https://i.gr-assets.com/images/S/compressed.photo.goodreads.com/books/1386267561l/18633478._SX98_.jpg,https://i.gr-assets.com/images/S/compressed.photo.goodreads.com/books/1386267561l/18633478._SY75_.jpg,https://i.gr-assets.com/images/S/compressed.photo.goodreads.com/books/1386267561l/18633478.jpg,2014,6,17,Del Rey,eng,true,"For nearly two thousand years, only one Druid has walked the Earth—Atticus O’Sullivan, the Iron Druid, whose sharp wit and sharp sword have kept him alive as he’s been pursued by a pantheon of hostile deities. Now he’s got company.<br /> <br />Atticus’s apprentice Granuaile is at last a full Druid herself. What’s more, Atticus has defrosted an archdruid long ago frozen in time, a father figure (of sorts) who now goes by the modern equivalent of his old Irish name: Owen Kennedy.<br /> <br />And Owen has some catching up to do.<br /> <br />Atticus takes pleasure in the role reversal, as the student is now the teacher. Between busting Atticus’s chops and trying to fathom a cell phone, Owen must also learn English. For Atticus, the jury’s still out on whether the wily old coot will be an asset in the epic battle with Norse god Loki—or merely a pain in the arse.<br /> <br />But Atticus isn’t the only one with daddy issues. Granuaile faces a great challenge: to exorcise a sorcerer’s spirit that is possessing her father in India. Even with the help of the witch Laksha, Granuaile may be facing a crushing defeat.<br /> <br />As the trio of Druids deals with pestilence-spreading demons, bacon-loving yeti, fierce flying foxes, and frenzied Fae, they’re hoping that this time, three’s a charm.",4.28,353,Kindle Edition, ,74,https://www.goodreads.com/book/show/18633478-shattered,https://www.goodreads.com/book/show/18633478-shattered
18633797,"Sombra y hueso (Trilogía Grisha, #1)",8415709358,9788415709350, , ,ID,https://i.gr-assets.com/images/S/compressed.photo.goodreads.com/books/1381168825l/18633797._SX98_.jpg,https://i.gr-assets.com/images/S/compressed.photo.goodreads.com/books/1381168825l/18633797._SY75_.jpg,https://i.gr-assets.com/images/S/compressed.photo.goodreads.com/books/1381168825l/18633797.jpg,2013,11,11,Editorial Hidra,spa,false,"Alina Starkov no espera mucho de la vida. Se quedó huérfana después de la guerra y lo único que tiene en el mundo es a su amigo Mal. A raíz de un ataque que recibe Mal al entrar en La Sombra, una oscuridad antinatural repleta de monstruos que ha aislado el país, Alina revela un poder latente que ni ella misma sabía que tenía. Tras ese episodio, Alina es conducida a la fuerza hasta la corte real para ser entrenada como un miembro de los Grisha, un grupo de magos de élite comandado por un individuo misterioso que se hace llamar El Oscuro.",3.99,428,Paperback, ,634,https://www.goodreads.com/book/show/18633797-sombra-y-hueso,https://www.goodreads.com/book/show/18633797-sombra-y-hueso
18634109,Oz: The Complete Collection, , ,B00C448DL8, ,ID,https://i.gr-assets.com/images/S/compressed.photo.goodreads.com/books/1384803504l/18634109._SX98_.jpg,https://i.gr-assets.com/images/S/compressed.photo.goodreads.com/books/1384803504l/18634109._SY75_.jpg,https://i.gr-assets.com/images/S/compressed.photo.goodreads.com/books/1384803504l/18634109.jpg,2014,7,18,Maplewood Books,en-US,true,"Although most children today are introduced to the world of Oz through the classic 1939 movie, L. Frank Baum has been captivating the hearts of the young, and not so young, for over a hundred years.<br /><br />This delightful compilation includes all fifteen books written by L. Frank Baum:<br /><br />The Wonderful Wizard of Oz<br />The Marvelous Land of Oz<br />Ozma of Oz<br />Dorothy and the Wizard in Oz<br />The Road to Oz<br />The Emerald City of Oz<br />The Patchwork Girl Of Oz<br />Little Wizard Stories of Oz<br />Tik-Tok of Oz<br />The Scarecrow Of Oz<br />Rinkitink In Oz<br />The Lost Princess Of Oz<br />The Tin Woodman Of Oz<br />The Magic of Oz<br />Glinda Of Oz<br /><br />Perhaps there is no better, or fitting, introduction one could give to this compilation than the author's note that Baum himself writes in his very first book, ""The Wonderful Wizard of Oz."" Here he reveals the true intention of his work. Folklore, legends, myths and fairy tales have followed childhood through the ages, for every healthy youngster has a wholesome and instinctive love for stories fantastic, marvelous and manifestly unreal. The winged fairies of Grimm and Andersen have brought more happiness to childish hearts than all other human creations. Yet the old time fairy tale, having served for generations, may now be classed as ""historical"" in the children's library; for the time has come for a series of newer ""wonder tales"" in which the stereotyped genie, dwarf and fairy are eliminated, together with all the horrible and blood-curdling incidents devised by their authors to point a fearsome moral to each tale. Modern education includes morality; therefore the modern child seeks only entertainment in its wonder tales and gladly dispenses with all disagreeable incident. Having this thought in mind, the story of ""The Wonderful Wizard of Oz"" was written solely to please children of today. It aspires to being a modernized fairy tale, in which the wonderment and joy are retained and the heartaches and nightmares are left out.",4.24,1796,Kindle Edition, ,62,https://www.goodreads.com/book/show/18634109-oz,https://www.goodreads.com/book/show/18634109-oz
18635016,"The One (The Selection, #3)",0062059998,9780062059994, , ,ID,https://i.gr-assets.com/images/S/compressed.photo.goodreads.com/books/1395612906l/18635016._SX98_.jpg,https://i.gr-assets.com/images/S/compressed.photo.goodreads.com/books/1395612906l/18635016._SY75_.jpg,https://i.gr-assets.com/images/S/compressed.photo.goodreads.com/books/1395612906l/18635016.jpg,2014,5,6,HarperTeen,eng,false,"The time has come for one winner to be crowned.<br /><br />When she was chosen to compete in the Selection, America never dreamed she would find herself anywhere close to the crown—or to Prince Maxon's heart. But as the end of the competition approaches, and the threats outside the palace walls grow more vicious, America realizes just how much she stands to lose—and how hard she'll have to fight for the future she wants.",4.20,323,Hardcover, ,15611,https://www.goodreads.com/book/show/18635016-the-one,https://www.goodreads.com/book/show/18635016-the-one
18635092,The Truth Is a Cave in the Black Mountains,006228214X,9780062282149, , ,ID,https://i.gr-assets.com/images/S/compressed.photo.goodreads.com/books/1393224864l/18635092._SX98_.jpg,https://i.gr-assets.com/images/S/compressed.photo.goodreads.com/books/1393224864l/18635092._SX50_.jpg,https://i.gr-assets.com/images/S/compressed.photo.goodreads.com/books/1393224864l/18635092.jpg,2014,6,17,William Morrow,eng,false,"The text of <em>The Truth is a Cave in the Black Mountains</em> was first published in the collection anthology <em>Stories: All New Tales</em> edited by Neil Gaiman and Al Sarrantonio. This gorgeous full-color illustrated book version was born of a unique collaboration between writer Neil Gaiman and artist Eddie Campbell, who brought to vivid life the characters and landscape of Gaiman's story. In August 2010, <em>The Truth is a Cave in the Black Mountains</em> was performed in the concert hall of the Sydney Opera House to a sold-out crowd—Gaiman read his tale live as Campbell's magnificent artwork was presented, scene-by-scene, on large screens. Narrative and art were accompanied by live music composed and performed especially for the story by the FourPlay String Quartet.",3.98,74,Hardcover, ,1033,https://www.goodreads.com/book/show/18635092-the-truth-is-a-cave-in-the-black-mountains,https://www.goodreads.com/book/show/18635092-the-truth-is-a-cave-in-the-black-mountains
18635113,Elizabeth Is Missing,0062309668,9780062309662, , ,ID,https://i.gr-assets.com/images/S/compressed.photo.goodreads.com/books/1388883559l/18635113._SX98_.jpg,https://i.gr-assets.com/images/S/compressed.photo.goodreads.com/books/1388883559l/18635113._SY75_.jpg,https://i.gr-assets.com/images/S/compressed.photo.goodreads.com/books/1388883559l/18635113.jpg,2014,6,10,Harper,eng,false,"In this darkly riveting debut novel—a sophisticated psychological mystery that is also a heartbreakingly honest meditation on memory, identity, and aging—an elderly woman descending into dementia embarks on a desperate quest to find the best friend she believes has disappeared, and her search for the truth will go back decades and have shattering consequences.<br /><br />Maud, an aging grandmother, is slowly losing her memory—and her grip on everyday life. Yet she refuses to forget her best friend Elizabeth, who she is convinced is missing and in terrible danger.<br /><br />But no one will listen to Maud—not her frustrated daughter, Helen, not her caretakers, not the police, and especially not Elizabeth's mercurial son, Peter. Armed with handwritten notes she leaves for herself and an overwhelming feeling that Elizabeth needs her help, Maud resolves to discover the truth and save her beloved friend.<br /><br />This singular obsession forms a cornerstone of Maud's rapidly dissolving present. But the clues she discovers seem only to lead her deeper into her past, to another unsolved disappearance: her sister, Sukey, who vanished shortly after World War II.<br /><br />As vivid memories of a tragedy that occurred more than fifty years ago come flooding back, Maud discovers new momentum in her search for her friend. Could the mystery of Sukey's disappearance hold the key to finding Elizabeth?",3.72,320,Hardcover, ,4751,https://www.goodreads.com/book/show/18635113-elizabeth-is-missing,https://www.goodreads.com/book/show/18635113-elizabeth-is-missing
