id,title,isbn,isbn13,asin,kindle_asin,country_code,image_url,small_image_url,large_image_url,publication_year,publication_month,publication_day,publisher,language_code,is_ebook,description,average_rating,num_pages,format,edition_information,text_reviews_count,url,link
1306635,Canadian Whisky: The Portable Expert,0771027435,9780771027437, , ,ID,https://i.gr-assets.com/images/S/compressed.photo.goodreads.com/books/1333579296l/1306635._SX98_.jpg,https://i.gr-assets.com/images/S/compressed.photo.goodreads.com/books/1333579296l/1306635._SX50_.jpg,https://i.gr-assets.com/images/S/compressed.photo.goodreads.com/books/1333579296l/1306635.jpg,2012,5,8,McClelland & Stewart,en-GB,false,"Davin de Kergommeaux takes readers on a journey through the first systematic presentation of Canadian whisky: how it's made, who makes it, why it tastes the way it does, its history, and the rich, centuries-old folklore surrounding it.<br /><b> </b><br />Join whisky authority Davin de Kergommeaux on a pan-Canadian journey from British Columbia to Nova Scotia, celebrating the diversity of Canada's unique spirit. With his conversational and accessible tutelage, de Kergommeaux offers readers a carefully researched, reliable, and authoritative guide to Canadian whisky that is, quite simply, not available anywhere else. Not only a book describing the history and culture of the spirit, <b>Canadian Whisky: The Portable Expert</b><i> </i>is also an informed exploration of taste. For the first time, whisky consumers -- experts and novices alike -- can approach Canadian whisky with a connoisseur's appreciation of its rich subtleties.",4.30,352,Hardcover, ,6,https://www.goodreads.com/book/show/1306635.Canadian_Whisky,https://www.goodreads.com/book/show/1306635.Canadian_Whisky
1307032,"Flash Deconstruction: The Process, Design, and ActionScript of Juxt Interactive",0735711496,9780735711495, , ,ID,https://i.gr-assets.com/images/S/compressed.photo.goodreads.com/books/1347565618l/1307032._SX98_.jpg,https://i.gr-assets.com/images/S/compressed.photo.goodreads.com/books/1347565618l/1307032._SX50_.jpg,https://i.gr-assets.com/images/S/compressed.photo.goodreads.com/books/1347565618l/1307032.jpg,2001,11,1,New Riders Publishing,eng,false,"The interpretivist methodological framework made its appearance in educational research in the late 1970s, posing a fundamental and far-reaching challenge to the hitherto dominant positivist framework and opening up a number of divides that many have perceived as fundamental and unbridgeable.",3.71,280,Paperback, ,0,https://www.goodreads.com/book/show/1307032.Flash_Deconstruction,https://www.goodreads.com/book/show/1307032.Flash_Deconstruction
1307370,Cairo Portfolio,9774246209,9789774246203, , ,ID,https://i.gr-assets.com/images/S/compressed.photo.goodreads.com/books/1348474123l/1307370._SX98_.jpg,https://i.gr-assets.com/images/S/compressed.photo.goodreads.com/books/1348474123l/1307370._SX50_.jpg,https://i.gr-assets.com/images/S/compressed.photo.goodreads.com/books/1348474123l/1307370.jpg,2010,10,15,American University in Cairo Press,eng,false,"This handsome portfolio contains ten fine art prints of David Roberts' superb lithographs of nineteenth-century Cairo, selected from Egypt: Yesterday and Today (AUC Press, 1996). Between 1842 and 1849, on the basis of sketches made on the spot and aided by his excellent memory, Roberts produced the drawings that Louis Haghe turned into prints published by Graham Moon. These lithographs appeared in the original hand-painted deluxe edition. Suitable for framing, they reproduce details of the monuments and streets of nineteenth-century Cairo with an accuracy that today would be called photographic. This high-quality collection of prints celebrates the epic grandeur and fine detail of Roberts' views, in a format that complements his extraordinary artistic achievements.",4.17, ,Paperback, ,0,https://www.goodreads.com/book/show/1307370.Cairo_Portfolio,https://www.goodreads.com/book/show/1307370.Cairo_Portfolio
1307371,Luxor Portfolio,9774246217,9789774246210, , ,ID,https://i.gr-assets.com/images/S/compressed.photo.goodreads.com/books/1348475342l/1307371._SX98_.jpg,https://i.gr-assets.com/images/S/compressed.photo.goodreads.com/books/1348475342l/1307371._SX50_.jpg,https://i.gr-assets.com/images/S/compressed.photo.goodreads.com/books/1348475342l/1307371.jpg,2001,3,1,American University in Cairo Press,eng,false,"This handsome portfolio contains ten fine art prints of David Roberts' superb lithographs of nineteenth-century Luxor, selected from Egypt: Yesterday and Today (AUC Press, 1996). Between 1842 and 1849, on the basis of sketches made on the spot and aided by his excellent memory, Roberts produced the drawings that Louis Haghe turned into prints published by Graham Moon. These lithographs appeared in the original hand-painted deluxe edition. Suitable for framing, they reproduce details of the monuments of nineteenth-century Luxor with an accuracy that today would be called photographic. This high-quality collection of prints celebrates the epic grandeur and fine detail of Roberts' views, in a format that complements his extraordinary artistic achievements.",4.00,10,Paperback, ,0,https://www.goodreads.com/book/show/1307371.Luxor_Portfolio,https://www.goodreads.com/book/show/1307371.Luxor_Portfolio
1308591,Dot.con: How America Lost Its Mind and Money in the Internet Era,0060008814,9780060008819, , ,ID,https://i.gr-assets.com/images/S/compressed.photo.goodreads.com/books/1428947420l/1308591._SX98_.jpg,https://i.gr-assets.com/images/S/compressed.photo.goodreads.com/books/1428947420l/1308591._SY75_.jpg,https://i.gr-assets.com/images/S/compressed.photo.goodreads.com/books/1428947420l/1308591.jpg,2003,5,13,Harper Perennial,en-US,false,"The Internet stock bubble wasn't just about goggle-eyed day traderstrying to get rich on the Nasdaq and goateed twenty-five-year-olds playing wannabe Bill Gates. It was also about an America that believed it had discovered the secret of eternal prosperity: it said something about all of us, and what we thought about ourselves, as the twenty-first century dawned. John Cassidy's Dot.con brings this tumultuous episode to life. Moving from the Cold War Pentagon to Silicon Valley to Wall Street and into the homes of millions of Americans, Cassidy tells the story of the great boom and bust in an authoritative and entertaining narrative. Featuring all the iconic figures of the Internet era -- Marc Andreessen, Jeff Bezos, Steve Case, Alan Greenspan, and many others -- and with a new Afterword on the aftermath of the bust, Dot.con is a panoramic and stirring account of human greed and gullibility.",3.84,416,Paperback, ,9,https://www.goodreads.com/book/show/1308591.Dot_con,https://www.goodreads.com/book/show/1308591.Dot_con
1309838,Northanger Abbey,1854223623,9781854223623, , ,ID,https://i.gr-assets.com/images/S/compressed.photo.goodreads.com/books/1355912195l/1309838._SY160_.jpg,https://i.gr-assets.com/images/S/compressed.photo.goodreads.com/books/1355912195l/1309838._SY75_.jpg,https://i.gr-assets.com/images/S/compressed.photo.goodreads.com/books/1355912195l/1309838.jpg,1992,,,Magna Books,eng,false,"Jane Austen's first novel—published posthumously in 1818—tells the story of Catherine Morland and her dangerously sweet nature, innocence, and sometime self-delusion. Though Austen's fallible heroine is repeatedly drawn into scrapes while vacationing at Bath and during her subsequent visit to Northanger Abbey, Catherine eventually triumphs, blossoming into a discerning woman who learns truths about love, life, and the heady power of literature. The satirical novel pokes fun at the gothic novel while earnestly emphasizing caution to the female sex.",3.83,239,Hardcover, ,4,https://www.goodreads.com/book/show/1309838.Northanger_Abbey,https://www.goodreads.com/book/show/1309838.Northanger_Abbey
1310485,al-Imam Ali,9644650239,9789644650239, , ,ID,https://s.gr-assets.com/assets/nophoto/book/111x148-bcc042a9c91a29c1d680899eff700a03.png,https://s.gr-assets.com/assets/nophoto/book/50x75-a91bf249278a81aabab721ef782c4a74.png,https://s.gr-assets.com/assets/nophoto/book/111x148-bcc042a9c91a29c1d680899eff700a03.png,2000,,,Dar al-Kitab al-Islami,eng,false,"Elinizdeki eser, Peygamber’in damadı olan Ali’den bahsetmiyor, savaş kahramanı olan Ali’den bahsetmiyor, Peygamber’in sahabesi olan Ali’den bahsetmiyor, dördüncü halife olan Ali’den bahsetmiyor, ilk Şiî imamı olan Ali’den de bahsetmiyor. Elinizdeki eser, tarihsel Sünnîliğin ve tarihsel Şiîliğin anlatılmasını istediği Ali’yi anlatmıyor. Kutsal, aşkın ve zihinsel olan mutlak insanî erdemliliği, kendi şahsında somut, nesnel ve yaşayan bir gerçekliğe dönüştüren Ali’den bahsediyor. Yaşayan insana, bana, sana, bize, Müslüman’a tüm insanlığa lazım olan da zaten bu Ali değil midir?",3.87,297,Unknown Binding, ,2,https://www.goodreads.com/book/show/1310485.al_Imam_Ali,https://www.goodreads.com/book/show/1310485.al_Imam_Ali
1310645,Classics Illustrated: The Count of Monte Cristo,0425120287,9780425120286, , ,ID,https://i.gr-assets.com/images/S/compressed.photo.goodreads.com/books/1297557698l/1310645._SX98_.jpg,https://i.gr-assets.com/images/S/compressed.photo.goodreads.com/books/1297557698l/1310645._SY75_.jpg,https://i.gr-assets.com/images/S/compressed.photo.goodreads.com/books/1297557698l/1310645.jpg,1990,4,,Berkley Publishing Group,eng,false,"Here is an all-new adaptation of Dumas's classic, retaining the integrity of the original novel and using original dialogue and narration. Color illustrations.",4.23,43,Paperback,"Classics illustrated (New York), no. 7.",14,https://www.goodreads.com/book/show/1310645.Classics_Illustrated,https://www.goodreads.com/book/show/1310645.Classics_Illustrated
1310839,From Bauhaus to Our House,0374158924,9780374158927, , ,ID,https://i.gr-assets.com/images/S/compressed.photo.goodreads.com/books/1200112469l/1310839._SX98_.jpg,https://i.gr-assets.com/images/S/compressed.photo.goodreads.com/books/1200112469l/1310839._SX50_.jpg,https://i.gr-assets.com/images/S/compressed.photo.goodreads.com/books/1200112469l/1310839.jpg,1981,10,1,Farrar Straus Giroux,eng,false,"Walter Groppius, granddaddy of steel and glass, conceived his architectural vision in the rubble of WW I and the decadence of Weimar in the decade after.<p>His doctrine found fertile soil in America, where it was time to adopt a clearly defined and suitable representative architecture.</p><p>Tom Wolfe, author of THE PAINTED WORD and THE RIGHT STUFF, treats us to a chronicle of the trends that ultimately brought us the ubiquitous and baffling ""glass box"" of modern commerce.</p><p>""Delightfully witty, biting history of modern architecture...scintillating high comedy of big money, manners and massive manipulation of public taste."" (Publishers Weekly)</p>",3.77,143,Hardcover, ,24,https://www.goodreads.com/book/show/1310839.From_Bauhaus_to_Our_House,https://www.goodreads.com/book/show/1310839.From_Bauhaus_to_Our_House
1310913,شور آباد, , , , ,ID,https://s.gr-assets.com/assets/nophoto/book/111x148-bcc042a9c91a29c1d680899eff700a03.png,https://s.gr-assets.com/assets/nophoto/book/50x75-a91bf249278a81aabab721ef782c4a74.png,https://s.gr-assets.com/assets/nophoto/book/111x148-bcc042a9c91a29c1d680899eff700a03.png,1962,,,,per,false,,3.89, , , ,2,https://www.goodreads.com/book/show/1310913._,https://www.goodreads.com/book/show/1310913._
1311162,A Streetcar named desire,2729816097,9782729816094, , ,ID,https://i.gr-assets.com/images/S/compressed.photo.goodreads.com/books/1182681405l/1311162._SX98_.jpg,https://i.gr-assets.com/images/S/compressed.photo.goodreads.com/books/1182681405l/1311162._SY75_.jpg,https://i.gr-assets.com/images/S/compressed.photo.goodreads.com/books/1182681405l/1311162.jpg,2003,9,2,Ellipses Marketing,fre,false,"Ce volume présente par sa structure tripartite - études de la pièce, du film et textes croisés - des approches volontairement très diverses de A Streetcar Named Desire, œuvre emblématique de Tennessee Williams devenue film mythique grâce à Elia Kazan, Marlon Brando et Vivien Leigh. Ces analyses ont pour but de resituer l'œuvre dans un contexte historique, littéraire et cinématographique aussi inclusif que possible, tout en proposant des lectures approfondies de ses modalités de fonctionnement et des dispositifs d'écho ou, au contraire, des phénomènes de divergence entre les deux formes d'art. En offrant un éclairage sur quelques aspects essentiels de la pièce et du film, les différents contributeurs ont tenté d'expliciter les parcours singuliers de deux auteurs qui partagent le même territoire.",4.18,288,Paperback, ,1,https://www.goodreads.com/book/show/1311162.A_Streetcar_named_desire,https://www.goodreads.com/book/show/1311162.A_Streetcar_named_desire
1314073,کالیگولا,9646380298,9789646380298, , ,ID,https://i.gr-assets.com/images/S/compressed.photo.goodreads.com/books/1340264003l/1314073._SX98_.jpg,https://i.gr-assets.com/images/S/compressed.photo.goodreads.com/books/1340264003l/1314073._SX50_.jpg,https://i.gr-assets.com/images/S/compressed.photo.goodreads.com/books/1340264003l/1314073.jpg,2007,,,کتاب زمان,fre,false,Caligula,4.09,152,Paperback, ,121,https://www.goodreads.com/book/show/1314073._,https://www.goodreads.com/book/show/1314073._
1314332,Before I Die,0385613466,9780385613460, , ,ID,https://i.gr-assets.com/images/S/compressed.photo.goodreads.com/books/1348002855l/1314332._SX98_.jpg,https://i.gr-assets.com/images/S/compressed.photo.goodreads.com/books/1348002855l/1314332._SX50_.jpg,https://i.gr-assets.com/images/S/compressed.photo.goodreads.com/books/1348002855l/1314332.jpg,2007,7,5,David Fickling Books,eng,false,"The story of Tessa, a young teenage girl who has only months to live ... a brilliantly crafted novel, heartbreaking yet life-affirming.<br /><br />Tessa has just months to live. Fighting back against hospital visits, endless tests, drugs with excruciating side-effects, Tessa compiles a list. It’s her To Do Before I Die list. And number one is Sex. Released from the constraints of ‘normal’ life, Tessa tastes new experiences to make her feel alive while her failing body struggles to keep up. Tessa’s feelings, her relationships with her father and brother, her estranged mother, her best friend, and her new boyfriend, all are painfully crystallised in the precious weeks before Tessa’s time finally runs out.",3.83,336,Hardcover, ,2952,https://www.goodreads.com/book/show/1314332.Before_I_Die,https://www.goodreads.com/book/show/1314332.Before_I_Die
1314656,Goal Digger,097942450X,9780979424502, , ,ID,https://i.gr-assets.com/images/S/compressed.photo.goodreads.com/books/1387714099l/1314656._SX98_.jpg,https://i.gr-assets.com/images/S/compressed.photo.goodreads.com/books/1387714099l/1314656._SY75_.jpg,https://i.gr-assets.com/images/S/compressed.photo.goodreads.com/books/1387714099l/1314656.jpg,2007,6,19,Bush Street Press,en-GB,false,"Financial and life advice meets the sizzle of Sex and the City. Marry rich! That's what Alicia Dunams set out to do. But instead of marrying a millionaire, she learned the secrets of becoming one turning her dates with fame and fortune into the ultimate wealth-building school. Now, you too can make more money, jumpstart your ideas and enjoy your ultimate lifestyle using the Rich Men secrets revealed in her amazing new book! Goal Digger is her inspiring story, and your first class ticket to the life of your dreams! Inside this sizzling new tell-all, Alicia takes you beyond the expensive gifts, exotic trips and lavish dinners to reveal the intimate lessons her Rich Men taught her about money, life and success.",3.82, ,Paperback, ,3,https://www.goodreads.com/book/show/1314656.Goal_Digger,https://www.goodreads.com/book/show/1314656.Goal_Digger
1316617,"Succubus on Top (Georgina Kincaid, #2)",0758216424,9780758216427, , ,ID,https://i.gr-assets.com/images/S/compressed.photo.goodreads.com/books/1315977158l/1316617._SX98_.jpg,https://i.gr-assets.com/images/S/compressed.photo.goodreads.com/books/1315977158l/1316617._SX50_.jpg,https://i.gr-assets.com/images/S/compressed.photo.goodreads.com/books/1315977158l/1316617.jpg,2008,1,1,Kensington Publishing Corporation,eng,false,"Love hurts, and no one knows it better than Georgina Kincaid. If she so much as kisses Seth Mortensen, the shy, sexy writer she's been dating, she'll drain his life force. Admittedly, the shapeshifting and immortality perks of a succubus are terrific, but it's completely unfair that a she-demon whose purpose is seduction can't get down with the one mortal who accepts her for who she is. . .<br /><br />It's not just her personal life that's in chaos. Doug, Georgina's co-worker at a local bookstore, has been exhibiting bizarre behavior, and Georgina suspects something far more demonic than double espressos. She could use an assist from Bastien, an irresistibly charming incubus and her best immortal friend, but he's giving Georgina some highly distracting come-hither vibes. Georgina is going to have to work solo on this one-and fast, because soon, Doug's life won't be the only one on the line. . .",4.06,314,Paperback, ,1074,https://www.goodreads.com/book/show/1316617.Succubus_on_Top,https://www.goodreads.com/book/show/1316617.Succubus_on_Top
1317696,The Enchantress of Florence,0224061631,9780224061636, , ,ID,https://i.gr-assets.com/images/S/compressed.photo.goodreads.com/books/1200508801l/1317696._SX98_.jpg,https://i.gr-assets.com/images/S/compressed.photo.goodreads.com/books/1200508801l/1317696._SY75_.jpg,https://i.gr-assets.com/images/S/compressed.photo.goodreads.com/books/1200508801l/1317696.jpg,2008,,,Cape,eng,false,"A tall, yellow-haired young European traveller calling himself 'Mogor dell'Amore', the Mughal of Love, arrives at the court of the real Grand Mughal, the Emperor Akbar, with a tale to tell that begins to obsess the whole imperial capital. The stranger claims to be the child of a lost Mughal princess, the youngest sister of Akbar's grandfather Babar: Qara Koz, 'Lady Black Eyes', a great beauty believed to possess powers of enchantment and sorcery, who is taken captive first by an Uzbek warlord, then by the Shah of Persia, and finally becomes the lover of a certain Argalia, a Florentine soldier of fortune, commander of the armies of the Ottoman Sultan. When Argalia returns home with his Mughal mistress the city is mesmerized by her presence, and much trouble ensues. <i>The Enchantress of Florence</i> is the story of a woman attempting to command her own destiny in a man's world. It brings together two cities that barely know each other - the hedonistic Mughal capital, in which the brilliant emperor wrestles daily with questions of belief, desire and the treachery of sons, and the equally sensual Florentine world of powerful courtesans, humanist philosophy and inhuman torture, where Argalia's boyhood friend ""il Machia"" - Niccolo' Machiavelli - is learning, the hard way, about the true brutality of power. These two worlds, so far apart, turn out to be uncannily alike, and the enchantments of women hold sway over them both. But is Mogor's story true? And if so, then what happened to the lost princess? And if he's a liar, must he die?",3.59,359,Hardcover, ,1521,https://www.goodreads.com/book/show/1317696.The_Enchantress_of_Florence,https://www.goodreads.com/book/show/1317696.The_Enchantress_of_Florence
1317946,Managing Humans: Biting and Humorous Tales of a Software Engineering Manager,159059844X,9781590598443, , ,ID,https://i.gr-assets.com/images/S/compressed.photo.goodreads.com/books/1348842671l/1317946._SX98_.jpg,https://i.gr-assets.com/images/S/compressed.photo.goodreads.com/books/1348842671l/1317946._SX50_.jpg,https://i.gr-assets.com/images/S/compressed.photo.goodreads.com/books/1348842671l/1317946.jpg,2007,6,1,Apress,en-GB,false,"<em>Managing Humans</em> is a selection of the best essays from <strong>Michael Lopp</strong>'s web site, Rands in Repose. Drawing on Lopp's management experiences at Apple, Netscape, Symantec, and Borland, this book is full of stories based on companies in the Silicon Valley where people have been known to yell at each other. It is a place full of dysfunctional bright people who are in an incredible hurry to find the next big thing so they can strike it rich and then do it all over again. Among these people are managers, a strange breed of people who through a mystical organizational ritual have been given power over your future and your bank account.<br /><br />Whether you're an aspiring manager, a current manager, or just wondering what the heck a manager does all day, there is a story in this book that will speak to you.",3.97,209,Paperback, ,190,https://www.goodreads.com/book/show/1317946.Managing_Humans,https://www.goodreads.com/book/show/1317946.Managing_Humans
1319826,Sansibar oder der letzte Grund,3257200552,9783257200553, , ,ID,https://i.gr-assets.com/images/S/compressed.photo.goodreads.com/books/1182728246l/1319826._SX98_.jpg,https://i.gr-assets.com/images/S/compressed.photo.goodreads.com/books/1182728246l/1319826._SY75_.jpg,https://i.gr-assets.com/images/S/compressed.photo.goodreads.com/books/1182728246l/1319826._SY475_.jpg,1970,,,Diogenes,ger,false,"In einer kleinen Stadt an der Ostsee treffen zufällig sechs Gestalten zusammen: ›Der Junge‹; Gregor, der KPD-Funktionär; Judith, die Jüdin; am Ort selbst befinden sich der Pfarrer Helander; Knudsen, der Fischer und Kutterbesitzer; als letzter die Holzplastik des ›Lesenden Klosterschülers‹. Und diese sechs Gestalten haben kein anderes Anliegen, als Deutschland zu verlassen... Alfred Anderschs großes Buch von Sansibar ist ein Mißtrauensvotum ersten Ranges gegen unser behäbig aufgeblasenes ›Volk der Mitte‹.",3.50,159,Paperback, ,33,https://www.goodreads.com/book/show/1319826.Sansibar_oder_der_letzte_Grund,https://www.goodreads.com/book/show/1319826.Sansibar_oder_der_letzte_Grund
1319874,A Few Short Notes on Tropical Butterflies,0060509295,9780060509293, , ,ID,https://i.gr-assets.com/images/S/compressed.photo.goodreads.com/books/1440422860l/1319874._SX98_.jpg,https://i.gr-assets.com/images/S/compressed.photo.goodreads.com/books/1440422860l/1319874._SY75_.jpg,https://i.gr-assets.com/images/S/compressed.photo.goodreads.com/books/1440422860l/1319874._SY475_.jpg,2004,1,20,Harper Perennial,eng,false,"These vivid and compelling tales, many set in Africa and Asia, are about immigrants and others facing change and dislocation. The science is never pedantic; indeed the language of biology and natural history is used to great lyrical effect. The stories are accomplished and seasoned, remarkably so given that this is the author’s first book. Murray is adept at holding together a complex narrative and creating characters who reach out emotionally to the reader upon first meeting.<br /><br />Global in scope, classical in form, evocative of place, and deeply emotional, this collection marks the beginning of what promises to be an illustrious career.",3.87,274,Paperback, ,49,https://www.goodreads.com/book/show/1319874.A_Few_Short_Notes_on_Tropical_Butterflies,https://www.goodreads.com/book/show/1319874.A_Few_Short_Notes_on_Tropical_Butterflies
1319902,Momo,3423109580,9783423109581, , ,ID,https://i.gr-assets.com/images/S/compressed.photo.goodreads.com/books/1349076112l/1319902._SY160_.jpg,https://i.gr-assets.com/images/S/compressed.photo.goodreads.com/books/1349076112l/1319902._SY75_.jpg,https://i.gr-assets.com/images/S/compressed.photo.goodreads.com/books/1349076112l/1319902.jpg,1988,11,27,DTV Deutscher Taschenbuch,ger,false,"Momo lebt am Rande einer Großstadt in den Ruinen eines Amphitheaters. Sie besitzt nichts als das, was sie findet oder was man ihr schenkt, und eine außergewöhnliche Gabe: Sie hat immer Zeit und ist eine wunderbare Zuhörerin. Eines Tages treten die grauen Herren auf den Plan. Sie haben es auf die kostbare Lebenszeit der Menschen abgesehen und Momo ist die Einzige, die ihnen noch Einhalt gebieten kann.",4.32,260,Paperback, ,8,https://www.goodreads.com/book/show/1319902.Momo,https://www.goodreads.com/book/show/1319902.Momo
