id,title,isbn,isbn13,asin,kindle_asin,country_code,image_url,small_image_url,large_image_url,publication_year,publication_month,publication_day,publisher,language_code,is_ebook,description,average_rating,num_pages,format,edition_information,text_reviews_count,url,link
1374695,The Deviant's Advantage: How Fringe Ideas Create Mass Markets,0609609580,9780609609583, , ,ID,https://i.gr-assets.com/images/S/compressed.photo.goodreads.com/books/1431801702l/1374695._SX98_.jpg,https://i.gr-assets.com/images/S/compressed.photo.goodreads.com/books/1431801702l/1374695._SY75_.jpg,https://i.gr-assets.com/images/S/compressed.photo.goodreads.com/books/1431801702l/1374695.jpg,2002,9,10,Crown Business,en-US,false,"Don’t consider yourself deviant? Well, that just may be a career breaker. Odds are the idea or product that will transform your business or industry tomorrow is out there right now, hiding in the shadows of the Fringe, raw, messy, untamed, and just waiting to be exploited. Trapping, taming, and marketing it is the key to burying your competition and staying ahead of your market.<br /><br />Deviance is nothing more than a marked separation from the norm and is the source of innovation, the kind of breakthrough thinking that creates new markets and tumbles traditional ones. Positive deviation is an inexhaustible font of new ideas, products, and services. It’s the source of all creative thinking and dynamic new market development and ultimately the basis of all incremental profit. <br /><br /><b>The Deviant’s Advantage</b> describes how deviance proceeds along a traceable trajectory from the Fringe, where it originates but has zero commercial potential; to the Edge, where word of mouth creates a limited audience; to the Realm of the Cool, where the buzz and market momentum really start to build; to the Next Big Thing, where demand is honed and intensifies; finally landing at Social Convention, the heart of the mass market. <br /><br />Ryan Mathews and Watts Wacker, two of America’s most respected futurists, trace the “Path of the Devox” (the voice, spirit, or incarnation of deviant ideas, products, and individuals), using it as a way to explain how and why:<br />* Christian fundamentalism morphed from college Bible studies to Republican party king-making<br />* Reebok cares more about what’s on the feet of kids in Detroit and Philadelphia than what the so-hip-it-hurts set is wearing in New York or on Rodeo Drive<br />* Napster exploded from an idea germinating inside a sixteen-year-old to a movement with 60 million subscribers that very nearly destroyed the music industry<br />* Hugh Hefner went from America’s most public pornographer to a cultural icon with decidedly Puritan sensibilities<br /><br />Mathews and Wacker also look at what happens to formerly deviant products and ideas after they are replaced by the next wave from the Fringe—how they morph into Cliché (where their commercial potential may actually increase), become Icons or even Archetypes, or fade into Oblivion, and how you can profitably manage even a fading concept.<br /><br />Looking for the next big idea for your business? Then it’s past time to quit staring at the Social Convention for inspiration and start scouring the Fringes of society. Tomorrow’s breakthrough concept is lurking out there right now, in the mind of a deviant individual. Your choice is simple: find it and exploit it, or be buried by those who do.<br /><br /><br /><i>From the Hardcover edition.</i>",3.64,288,Hardcover, ,2,https://www.goodreads.com/book/show/1374695.The_Deviant_s_Advantage,https://www.goodreads.com/book/show/1374695.The_Deviant_s_Advantage
1376068,Listening Is an Act of Love: A Celebration of American Life from the StoryCorps Project,1594201404,9781594201400, , ,ID,https://i.gr-assets.com/images/S/compressed.photo.goodreads.com/books/1347537598l/1376068._SX98_.jpg,https://i.gr-assets.com/images/S/compressed.photo.goodreads.com/books/1347537598l/1376068._SX50_.jpg,https://i.gr-assets.com/images/S/compressed.photo.goodreads.com/books/1347537598l/1376068.jpg,2007,11,8,"Penguin Press HC, The",en-US,false,"From more than ten thousand interviews, StoryCorps-the largest oral history project in the nation's history-presents a tapestry of American stories, told by the people who lived them to the people they love.<br /><br /> StoryCorps began with the idea that everyone has an important story to tell. And since 2003, this remarkable project has been collecting the stories of everyday Americans and preserving them for future generations. In New York City and in mobile recording booths traveling the country-from small towns to big cities, at Native American reservations and an Army post-StoryCorps is collecting the memories of Americans from all ages, backgrounds, and walks of life. The project represents a wondrous nationwide celebration of our shared humanity, capturing for posterity the stories that define us and bind us together.<br /><br /> In <i>Listening Is an Act of Love</i>, StoryCorps founder and legendary radio producer Dave Isay selects some of the most remarkable stories from the already vast collection and arranges them thematically into a moving portrait of American life. The voices here connect us to real people and their lives-to their experiences of profound joy, sadness, courage and despair, to good times and hard times, to good deeds and misdeeds.<br /><br /> To read this book is to be reminded of how rich and varied the American storybook truly is, how resistant to easy categorization or caricature. Above all, this book honors the gift each StoryCorps participant has made, from the raw material of his or her life, to the Americans who will come after. We are our history, individually and collectively, and <i>Listening Is an Act of Love</i> touchingly reminds us of this powerful truth.<br /><br />",4.28,284,Hardcover, ,708,https://www.goodreads.com/book/show/1376068.Listening_Is_an_Act_of_Love,https://www.goodreads.com/book/show/1376068.Listening_Is_an_Act_of_Love
1377382,Jalan Menikung,979444412X,9789794444122, , ,ID,https://i.gr-assets.com/images/S/compressed.photo.goodreads.com/books/1466440007l/1377382._SX98_.jpg,https://i.gr-assets.com/images/S/compressed.photo.goodreads.com/books/1466440007l/1377382._SX50_.jpg,https://i.gr-assets.com/images/S/compressed.photo.goodreads.com/books/1466440007l/1377382._SX318_.jpg,1999,,,"Pustaka Utama Grafiti, Yayasan Adikarya IKAPI dan The Ford Foundation",ind,false,"Masih ingat Para Priyayi, kisah tentang keluarga besar Sastro Darsono dari Wanagalih? Dalam Jalan Menikung ini kisah keluarga Sastro Darsono berlanjut dengan kehidupan Harimurti-Sulistianingsih bersama anak tunggal mereka, Eko, yang belajar di Sunnybrook College, Connecticut, Amerika Serikat. Sukses dalam studi dan ingin kembali ke tanah air, ternyata Eko tersandung oleh masa lalu ayahnya. Harimurti dipecat dari pekerjaannya, anjuran sang ayah ia tetap tinggal di Sunnybrook dan kemudian bekerja",3.52,184,Paperback, ,49,https://www.goodreads.com/book/show/1377382.Jalan_Menikung,https://www.goodreads.com/book/show/1377382.Jalan_Menikung
1378736,Cielos de barro,8408039628,9788408039624, , ,ID,https://i.gr-assets.com/images/S/compressed.photo.goodreads.com/books/1371045717l/1378736._SX98_.jpg,https://i.gr-assets.com/images/S/compressed.photo.goodreads.com/books/1371045717l/1378736._SY75_.jpg,https://i.gr-assets.com/images/S/compressed.photo.goodreads.com/books/1371045717l/1378736.jpg,2001,,,Booket,spa,false,"Dulce Chacón indaga en la memoria de un hombre que se resiste a la verdades a medias, y que con su familia sera testigo y protagonista de una historia que discurre paralela entre amos y sirvientes. Cielos de barro arranca con la intriga de un asesinato, que sera el hilo conductor de una narracion cargada de odios y de verguenzas, de opresiones y de sumisiones, pero tambien de pasion, de amor y de entrega. Como telon de fondo, el horror de la guerra y la posguerra, y una saga de vencedores y vencidos, para los que no todos los cielos son iguales.",3.88,304,Paperback, ,15,https://www.goodreads.com/book/show/1378736.Cielos_de_barro,https://www.goodreads.com/book/show/1378736.Cielos_de_barro
1379502,Pastel School,0762106980,9780762106981, , ,ID,https://i.gr-assets.com/images/S/compressed.photo.goodreads.com/books/1389052500l/1379502._SX98_.jpg,https://i.gr-assets.com/images/S/compressed.photo.goodreads.com/books/1389052500l/1379502._SX50_.jpg,https://i.gr-assets.com/images/S/compressed.photo.goodreads.com/books/1389052500l/1379502.jpg,2006,4,20,Readers Digest,en-US,false,"More than 40 step-by-step sequences show how to master pastel painting and develop your own individual style. Eight projects show the whole process of picture making, from planning to completion.",4.00,176,Paperback, ,5,https://www.goodreads.com/book/show/1379502.Pastel_School,https://www.goodreads.com/book/show/1379502.Pastel_School
1379659,Famous Builder,1555973698,9781555973698, , ,ID,https://i.gr-assets.com/images/S/compressed.photo.goodreads.com/books/1312036090l/1379659._SX98_.jpg,https://i.gr-assets.com/images/S/compressed.photo.goodreads.com/books/1312036090l/1379659._SY75_.jpg,https://i.gr-assets.com/images/S/compressed.photo.goodreads.com/books/1312036090l/1379659.jpg,2002,10,1,Graywolf Press,eng,false,"Paul Lisicky remembers being not much like other boys his age, but rather the awkward thirteen-year-old with ""arms thick as drinking straws,"" who composes tunes in his head that he might later send to <i>Folk Mass Today</i> or to the producers of <i>The Partridge Family</i>. Born into a family whose incremental success bumps them up a notch from their immigrant upbringing and into suburban America, Paul puts his creative, undaunted energy into drawing intricate housing development plans and writing liturgical music.<br /><br />In the lively, loving essays contained in <i>Famous Builder</i>, Lisicky explores the constant impulse to rebuild the self. With gracious, thoughtful candor and pitch-perfect humor, he explores the very personal realms of childhood dreams and ambitions, adolescent sexual awakenings, and adult realities.",4.22,200,Paperback, ,7,https://www.goodreads.com/book/show/1379659.Famous_Builder,https://www.goodreads.com/book/show/1379659.Famous_Builder
1379695,Split: A Memoir of Divorce,052595046X,9780525950462, , ,ID,https://i.gr-assets.com/images/S/compressed.photo.goodreads.com/books/1388198817l/1379695._SX98_.jpg,https://i.gr-assets.com/images/S/compressed.photo.goodreads.com/books/1388198817l/1379695._SY75_.jpg,https://i.gr-assets.com/images/S/compressed.photo.goodreads.com/books/1388198817l/1379695.jpg,2008,4,17,Dutton Adult,en-US,false,"Bestselling and award-winning author Suzanne Finnamore writes a story of divorce that is �brilliant� (Augusten Burroughs) and sure to become a classic. <br /><br /> There are certain books that come to epitomize their painful subject matter, offering solace to those who share the same fate and pleasure to those who merely appreciate fine writing. What <i>The Year of Magical Thinking</i> did for grief, what <i>Drinking: A Love Story</i> did for alcoholism, now Split does for divorce. Prescriptive yet full of pragmatic advice, insight and black humor, Split is a finely wrought tourniquet for a broken union and its attendant trauma. <br /><br /> Suzanne Finnamore, author of the novel Otherwise Engaged, didn�t see it coming. Well, perhaps she saw something�for example, a cocktail napkin on which her husband, N, had scribbled a Cole Porter love song and someone else�s name�but she refused to acknowledge it. She was busy tending to their one-year-old son, then applying makeup, donning high heels, and mixing a martini to greet N with when he arrived home at night. Until the night N came home, told her she looked beautiful, changed his clothes, and announced that he was leaving. <br /><br /> In crystalline, riveting prose, Finnamore tells the story of her divorce, and her marriage, and how it all imploded and came back together, changed. At once quite funny, achingly sad, and unflinchingly fierce, Split will resonate with anyone who�s endured the end of a relationship.",3.49,272,Hardcover, ,142,https://www.goodreads.com/book/show/1379695.Split,https://www.goodreads.com/book/show/1379695.Split
1379905,گل صحرا, ,9789643621681, , ,ID,https://i.gr-assets.com/images/S/compressed.photo.goodreads.com/books/1582997662l/1379905._SX98_.jpg,https://i.gr-assets.com/images/S/compressed.photo.goodreads.com/books/1582997662l/1379905._SX50_.jpg,https://i.gr-assets.com/images/S/compressed.photo.goodreads.com/books/1582997662l/1379905._SX318_.jpg,2007,10,1,چشمه,per,false,واریس دیری زنی فوق‌العاده است. روح او مانند زیبایی‌اش نفس را در سینه جبس می‌کند. او به شکلی مضاعف زندگی می‌کند. روزها مدل بین‌المللی معروف و سخنگوی حقوق زنان در آفریقاست و شب‌ها رؤیای بازگشت به خانه، به وطنش سومالی را در سر می‌پروراند.<br />وقتی واریس دوازده سال بیش‌تر نداشت، از زندگی کوچ‌نشینی صحرانشینی فرار کرد. چون پدرش در مقابل پنج شتر ترتیب ازدواجش را با مرد غریبه‌ای شصت ساله داده بود. او از صحرای سخت سومالی می‌گذرد و به لندن جایی که به وسیله‌ی عکاسی کشف می‌شود، سفر می‌کند اما با خود خاطرات ناگوار و درد و رتج واقعی سنتی کهن را به همراه می‌برد؛ ختنه، وقتی که او پنج سال داشت، ختنه شد,4.13,392,Paperback, ,59,https://www.goodreads.com/book/show/1379905._,https://www.goodreads.com/book/show/1379905._
1379961,People of the Book,067001821X, , , ,ID,https://i.gr-assets.com/images/S/compressed.photo.goodreads.com/books/1442955497l/1379961._SX98_.jpg,https://i.gr-assets.com/images/S/compressed.photo.goodreads.com/books/1442955497l/1379961._SY75_.jpg,https://i.gr-assets.com/images/S/compressed.photo.goodreads.com/books/1442955497l/1379961._SY475_.jpg,2008,10,1,Viking Books,eng,false,"From the Pulitzer Prize–winning author of <i>March</i>, the journey of a rare illuminated manuscript through centuries of exile and war<br /><br />In 1996, Hanna Heath, an Australian rare-book expert, is offered the job of a lifetime: analysis and conservation of the famed Sarajevo Haggadah, which has been rescued from Serb shelling during the Bosnian war. Priceless and beautiful, the book is one of the earliest Jewish volumes ever to be illuminated with images. When Hanna, a caustic loner with a passion for her work, discovers a series of tiny artifacts in its ancient binding—an insect wing fragment, wine stains, salt crystals, a white hair—she begins to unlock the book’s mysteries. The reader is ushered into an exquisitely detailed and atmospheric past, tracing the book’s journey from its salvation back to its creation. <br /><br />In Bosnia during World War II, a Muslim risks his life to protect it from the Nazis. In the hedonistic salons of fin-de-siècle Vienna, the book becomes a pawn in the struggle against the city’s rising anti-Semitism. In inquisition-era Venice, a Catholic priest saves it from burning. In Barcelona in 1492, the scribe who wrote the text sees his family destroyed by the agonies of enforced exile. And in Seville in 1480, the reason for the Haggadah’s extraordinary illuminations is finally disclosed. Hanna’s investigation unexpectedly plunges her into the intrigues of fine art forgers and ultra-nationalist fanatics. Her experiences will test her belief in herself and the man she has come to love. <br /><br />Inspired by a true story, <i>People of the Book</i> is at once a novel of sweeping historical grandeur and intimate emotional intensity, an ambitious, electrifying work by an acclaimed and beloved author.",4.02,372,Hardcover, ,10214,https://www.goodreads.com/book/show/1379961.People_of_the_Book,https://www.goodreads.com/book/show/1379961.People_of_the_Book
1380162,Life is Just What You Make It: My Story So Far,078686494X,9780786864942, , ,ID,https://i.gr-assets.com/images/S/compressed.photo.goodreads.com/books/1422895648l/1380162._SX98_.jpg,https://i.gr-assets.com/images/S/compressed.photo.goodreads.com/books/1422895648l/1380162._SY75_.jpg,https://i.gr-assets.com/images/S/compressed.photo.goodreads.com/books/1422895648l/1380162.jpg,1999,6,9,Hyperion Books,en-US,false,"At age five, Donny Osmond first sang his way into North Americas heart. By the time he was a teenager, he had four separate careers successfully underway, as a solo artist, as a member of the Osmond Brothers, as part of a singing duo with his sister, Marie, and as the co-host of a highly successful network television variety show. But by the early 80s, public perception had changed, and Donny discovered that, thanks to his squeaky-clean image, his very name had become poison. In this inspiring autobiography, Donny tells what it is like to survive the ups and downs of the entertainment business while trying to keep his faith, dignity, and sense of humor intact. He recalls memories of his experiences with a variety of celebrities, from Groucho Marx and Lucille Ball to Michael Jackson and Howard Stern. He shares how he finally achieved resolution through marriage, fatherhood, perseverance, and self-acceptance. And he recounts the long and difficult road leading to a renewed recording career, nearly two thousand triumphant performances in Joseph and the Amazing Technicolor Dreamcoat, and a new nationally syndicated talk show. The millions of people who watched Donny grow up are now embracing the man whose life and career exemplify the classic values that so many now share.",3.95,336,Hardcover, ,60,https://www.goodreads.com/book/show/1380162.Life_is_Just_What_You_Make_It,https://www.goodreads.com/book/show/1380162.Life_is_Just_What_You_Make_It
1380861,Un Gusto a Almendras Amargas,8401561531,9788401561535, , ,ID,https://s.gr-assets.com/assets/nophoto/book/111x148-bcc042a9c91a29c1d680899eff700a03.png,https://s.gr-assets.com/assets/nophoto/book/50x75-a91bf249278a81aabab721ef782c4a74.png,https://s.gr-assets.com/assets/nophoto/book/111x148-bcc042a9c91a29c1d680899eff700a03.png,1996,4,28,"Plaza & Janes Editores, S.A.",spa,false,"It is 414 A.D. and the once-powerful Roman Empire is in its death throes—split between East and West, menaced by barbarian hordes almost literally at its gates. The Emperor Honorious cowers in the marsh-bound city of Ravenna, where he has moved the government. There is the Prefect Hadrian, a powerful official and fanatical Christian convert; Marcus Anicius, the pagan aristocrat who is clinging to a dyping past, and the Jew Eliezar ben Elijah, hemmed in by his own traditions and burdened by his dark vision of the future.",3.42,0,Paperback, ,2,https://www.goodreads.com/book/show/1380861.Un_Gusto_a_Almendras_Amargas,https://www.goodreads.com/book/show/1380861.Un_Gusto_a_Almendras_Amargas
1381248,کشور آخرین‌ها, , , , ,ID,https://i.gr-assets.com/images/S/compressed.photo.goodreads.com/books/1368976742l/1381248._SX98_.jpg,https://i.gr-assets.com/images/S/compressed.photo.goodreads.com/books/1368976742l/1381248._SX50_.jpg,https://i.gr-assets.com/images/S/compressed.photo.goodreads.com/books/1368976742l/1381248.jpg,2009,,,نشر افق,per,false,دختر جوانی به نام آنابلوم که در جستجوی برادر گمشده‌اش به شهری ناشناس سفر می‌کند و پس از مدتی مایوس از یافتن برادر، بی‌پول و بی‌خانمان در شهری مصیبت‌زده روزگار را سپری می‌کند. او برای فرار از بی‌خانمانی دعوت پیرزنی ناشناس را می‌پذیرد، اما با شوهر شرور و متجاوز او روبه‌رو می‌شود و حلقه‌های مصیبت این چنین تکرار می‌شوند؛,3.87,174,Paperback, ,28,https://www.goodreads.com/book/show/1381248._,https://www.goodreads.com/book/show/1381248._
1382607,The Lonely Londoners, , , , ,ID,https://i.gr-assets.com/images/S/compressed.photo.goodreads.com/books/1348838699l/1382607._SX98_.jpg,https://i.gr-assets.com/images/S/compressed.photo.goodreads.com/books/1348838699l/1382607._SY75_.jpg,https://i.gr-assets.com/images/S/compressed.photo.goodreads.com/books/1348838699l/1382607.jpg,2006,7,27,Penguin Books Ltd,eng,false,"Alternate cover edition for ISBN 9780141188416. Newer cover <a href=""https://www.goodreads.com/book/show/54697648-the-lonely-londoners"" rel=""nofollow noopener"">may be found here</a>, and an older cover <a href=""https://www.goodreads.com/book/show/55335722-the-lonely-londoners"" rel=""nofollow noopener"">here</a><br /><br />From the brilliant, sharp, witty pen of Sam Selvon, <i>The Lonely Londoners</i> is a classic novel of immigrant life in 1950s London.<br /><br />At Waterloo Station, hopeful new arrivals from the West Indies step off the boat train, ready to start afresh in 1950s London. There, homesick Moses Aloetta, who has already lived in the city for years, meets Henry 'Sir Galahad' Oliver and shows him the ropes. In this strange, cold and foggy city where the natives can be less than friendly at the sight of a black face, has Galahad met his Waterloo? But the irrepressible newcomer cannot be cast down. He and all the other lonely new Londoners - from shiftless Cap to Tolroy, whose family has descended on him from Jamaica - must try to create a new life for themselves. As pessimistic 'old veteran' Moses watches their attempts, they gradually learn to survive and come to love the heady excitements of London.",3.69,156,Paperback,Penguin Modern Classics,152,https://www.goodreads.com/book/show/1382607.The_Lonely_Londoners,https://www.goodreads.com/book/show/1382607.The_Lonely_Londoners
1382972,"Don Quixote de La Mancha, Vol 1",1406791725,9781406791723, , ,ID,https://i.gr-assets.com/images/S/compressed.photo.goodreads.com/books/1347605886l/1382972._SX98_.jpg,https://i.gr-assets.com/images/S/compressed.photo.goodreads.com/books/1347605886l/1382972._SY75_.jpg,https://i.gr-assets.com/images/S/compressed.photo.goodreads.com/books/1347605886l/1382972.jpg,2006,1,1,Pomona Press,eng,false,"Don Quixote, errant knight and sane madman, with the company of his faithful squire and wise fool, Sancho Panza, together roam the world and haunt readers' imaginations as they have for nearly four hundred years.",3.92,452,Paperback, ,67,https://www.goodreads.com/book/show/1382972.Don_Quixote_de_La_Mancha_Vol_1,https://www.goodreads.com/book/show/1382972.Don_Quixote_de_La_Mancha_Vol_1
