id,title,isbn,isbn13,asin,kindle_asin,country_code,image_url,small_image_url,large_image_url,publication_year,publication_month,publication_day,publisher,language_code,is_ebook,description,average_rating,num_pages,format,edition_information,text_reviews_count,url,link
15788855,۵ نفری که در بهشت ملاقات می‌کنید,9648554617, , , ,ID,https://s.gr-assets.com/assets/nophoto/book/111x148-bcc042a9c91a29c1d680899eff700a03.png,https://s.gr-assets.com/assets/nophoto/book/50x75-a91bf249278a81aabab721ef782c4a74.png,https://s.gr-assets.com/assets/nophoto/book/111x148-bcc042a9c91a29c1d680899eff700a03.png,,,,,,false,"From the author of Tuesdays with Morrie, a novel that explores the unexpected connections of our lives, and the idea that heaven is more than a place; it's an answer.<br /><br />From the author of the phenomenal #1 New York Times bestseller Tuesdays with Morrie, a novel that explores the unexpected connections of our lives, and the idea that heaven is more than a place; it's an answer. <br /><br />Eddie is a wounded war veteran, an old man who has lived, in his mind, an uninspired life. His job is fixing rides at a seaside amusement park. On his 83rd birthday, a tragic accident kills him as he tries to save a little girl from a falling cart. He awakes in the afterlife, where he learns that heaven is not a destination. It's a place where your life is explained to you by five people, some of whom you knew, others who may have been strangers. One by one, from childhood to soldier to old age, Eddie's five people revisit their connections to him on earth, illuminating the mysteries of his ""meaningless"" life, and revealing the haunting secret behind the eternal question: ""Why was I here?""",3.94, , , ,0,https://www.goodreads.com/book/show/15788855,https://www.goodreads.com/book/show/15788855
15788880,The Startup Playbook: Secrets of the Fastest-Growing Startups from Their Founding Entrepreneurs,1452105049,9781452105048, , ,ID,https://i.gr-assets.com/images/S/compressed.photo.goodreads.com/books/1356181880l/15788880._SX98_.jpg,https://i.gr-assets.com/images/S/compressed.photo.goodreads.com/books/1356181880l/15788880._SX50_.jpg,https://i.gr-assets.com/images/S/compressed.photo.goodreads.com/books/1356181880l/15788880.jpg,2013,1,2,Chronicle Books,en-GB,false,"According to the Kauffman Index of Entrepreneurial Activity, more than 565,000 new businesses were created in 2010 in the United States alone—each one of them hoping to strike gold. <em>The Startup Playbook</em> will help them succeed. Going insider to insider with unprecedented access, <em>New York Times</em> bestselling author and Clickable CEO, David Kidder, shares the hard-hitting experiences of some of the world's most influential entrepreneurs and CEOs, revealing their most closely held advice. Face-to-face interviews with 40 founders give readers key insights into what it took to build PayPal, LinkedIn, AOL, TED, Flickr, and many others into household names. Special sections include topics ranging from how to select the right idea to pursue to finding funding and overcoming inevitable obstacles. In an economy demanding change, <em>The Startup Playbook</em> is the go-to for entrepreneurs big and small.",3.79,292,Hardcover, ,29,https://www.goodreads.com/book/show/15788880-the-startup-playbook,https://www.goodreads.com/book/show/15788880-the-startup-playbook
15788898,7 Years Younger: The Revolutionary 7-Week Plan to Look and Feel Your Best,1936297639,9781936297634, , ,ID,https://i.gr-assets.com/images/S/compressed.photo.goodreads.com/books/1355957826l/15788898._SX98_.jpg,https://i.gr-assets.com/images/S/compressed.photo.goodreads.com/books/1355957826l/15788898._SX50_.jpg,https://i.gr-assets.com/images/S/compressed.photo.goodreads.com/books/1355957826l/15788898.jpg,2013,1,1,7 Years Younger,,false,"This revolutionary new book kicks off with a 7-day Jumpstart plan offering you all the tools you need to start your total rejuvenation. Then you'll follow the 7-week, science-based program with a holistic approach to looking and feeling younger. Its 7 age erasers cover every base with special regimens for skin care, makeup, hair care, nutrition and diet, fitness, brain fitness, and emotional health. With this program you can ""de-age"" your skin, use makeup and hair smarts to get a youthful look, rehab your diet and exercise habits in a way that lowers your risk of age-related diseases and to lose weight, learn to<b> </b>sharpen your mind, and nurture your emotional health. You'll be surprised at how much you can turn back the clock on your own--without stepping near a plastic surgeon's office, or spending a fortune on expensive beauty products. <br /><br />The scientists at the Good Housekeeping Research Institute rigorously tested more than 400 beauty products and conducted more than 5,000 lab tests over the course of two years to find the anti-aging products that <u>really work</u>. Then ten test panelists went on the week long Jumpstart followed by the full 7-week plan. The results were fantastic, with one panelist losing 12 pounds, another losing 10 inches from around her waist, and yet another re-emerging as the glamorous-looking woman she was before she started raising a family. As one of the panelists said<b>, </b>""There are a lot of diet and exercise programs out there on the market. And there are a lot of beauty tips you can get... but '7 Years Younger' has taken all of those things and put them into... a one stop shopping experience for your... overall beauty and health and mindset."" <br /><br />""What's great about the program,"" says <i>Good Housekeeping</i> editor in chief Rosemary Ellis, ""is that you can treat it like a tool kit. You can pick and choose which elements of the program you want to focus on.""",3.22,356,Hardcover, ,33,https://www.goodreads.com/book/show/15788898-7-years-younger,https://www.goodreads.com/book/show/15788898-7-years-younger
15789443,"Something Real (Something Real, #1)", , ,B00E718YEC, ,ID,https://i.gr-assets.com/images/S/compressed.photo.goodreads.com/books/1385144446l/15789443._SX98_.jpg,https://i.gr-assets.com/images/S/compressed.photo.goodreads.com/books/1385144446l/15789443._SY75_.jpg,https://i.gr-assets.com/images/S/compressed.photo.goodreads.com/books/1385144446l/15789443.jpg,2014,2,4,Henry Holt BYR,eng,true,"There’s nothing real about reality TV.<br /><br />Seventeen-year-old Bonnie™ Baker has grown up on TV—she and her twelve siblings are the stars of one-time hit reality show Baker’s Dozen. Since the show’s cancellation and the scandal surrounding it, Bonnie™ has tried to live a normal life, under the radar and out of the spotlight. But it’s about to fall apart…because Baker’s Dozen is going back on the air. Bonnie™’s mom and the show’s producers won’t let her quit and soon the life she has so carefully built for herself, with real friends (and maybe even a real boyfriend), is in danger of being destroyed by the show. Bonnie™ needs to do something drastic if her life is ever going to be her own—even if it means being more exposed than ever before.",3.93,413,Kindle Edition, ,556,https://www.goodreads.com/book/show/15789443-something-real,https://www.goodreads.com/book/show/15789443-something-real
15790824,"The Admirals: Nimitz, Halsey, Leahy, and King --- The Five-Star Admirals Who Won the War at Sea",0316097837,9780316097833, , ,ID,https://i.gr-assets.com/images/S/compressed.photo.goodreads.com/books/1352228407l/15790824._SX98_.jpg,https://i.gr-assets.com/images/S/compressed.photo.goodreads.com/books/1352228407l/15790824._SY75_.jpg,https://i.gr-assets.com/images/S/compressed.photo.goodreads.com/books/1352228407l/15790824.jpg,2013,5,7,Back Bay Books,en-US,false,"<strong>How history's only five-star admirals triumphed in World War II and made the United States the world's dominant sea power.</strong> <br /><br />Only four men in American history have been promoted to the five-star rank of Admiral of the Fleet: William Leahy, Ernest King, Chester Nimitz, and William Halsey. These four men were the best and the brightest the navy produced, and together they led the U.S. navy to victory in World War II, establishing the United States as the world's greatest fleet. <br /><br />In THE ADMIRALS, award-winning historian Walter R. Borneman tells their story in full detail for the first time. Drawing upon journals, ship logs, and other primary sources, he brings an incredible historical moment to life, showing us how the four admirals revolutionized naval warfare forever with submarines and aircraft carriers, and how these men-who were both friends and rivals-worked together to ensure that the Axis fleets lay destroyed on the ocean floor at the end of World War II.",4.28,608,Paperback, ,10,https://www.goodreads.com/book/show/15790824-the-admirals,https://www.goodreads.com/book/show/15790824-the-admirals
15790837,Let's Explore Diabetes with Owls,0316154695,9780316154697, , ,ID,https://i.gr-assets.com/images/S/compressed.photo.goodreads.com/books/1359704028l/15790837._SX98_.jpg,https://i.gr-assets.com/images/S/compressed.photo.goodreads.com/books/1359704028l/15790837._SY75_.jpg,https://i.gr-assets.com/images/S/compressed.photo.goodreads.com/books/1359704028l/15790837.jpg,2013,4,23,"Little, Brown and Company",eng,false,"A guy walks into a bar car and...<br /><br />From here the story could take many turns. When this guy is David Sedaris, the possibilities are endless, but the result is always the same: he will both delight you with twists of humor and intelligence and leave you deeply moved. <br /><br />Sedaris remembers his father's dinnertime attire (shirtsleeves and underpants), his first colonoscopy (remarkably pleasant), and the time he considered buying the skeleton of a murdered Pygmy. <br /><br />With <i>Let's Explore Diabetes with Owls</i>, David Sedaris shows once again why his work has been called ""hilarious, elegant, and surprisingly moving"" (<i>Washington Post</i>).",3.83,275,Hardcover, ,8439,https://www.goodreads.com/book/show/15790837-let-s-explore-diabetes-with-owls,https://www.goodreads.com/book/show/15790837-let-s-explore-diabetes-with-owls
15790842,"Life After Life (Todd Family, #1)",0316176486,9780316176484, , ,ID,https://i.gr-assets.com/images/S/compressed.photo.goodreads.com/books/1358173808l/15790842._SX98_.jpg,https://i.gr-assets.com/images/S/compressed.photo.goodreads.com/books/1358173808l/15790842._SY75_.jpg,https://i.gr-assets.com/images/S/compressed.photo.goodreads.com/books/1358173808l/15790842.jpg,2013,4,2,Reagan Arthur Books,eng,false,"What if you could live again and again, until you got it right? <br /><br />On a cold and snowy night in 1910, Ursula Todd is born to an English banker and his wife. She dies before she can draw her first breath. On that same cold and snowy night, Ursula Todd is born, lets out a lusty wail, and embarks upon a life that will be, to say the least, unusual. For as she grows, she also dies, repeatedly, in a variety of ways, while the young century marches on towards its second cataclysmic world war. <br /><br />Does Ursula's apparently infinite number of lives give her the power to save the world from its inevitable destiny? And if she can - will she?",3.76,531,Hardcover, ,21003,https://www.goodreads.com/book/show/15790842-life-after-life,https://www.goodreads.com/book/show/15790842-life-after-life
15790857,"Where'd You Go, Bernadette",0316204269,9780316204262, , ,ID,https://i.gr-assets.com/images/S/compressed.photo.goodreads.com/books/1352228181l/15790857._SX98_.jpg,https://i.gr-assets.com/images/S/compressed.photo.goodreads.com/books/1352228181l/15790857._SY75_.jpg,https://i.gr-assets.com/images/S/compressed.photo.goodreads.com/books/1352228181l/15790857.jpg,2013,4,2,Back Bay Books,eng,false,"Bernadette Fox has vanished.<br /><br />When her daughter Bee claims a family trip to Antarctica as a reward for perfect grades, Bernadette, a fiercely intelligent shut-in, throws herself into preparations for the trip. But worn down by years of trying to live the Seattle life she never wanted, Ms. Fox is on the brink of a meltdown. And after a school fundraiser goes disastrously awry at her hands, she disappears, leaving her family to pick up the pieces--which is exactly what Bee does, weaving together an elaborate web of emails, invoices, and school memos that reveals a secret past Bernadette has been hiding for decades. <i>Where'd You Go Bernadette</i> is an ingenious and unabashedly entertaining novel about a family coming to terms with who they are and the power of a daughter's love for her mother.",3.89,326,Paperback, ,1425,https://www.goodreads.com/book/show/15790857-where-d-you-go-bernadette,https://www.goodreads.com/book/show/15790857-where-d-you-go-bernadette
15790883,"Promise of Blood (Powder Mage, #1)",0316219037,9780316219037, , ,ID,https://i.gr-assets.com/images/S/compressed.photo.goodreads.com/books/1350337505l/15790883._SX98_.jpg,https://i.gr-assets.com/images/S/compressed.photo.goodreads.com/books/1350337505l/15790883._SY75_.jpg,https://i.gr-assets.com/images/S/compressed.photo.goodreads.com/books/1350337505l/15790883.jpg,2013,4,16,Orbit,eng,false,"The Age of Kings is dead . . . and I have killed it. <br /><br />It's a bloody business overthrowing a king...<br />Field Marshal Tamas' coup against his king sent corrupt aristocrats to the guillotine and brought bread to the starving. But it also provoked war with the Nine Nations, internal attacks by royalist fanatics, and the greedy to scramble for money and power by Tamas's supposed allies: the Church, workers unions, and mercenary forces.<br /><br />Stretched to his limit, Tamas is relying heavily on his few remaining powder mages, including the embittered Taniel, a brilliant marksman who also happens to be his estranged son, and Adamat, a retired police inspector whose loyalty is being tested by blackmail.<br /><br />But when gods are involved...<br />Now, as attacks batter them from within and without, the credulous are whispering about omens of death and destruction. Just old peasant legends about the gods waking to walk the earth. No modern educated man believes that sort of thing. But they should...<br /><br />In a rich, distinctive world that mixes magic with technology, who could stand against mages that control gunpowder and bullets?",4.11,545,Hardcover, ,2343,https://www.goodreads.com/book/show/15790883-promise-of-blood,https://www.goodreads.com/book/show/15790883-promise-of-blood
15791144,Adulting: How to Become a Grown-up in 468 Easy(ish) Steps,1455516902,9781455516902, , ,ID,https://i.gr-assets.com/images/S/compressed.photo.goodreads.com/books/1352437033l/15791144._SX98_.jpg,https://i.gr-assets.com/images/S/compressed.photo.goodreads.com/books/1352437033l/15791144._SY75_.jpg,https://i.gr-assets.com/images/S/compressed.photo.goodreads.com/books/1352437033l/15791144.jpg,2013,5,7,Grand Central Publishing,eng,false,"If you graduated from college but still feel like a student . . . if you wear a business suit to job interviews but pajamas to the grocery store . . . if you have your own apartment but no idea how to cook or clean . . . it's OK. But it doesn't have to be this way.<br />Just because you don't feel like an adult doesn't mean you can't act like one. And it all begins with this funny, wise, and useful book. Based on Kelly Williams Brown's popular blog, ADULTING makes the scary, confusing ""real world"" approachable, manageable-and even conquerable. This guide will help you to navigate the stormy Sea of Adulthood so that you may find safe harbor in Not Running Out of Toilet Paper Bay, and along the way you will learn:<br /><br />What to check for when renting a new apartment-Not just the nearby bars, but the faucets and stove, among other things.<br />When a busy person can find time to learn more about the world- It involves the intersection of NPR and hair-straightening.<br />How to avoid hooking up with anyone in your office -- Imagine your coworkers having plastic, featureless doll crotches. It helps.<br />The secret to finding a mechanic you love-Or, more realistically, one that will not rob you blind.<br />From breaking up with frenemies to fixing your toilet, this way fun comprehensive handbook is the answer for aspiring grown-ups of all ages.<br /><br />New York Times Bestseller.",3.73,273,Paperback, ,1334,https://www.goodreads.com/book/show/15791144-adulting,https://www.goodreads.com/book/show/15791144-adulting
15791150,Dark Secrets (Sebastian Bergman #1),1455520756,9781455520756, , ,ID,https://i.gr-assets.com/images/S/compressed.photo.goodreads.com/books/1352436725l/15791150._SX98_.jpg,https://i.gr-assets.com/images/S/compressed.photo.goodreads.com/books/1352436725l/15791150._SY75_.jpg,https://i.gr-assets.com/images/S/compressed.photo.goodreads.com/books/1352436725l/15791150.jpg,2013,4,23,Grand Central Publishing,eng,false,"It all begins with a call to the police. A sixteen-year-old boy, Roger Eriksson, has gone missing in the town of Västerås. A search is organized and a group of young scouts makes an awful discovery in a marsh: Roger is dead.<br /><br />Meanwhile, Sebastian Bergman, psychologist, criminal profiler and one of Sweden's top experts on serial killers, is in Västerås to settle his mother's estate following her death. Sebastian has withdrawn from police work after the death of his wife and daughter in the 2004 tsunami.<br /><br />When the Crime Investigation Department asks Sebastian for his help in Roger's case, his arrogant manner at first alienates the rest of the team. Pushing forward, though, they begin to make disturbing discoveries about the private school Roger attended....",4.01,464,Paperback, ,133,https://www.goodreads.com/book/show/15791150-dark-secrets,https://www.goodreads.com/book/show/15791150-dark-secrets
15791154,"The Hit (Will Robie, #2)",1455521213,9781455521210, , ,ID,https://i.gr-assets.com/images/S/compressed.photo.goodreads.com/books/1361749502l/15791154._SX98_.jpg,https://i.gr-assets.com/images/S/compressed.photo.goodreads.com/books/1361749502l/15791154._SY75_.jpg,https://i.gr-assets.com/images/S/compressed.photo.goodreads.com/books/1361749502l/15791154.jpg,2013,4,23,Grand Central Publishing,eng,false,"Will Robie is a master of killing.<p>A highly skilled assassin, Robie is the man the U.S. government calls on to eliminate the worst of the worst-enemies of the state, monsters committed to harming untold numbers of innocent victims.</p><p>No one else can match Robie's talents as a hitman...no one, except Jessica Reel. A fellow assassin, equally professional and dangerous, Reel is every bit as lethal as Robie. And now, she's gone rogue, turning her gun sights on other members of their agency.</p><p>To stop one of their own, the government looks again to Will Robie. His mission: bring in Reel, dead or alive. Only a killer can catch another killer, they tell him.</p><p>But as Robie pursues Reel, he quickly finds that there is more to her betrayal than meets the eye. Her attacks on the agency conceal a larger threat, a threat that could send shockwaves through the U.S. government and around the world.</p>",4.10,392,Hardcover, ,2684,https://www.goodreads.com/book/show/15791154-the-hit,https://www.goodreads.com/book/show/15791154-the-hit
15792258,پدرو پارامو, , , , ,ID,https://i.gr-assets.com/images/S/compressed.photo.goodreads.com/books/1344287925l/15792258._SX98_.jpg,https://i.gr-assets.com/images/S/compressed.photo.goodreads.com/books/1344287925l/15792258._SX50_.jpg,https://i.gr-assets.com/images/S/compressed.photo.goodreads.com/books/1344287925l/15792258.jpg,,,,,per,false,"A classic of Mexican modern literature about a haunted village.<br /><br />As one enters Juan Rulfo's legendary novel, one follows a dusty road to a town of death. Time shifts from one consciousness to another in a hypnotic flow of dreams, desires, and memories, a world of ghosts dominated by the figure of Pedro Páramo - lover, overlord, murderer.<br /><br />Rulfo's extraordinary mix of sensory images, violent passions and unfathomable mysteries has been a profound influence on a whole generation of Latin American writers including Carlos Fuentes, Mario Vargas Llosa, and Gabriel García Márquez. To read Pedro Páramo today is as overwhelming an experience as when it was first published in Mexico nearly fifty years ago.",4.06, ,Paperback, ,1,https://www.goodreads.com/book/show/15792258,https://www.goodreads.com/book/show/15792258
15792342,"Irredeemable Digital Omnibus, Volume 1", , , , ,ID,https://i.gr-assets.com/images/S/compressed.photo.goodreads.com/books/1344291454l/15792342._SX98_.jpg,https://i.gr-assets.com/images/S/compressed.photo.goodreads.com/books/1344291454l/15792342._SY75_.jpg,https://i.gr-assets.com/images/S/compressed.photo.goodreads.com/books/1344291454l/15792342.jpg,2012,7,28,Boom! Studios,eng,true,Collecting issues 1 to 19 of the series.,4.34,481,ebook, ,17,https://www.goodreads.com/book/show/15792342-irredeemable-digital-omnibus-volume-1,https://www.goodreads.com/book/show/15792342-irredeemable-digital-omnibus-volume-1
15792480,El Aleph,0307950948,9780307950949, , ,ID,https://i.gr-assets.com/images/S/compressed.photo.goodreads.com/books/1344371498l/15792480._SX98_.jpg,https://i.gr-assets.com/images/S/compressed.photo.goodreads.com/books/1344371498l/15792480._SY75_.jpg,https://i.gr-assets.com/images/S/compressed.photo.goodreads.com/books/1344371498l/15792480.jpg,2012,9,4,Vintage Espanol,spa,false,"<b>“Uno de los artistas contemporáneos más memorables… La deuda que tenemos contraída con él quienes escribimos en español es enorme”. —Mario Vargas Llosa<br /><br /></b>Considerado uno de los escritores más influyentes del siglo XX en cualquier idioma, la obra de Jorge Luis Borges continúa inspirando a nuevas generaciones de lectores gracias al deslumbrante poder de sus imágenes y la inmensa profundidad de sus temas. <br /><br />Originalmente publicada en 1949, esta colección reúne dieciocho relatos entre los que se encuentra algunos de los más admirados cuentos de la literatura: “El Aleph”, la clásica historia de una resplandeciente esfera en la que confluyen de un modo asombroso todos los tiempos y todos los espacios en el universo; “El Zahir”, una fascinante reflexión sobre la obsesión, Borges narra la historia de un objeto que inspira la fascinación inmediata de todos aquellos que lo ven hasta consumir su atención y realidad completa; y “El Inmortal”, un inquietante viaje a través de la Ciudad de los Inmortales, un laberíntico mundo en el que todo, incluso los edificios y las escaleras, aparece caóticamente irregular o invertido. <br /><br />Juntos, estos dieciocho relatos, cada uno singularmente original y complejo a su manera,  representan una pieza clave en el museo de la obra del maestro argentino, así como en los anales de la literatura universal.",4.37,224,Paperback, ,12,https://www.goodreads.com/book/show/15792480-el-aleph,https://www.goodreads.com/book/show/15792480-el-aleph
15792558,Fresh Off the Boat: A Memoir,0679644881,9780679644880, , ,ID,https://i.gr-assets.com/images/S/compressed.photo.goodreads.com/books/1349367756l/15792558._SX98_.jpg,https://i.gr-assets.com/images/S/compressed.photo.goodreads.com/books/1349367756l/15792558._SY75_.jpg,https://i.gr-assets.com/images/S/compressed.photo.goodreads.com/books/1349367756l/15792558.jpg,2013,1,29,Spiegel & Grau,eng,false,"<b>“Long before I met him, I was a fan of his writing, and his merciless wit. He’s bigger than food.”—Anthony Bourdain </b><br /><br />Eddie Huang is the thirty-year-old proprietor of Baohaus—the hot East Village hangout where foodies, stoners, and students come to stuff their faces with delicious Taiwanese street food late into the night—and one of the food world’s brightest and most controversial young stars. But before he created the perfect home for himself in a small patch of downtown New York, Eddie wandered the American wilderness looking for a place to call his own.  <br /><br />Eddie grew up in theme-park America, on a could-be-anywhere cul-de-sac in suburban Orlando, raised by a wild family of FOB (“fresh off the boat”) hustlers and hysterics from Taiwan. While his father improbably launched a series of successful seafood and steak restaurants, Eddie burned his way through American culture, defying every “model minority” stereotype along the way. He obsessed over football, fought the All-American boys who called him a chink, partied like a gremlin, sold drugs with his crew, and idolized Tupac. His anchor through it all was food—from making Southern ribs (and scoring drugs) with the Haitian cooks in his dad’s restaurant to preparing traditional meals in his mother’s kitchen to haunting the midnight markets of Taipei when he was shipped off to the homeland. After misadventures as an unlikely lawyer, street fashion renegade, and stand-up comic, Eddie finally threw everything he loved—past and present, family and food—into his own restaurant, bringing together a legacy stretching back to China and the shards of global culture he’d melded into his own identity. <br /><br />Funny, raw, and moving, and told in an irrepressibly alive and original voice, <i>Fresh Off the Boat </i>recasts the immigrant’s story for the twenty-first century—it’s a story of food, family, and the forging of a new notion of what it means to be American.",3.68,288,Hardcover, ,1263,https://www.goodreads.com/book/show/15792558-fresh-off-the-boat,https://www.goodreads.com/book/show/15792558-fresh-off-the-boat
