id,title,isbn,isbn13,asin,kindle_asin,country_code,image_url,small_image_url,large_image_url,publication_year,publication_month,publication_day,publisher,language_code,is_ebook,description,average_rating,num_pages,format,edition_information,text_reviews_count,url,link
30285562,Lucky in Love,1338058010,9781338058017, , ,ID,https://i.gr-assets.com/images/S/compressed.photo.goodreads.com/books/1496161642l/30285562._SX98_.jpg,https://i.gr-assets.com/images/S/compressed.photo.goodreads.com/books/1496161642l/30285562._SY75_.jpg,https://i.gr-assets.com/images/S/compressed.photo.goodreads.com/books/1496161642l/30285562._SY475_.jpg,2017,7,25,Scholastic,eng,false,"<p>Maddie's not impulsive. She's all about hard work and planning ahead. But one night, on a whim, she buys a lottery ticket. And then, to her astonishment — <br /><br />She wins!<br /><br />In a flash, Maddie's life is unrecognizable. No more stressing about college scholarships. Suddenly, she's talking about renting a yacht. And being in the spotlight at school is fun... until rumors start flying, and random people ask her for loans. Now, Maddie isn't sure who she can trust.<br /><br />Except for Seth Nguyen, her funny, charming coworker at the local zoo. Seth doesn't seem aware of Maddie's big news. And, for some reason, she doesn't want to tell him. But what will happen if he learns her secret?<br /><br />With tons of humor and heart, Kasie West delivers a million-dollar tale of winning, losing, and falling in love.</p>",3.54,337,Hardcover, ,1987,https://www.goodreads.com/book/show/30285562-lucky-in-love,https://www.goodreads.com/book/show/30285562-lucky-in-love
30288282,The Immortalists,0735213186,9780735213180, , ,ID,https://i.gr-assets.com/images/S/compressed.photo.goodreads.com/books/1493015963l/30288282._SX98_.jpg,https://i.gr-assets.com/images/S/compressed.photo.goodreads.com/books/1493015963l/30288282._SY75_.jpg,https://i.gr-assets.com/images/S/compressed.photo.goodreads.com/books/1493015963l/30288282.jpg,2018,1,9,G.P. Putnam's Sons,eng,false,"If you knew the date of your death, how would you live your life?<br /><br /> It's 1969 in New York City's Lower East Side, and word has spread of the arrival of a mystical woman, a traveling psychic who claims to be able to tell anyone the day they will die. The Gold children—four adolescents on the cusp of self-awareness—sneak out to hear their fortunes.<br /><br />The prophecies inform their next five decades. Golden-boy Simon escapes to the West Coast, searching for love in '80s San Francisco; dreamy Klara becomes a Las Vegas magician, obsessed with blurring reality and fantasy; eldest son Daniel seeks security as an army doctor post-9/11; and bookish Varya throws herself into longevity research, where she tests the boundary between science and immortality.<br /><br />A sweeping novel of remarkable ambition and depth, <i>The Immortalists</i> probes the line between destiny and choice, reality and illusion, this world and the next. It is a deeply moving testament to the power of story, the nature of belief, and the unrelenting pull of familial bonds.",3.71,346,Hardcover, ,12894,https://www.goodreads.com/book/show/30288282-the-immortalists,https://www.goodreads.com/book/show/30288282-the-immortalists
30289397,Sergeant Bertrand,9059366670,9789059366671, , ,ID,https://i.gr-assets.com/images/S/compressed.photo.goodreads.com/books/1464188492l/30289397._SX98_.jpg,https://i.gr-assets.com/images/S/compressed.photo.goodreads.com/books/1464188492l/30289397._SY75_.jpg,https://i.gr-assets.com/images/S/compressed.photo.goodreads.com/books/1464188492l/30289397.jpg,2016,5,26,Cossee,nl,false,"Zijn vrouw staat avond na avond op het toneel. Het publiek gaapt haar smachtend aan, de gluiperige regisseur dringt zich achter de coulissen op – het is geen wonder dat Nikolaj geteisterd wordt door een allesverslindende jaloezie. Zijn trouwe raadgever, de mysterieuze Sergeant Bertrand, toont hem een uitvlucht uit zijn voortdurende zorgen. Nikolaj blijkt algauw in staat tot daden die hij eerder niet voor mogelijk hield.<br /><br />In Sergeant Bertrand weeft de auteur een web van intriges en dringt hij door tot de kern van de menselijke zelfbescherming. Wat is waarheid, en wat verzinnen we voor onszelf om de werkelijkheid draaglijker te maken?",3.69,160,Paperback, ,35,https://www.goodreads.com/book/show/30289397-sergeant-bertrand,https://www.goodreads.com/book/show/30289397-sergeant-bertrand
30291044,"Ashwin (Gideon’s Riders, #1)", ,9781942432241, , ,ID,https://i.gr-assets.com/images/S/compressed.photo.goodreads.com/books/1487457707l/30291044._SX98_.jpg,https://i.gr-assets.com/images/S/compressed.photo.goodreads.com/books/1487457707l/30291044._SY75_.jpg,https://i.gr-assets.com/images/S/compressed.photo.goodreads.com/books/1487457707l/30291044._SY475_.jpg,2017,3,7,Kit Rocha,eng,true,"<i>The first book in the follow-up to Kit Rocha's bestselling BEYOND series...</i><br /><br /><b>Gideon's Riders, Book One</b><br /><br />Lieutenant Ashwin Malhotra is a Makhai soldier--genetically engineered to be cold, ruthless. Unfeeling. His commanding officers consider him the perfect operative, and they're right. Now, he has a simple mission: to infiltrate Gideon's Riders, the infamous sect of holy warriors that protects the people of Sector One.<br /><br />He's never failed to execute an objective, but there's one thing he didn't anticipate--running into Dr. Kora Bellamy, the only woman to ever break through his icy exterior.<br /><br />When Kora fled her life as a military doctor for the Makhai Project, all she wanted was peace--a quiet life where she could heal the sick and injured. The royal Rios family welcomed her like a sister, but she could never forget Ashwin. His sudden reappearance is a second chance--if she can manage to touch his heart.<br /><br />When the simmering tension between them finally ignites, Kora doesn't realize she's playing with fire. Because she's not just falling in love with a man who may not be able to love her back. Ashwin has too many secrets--and one of them could destroy her.<br />",4.16, ,ebook, ,188,https://www.goodreads.com/book/show/30291044-ashwin,https://www.goodreads.com/book/show/30291044-ashwin
30292689,"My Brother's Husband, Volume 1 (Otouto no Otto, #1)", , , , ,ID,https://i.gr-assets.com/images/S/compressed.photo.goodreads.com/books/1464231771l/30292689._SX98_.jpg,https://i.gr-assets.com/images/S/compressed.photo.goodreads.com/books/1464231771l/30292689._SX50_.jpg,https://i.gr-assets.com/images/S/compressed.photo.goodreads.com/books/1464231771l/30292689._SX318_.jpg,2015,,,Pantheon Books,eng,true,"Ten years ago Yaichi’s twin brother moved to Canada and married a man called Mike. A month ago, he died.<br /><br />Now Mike has arrived to Japan to meet Yaichi and his daughter Kana. Yaichi has to face his own preconceptions and come to terms about who his brother really was.",4.27,180,Kindle Edition, ,214,https://www.goodreads.com/book/show/30292689-my-brother-s-husband-volume-1,https://www.goodreads.com/book/show/30292689-my-brother-s-husband-volume-1
30295179,"Spider's Web (Glenmore Park Mystery, #1)", , ,B01G7AB5MI, ,ID,https://i.gr-assets.com/images/S/compressed.photo.goodreads.com/books/1464270704l/30295179._SX98_.jpg,https://i.gr-assets.com/images/S/compressed.photo.goodreads.com/books/1464270704l/30295179._SY75_.jpg,https://i.gr-assets.com/images/S/compressed.photo.goodreads.com/books/1464270704l/30295179._SY475_.jpg,2016,5,25,,en-US,true," 
  <b>Sometimes, Death Comes With a Warning</b>
  <br /> There’s a killer prowling the streets. He stalks and murders young women seemingly at random, and he always warns them first…  <br />Twenty year old Kendele Byers is savagely killed and buried in a shallow grave. She had a violent past, a bizarre kinky line of work, and the suspect list grows longer every day. <br /> <br />But when another woman is murdered, Detective Mitchell Lonnie realizes that there’s something much more sinister afoot, a connection between the two murders. Both victims had received a clue hinting their incoming demise several minutes before they were attacked. There’s a serial killer in Glenmore Park. Even worse, he seems to be accelerating his murder pace. <br /> <br />Now Mitchell and his partner need to locate the killer before more innocent women die. But when his sister gets involved, Mitchell’s focus begins to unravel. Soon his pursuit becomes personal, and the stakes rise very high… <br /> <br /><b>Fans of Angela Marsons, Michael Connelly and Peter James will be hooked by this new police mystery novel</b>",4.17,372,Kindle Edition, ,243,https://www.goodreads.com/book/show/30295179-spider-s-web,https://www.goodreads.com/book/show/30295179-spider-s-web
30297153,All You Can Ever Know,1936787970,9781936787975, , ,ID,https://i.gr-assets.com/images/S/compressed.photo.goodreads.com/books/1519748414l/30297153._SX98_.jpg,https://i.gr-assets.com/images/S/compressed.photo.goodreads.com/books/1519748414l/30297153._SY75_.jpg,https://i.gr-assets.com/images/S/compressed.photo.goodreads.com/books/1519748414l/30297153.jpg,2018,10,2,Catapult,eng,false,"What does it mean to lose your roots—within your culture, within your family—and what happens when you find them?<br /><br />Nicole Chung was born severely premature, placed for adoption by her Korean parents, and raised by a white family in a sheltered Oregon town. From early childhood, she heard the story of her adoption as a comforting, prepackaged myth. She believed that her biological parents had made the ultimate sacrifice in the hopes of giving her a better life; that forever feeling slightly out of place was simply her fate as a transracial adoptee. But as she grew up—facing prejudice her adoptive family couldn’t see, finding her identity as an Asian American and a writer, becoming ever more curious about where she came from—she wondered if the story she’d been told was the whole truth.<br /><br />With warmth, candor, and startling insight, Chung tells of her search for the people who gave her up, which coincided with the birth of her own child. <i>All You Can Ever Know</i> is a profound, moving chronicle of surprising connections and the repercussions of unearthing painful family secrets—vital reading for anyone who has ever struggled to figure out where they belong.<br /><br /><i>Finalist, National Book Critics Circle Award for Autobiography / Longlisted for the PEN Open Book Award / Named a Best Book of the Year by The Washington Post, NPR, The Boston Globe, TIME, Newsday, Library Journal, BuzzFeed, Real Simple, Paste Magazine, Chicago Public Library, Seattle Public Library, Goodreads, Shelf Awareness, Electric Literature, and more</i>",3.85,240,Hardcover, ,1867,https://www.goodreads.com/book/show/30297153-all-you-can-ever-know,https://www.goodreads.com/book/show/30297153-all-you-can-ever-know
30297411,The Lost Woman (Louise Rick #9),1455541079,9781455541072, , ,ID,https://i.gr-assets.com/images/S/compressed.photo.goodreads.com/books/1478537052l/30297411._SX98_.jpg,https://i.gr-assets.com/images/S/compressed.photo.goodreads.com/books/1478537052l/30297411._SY75_.jpg,https://i.gr-assets.com/images/S/compressed.photo.goodreads.com/books/1478537052l/30297411.jpg,2017,2,7,Hachette,eng,false,"Following the incredible success of Sara Blaedel's #1 international bestsellers The Forgotten Girls and The Killing Forest, Louise Rick--head of the police department's elite Special Search Agency charged with missing persons cases--returns in Sara's latest twist-filled suspense novel...<br /><br />A housewife is the target of a shocking, methodical killing. Shot with a hunting rifle through her kitchen window, the woman is dead before she hits the ground.<br /><br />Though murdered in England, it turns out that the woman, Sofie Parker, is actually a Danish citizen who's been on the Missing Persons list for almost two decades--so Louise Rick is called on to the case. Then, in an unexpected twist, the police discover that Sofie had been reported missing eighteen years ago by none other than Eik, Louise Rick's police colleague and lover.<br /><br />Impulsive as ever, Eik rushes to England, and ends up in jail on suspicion of Sofie's murder. Completely blindsided by Eik's connection to the case, Louise is thoroughly unsettled and sick with worry, yet she must set aside her own emotional turmoil if she hopes to find the killer in what will become her most controversial case yet...",3.67,296,Hardcover, ,197,https://www.goodreads.com/book/show/30297411-the-lost-woman,https://www.goodreads.com/book/show/30297411-the-lost-woman
30298108,Killers of the Flower Moon: The Osage Murders and the Birth of the FBI, , , , ,ID,https://i.gr-assets.com/images/S/compressed.photo.goodreads.com/books/1490492062l/30298108._SX98_.jpg,https://i.gr-assets.com/images/S/compressed.photo.goodreads.com/books/1490492062l/30298108._SY75_.jpg,https://i.gr-assets.com/images/S/compressed.photo.goodreads.com/books/1490492062l/30298108._SY475_.jpg,2017,4,18,Doubleday,eng,true,"<p>In the 1920s, the richest people per capita in the world were members of the Osage Indian Nation in Oklahoma. After oil was discovered beneath their land, the Osage rode in chauffeured automobiles, built mansions, and sent their children to study in Europe.</p><p>Then, one by one, they began to be killed off. One Osage woman, Mollie Burkhart, watched as her family was murdered. Her older sister was shot. Her mother was then slowly poisoned. And it was just the beginning, as more Osage began to die under mysterious circumstances.</p><p>In this last remnant of the Wild West—where oilmen like J. P. Getty made their fortunes and where desperadoes such as Al Spencer, “the Phantom Terror,” roamed – virtually anyone who dared to investigate the killings were themselves murdered. As the death toll surpassed more than twenty-four Osage, the newly created F.B.I. took up the case, in what became one of the organization’s first major homicide investigations. But the bureau was then notoriously corrupt and initially bungled the case. Eventually the young director, J. Edgar Hoover, turned to a former Texas Ranger named Tom White to try to unravel the mystery. White put together an undercover team, including one of the only Native American agents in the bureau. They infiltrated the region, struggling to adopt the latest modern techniques of detection. Together with the Osage they began to expose one of the most sinister conspiracies in American history.</p><p>A true-life murder mystery about one of the most monstrous crimes in American history.</p>",4.07,354,Kindle Edition, ,1217,https://www.goodreads.com/book/show/30298108-killers-of-the-flower-moon,https://www.goodreads.com/book/show/30298108-killers-of-the-flower-moon
30298887,"Into the Firestorm (BOSS, Inc., #3)", , ,B01FBZXPFA, ,ID,https://i.gr-assets.com/images/S/compressed.photo.goodreads.com/books/1481733575l/30298887._SY160_.jpg,https://i.gr-assets.com/images/S/compressed.photo.goodreads.com/books/1481733575l/30298887._SY75_.jpg,https://i.gr-assets.com/images/S/compressed.photo.goodreads.com/books/1481733575l/30298887._SY475_.jpg,2017,1,31,Zebra,eng,true,"<b>At Brodie Operations Security Service, Inc., following your instincts is company policy . . .</b><br />M. Cassidy—Luke Brodie had heard the name before, some novice bounty hunter working Seattle, catching tricky skips with more success than a newcomer should expect. But the dark curls, sparkly top, and impressive cleavage were not what Brodie had pictured.<br /><br />Emma Cassidy is tough and smart and sexy as hell. She’s also popping up a step ahead of him every time he’s close to the capture he wants most . . . and there’s no room for learning on the trail of this monster.<br /><br />Emma has idolized Luke Brodie, the bounty hunter who can bring anyone in. The big man in the soft shoes, with a face like a fallen angel and a reputation for breaking hearts. Watching him in action is intoxicating. But her fight with Rudy Vance is fiercely personal. If he gets too close, Brodie will find out just how ferocious she can be . . .",4.21,400,Kindle Edition, ,143,https://www.goodreads.com/book/show/30298887-into-the-firestorm,https://www.goodreads.com/book/show/30298887-into-the-firestorm
30300959,دختر شاه برای ماه گریه می کند,964305666X, , , ,ID,https://i.gr-assets.com/images/S/compressed.photo.goodreads.com/books/1464356841l/30300959._SX98_.jpg,https://i.gr-assets.com/images/S/compressed.photo.goodreads.com/books/1464356841l/30300959._SY75_.jpg,https://i.gr-assets.com/images/S/compressed.photo.goodreads.com/books/1464356841l/30300959._SY475_.jpg,,,,کتاب مریم (وابسته به نشر مرکز),per,false,پشت جلد کتاب:<br />در قصر غوغای عجیبی برپا بود، چون پرستار دختر شاه به اتاق او رفته بود و دیده بود که او در رختخواب نیست. پرستار با عجله به خوابگاه شاه رفت و فریاد کشید: بیدار شوید، بیدار شوید! یک نفر دخترتان را دزدیده!<br />شاه با شبکلاه کج و کوله شده اش از رختخواب بیرون آمد و از سوراخ در نگاه کرد و پرسید: کی؟<br />پرستار گفت: پسری که نقره ها را تمیز می کند. همین هفته ی پیش بشقاب نقره گم شد. حتماً کسی که بشقاب نقره می دزدد می تواند دختر شاه را هم بدزدد. بله. اگر از من بپرسید می گویم کار خودش است.<br />شاه گفت: من از تو پرسیدم، پس پسر را به زندان بیندازید.,2.75,94,Paperback, ,1,https://www.goodreads.com/book/show/30300959,https://www.goodreads.com/book/show/30300959
30304223,Rabbit Cake,194104056X,9781941040560, , ,ID,https://i.gr-assets.com/images/S/compressed.photo.goodreads.com/books/1464994910l/30304223._SX98_.jpg,https://i.gr-assets.com/images/S/compressed.photo.goodreads.com/books/1464994910l/30304223._SY75_.jpg,https://i.gr-assets.com/images/S/compressed.photo.goodreads.com/books/1464994910l/30304223.jpg,2017,3,7,Tin House Books,eng,false,"<p>
  <em>
    <strong>People Magazine</strong>
  </em>
  <strong> Book of the Week<br /><br />An Indies Introduce and Indie Next Pick<br /><br />Fans of Maria Semple's <em>Where'd You Go Bernadette </em>and and Celeste Ng's <em>Everything I Never Told You</em> will delight in Annie Hartnett's debut, a darkly comic novel about a young girl named Elvis trying to figure out her place in a world without her mother.<br /></strong>
</p>Twelve-year-old Elvis Babbitt has a head for the facts: she knows science proves yellow is the happiest color, she knows a healthy male giraffe weighs about 3,000 pounds, and she knows that the naked mole rat is the longest living rodent. She knows she should plan to grieve her mother, who has recently drowned while sleepwalking, for exactly eighteen months. But there are things Elvis doesn’t yet know—like how to keep her sister Lizzie from poisoning herself while sleep-eating or why her father has started wearing her mother's silk bathrobe around the house. Elvis investigates the strange circumstances of her mother's death and finds comfort, if not answers, in the people (and animals) of Freedom, Alabama. As hilarious a storyteller as she is heartbreakingly honest, Elvis is a truly original voice in this exploration of grief, family, and the endurance of humor after loss. ",3.97,332,Paperback, ,1064,https://www.goodreads.com/book/show/30304223-rabbit-cake,https://www.goodreads.com/book/show/30304223-rabbit-cake
30308970,Swing Time, , ,B01D9H1Q2Q, ,ID,https://i.gr-assets.com/images/S/compressed.photo.goodreads.com/books/1464468582l/30308970._SX98_.jpg,https://i.gr-assets.com/images/S/compressed.photo.goodreads.com/books/1464468582l/30308970._SY75_.jpg,https://i.gr-assets.com/images/S/compressed.photo.goodreads.com/books/1464468582l/30308970._SY475_.jpg,2016,11,15,Penguin Books,eng,true,"<b>A <i>New York Times </i>bestseller * Finalist for the National Book Critics Circle Award for Fiction * Longlisted for the Man Booker Prize</b><br /><br />An ambitious, exuberant new novel moving from North West London to West Africa, from the multi-award-winning author of White Teeth and On Beauty.<br /><br />Two brown girls dream of being dancers—but only one, Tracey, has talent. The other has ideas: about rhythm and time, about black bodies and black music, what constitutes a tribe, or makes a person truly free. It's a close but complicated childhood friendship that ends abruptly in their early twenties, never to be revisited, but never quite forgotten, either.<br /><br />Tracey makes it to the chorus line but struggles with adult life, while her friend leaves the old neighborhood behind, traveling the world as an assistant to a famous singer, Aimee, observing close up how the one percent live.<br /><br />But when Aimee develops grand philanthropic ambitions, the story moves from London to West Africa, where diaspora tourists travel back in time to find their roots, young men risk their lives to escape into a different future, the women dance just like Tracey—the same twists, the same shakes—and the origins of a profound inequality are not a matter of distant history, but a present dance to the music of time.",3.57,461,Kindle Edition, ,173,https://www.goodreads.com/book/show/30308970-swing-time,https://www.goodreads.com/book/show/30308970-swing-time
30310540,"Deadly Web (Glenmore Park Mystery, #2)", , ,B01G4AL7V0, ,ID,https://i.gr-assets.com/images/S/compressed.photo.goodreads.com/books/1464598026l/30310540._SX98_.jpg,https://i.gr-assets.com/images/S/compressed.photo.goodreads.com/books/1464598026l/30310540._SX50_.jpg,https://i.gr-assets.com/images/S/compressed.photo.goodreads.com/books/1464598026l/30310540._SY475_.jpg,2016,6,24,Amazon Digital Services LLC ,eng,true,"One Night, Two Dead Victims<br /><br />Killers don’t patiently wait their turn before committing murder<br /><br />Detective Hannah Shor is desperate to prove her worth to her superiors, and herself. When a middle aged man is found stabbed to death in his apartment, she might just get her chance. But then she finds that the victim was a vile Internet Troll, sexually harassing women on Twitter. Hannah starts wondering if she really wants to catch his killer.<br /><br />And the night is far from over. Only several hours later, a young woman is strangled to death. Detective Jacob Cooper discovers that the victim was lost in her own online world–a recluse who spent all day sucked into a violent online role-playing game. To find the killer, Jacob might have to step into the game.<br /><br />Now Hannah will have to push aside her qualms, and Jacob will have to find a way to overcome his technophobia, if they want to crack the cases. Their search will take them into the seedier parts of the Internet and uncover shocking secrets as they attempt to expose a killer.",3.93,189,Kindle Edition, ,84,https://www.goodreads.com/book/show/30310540-deadly-web,https://www.goodreads.com/book/show/30310540-deadly-web
30312547,Amina's Voice,1481492063,9781481492065, , ,ID,https://i.gr-assets.com/images/S/compressed.photo.goodreads.com/books/1478818044l/30312547._SX98_.jpg,https://i.gr-assets.com/images/S/compressed.photo.goodreads.com/books/1478818044l/30312547._SY75_.jpg,https://i.gr-assets.com/images/S/compressed.photo.goodreads.com/books/1478818044l/30312547._SY475_.jpg,2017,3,14,Salaam Reads / Simon  Schuster Books for Young Readers,eng,false,"Amina has never been comfortable in the spotlight. She is happy just hanging out with her best friend, Soojin. Except now that she’s in middle school everything feels different. Soojin is suddenly hanging out with Emily, one of the “cool” girls in the class, and even talking about changing her name to something more “American.” Does Amina need to start changing too? Or hiding who she is to fit in? While Amina grapples with these questions, she is devastated when her local mosque is vandalized.",3.98,208,Hardcover, ,1174,https://www.goodreads.com/book/show/30312547-amina-s-voice,https://www.goodreads.com/book/show/30312547-amina-s-voice
