id,title,isbn,isbn13,asin,kindle_asin,country_code,image_url,small_image_url,large_image_url,publication_year,publication_month,publication_day,publisher,language_code,is_ebook,description,average_rating,num_pages,format,edition_information,text_reviews_count,url,link
436,La trilogía de Nueva York,8433906992,9788433906991, , ,ID,https://i.gr-assets.com/images/S/compressed.photo.goodreads.com/books/1359242586l/436._SX98_.jpg,https://i.gr-assets.com/images/S/compressed.photo.goodreads.com/books/1359242586l/436._SY75_.jpg,https://i.gr-assets.com/images/S/compressed.photo.goodreads.com/books/1359242586l/436.jpg,1996,3,1,Anagrama,spa,false,"«Todo empezó por un número equivocado, el teléfono sonó tres veces en mitad de la noche y la voz al otro lado preguntó por alguien que no era él.» Así comienza <i>La ciudad de cristal</i>, primera de las tres novelas que conforman <i>La trilogía de Nueva York</i>. A Daniel Quinn, escritor de literatura policíaca, su interlocutor telefónico lo toma por un detective y le encarga un caso. Quinn, lejos de deshacer el malentendido, se mete en el papel que le han adjudicado y se ve envuelto en una historia repleta de enigmas, complicadas relaciones paternofiliales, locura y delirio. En <i>Fantasmas</i>, segunda de las piezas, un detective privado y el hombre al que tiene que vigilar juegan al escondite en un claustrofóbico universo urbano. Por último, en <i>La habitación cerrada</i> el protagonista se ve confrontado a los recuerdos de un amigo de la infancia cuando la mujer de éste le escribe una carta explicándole que su marido ha desaparecido misteriosamente.<br /><i>La trilogía de Nueva York</i>, una de las obras literarias más memorables de los años ochenta, es uno de los cimientos sobre los que se sustenta el prestigio internacional de Paul Auster. El escritor maneja, manipula y reinventa el género policíaco, del que hace una relectura posmoderna con tintes metafísicos. La trama detectivesca sirve como marco para plantear al lector un fascinante juego de espejos, símbolos, guiños y sorpresas; para explorar un mundo extraño, sombrío y perturbador, poblado de personajes fascinantes y ambiguos. El autor entreteje tres historias independientes que forjan mitos contemporáneos.",3.87,344,Paperback,Panorama de narrativas #348,98,https://www.goodreads.com/book/show/436.La_trilog_a_de_Nueva_York,https://www.goodreads.com/book/show/436.La_trilog_a_de_Nueva_York
446,The Brooklyn Follies,0312426232,9780312426231, , ,ID,https://i.gr-assets.com/images/S/compressed.photo.goodreads.com/books/1388285831l/446._SX98_.jpg,https://i.gr-assets.com/images/S/compressed.photo.goodreads.com/books/1388285831l/446._SY75_.jpg,https://i.gr-assets.com/images/S/compressed.photo.goodreads.com/books/1388285831l/446.jpg,2006,10,17,Picador,eng,false,"Nathan Glass has come to Brooklyn to die. Divorced, retired, estranged from his only daughter, the former life insurance salesman seeks only solitude and anonymity. Then Glass encounters his long-lost nephew, Tom Wood, who is working in a local bookstore—a far cry from the brilliant academic career Tom had begun when Nathan saw him last. Tom's boss is the colorful and charismatic Harry Brightman—a.k.a. Harry Dunkel—once the owner of a Chicago art gallery, whom fate has also brought to the ""ancient kingdom of Brooklyn, New York."" Through Tom and Harry, Nathan's world gradually broadens to include a new circle of acquaintances. He soon finds himself drawn into a scam involving a forged page of <i>The Scarlet Letter</i>, and begins to undertake his own literary venture, <i>The Book of Human Folly</i>, an account of ""every blunder, every pratfall, every embarrassment, every idiocy, every foible, and every inane act I have committed during my long and checkered career as a man.""<br /> <br /><i>The Brooklyn Follies</i> is Paul Auster's warmest, most exuberant novel, a moving, unforgettable hymn to the glories and mysteries of ordinary human life.",3.84,306,Paperback, ,1192,https://www.goodreads.com/book/show/446.The_Brooklyn_Follies,https://www.goodreads.com/book/show/446.The_Brooklyn_Follies
447,Moon Palace,0140115854,9780140115857, , ,ID,https://i.gr-assets.com/images/S/compressed.photo.goodreads.com/books/1390616212l/447._SX98_.jpg,https://i.gr-assets.com/images/S/compressed.photo.goodreads.com/books/1390616212l/447._SY75_.jpg,https://i.gr-assets.com/images/S/compressed.photo.goodreads.com/books/1390616212l/447.jpg,1990,4,1,Penguin Books,eng,false,"Marco Stanley Fogg is an orphan, a child of the sixties, a quester tirelessly seeking the key to his past, the answers to the ultimate riddle of his fate. As Marco sets out on a journey from the canyons of Manhattan to the deserts of Utah, he encounters a gallery of characters and a series of events as rich and surprising as any in modern fiction.<br /><br />Beginning during the summer that men first walked on the moon, and moving backward and forward in time to span three generations, Moon Palace is propelled by coincidence and memory, and illuminated by marvelous flights of lyricism and wit. Here is the most entertaining and moving novel yet from an author well known for his breathtaking imagination.",3.95,320,Paperback, ,548,https://www.goodreads.com/book/show/447.Moon_Palace,https://www.goodreads.com/book/show/447.Moon_Palace
449,Timbuktu,0312263996,9780312263997, , ,ID,https://i.gr-assets.com/images/S/compressed.photo.goodreads.com/books/1355142497l/449._SX98_.jpg,https://i.gr-assets.com/images/S/compressed.photo.goodreads.com/books/1355142497l/449._SY75_.jpg,https://i.gr-assets.com/images/S/compressed.photo.goodreads.com/books/1355142497l/449.jpg,2000,5,,Picador,eng,false,"Mr. Bones, the canine hero of Paul Auster's astonishing new book, is the sidekick and confidant of Willy G. Christmas, a brilliant and troubled homeless man from Brooklyn. As Willy's body slowly expires, he sets off with Mr. Bones for Baltimore in search of his high school English teacher and a new home for his companion. Mr. Bones is our witness during their journey, and out of his thoughts, Paul Auster has spun one of the richest, most compelling tales in American fiction.<br /><br />",3.69,181,Paperback, ,652,https://www.goodreads.com/book/show/449.Timbuktu,https://www.goodreads.com/book/show/449.Timbuktu
451,True Tales of American Life,0571210708,9780571210701, , ,ID,https://i.gr-assets.com/images/S/compressed.photo.goodreads.com/books/1156917444l/451._SX98_.jpg,https://i.gr-assets.com/images/S/compressed.photo.goodreads.com/books/1156917444l/451._SY75_.jpg,https://i.gr-assets.com/images/S/compressed.photo.goodreads.com/books/1156917444l/451.jpg,,,,Faber  Faber,en-GB,false,"Chosen by Paul Auster out of the four thousand stories submitted to his radio programme on National Public Radio, these 180 stories provide a wonderful portrait of America in the twentieth century. The requirement for selection was that each of the stories should be true, and each of the writers should not have been previously published. The collection that has emerged provides a richly varied and authentic voice for the American people, whose lives, loves, griefs, regrets, joys and sense of humour are vividly and honestly recounted throughout, and adeptly organised by Auster into themed sections. The section composed of war stories stretches as far back as the Civil War, still the defining moment in American history; while the sequence of 'Meditations' conclude the volume with a true and abiding sense of transcendence.<br /><br />The resultant anthology is both an enduring hymn to the strange everyday of contemporary American life and a masterclass in the art of storytelling.",3.88,480,Paperback, ,46,https://www.goodreads.com/book/show/451.True_Tales_of_American_Life,https://www.goodreads.com/book/show/451.True_Tales_of_American_Life
454,Travels in the Scriptorium,0805081453,9780805081459, , ,ID,https://i.gr-assets.com/images/S/compressed.photo.goodreads.com/books/1436395511l/454._SX98_.jpg,https://i.gr-assets.com/images/S/compressed.photo.goodreads.com/books/1436395511l/454._SY75_.jpg,https://i.gr-assets.com/images/S/compressed.photo.goodreads.com/books/1436395511l/454._SY475_.jpg,2007,1,23,Henry Holt & Company,eng,false,"<div>
  <div>
    <b>A man pieces together clues to his past--and the identity of his captors--in this fantastic, labyrinthine novel</b>
  </div>
  <div><br />An old man awakens, disoriented, in an unfamiliar chamber. With no memory of who he is or how he has arrived there, he pores over the relics on the desk, examining the circumstances of his confinement and searching his own hazy mind for clues.</div>
  <div><br />Determining that he is locked in, the man--identified only as Mr. Blank--begins reading a manuscript he finds on the desk, the story of another prisoner, set in an alternate world the man doesn't recognize. Nevertheless, the pages seem to have been left for him, along with a haunting set of photographs. As the day passes, various characters call on the man in his cell--vaguely familiar people, some who seem to resent him for crimes he can't remember--and each brings frustrating hints of his identity and his past. All the while an overhead camera clicks and clicks, recording his movements, and a microphone records every sound in the room. Someone is watching.</div>
  <div><br />Both chilling and poignant, <i>Travels in the Scriptorium</i> is vintage Auster: mysterious texts, fluid identities, a hidden past, and, somewhere, an obscure tormentor. And yet, as we discover during one day in the life of Mr. Blank, his world is not so different from our own.</div>
</div>",3.24,145,Hardcover, ,582,https://www.goodreads.com/book/show/454.Travels_in_the_Scriptorium,https://www.goodreads.com/book/show/454.Travels_in_the_Scriptorium
455,In the Country of Last Things,0140097058,9780140097054, , ,ID,https://i.gr-assets.com/images/S/compressed.photo.goodreads.com/books/1309985733l/455._SX98_.jpg,https://i.gr-assets.com/images/S/compressed.photo.goodreads.com/books/1309985733l/455._SY75_.jpg,https://i.gr-assets.com/images/S/compressed.photo.goodreads.com/books/1309985733l/455.jpg,1988,5,2,Penguin Books,en-US,false,"In a distant and unsettling future, Anna Blume is on a mission in an unnamed city of chaos and disaster. Its destitute inhabitants scavenge garbage for food and shelter, no industry exists, and an elusive government provides nothing but corruption. Anna wades through the filth to find her long-lost brother, a one-time journalist who may or may not be alive. <i>New York </i>Times-bestselling author Paul Auster (<i>The New York Trilogy)</i> shows us a disturbing Hobbesian society in this dystopian, post-apocalyptic novel.",3.87,188,Paperback, ,53,https://www.goodreads.com/book/show/455.In_the_Country_of_Last_Things,https://www.goodreads.com/book/show/455.In_the_Country_of_Last_Things
456,Leviathan,0140178139,9780140178135, , ,ID,https://i.gr-assets.com/images/S/compressed.photo.goodreads.com/books/1388371291l/456._SX98_.jpg,https://i.gr-assets.com/images/S/compressed.photo.goodreads.com/books/1388371291l/456._SY75_.jpg,https://i.gr-assets.com/images/S/compressed.photo.goodreads.com/books/1388371291l/456.jpg,1993,9,1,Penguin Books,eng,false,"<i>New York Times </i>bestselling author Paul Auster (<i>The New York Trilogy</i>) opens <i>Leviathan</i> with the tearing of a bomb explosion and the death of one Benjamin Sachs. Ben’s one-time best friend, Peter Aaron, begins to retrospectively investigate the transformation that led Ben from his enviable stable life, to one of a recluse. Both were once intelligent, yet struggling novelists until Ben’s near-death experience falling from a fire escape triggers a tumble in which he becomes withdrawn and disturbed, living alone and building bombs in a far-off cabin. That is, until he mysteriously disappears, leaving behind only a manuscript titled <i>Leviathan</i>, pages rustling in the wind.",3.96,275,Paperback, ,472,https://www.goodreads.com/book/show/456.Leviathan,https://www.goodreads.com/book/show/456.Leviathan
463,The Red Notebook: True Stories,0811214982,9780811214988, , ,ID,https://i.gr-assets.com/images/S/compressed.photo.goodreads.com/books/1390681139l/463._SX98_.jpg,https://i.gr-assets.com/images/S/compressed.photo.goodreads.com/books/1390681139l/463._SY75_.jpg,https://i.gr-assets.com/images/S/compressed.photo.goodreads.com/books/1390681139l/463.jpg,2002,6,17,New Directions,eng,false,"Paul Auster has earned international praise for the imaginative power of his many novels, including <em>The New York Trilogy, Moon Palace, The Music of Chance, Mr. Vertigo</em>, and <em>Timbuktu</em>. He has also published a number of highly original non-fiction works: <em>The Invention of Solitude, Hand to Mouth, and The Art of Hunger</em>. In <em>The Red Notebook</em>, Auster again explores events from the real world large and small, tragic and comic—that reveal the unpredictable, shifting nature of human experience. A burnt onion pie, a wrong number, a young boy struck by lightning, a man falling off a roof, a scrap of paper discovered in a Paris hotel room—all these form the context for a singular kind of <em>ars poetica</em>, a literary manifesto without theory, cast in the irreducible forms of pure story telling.",3.78,104,Paperback, ,129,https://www.goodreads.com/book/show/463.The_Red_Notebook,https://www.goodreads.com/book/show/463.The_Red_Notebook
464,Collected Poems,1585674044,9781585674046, , ,ID,https://i.gr-assets.com/images/S/compressed.photo.goodreads.com/books/1156917478l/464._SX98_.jpg,https://i.gr-assets.com/images/S/compressed.photo.goodreads.com/books/1156917478l/464._SX50_.jpg,https://i.gr-assets.com/images/S/compressed.photo.goodreads.com/books/1156917478l/464._SX318_.jpg,2004,1,5,Harry N. Abrams,eng,false,"Paul Auster's penetrating and charged verse resembles little else in recent American poetry. This collection of Auster's poetry, translations, and composition notes from early in his career do much to reinforce the idea that Paul Auster is, indeed, a unique and masterful figure in the literary world. Taut, densely lyrical, and everywhere informed by a powerful and subtle music, this selection of writings begins with the compact verse fragments of ""Spokes"" (written when Auster was in his early twenties) and ""Unearth,"" continues on through the more ample meditations of ""Wall Writing, Disappearances, Effigies, Fragments From the Cold, Facing the Music,"" and ""White Spaces,"" then moves further back in time to include Auster's revealing translations of many of the French poets who influenced his own writing, as well as the provocative and previously unpublished ?Notes From A Composition Book? (1967). An introduction by Norman Finkelstein connects biographical elements to a consideration of the work, and takes in Auster's early literary and philosophical influences.<br /><br />Powerful, haunting, and precise, this view from the past to the present will appeal to those unfamiliar with this aspect of Auster's work, as well as those already acquainted with his poetry.",3.58,192,Hardcover, ,3,https://www.goodreads.com/book/show/464.Collected_Poems,https://www.goodreads.com/book/show/464.Collected_Poems
475,Collapse: How Societies Choose to Fail or Succeed,0143036556,9780143036555, , ,ID,https://i.gr-assets.com/images/S/compressed.photo.goodreads.com/books/1441419222l/475._SX98_.jpg,https://i.gr-assets.com/images/S/compressed.photo.goodreads.com/books/1441419222l/475._SY75_.jpg,https://i.gr-assets.com/images/S/compressed.photo.goodreads.com/books/1441419222l/475._SY475_.jpg,2005,12,27,Penguin Books Ltd. (London),eng,false,"Brilliant, illuminating, and immensely absorbing, <i>Collapse</i> is destined to take its place as one of the essential books of our time, raising the urgent question: How can our world best avoid committing ecological suicide?<br /><br />In his million-copy bestseller <i>Guns, Germs, and Steel</i>, Jared Diamond examined how and why Western civilizations developed the technologies and immunities that allowed them to dominate much of the world. Now in this brilliant companion volume, Diamond probes the other side of the equation: What caused some of the great civilizations of the past to collapse into ruin, and what can we learn from their fates?<br /><br />As in <i>Guns, Germs, and Steel</i>, Diamond weaves an all-encompassing global thesis through a series of fascinating historical-cultural narratives. Moving from the Polynesian cultures on Easter Island to the flourishing American civilizations of the Anasazi and the Maya and finally to the doomed Viking colony on Greenland, Diamond traces the fundamental pattern of catastrophe. Environmental damage, climate change, rapid population growth, and unwise political choices were all factors in the demise of these societies, but other societies found solutions and persisted. Similar problems face us today and have already brought disaster to Rwanda and Haiti, even as China and Australia are trying to cope in innovative ways. Despite our own society's apparently inexhaustible wealth and unrivaled political power, ominous warning signs have begun to emerge even in ecologically robust areas like Montana.<br /><br />Brilliant, illuminating, and immensely absorbing, <i>Collapse</i> is destined to take its place as one of the essential books of our time, raising the urgent question: How can our world best avoid committing ecological suicide?",3.92,608,Paperback, ,2952,https://www.goodreads.com/book/show/475.Collapse,https://www.goodreads.com/book/show/475.Collapse
478,Bowling Alone: The Collapse and Revival of American Community,0743203046,9780743203043, , ,ID,https://i.gr-assets.com/images/S/compressed.photo.goodreads.com/books/1424632781l/478._SX98_.jpg,https://i.gr-assets.com/images/S/compressed.photo.goodreads.com/books/1424632781l/478._SY75_.jpg,https://i.gr-assets.com/images/S/compressed.photo.goodreads.com/books/1424632781l/478.jpg,2001,8,7,Simon  Schuster,eng,false,"Once we bowled in leagues, usually after work--but no longer. This seemingly small phenomenon symbolizes a significant social change that Robert Putnam has identified in this brilliant volume, which <i>The Economist</i> hailed as ""a prodigious achievement.""<br /><br />Drawing on vast new data that reveal Americans' changing behavior, Putnam shows how we have become increasingly disconnected from one another and how social structures--whether they be PTA, church, or political parties--have disintegrated. Until the publication of this groundbreaking work, no one had so deftly diagnosed the harm that these broken bonds have wreaked on our physical and civic health, nor had anyone exalted their fundamental power in creating a society that is happy, healthy, and safe.<br /><br />Like defining works from the past, such as <i>The Lonely Crowd</i> and <i>The Affluent Society, </i> and like the works of C. Wright Mills and Betty Friedan, Putnam's <i>Bowling Alone</i> has identified a central crisis at the heart of our society and suggests what we can do.",3.81,544,Paperback, ,555,https://www.goodreads.com/book/show/478.Bowling_Alone,https://www.goodreads.com/book/show/478.Bowling_Alone
485,The Languages of Native North America,052129875X,9780521298759, , ,ID,https://i.gr-assets.com/images/S/compressed.photo.goodreads.com/books/1390022979l/485._SX98_.jpg,https://i.gr-assets.com/images/S/compressed.photo.goodreads.com/books/1390022979l/485._SY75_.jpg,https://i.gr-assets.com/images/S/compressed.photo.goodreads.com/books/1390022979l/485.jpg,2001,6,7,Cambridge University Press,en-US,false,"This book is a comprehensive and authoritative survey of the native North American languages. These several hundred languages show tremendous genetic and typological diversity, and offer numerous challenges to current linguistic theory. The book includes an overview of their special characteristics, descriptions of special styles, a catalog of the languages that details their locations, genetic affiliations, number of speakers, and major structural features, and lists published material on them.",4.53,773,Paperback, ,6,https://www.goodreads.com/book/show/485.The_Languages_of_Native_North_America,https://www.goodreads.com/book/show/485.The_Languages_of_Native_North_America
489,Along The Clipper Way,0345021037,9780345021038, , ,ID,https://i.gr-assets.com/images/S/compressed.photo.goodreads.com/books/1216684733l/489._SY160_.jpg,https://i.gr-assets.com/images/S/compressed.photo.goodreads.com/books/1216684733l/489._SY75_.jpg,https://i.gr-assets.com/images/S/compressed.photo.goodreads.com/books/1216684733l/489.jpg,,,,"Ballantine Books, Inc.",,false,,4.08, , , ,4,https://www.goodreads.com/book/show/489.Along_The_Clipper_Way,https://www.goodreads.com/book/show/489.Along_The_Clipper_Way
491,"Life And Adventures Of John Nicol, Mariner",0862419921,9780862419929, , ,ID,https://s.gr-assets.com/assets/nophoto/book/111x148-bcc042a9c91a29c1d680899eff700a03.png,https://s.gr-assets.com/assets/nophoto/book/50x75-a91bf249278a81aabab721ef782c4a74.png,https://s.gr-assets.com/assets/nophoto/book/111x148-bcc042a9c91a29c1d680899eff700a03.png,,,,Canongate Pub Ltd,,false,"<div>In his many voyages, the Scottish-born sailor John Nicol (1755 - 1825) twice circumnavigated the globe, visiting every inhabited continent while participating in many of the greatest events of exploration and adventure of the eighteenth century. During his career Nicol battled pirates, traded with Native Americans, and fought for the British navy in the American and French revolutions. In Hawaii, he was entertained by the King's court mere days after the murder of Captain James Cook. In Jamaica, he saw firsthand the horrors of the slave system and befriended slaves who invited him to join in their dance celebrations. En route to Australia, he would meet the love of his life, Sarah Whitlam, a convict bound for the Botany Bay prison colony, who would bear his son before duty forced them apart forever. An international best-seller, The Life and Adventures of John Nicol, Mariner is a rousing memoir of an ordinary man's extraordinary life, a gripping true adventure tale. ""[Nicol has] made a lasting place for himself in the literature of the sea and ships he loved so deeply."" -- Jonathan Yardley, The Washington Post</div>",4.00, , , ,1,https://www.goodreads.com/book/show/491.Life_And_Adventures_Of_John_Nicol_Mariner,https://www.goodreads.com/book/show/491.Life_And_Adventures_Of_John_Nicol_Mariner
492,The Fantastic Inventions of Nikola Tesla,0932813194,9780932813190, , ,ID,https://i.gr-assets.com/images/S/compressed.photo.goodreads.com/books/1400874109l/492._SX98_.jpg,https://i.gr-assets.com/images/S/compressed.photo.goodreads.com/books/1400874109l/492._SX50_.jpg,https://i.gr-assets.com/images/S/compressed.photo.goodreads.com/books/1400874109l/492.jpg,2014,6,12,Adventures Unlimited Press,,false,"Nikola Tesla's Electricity Unplugged is a unique anthology of hand-picked Tesla articles, arranged historically, which presents overwhelming and convincing evidence for the reality of Tesla's high efficiency, low cost wireless power transmission. Following in the footsteps of the editor's first book in the series, Harnessing the Wheelwork of Nature, Dr. Tom Valone's book chronologically traces the original intention that Nikola Tesla had for his wireless electricity and how he updated and expanded upon it later on, with reprints of his key articles, to the recent genius engineers and physicists who are now finally bringing this last and most elusive, highly advanced Tesla technology into reality. The Corum article (along with the Peterson article) on the Zenneck wave transmission experiments culminates the viewpoints of all of the book's contributors. Its purposeful placement as the last chapter of the book, is because this exclusive article publication is a major scientific breakthrough, as testified by the book's endorsement from Brigadier General Michael Miller, and foretells the understandable, visionary road to the corporate formation of wireless power utilities. Furthermore, this is the first and only book in the world which explains how an electromagnetic wave traveling across the electrically conductive surface of the earth, was predicted by Tesla and Zenneck (two pictures in the book show them together on pages 74 and 381) and why it is the essential missing link of any Tesla wireless transmission theory. Many of the contributors also nicely explain the ""surface wave phenomenon"" as well as ""resonant earth-ionosphere"" modes of electrical transmission without wires that compliments the surface wave theory and experiment. Nikola Tesla's Electricity Unplugged therefore is a treasure compared to any other Tesla reference book currently in print, since it is jam-packed with personal stories of Tesla, such as one reprinted from the prestigious Smithsonian magazine, along with great illustrated slideshows adapted for the book format, the ""secret"" history of Tesla's wireless, the real Tesla electric car, high Q resonant power transfer examples being used today by Qualcomm, ""Tesla unplugged"" explained in an easy-to-understand presentation by a Brookhaven National Lab scientist, wireless electricity article based on scalar waves, even including a couple amazing rigorous equation articles with wireless solutions for the tech audience, a unique and evocative Foreword by Nikola Tesla's last living direct descendant, all presented in a 457-page paperback book, suitable as a college or high school reader, or simply as an eye-opening, optimistic window onto the electrical genius regarded as the ""Master of Lightning,"" with a priceless collection of nineteen (19) contributors not available anywhere else.",4.07,351,Paperback, ,21,https://www.goodreads.com/book/show/492.The_Fantastic_Inventions_of_Nikola_Tesla,https://www.goodreads.com/book/show/492.The_Fantastic_Inventions_of_Nikola_Tesla
