id,title,isbn,isbn13,asin,kindle_asin,country_code,image_url,small_image_url,large_image_url,publication_year,publication_month,publication_day,publisher,language_code,is_ebook,description,average_rating,num_pages,format,edition_information,text_reviews_count,url,link
311058,Understanding the Enneagram: The Practical Guide to Personality Types,0618004157,9780618004157, , ,ID,https://i.gr-assets.com/images/S/compressed.photo.goodreads.com/books/1348119995l/311058._SX98_.jpg,https://i.gr-assets.com/images/S/compressed.photo.goodreads.com/books/1348119995l/311058._SY75_.jpg,https://i.gr-assets.com/images/S/compressed.photo.goodreads.com/books/1348119995l/311058.jpg,2000,1,18,Mariner Books,en-US,false,"PERSONALITY TYPES, the first book by Don Richard Riso, has become the leading guide to the Enneagram, as well as a cherished classic in the literature of personal growth around the world. This is the groundbreaking book that set the standard for insight and accuracy about this ancient symbol of human personality. UNDERSTANDING THE ENNEAGRAM soon followed and has since become another indispensable reseource, teaching readers not only how to understand this psychological framework in daily life but how to use it in many different settings. Don Riso and Russ Hudson have now fully revised and updated this authoritative guide to the Enneagram, based on their continuing work in the field, which is attracting ever-increasing attention. Discover how to use the Enneagram to find fulfillment in your personal develpemnt and in all of your relationships.",4.12,416,Paperback, ,35,https://www.goodreads.com/book/show/311058.Understanding_the_Enneagram,https://www.goodreads.com/book/show/311058.Understanding_the_Enneagram
311059,The Spiritual Dimension of the Enneagram: Nine Faces of the Soul,1585420816,9781585420810, , ,ID,https://i.gr-assets.com/images/S/compressed.photo.goodreads.com/books/1387743834l/311059._SX98_.jpg,https://i.gr-assets.com/images/S/compressed.photo.goodreads.com/books/1387743834l/311059._SY75_.jpg,https://i.gr-assets.com/images/S/compressed.photo.goodreads.com/books/1387743834l/311059.jpg,2001,2,19,TarcherPerigee,eng,false,"A groundbreaking exploration of the spiritual dimension of working with the enneagram by one of its earliest students and teachers in America.<br /><br />Here is one of the first books to explore in an authentic and comprehensive way the original spiritual dimension of the enneagram. Among the most knowledgeable teachers of the enneagram in America, <b>Sandra Maitri</b> shows how the enneagram not only reveals our personalities, but illuminates a basic essence within each of us. She shows how traversing the inner territory particular to our ennea-type can bring us profound fulfillment and meaning, as well as authentic spiritual development.",4.15,336,Paperback, ,33,https://www.goodreads.com/book/show/311059.The_Spiritual_Dimension_of_the_Enneagram,https://www.goodreads.com/book/show/311059.The_Spiritual_Dimension_of_the_Enneagram
311073,Out of the Box: Coaching with the Enneagram,0976315904,9780976315902, , ,ID,https://i.gr-assets.com/images/S/compressed.photo.goodreads.com/books/1348422981l/311073._SX98_.jpg,https://i.gr-assets.com/images/S/compressed.photo.goodreads.com/books/1348422981l/311073._SX50_.jpg,https://i.gr-assets.com/images/S/compressed.photo.goodreads.com/books/1348422981l/311073.jpg,2005,6,4,Ninestar Publishing,en-US,false,Learn to use the Enneagram for better understanding of nine different ways of viewing the world and where to apply leverage for transformational change.,3.26,240,Paperback, ,0,https://www.goodreads.com/book/show/311073.Out_of_the_Box,https://www.goodreads.com/book/show/311073.Out_of_the_Box
311095,The Unknown Ajax,0099474360,9780099474364, , ,ID,https://i.gr-assets.com/images/S/compressed.photo.goodreads.com/books/1320389044l/311095._SX98_.jpg,https://i.gr-assets.com/images/S/compressed.photo.goodreads.com/books/1320389044l/311095._SY75_.jpg,https://i.gr-assets.com/images/S/compressed.photo.goodreads.com/books/1320389044l/311095.jpg,2005,1,6,Arrow,eng,false,"Miles from anywhere, Darracott Place is presided over by elderly Lord Darracott. Irascible Lord Darracott rules his barony with a firm hand. The tragic accident that killed his eldest son by drowning has done nothing to improve his temper. For now, he must send for the next heir apparent--the unknown offspring of the uncle whom the family is never permitted to mention. He also summons his bickering descendants to the rundown family estate. Yet none of that beleaguered family are prepared for the arrival of the weaver's brat and heir apparent...",4.08,352,Paperback, ,453,https://www.goodreads.com/book/show/311095.The_Unknown_Ajax,https://www.goodreads.com/book/show/311095.The_Unknown_Ajax
311096,The Reluctant Widow,0099468077,9780099468073, , ,ID,https://i.gr-assets.com/images/S/compressed.photo.goodreads.com/books/1327943029l/311096._SX98_.jpg,https://i.gr-assets.com/images/S/compressed.photo.goodreads.com/books/1327943029l/311096._SY75_.jpg,https://i.gr-assets.com/images/S/compressed.photo.goodreads.com/books/1327943029l/311096.jpg,2004,10,7,Arrow,eng,false,"A fateful mistake... Stepping into the wrong carriage at a Sussex village, Elinor Rochdale is swept up in a thrilling and dangerous adventure. Elinor is rather surprised that her prospective employer is quite rich, and more so at tile decayed grandeur of the house to which she is transported. Elinor thought she was entering Highnoons as a governess, but Eduard Carlyon, the handsomely fashionable gentleman who carefully interviewed her obviously needed no governess. Carlyon was seeking a wife-not for himself, but for his young cousin, Eustace Cheviot, the dissipated and profligate owner of the ruined estate, who now lay on his deathbed. Surprised and repulsed as she was by this strange proposal, Elinor was nevertheless unable to resist Carlyon and his mystifying plans. Ned persuades Elinor to marry his cousin as a simple business arrangement.<br /><br />A momentous decision... And so in the short span of a few hours would-be governess became a bride - and a widow almost as soon as the ring is on her finger. Even as she assumed the duties of mistress of Highnoons, even as she tried to solve the puzzle that placed her in this unusual situation, Elinor found herself inextricably- drawn to Ned Carlyon, the aloof, caustic man who treated her with nothing more than cousinly respect - the last thing that spirited Elinor wanted.... As partner in a secret conspiracy to save a family's name she finds herself embroiled with uninvited guests, housebreakers, missing government papers, an Napoleonic spy ring, and a shocking murder. And mysterious conspirator Lord Carlyon won't let her leave....",3.86,278,Paperback, ,558,https://www.goodreads.com/book/show/311096.The_Reluctant_Widow,https://www.goodreads.com/book/show/311096.The_Reluctant_Widow
311123,Footsteps in the Dark,0099493691,9780099493693, , ,ID,https://i.gr-assets.com/images/S/compressed.photo.goodreads.com/books/1320460143l/311123._SX98_.jpg,https://i.gr-assets.com/images/S/compressed.photo.goodreads.com/books/1320460143l/311123._SY75_.jpg,https://i.gr-assets.com/images/S/compressed.photo.goodreads.com/books/1320460143l/311123.jpg,2007,1,4,Arrow,eng,false,"Locals claim the Priory is haunted and refuse to put a single toe past the front door. Left empty for years, and even their deceased uncle chose to live in a different house, far away from this particular property. But the ramshackle old house, with its rambling charm is the perfect setting for a much-needed holiday for siblings Peter, Celia and Margaret, who have inherited it from their uncle. It wasn't the lack of modern conveniences that made a summer spent at the ancient priory mansion such an unsettling experience. It was the supposed ghost... or whatever was groaning in the cellars and roaming the countryside around Framley Village after dark.<br /><br />But when a murder victim is discovered in the drafty Priory halls, the once unconcerned trio begins to fear that the ghostly rumors are true and they are not alone after all! But traditionally ghosts don't commit murder. And in this case, the things which go bump in the night are deadly. With a killer on the loose, will they find themselves the next victims or will they uncover the true in time? Does the key to the crime lie in the realm of the supernaturalr? Or is the explanation much more down to earth with a more corporeal culpritl of flesh and blood?",3.72,336,Paperback, ,451,https://www.goodreads.com/book/show/311123.Footsteps_in_the_Dark,https://www.goodreads.com/book/show/311123.Footsteps_in_the_Dark
311124,Detection Unlimited (Inspectors Hannasyde & Hemingway #8),0099493748,9780099493747, , ,ID,https://i.gr-assets.com/images/S/compressed.photo.goodreads.com/books/1320518445l/311124._SX98_.jpg,https://i.gr-assets.com/images/S/compressed.photo.goodreads.com/books/1320518445l/311124._SY75_.jpg,https://i.gr-assets.com/images/S/compressed.photo.goodreads.com/books/1320518445l/311124.jpg,2006,9,7,Arrow,eng,false,"It was a hot June evening in the village of Thornden, the Hasells celebrate a tennis party at the Cedars, their mansion. The young Haswell had just motored the lovely Abby Dearham back from social event of the week. Nearly everyone of the village uppercrust had come to the party--the Squire, the Vicar, the sharp-tongued heir to five centuries of local real estate. But the unpopular solicitor Sampson Warrenby had declined, and no one was sorry. Why this charmless social-climber was invited was beyond Abby. Had he some sinister hold on the social leaders of Thornden? All joking was cut short when a wild-eyed girl came running down the lane. For it was Mavis, Warrenby's niece, announcing he was dead.<br /><br />Slumped on a seat under an oak tree is old Sampson Warrenby, with a bullet through his brain. When the upstart solicitor is killed and everyone -- who at one time or another wanted him out of the way -- feels panic stricken. His body is discovered by his anxious niece, who is just one of ten people in the village in the running for chief suspect, having cause to dislike Warrenby intensely. Everybody in the village is ready to tell Chief Inspector Hemingway who did it. Could the murderer have been the dead man's niece? Or perhaps it was the other town solicitor? The couple at the farm had a guilty secret-what was it? And why is it someone else actually wants to be the prime suspect? Add to this the fact that Warrenby was blackmailing someone. Only Hemingway can uncover which of the ten has turned hatred into murder, but has his work cut out for him.",3.78,352,Paperback, ,112,https://www.goodreads.com/book/show/311124.Detection_Unlimited,https://www.goodreads.com/book/show/311124.Detection_Unlimited
311129,The Toll-Gate,0099476363,9780099476368, , ,ID,https://i.gr-assets.com/images/S/compressed.photo.goodreads.com/books/1320434556l/311129._SX98_.jpg,https://i.gr-assets.com/images/S/compressed.photo.goodreads.com/books/1320434556l/311129._SY75_.jpg,https://i.gr-assets.com/images/S/compressed.photo.goodreads.com/books/1320434556l/311129.jpg,2005,10,6,Arrow,eng,false,"<b>His exploits were legendary…</b><br /><br />Captain John Staple, back from the battlefront, is already bored with his quiet civilian life in the country. When he stumbles upon a mystery involving a disappearing toll-gate keeper, nothing could keep the adventure-loving captain from investigating.<br /><br /><b>But winning her will be his greatest yet…</b><br /><br />The plot thickens when John encounters the enigmatic Lady Nell Stornaway and soon learns that rescuing her from her unsavory relatives makes even the most ferocious cavalry charge look like a particularly tame hand of loo. Between hiding his true identity from Nell and the arrival in the neighborhood of some distinctly shady characters, Captain Staple finds himself embarked on the adventure-and romance-of a lifetime.",3.92,288,Paperback, ,296,https://www.goodreads.com/book/show/311129.The_Toll_Gate,https://www.goodreads.com/book/show/311129.The_Toll_Gate
311134,Why Shoot a Butler?, , , , ,ID,https://i.gr-assets.com/images/S/compressed.photo.goodreads.com/books/1320460145l/311134._SX98_.jpg,https://i.gr-assets.com/images/S/compressed.photo.goodreads.com/books/1320460145l/311134._SY75_.jpg,https://i.gr-assets.com/images/S/compressed.photo.goodreads.com/books/1320460145l/311134.jpg,2007,1,23,Arrow,eng,false,"Every family has secrets, but the Fountains' are turning deadly...<br /><br />On a dark night, along a lonely country road, barrister Frank Amberley stops to help a young lady in distress and discovers a sports car with a corpse behind the wheel. The girl protests her innocence, and Amberley believes her;at least until he gets drawn into the mystery and the clues incriminating Shirley Brown begin to add up.<br /><br />In an English country house murder mystery with a twist, it's the butler who's the victim, every clue complicates the puzzle, and the bumbling police are well meaning but completely baffled. Fortunately, in ferreting out a desperate killer, amateur sleuth Amberley is as brilliant as he is arrogant, but this time he's not sure he wants to know the truth...",3.68,320,Paperback, ,252,https://www.goodreads.com/book/show/311134.Why_Shoot_a_Butler_,https://www.goodreads.com/book/show/311134.Why_Shoot_a_Butler_
311150,Arabella,0099465620,9780099465621, , ,ID,https://i.gr-assets.com/images/S/compressed.photo.goodreads.com/books/1323965579l/311150._SX98_.jpg,https://i.gr-assets.com/images/S/compressed.photo.goodreads.com/books/1323965579l/311150._SY75_.jpg,https://i.gr-assets.com/images/S/compressed.photo.goodreads.com/books/1323965579l/311150.jpg,2004,10,7,Arrow Books Ltd.,eng,false,"To Arabella Tallant, the eldest daughter of a penniless country clergyman, the invitation to stay with her London godmother was like the key to heaven, for in addition to living in the glamorous city, Arabella might even find a suitable husband there. Armed with beauty, virtue and a benevolent godmother, the impetuous but impoverished Arabella embarked on her first London season with her mother's wish in mind: snare a rich husband. <br /><br />On her way to London Arabella's carriage breaks down outside the hunting lodge of the wealthy and socially prominent Robert Beaumaris, fate cast her in his path. Arabella's only fault is impetuosity, and her pride stung when she overhears a remark of her path of arrogant host, who accused her of being another petty female after his wealth, the proud, headstrong ingenue made a most startling claim -- she was an heiress! A pretense that deeply amuses the jaded Beau. To counter her white lie, Beaumaris launches her into high society and thereby subjects her to all kinds of amorous fortune hunters in London and other embarrassments.<br /><br />Suddenly Arabella found herself the talk of the ton and pursued by some of the most eligible young men of the day. But only one caught Arabella's fancy: Beaumaris, the handsome and dedicated bachelor. She should know better than to allow herself to be provoked by nonpareil Beau. But would her deceitful charade destroy her one chance for true love...?<br /><br />Beaumaris, however, although a most artful matrimonial dodger, badly underestimated his seemingly naive adversary... When compassionate Arabella rescues such unfortunate creatures as a mistreated chimney sweep and a mixed-breed mongrel, she foists them upon Beaumaris, who finds he rather enjoys the role of rescuer and is soon given the opportunity to prove his worth in the person of Bertram Tallant, the also impetuous young brother of Arabella....",4.07,320,Paperback,New edition,1058,https://www.goodreads.com/book/show/311150.Arabella,https://www.goodreads.com/book/show/311150.Arabella
311151,The Quiet Gentleman,0373836848,9780373836840, , ,ID,https://i.gr-assets.com/images/S/compressed.photo.goodreads.com/books/1217460707l/311151._SX98_.jpg,https://i.gr-assets.com/images/S/compressed.photo.goodreads.com/books/1217460707l/311151._SY75_.jpg,https://i.gr-assets.com/images/S/compressed.photo.goodreads.com/books/1217460707l/311151.jpg,2006,1,10,Harlequin ,eng,false,"Gervase Frant finally returns to his father's estate to claim his title as the new Seventh Earl of St. Erth at Stanyon. Unscathed from glory at Waterloo, Gervase expected a hero's welcome - instead he's given a frigid cold shoulder. Upon his return only Theo, a cousin even quieter than himself, is there to greet him--and when he meets his stepmother and half-brother open disdain put a chill on Gervase's welcome, and he detects open regret that he has survived inconveniently two wars. Now he must establish himself as the new head of the house... and ignore his family's rising hostility. <br /><br />Then Gervase's eye is caught by beautiful and charming Mariann Bolderwood, a collector of beaux -- the same young woman already much in favor with his half-brother. Gervase struggles to maintain a gentlemanly balance, but now the brothers are again rivals as they bid for the lady's attentions. But the dangers of the Lincolnshire countryside could never be more unexpected. Gervase finds himself the victim of repeatedly life-threatening accidents. And soon it becomes increasingly clear that someone wants the new Earl cruelly dead. Level-headed Drusilla Morville is captivated by Gervase but knows that she does not stand a chance against the debutantes vying for his affections, until Gervase's life is endangered and free-spirited Drusilla comes to the rescue.",3.97,416,Mass Market Paperback,Harlequin Signature Showcase,333,https://www.goodreads.com/book/show/311151.The_Quiet_Gentleman,https://www.goodreads.com/book/show/311151.The_Quiet_Gentleman
311153,The Spanish Bride,009947445X,9780099474456, , ,ID,https://i.gr-assets.com/images/S/compressed.photo.goodreads.com/books/1330087411l/311153._SX98_.jpg,https://i.gr-assets.com/images/S/compressed.photo.goodreads.com/books/1330087411l/311153._SY75_.jpg,https://i.gr-assets.com/images/S/compressed.photo.goodreads.com/books/1330087411l/311153.jpg,2005,6,2,Arrow,eng,false,"Shot-proof, fever-proof and a veteran campaigner at the age of twenty-five, Brigade-Major Harry Smith is reputed to be the luckiest man in Lord Wellington's army. But at the Seige of Badajos, his friends foretell the ruin of his career. For when Harry meets the defenceless Juana, a fiery passion consumes him. Under the banner of honour and with the selfsame ardour he so frequently displays in battle, he dives headlong into marriage. In his beautiful child-bride he finds a kindred spirit - &amp; a temper to match his own",3.44,422,Paperback, ,138,https://www.goodreads.com/book/show/311153.The_Spanish_Bride,https://www.goodreads.com/book/show/311153.The_Spanish_Bride
311162,Envious Casca (Inspectors Hannasyde & Hemingway #6),0099493667,9780099493662, , ,ID,https://i.gr-assets.com/images/S/compressed.photo.goodreads.com/books/1320460137l/311162._SX98_.jpg,https://i.gr-assets.com/images/S/compressed.photo.goodreads.com/books/1320460137l/311162._SY75_.jpg,https://i.gr-assets.com/images/S/compressed.photo.goodreads.com/books/1320460137l/311162.jpg,2006,9,7,Arrow,eng,false,"'Tis the season-to be dead...<br /><br />Resigned to spending Christmas at Lexham Manor, Mathilda Clare wasn't sure what she dreaded most--the foul temper of Nat Herriard, the filthy-rich old Scrooge who owned the place, or the sweetness-and-light of his brother, Joseph. Joseph had concocted a guest list brilliantly headed for mayhem... acid-tongued young Stephen, his sly sister Paula, and Nat's sharp-dealing partner, with a finger in some strange pies. ""There'll be murder before we're through,"" Mathilda laughed. And she was absolutely right. This it is no ordinary Christmas, when the holiday party takes on a sinister aspect when the colorful assortment of guests discovers there is a killer in their midst. The owner of the substantial estate, that old Scrooge Nathaniel Herriard, is found stabbed in the back, and the six holiday guests find themselves the suspects of a murder enquiry.<br /><br />For Inspector Hemingway of Scotland Yard, 'tis the season to find whodunit. Whilst the delicate matter of inheritance could be the key to this crime, the real conundrum is how any of the suspects could have entered the locked room to commit this foul deed. The investigation is complicated by the fact that every guest is hiding something-throwing all of their testimony into question and casting suspicion far and wide. The clever and daring crime will mystify readers, yet the answer is in plain sight all along....",3.74,384,Paperback, ,222,https://www.goodreads.com/book/show/311162.Envious_Casca,https://www.goodreads.com/book/show/311162.Envious_Casca
311163,Faro's Daughter,0099465590,9780099465591, , ,ID,https://i.gr-assets.com/images/S/compressed.photo.goodreads.com/books/1320463479l/311163._SX98_.jpg,https://i.gr-assets.com/images/S/compressed.photo.goodreads.com/books/1320463479l/311163._SY75_.jpg,https://i.gr-assets.com/images/S/compressed.photo.goodreads.com/books/1320463479l/311163.jpg,2004,7,27,Arrow,eng,false,"Renowned gamester, and the first to own that he is untroubled by a romantic disposition, Max Ravenscar regards all eligible females with indifference. But when he learns that his young cousin Adrian is bent on marrying Deborah Grantham, beautiful mistress of her aunt's gaming house, he meets an opponent in whom all his experience of risk and gambles finds him unprepared.",3.93,288,Paperback, ,638,https://www.goodreads.com/book/show/311163.Faro_s_Daughter,https://www.goodreads.com/book/show/311163.Faro_s_Daughter
311165,Cotillion,0061001783,9780061001789, , ,ID,https://i.gr-assets.com/images/S/compressed.photo.goodreads.com/books/1266521416l/311165._SX98_.jpg,https://i.gr-assets.com/images/S/compressed.photo.goodreads.com/books/1266521416l/311165._SY75_.jpg,https://i.gr-assets.com/images/S/compressed.photo.goodreads.com/books/1266521416l/311165.jpg,1991,6,1,HarperPrism,eng,false,"""One of you shall have her, and my fortune into the bargain""<br /><br />Such was the whimsical, some would say outrageous, statement of the ageing Mr Penicuik, to the three of his great-nephews gathered around him.<br /><br />The future of his vivacious step-daughter, Miss Kitty Charing, was thus assured, provided she married one of the handsome beaux now seeking her hand. But Kitty was in no hurry to conclude such a contract. By hook or by crook she meant to go to London, where anything might happen and very often did...",4.06,416,Paperback, ,959,https://www.goodreads.com/book/show/311165.Cotillion,https://www.goodreads.com/book/show/311165.Cotillion
311166,"They Found Him Dead (Inspectors Hannasyde & Hemingway, #3)",0553104128,9780553104127, , ,ID,https://i.gr-assets.com/images/S/compressed.photo.goodreads.com/books/1219786130l/311166._SY160_.jpg,https://i.gr-assets.com/images/S/compressed.photo.goodreads.com/books/1219786130l/311166._SY75_.jpg,https://i.gr-assets.com/images/S/compressed.photo.goodreads.com/books/1219786130l/311166.jpg,1970,,,Bantam,eng,false,"It is the morning after wealthy Silas Kane's sixtieth birthday party - a celebration that brings to light a number of familial controversies. When Kane is found dead at the foot of a cliff, the assumption is that he simply lost his way in the fog and fell by accident. But the subsequent death of his nephew and heir and threats on the life of the third Kane, the newest heir, raises obvious suspicion, and the redoubtable investigative skills of Superintendent Hannasyde prove critical once again.",3.79,252,Mass Market Paperback, ,163,https://www.goodreads.com/book/show/311166.They_Found_Him_Dead,https://www.goodreads.com/book/show/311166.They_Found_Him_Dead
311180,"A Blunt Instrument (Inspectors Hannasyde & Hemingway, #4)",0099493659,9780099493655, , ,ID,https://i.gr-assets.com/images/S/compressed.photo.goodreads.com/books/1320460135l/311180._SX98_.jpg,https://i.gr-assets.com/images/S/compressed.photo.goodreads.com/books/1320460135l/311180._SY75_.jpg,https://i.gr-assets.com/images/S/compressed.photo.goodreads.com/books/1320460135l/311180.jpg,2006,4,6,arrow books,eng,false,"When Ernest Fletcher is found bludgeoned to death in his study, everyone is shocked and mystified: Ernest was well liked and respected, so who would want to kill him?<br /><br />Enter Superintendent Hannasyde who, with consummate skill, begins to uncover the complexities of Fletcher's life. It seems the real Fletcher was far from the gentleman he pretended to be. There is, in fact, no shortage of people who wanted him dead.<br /><br />And then the killer struck again...",3.73,304,Paperback, ,204,https://www.goodreads.com/book/show/311180.A_Blunt_Instrument,https://www.goodreads.com/book/show/311180.A_Blunt_Instrument
